existential risk,"Leading scientists have classified unaligned artificial intelligence as a potential existential risk to humanity.",실존적 위험,"주요 과학자들은 정렬되지 않은 인공지능을 인류에 대한 잠재적 실존적 위험으로 분류했다.",実存的リスク,"主要な科学者たちは整合されていない人工知能を人類に対する潜在的な実存的リスクに分類した。",存亡风险,"顶尖科学家已将未对齐的人工智能归类为对人类的潜在存亡风险。",riesgo existencial,"Científicos destacados han clasificado la inteligencia artificial no alineada como un riesgo existencial potencial para la humanidad.",rủi ro hiện sinh,"Các nhà khoa học hàng đầu đã phân loại trí tuệ nhân tạo chưa được căn chỉnh là rủi ro hiện sinh tiềm tàng đối với nhân loại.",ความเสี่ยงต่อการดำรงอยู่,"นักวิทยาศาสตร์ชั้นนำจัดประเภทปัญญาประดิษฐ์ที่ไม่สอดคล้องว่าเป็นความเสี่ยงต่อการดำรงอยู่ของมนุษยชาติ",risiko eksistensial,"Ilmuwan terkemuka telah mengklasifikasikan kecerdasan buatan yang tidak selaras sebagai risiko eksistensial potensial bagi umanitas."
forensic psychology,"Forensic psychology applies psychological principles to legal proceedings and criminal investigations.",법심리학,"법심리학은 심리학적 원리를 법적 절차와 범죄 수사에 적용한다.",法心理学,"法心理学は法的手続きや犯罪捜査に心理学的原理を適用する。",法庭心理学,"法庭心理学将心理学原理应用于法律程序和犯罪调查。",psicología forense,"La psicología forense aplica principios psicológicos a los procedimientos legales e investigaciones criminales.",tâm lý học pháp y,"Tâm lý học pháp y áp dụng các nguyên lý tâm lý học vào các thủ tục pháp lý và điều tra hình sự.",จิตวิทยานิติเวช,"จิตวิทยานิติเวชนำหลักการทางจิตวิทยามาประยุกต์ใช้กับกระบวนการทางกฎหมายและการสืบสวนคดีอาญา",psikologi forensik,"Psikologi forensik menerapkan prinsip-prinsip psikologis pada proses hukum dan investigasi kriminal."
environmental governance,"Environmental governance frameworks must balance economic development with ecological sustainability.",환경 거버넌스,"환경 거버넌스 프레임워크는 경제 발전과 생태적 지속가능성의 균형을 맞춰야 한다.",環境ガバナンス,"環境ガバナンスの枠組みは経済発展と生態学的持続可能性のバランスを取らなければならない。",环境治理,"环境治理框架必须在经济发展与生态可持续性之间取得平衡。",gobernanza ambiental,"Los marcos de gobernanza ambiental deben equilibrar el desarrollo económico con la sostenibilidad ecológica.",quản trị môi trường,"Các khung quản trị môi trường phải cân bằng giữa phát triển kinh tế và bền vững sinh thái.",ธรรมาภิบาลด้านสิ่งแวดล้อม,"กรอบธรรมาภิบาลด้านสิ่งแวดล้อมต้องสร้างสมดุลระหว่างการพัฒนาเศรษฐกิจกับความยั่งยืนทางนิเวศวิทยา",tata kelola lingkungan,"Kerangka tata kelola lingkungan harus menyeimbangkan pembangunan ekonomi dengan keberlanjutan ekologis."
merger arbitrage,"Hedge funds specializing in merger arbitrage profit from price discrepancies during corporate acquisitions.",합병 차익거래,"합병 차익거래를 전문으로 하는 헤지펀드는 기업 인수 시 가격 불일치에서 이익을 얻는다.",合併裁定取引,"合併裁定取引を専門とするヘッジファンドは企業買収時の価格差から利益を得る。",并购套利,"专门从事并购套利的对冲基金从企业收购过程中的价格差异中获利。",arbitraje de fusiones,"Los fondos de cobertura especializados en arbitraje de fusiones obtienen ganancias de las discrepancias de precios durante las adquisiciones corporativas.",chênh lệch giá sáp nhập,"Các quỹ đầu cơ chuyên về chênh lệch giá sáp nhập thu lợi từ sự chênh lệch giá trong các thương vụ mua lại doanh nghiệp.",การเก็งกำไรจากการควบรวม,"กองทุนเฮดจ์ฟันด์ที่เชี่ยวชาญด้านการเก็งกำไรจากการควบรวมได้กำไรจากความแตกต่างของราคาระหว่างการซื้อกิจการ",arbitrase merger,"Dana lindung nilai yang mengkhususkan diri dalam arbitrase merger mendapat keuntungan dari perbedaan harga selama akuisisi perusahaan."
psychopharmacology,"Psychopharmacology investigates how medications alter neurotransmitter systems to treat mental disorders.",정신약리학,"정신약리학은 약물이 정신 장애를 치료하기 위해 신경전달물질 시스템을 어떻게 변화시키는지 연구한다.",精神薬理学,"精神薬理学は薬物が精神疾患を治療するために神経伝達物質システムをどのように変化させるかを研究する。",精神药理学,"精神药理学研究药物如何改变神经递质系统以治疗精神障碍。",psicofarmacología,"La psicofarmacología investiga cómo los medicamentos alteran los sistemas de neurotransmisores para tratar trastornos mentales.",dược lý tâm thần,"Dược lý tâm thần nghiên cứu cách thuốc thay đổi hệ thống dẫn truyền thần kinh để điều trị rối loạn tâm thần.",จิตเภสัชวิทยา,"จิตเภสัชวิทยาศึกษาว่ายาเปลี่ยนแปลงระบบสารสื่อประสาทอย่างไรเพื่อรักษาความผิดปกติทางจิต",psikofarmakologi,"Psikofarmakologi menyelidiki bagaimana obat-obatan mengubah sistem neurotransmiter untuk mengobati gangguan mental."
entanglement swapping,"Entanglement swapping allows quantum correlations to be established between particles that have never directly interacted.",얽힘 교환,"얽힘 교환은 직접 상호작용한 적이 없는 입자들 사이에 양자 상관관계를 형성할 수 있게 한다.",もつれの交換,"もつれの交換により直接相互作用したことのない粒子間に量子相関を確立できる。",纠缠交换,"纠缠交换允许在从未直接相互作用的粒子之间建立量子关联。",intercambio de entrelazamiento,"El intercambio de entrelazamiento permite establecer correlaciones cuánticas entre partículas que nunca han interactuado directamente.",hoán đổi vướng víu,"Hoán đổi vướng víu cho phép thiết lập tương quan lượng tử giữa các hạt chưa bao giờ tương tác trực tiếp.",การแลกเปลี่ยนเอนแทงเกิลเมนต์,"การแลกเปลี่ยนเอนแทงเกิลเมนต์ช่วยให้สามารถสร้างความสัมพันธ์เชิงควอนตัมระหว่างอนุภาคที่ไม่เคยมีปฏิสัมพันธ์โดยตรง",pertukaran keterkaitan,"Pertukaran keterkaitan memungkinkan korelasi kuantum dibangun antara partikel yang tidak pernah berinteraksi secara langsung."
beneficence,"The principle of beneficence obligates healthcare providers to act in the patient's best interest.",선행,"선행의 원칙은 의료 제공자가 환자의 최선의 이익을 위해 행동할 의무를 부여한다.",善行,"善行の原則は医療提供者に患者の最善の利益のために行動する義務を課す。",行善,"行善原则要求医疗服务提供者为患者的最大利益行事。",beneficencia,"El principio de beneficencia obliga a los proveedores de atención médica a actuar en el mejor interés del paciente.",lòng nhân từ,"Nguyên tắc nhân từ bắt buộc các nhà cung cấp dịch vụ y tế hành động vì lợi ích tốt nhất của bệnh nhân.",หลักการทำความดี,"หลักการทำความดีกำหนดให้ผู้ให้บริการด้านสุขภาพต้องกระทำเพื่อประโยชน์สูงสุดของผู้ป่วย",kebajikan,"Prinsip kebajikan mewajibkan penyedia layanan kesehatan untuk bertindak demi kepentingan terbaik pasien."
spin quantum number,"The spin quantum number determines the intrinsic angular momentum of subatomic particles.",스핀 양자수,"스핀 양자수는 아원자 입자의 고유 각운동량을 결정한다.",スピン量子数,"スピン量子数は亜原子粒子の固有角運動量を決定する。",自旋量子数,"自旋量子数决定了亚原子粒子的固有角动量。",número cuántico de espín,"El número cuántico de espín determina el momento angular intrínseco de las partículas subatómicas.",số lượng tử spin,"Số lượng tử spin xác định mô men động lượng nội tại của các hạt hạ nguyên tử.",เลขควอนตัมสปิน,"เลขควอนตัมสปินกำหนดโมเมนตัมเชิงมุมภายในของอนุภาคย่อยอะตอม",bilangan kuantum spin,"Bilangan kuantum spin menentukan momentum sudut intrinsik partikel subatomik."
goldplating,"Regulatory goldplating occurs when member states implement directives more strictly than required.",규제 과잉,"규제 과잉은 회원국이 요구보다 더 엄격하게 지침을 시행할 때 발생한다.",ゴールドプレーティング,"ゴールドプレーティングは加盟国が要求以上に厳格に指令を実施するときに起こる。",镀金条款,"镀金条款发生在成员国比要求更严格地执行指令时。",sobrerregulación,"La sobrerregulación ocurre cuando los estados miembros implementan directivas más estrictamente de lo requerido.",mạ vàng quy định,"Mạ vàng quy định xảy ra khi các quốc gia thành viên thực thi chỉ thị nghiêm ngặt hơn yêu cầu.",การเพิ่มกฎเกินความจำเป็น,"การเพิ่มกฎเกินความจำเป็นเกิดขึ้นเมื่อรัฐสมาชิกบังคับใช้คำสั่งอย่างเข้มงวดกว่าที่กำหนด",goldplating,"Goldplating regulasi terjadi ketika negara anggota menerapkan arahan lebih ketat dari yang disyaratkan."
Dunning-Kruger effect,"The Dunning-Kruger effect explains why incompetent individuals overestimate their own abilities.",더닝-크루거 효과,"더닝-크루거 효과는 능력이 부족한 사람들이 자신의 능력을 과대평가하는 이유를 설명한다.",ダニング・クルーガー効果,"ダニング・クルーガー効果は能力の低い個人がなぜ自分の能力を過大評価するかを説明する。",达克效应,"达克效应解释了为什么无能的人会高估自己的能力。",efecto Dunning-Kruger,"El efecto Dunning-Kruger explica por qué los individuos incompetentes sobreestiman sus propias habilidades.",hiệu ứng Dunning-Kruger,"Hiệu ứng Dunning-Kruger giải thích tại sao những người kém năng lực lại đánh giá quá cao khả năng của mình.",ปรากฏการณ์ดันนิง-ครูเกอร์,"ปรากฏการณ์ดันนิง-ครูเกอร์อธิบายว่าทำไมบุคคลที่ไร้ความสามารถจึงประเมินความสามารถของตัวเองสูงเกินจริง",efek Dunning-Kruger,"Efek Dunning-Kruger menjelaskan mengapa individu yang tidak kompeten melebih-lebihkan kemampuan mereka sendiri."
zero-sum game,"Realists view international relations as a zero-sum game where one nation's gain is another's loss.",제로섬 게임,"현실주의자들은 국제관계를 한 국가의 이익이 다른 국가의 손실인 제로섬 게임으로 본다.",ゼロサムゲーム,"現実主義者は国際関係を一国の利益が他国の損失であるゼロサムゲームとして捉える。",零和博弈,"现实主义者将国际关系视为零和博弈即一国之得即另一国之失。",juego de suma cero,"Los realistas ven las relaciones internacionales como un juego de suma cero donde la ganancia de una nación es la pérdida de otra.",trò chơi có tổng bằng không,"Những người theo chủ nghĩa hiện thực xem quan hệ quốc tế là trò chơi có tổng bằng không trong đó lợi ích của một quốc gia là tổn thất của quốc gia khác.",เกมผลรวมเป็นศูนย์,"นักสัจนิยมมองความสัมพันธ์ระหว่างประเทศเป็นเกมผลรวมเป็นศูนย์ที่ผลได้ของชาติหนึ่งคือผลเสียของอีกชาติ",permainan zero-sum,"Kaum realis memandang hubungan internasional sebagai permainan zero-sum di mana keuntungan satu negara adalah kerugian negara lain."
double-blind study,"A double-blind study ensures neither participants nor researchers know who receives the treatment or placebo.",이중맹검 연구,"이중맹검 연구는 참가자도 연구자도 누가 치료제 또는 위약을 받는지 모르도록 보장한다.",二重盲検試験,"二重盲検試験は参加者も研究者も誰が治療を受け誰がプラセボを受けるか知らないことを保証する。",双盲研究,"双盲研究确保参与者和研究人员都不知道谁接受了治疗或安慰剂。",estudio doble ciego,"Un estudio doble ciego asegura que ni los participantes ni los investigadores saben quién recibe el tratamiento o el placebo.",nghiên cứu mù đôi,"Nghiên cứu mù đôi đảm bảo cả người tham gia lẫn nhà nghiên cứu đều không biết ai nhận điều trị hay giả dược.",การศึกษาแบบปกปิดสองทาง,"การศึกษาแบบปกปิดสองทางรับรองว่าทั้งผู้เข้าร่วมและนักวิจัยไม่ทราบว่าใครได้รับการรักษาหรือยาหลอก",studi double-blind,"Studi double-blind memastikan baik peserta maupun peneliti tidak mengetahui siapa yang menerima pengobatan atau plasebo."
equity dilution,"Equity dilution reduces existing shareholders' ownership percentage when new shares are issued.",지분 희석,"지분 희석은 신주가 발행될 때 기존 주주의 소유 비율을 감소시킨다.",株式希薄化,"株式希薄化は新株が発行されると既存株主の持株比率を低下させる。",股权稀释,"当发行新股时股权稀释会降低现有股东的持股比例。",dilución de capital,"La dilución de capital reduce el porcentaje de propiedad de los accionistas existentes cuando se emiten nuevas acciones.",pha loãng cổ phần,"Pha loãng cổ phần làm giảm tỷ lệ sở hữu của các cổ đông hiện tại khi cổ phiếu mới được phát hành.",การเจือจางส่วนทุน,"การเจือจางส่วนทุนลดสัดส่วนการถือหุ้นของผู้ถือหุ้นเดิมเมื่อมีการออกหุ้นใหม่",dilusi ekuitas,"Dilusi ekuitas mengurangi persentase kepemilikan pemegang saham yang ada ketika saham baru diterbitkan."
biosecurity,"Biosecurity protocols prevent the accidental or deliberate release of dangerous biological agents.",생물안보,"생물안보 프로토콜은 위험한 생물학적 작용제의 우발적 또는 의도적 방출을 방지한다.",バイオセキュリティ,"バイオセキュリティプロトコルは危険な生物学的因子の偶発的または意図的な放出を防ぐ。",生物安全,"生物安全协议防止危险生物制剂的意外或故意释放。",bioseguridad,"Los protocolos de bioseguridad previenen la liberación accidental o deliberada de agentes biológicos peligrosos.",an ninh sinh học,"Các quy trình an ninh sinh học ngăn chặn việc phóng thích vô tình hoặc cố ý các tác nhân sinh học nguy hiểm.",ความมั่นคงทางชีวภาพ,"ระเบียบปฏิบัติด้านความมั่นคงทางชีวภาพป้องกันการปล่อยสารชีวภาพอันตรายโดยไม่ตั้งใจหรือโดยเจตนา",keamanan hayati,"Protokol keamanan hayati mencegah pelepasan agen biologis berbahaya secara tidak sengaja atau disengaja."
groupthink,"Groupthink suppresses dissenting opinions and leads teams toward irrational consensus decisions.",집단사고,"집단사고는 반대 의견을 억압하고 팀을 비합리적인 합의 결정으로 이끈다.",集団思考,"集団思考は反対意見を抑圧しチームを非合理的な合意の決定に導く。",群体思维,"群体思维压制不同意见并导致团队做出非理性的共识决策。",pensamiento grupal,"El pensamiento grupal suprime las opiniones disidentes y lleva a los equipos hacia decisiones de consenso irracionales.",tư duy nhóm,"Tư duy nhóm triệt tiêu các ý kiến bất đồng và dẫn dắt nhóm đến các quyết định đồng thuận phi lý.",การคิดแบบกลุ่ม,"การคิดแบบกลุ่มกดขี่ความเห็นที่แตกต่างและนำทีมไปสู่การตัดสินใจที่เป็นฉันทามติอย่างไร้เหตุผล",groupthink,"Groupthink menekan pendapat yang berbeda dan mengarahkan tim menuju keputusan konsensus yang tidak rasional."
seroprevalence,"Seroprevalence studies revealed that the actual infection rate was far higher than reported cases.",혈청 유병률,"혈청 유병률 조사는 실제 감염률이 보고된 사례보다 훨씬 높았음을 밝혔다.",血清有病率,血清有病率調査は実際の感染率が報告症例よりはるかに高いことを明らかにした。,血清阳性率,血清阳性率研究表明实际感染率远高于报告病例。,seroprevalencia,Los estudios de seroprevalencia revelaron que la tasa real de infección era mucho mayor que los casos reportados.,tỷ lệ huyết thanh dương tính,Các nghiên cứu tỷ lệ huyết thanh dương tính cho thấy tỷ lệ nhiễm thực tế cao hơn nhiều so với các ca được báo cáo.,ความชุกทางซีรั่ม,การศึกษาความชุกทางซีรั่มเผยให้เห็นว่าอัตราการติดเชื้อจริงสูงกว่าผู้ป่วยที่รายงานมาก,seroprevalensi,Studi seroprevalensi mengungkapkan bahwa tingkat infeksi sebenarnya jauh lebih tinggi daripada kasus yang dilaporkan.
zoonotic,"Zoonotic spillover events are increasingly common as humans encroach on wildlife habitats.",인수공통감염의,"인간이 야생동물 서식지를 침범함에 따라 인수공통감염 전파 사건이 점점 더 빈번해지고 있다.",人獣共通の,人間が野生生物の生息地を侵食するにつれ人獣共通感染症の波及事象がますます一般的になっている。,人畜共患的,随着人类侵占野生动物栖息地人畜共患病外溢事件日益增多。,zoonótico,Los eventos de desbordamiento zoonótico son cada vez más comunes a medida que los humanos invaden los hábitats de vida silvestre.,lây từ động vật,Các sự kiện lây lan từ động vật sang người ngày càng phổ biến khi con người xâm lấn môi trường sống hoang dã.,โรคจากสัตว์สู่คน,การแพร่เชื้อจากสัตว์สู่คนพบบ่อยขึ้นเมื่อมนุษย์รุกล้ำถิ่นที่อยู่ของสัตว์ป่า,zoonotik,Peristiwa limpahan zoonotik semakin umum seiring manusia merambah habitat satwa liar.
nosocomial,"Nosocomial infections remain a critical challenge for hospital infection control programs.",병원감염의,"병원감염은 의료기관 감염 관리 프로그램에 여전히 중대한 도전이다.",院内感染の,院内感染は病院の感染管理プログラムにとって依然として重大な課題である。,医院感染的,医院感染仍然是医院感染控制计划的重大挑战。,nosocomial,Las infecciones nosocomiales siguen siendo un desafío crítico para los programas de control de infecciones hospitalarias.,nhiễm trùng bệnh viện,Nhiễm trùng bệnh viện vẫn là thách thức nghiêm trọng đối với các chương trình kiểm soát nhiễm khuẩn.,การติดเชื้อในโรงพยาบาล,การติดเชื้อในโรงพยาบาลยังคงเป็นความท้าทายสำคัญสำหรับโปรแกรมควบคุมการติดเชื้อ,nosokomial,Infeksi nosokomial tetap menjadi tantangan kritis bagi program pengendalian infeksi rumah sakit.
vector-borne,"Vector-borne diseases are expanding their geographic range due to climate change.",매개체 전파의,"기후 변화로 인해 매개체 전파 질병의 지리적 범위가 확대되고 있다.",媒介性の,気候変動により媒介性疾患の地理的範囲が拡大している。,媒介传播的,由于气候变化媒介传播疾病正在扩大其地理范围。,transmitido por vectores,Las enfermedades transmitidas por vectores están expandiendo su alcance geográfico debido al cambio climático.,lây truyền qua véc tơ,Các bệnh lây truyền qua véc tơ đang mở rộng phạm vi địa lý do biến đổi khí hậu.,โรคที่นำโดยพาหะ,โรคที่นำโดยพาหะกำลังขยายขอบเขตทางภูมิศาสตร์เนื่องจากการเปลี่ยนแปลงสภาพภูมิอากาศ,ditularkan vektor,Penyakit yang ditularkan vektor memperluas jangkauan geografisnya akibat perubahan iklim.
sentinel surveillance,"Sentinel surveillance systems provide early warning signals for emerging infectious disease threats.",감시 감시체계,"감시 감시체계는 신종 감염병 위협에 대한 조기 경보 신호를 제공한다.",センチネルサーベイランス,センチネルサーベイランスシステムは新興感染症の脅威に対する早期警告信号を提供する。,哨点监测,哨点监测系统为新发传染病威胁提供早期预警信号。,vigilancia centinela,Los sistemas de vigilancia centinela proporcionan señales de alerta temprana para amenazas de enfermedades infecciosas emergentes.,giám sát trọng điểm,Các hệ thống giám sát trọng điểm cung cấp tín hiệu cảnh báo sớm cho các mối đe dọa bệnh truyền nhiễm mới nổi.,การเฝ้าระวังแบบจุดเฝ้าระวัง,ระบบเฝ้าระวังแบบจุดเฝ้าระวังให้สัญญาณเตือนภัยล่วงหน้าสำหรับโรคติดเชื้ออุบัติใหม่,surveilans sentinel,Sistem surveilans sentinel memberikan sinyal peringatan dini untuk ancaman penyakit menular yang muncul.
case-fatality rate,"The case-fatality rate of Ebola virus disease can exceed fifty percent in some outbreaks.",치명률,"에볼라 바이러스 질환의 치명률은 일부 발병에서 50퍼센트를 초과할 수 있다.",致死率,エボラウイルス病の致死率は一部の流行で50パーセントを超えることがある。,病死率,埃博拉病毒病的病死率在某些疫情中可超过百分之五十。,tasa de letalidad,La tasa de letalidad de la enfermedad por el virus del Ébola puede superar el cincuenta por ciento en algunos brotes.,tỷ lệ tử vong ca bệnh,Tỷ lệ tử vong ca bệnh của bệnh virus Ebola có thể vượt quá năm mươi phần trăm trong một số đợt bùng phát.,อัตราป่วยตาย,อัตราป่วยตายของโรคไวรัสอีโบลาอาจเกินร้อยละห้าสิบในการระบาดบางครั้ง,angka fatalitas kasus,Angka fatalitas kasus penyakit virus Ebola dapat melebihi lima puluh persen dalam beberapa wabah.
