brinkmanship,"The leader's brinkmanship brought the two nations dangerously close to armed conflict.",벼랑 끝 전술,"지도자의 벼랑 끝 전술은 두 나라를 무력 충돌의 위험한 경계로 몰고 갔다.",瀬戸際政策,"指導者の瀬戸際政策は両国を武力衝突の危険な境界に追い込んだ。",边缘政策,"领导人的边缘政策使两国危险地接近武装冲突。",política de riesgo calculado,"La política de riesgo calculado del líder llevó a las dos naciones peligrosamente cerca de un conflicto armado.",chính sách bên miệng hố chiến tranh,"Chính sách bên miệng hố chiến tranh của nhà lãnh đạo đã đưa hai quốc gia đến gần xung đột vũ trang một cách nguy hiểm.",นโยบายเสี่ยงขั้นสุด,"นโยบายเสี่ยงขั้นสุดของผู้นำทำให้ทั้งสองประเทศเข้าใกล้ความขัดแย้งทางอาวุธอย่างอันตราย",politik brinksmanship,"Politik brinksmanship pemimpin tersebut membawa kedua negara sangat dekat ke konflik bersenjata."
epigenetics,"Epigenetics reveals how environmental factors can alter gene expression without changing DNA sequences.",후성유전학,"후성유전학은 환경적 요인이 DNA 서열을 변경하지 않고 유전자 발현을 어떻게 변화시킬 수 있는지 밝혀준다.",エピジェネティクス,"エピジェネティクスは環境要因がDNA配列を変えずに遺伝子発現をどのように変化させるかを明らかにする。",表观遗传学,"表观遗传学揭示了环境因素如何在不改变DNA序列的情况下改变基因表达。",epigenética,"La epigenética revela cómo los factores ambientales pueden alterar la expresión génica sin cambiar las secuencias de ADN.",di truyền biểu sinh,"Di truyền biểu sinh cho thấy các yếu tố môi trường có thể thay đổi biểu hiện gen mà không thay đổi trình tự DNA.",เอพิเจเนติกส์,"เอพิเจเนติกส์เผยให้เห็นว่าปัจจัยด้านสิ่งแวดล้อมสามารถเปลี่ยนแปลงการแสดงออกของยีนโดยไม่เปลี่ยนลำดับดีเอ็นเอ",epigenetika,"Epigenetika mengungkap bagaimana faktor lingkungan dapat mengubah ekspresi gen tanpa mengubah urutan DNA."
placebo effect,"The placebo effect demonstrates the powerful influence of psychological expectation on physical healing.",위약 효과,"위약 효과는 심리적 기대가 신체 치유에 미치는 강력한 영향을 보여준다.",プラセボ効果,"プラセボ効果は心理的期待が身体の治癒に及ぼす強力な影響を示す。",安慰剂效应,"安慰剂效应表明心理预期对身体愈合的强大影响。",efecto placebo,"El efecto placebo demuestra la poderosa influencia de la expectativa psicológica en la curación física.",hiệu ứng giả dược,"Hiệu ứng giả dược cho thấy ảnh hưởng mạnh mẽ của kỳ vọng tâm lý đối với quá trình chữa lành thể chất.",ผลของยาหลอก,"ผลของยาหลอกแสดงให้เห็นอิทธิพลอันทรงพลังของความคาดหวังทางจิตวิทยาต่อการรักษาทางกายภาพ",efek plasebo,"Efek plasebo menunjukkan pengaruh kuat ekspektasi psikologis terhadap penyembuhan fisik."
autonomous weapon,"The development of autonomous weapons raises profound ethical questions about algorithmic decision-making in warfare.",자율무기,"자율무기의 개발은 전쟁에서 알고리즘적 의사결정에 대한 심오한 윤리적 질문을 제기한다.",自律型兵器,"自律型兵器の開発は戦争におけるアルゴリズムによる意思決定について深い倫理的問題を提起する。",自主武器,"自主武器的开发引发了关于战争中算法决策的深刻伦理问题。",arma autónoma,"El desarrollo de armas autónomas plantea profundas cuestiones éticas sobre la toma de decisiones algorítmica en la guerra.",vũ khí tự hành,"Việc phát triển vũ khí tự hành đặt ra những câu hỏi đạo đức sâu sắc về việc ra quyết định bằng thuật toán trong chiến tranh.",อาวุธอัตโนมัติ,"การพัฒนาอาวุธอัตโนมัติก่อให้เกิดคำถามทางจริยธรรมอันลึกซึ้งเกี่ยวกับการตัดสินใจด้วยอัลกอริทึมในสงคราม",senjata otonom,"Pengembangan senjata otonom menimbulkan pertanyaan etis yang mendalam tentang pengambilan keputusan algoritmik dalam peperangan."
board of directors,"The board of directors unanimously approved the strategic restructuring plan.",이사회,"이사회는 전략적 구조조정 계획을 만장일치로 승인했다.",取締役会,"取締役会は戦略的リストラ計画を全会一致で承認した。",董事会,"董事会一致批准了战略重组计划。",junta directiva,"La junta directiva aprobó unánimemente el plan de reestructuración estratégica.",hội đồng quản trị,"Hội đồng quản trị đã nhất trí thông qua kế hoạch tái cơ cấu chiến lược.",คณะกรรมการบริษัท,"คณะกรรมการบริษัทอนุมัติแผนปรับโครงสร้างเชิงกลยุทธ์เป็นเอกฉันท์",dewan direksi,"Dewan direksi dengan suara bulat menyetujui rencana restrukturisasi strategis."
dark matter,"Dark matter constitutes approximately twenty-seven percent of the universe yet remains undetectable by conventional instruments.",암흑물질,"암흑물질은 우주의 약 27%를 구성하지만 기존 장비로는 감지할 수 없다.",暗黒物質,"暗黒物質は宇宙の約27パーセントを構成するが従来の機器では検出できない。",暗物质,"暗物质约占宇宙的百分之二十七但仍然无法用传统仪器探测到。",materia oscura,"La materia oscura constituye aproximadamente el veintisiete por ciento del universo pero sigue siendo indetectable por instrumentos convencionales.",vật chất tối,"Vật chất tối chiếm khoảng hai mươi bảy phần trăm vũ trụ nhưng vẫn không thể phát hiện bằng các thiết bị thông thường.",สสารมืด,"สสารมืดประกอบเป็นประมาณยี่สิบเจ็ดเปอร์เซ็นต์ของจักรวาลแต่ยังตรวจจับไม่ได้ด้วยเครื่องมือทั่วไป",materi gelap,"Materi gelap menyusun sekitar dua puluh tujuh persen alam semesta namun tetap tidak terdeteksi oleh instrumen konvensional."
antimatter,"When antimatter collides with matter both are annihilated releasing enormous energy.",반물질,"반물질이 물질과 충돌하면 둘 다 소멸하면서 엄청난 에너지를 방출한다.",反物質,"反物質が物質と衝突すると両方が消滅し莫大なエネルギーを放出する。",反物质,"当反物质与物质碰撞时两者都会湮灭释放出巨大的能量。",antimateria,"Cuando la antimateria colisiona con la materia ambas se aniquilan liberando una energía enorme.",phản vật chất,"Khi phản vật chất va chạm với vật chất cả hai đều bị hủy diệt giải phóng năng lượng khổng lồ.",ปฏิสสาร,"เมื่อปฏิสสารชนกับสสาร ทั้งสองจะถูกทำลายล้างและปลดปล่อยพลังงานมหาศาล",antimateri,"Ketika antimateri bertabrakan dengan materi keduanya dimusnahkan dan melepaskan energi yang sangat besar."
string theory,"String theory posits that fundamental particles are actually one-dimensional vibrating strings.",끈 이론,"끈 이론은 기본 입자가 실제로 1차원 진동하는 끈이라고 가정한다.",弦理論,"弦理論は基本粒子が実際には一次元の振動する弦であると仮定する。",弦理论,"弦理论假设基本粒子实际上是一维振动的弦。",teoría de cuerdas,"La teoría de cuerdas postula que las partículas fundamentales son en realidad cuerdas vibrantes unidimensionales.",lý thuyết dây,"Lý thuyết dây cho rằng các hạt cơ bản thực chất là các dây dao động một chiều.",ทฤษฎีสตริง,"ทฤษฎีสตริงตั้งสมมติฐานว่าอนุภาคพื้นฐานเป็นสายสั่นสะเทือนหนึ่งมิติ",teori string,"Teori string berpendapat bahwa partikel fundamental sebenarnya adalah string bergetar satu dimensi."
Bose-Einstein condensate,"A Bose-Einstein condensate forms when atoms are cooled to near absolute zero and merge into a single quantum state.",보스-아인슈타인 응축,"보스-아인슈타인 응축은 원자가 절대영도 근처로 냉각되어 하나의 양자 상태로 합쳐질 때 형성된다.",ボース・アインシュタイン凝縮,"ボース・アインシュタイン凝縮は原子が絶対零度近くまで冷却され単一の量子状態に融合するときに形成される。",玻色-爱因斯坦凝聚体,"玻色-爱因斯坦凝聚体在原子被冷却到接近绝对零度并合并为单一量子态时形成。",condensado de Bose-Einstein,"Un condensado de Bose-Einstein se forma cuando los átomos se enfrían hasta cerca del cero absoluto y se fusionan en un solo estado cuántico.",ngưng tụ Bose-Einstein,"Ngưng tụ Bose-Einstein hình thành khi các nguyên tử được làm lạnh đến gần độ không tuyệt đối và hợp nhất thành một trạng thái lượng tử duy nhất.",สถานะควบแน่นโบส-ไอน์สไตน์,"สถานะควบแน่นโบส-ไอน์สไตน์เกิดขึ้นเมื่ออะตอมถูกทำให้เย็นลงจนใกล้ศูนย์สัมบูรณ์และรวมเป็นสถานะควอนตัมเดียว",kondensat Bose-Einstein,"Kondensat Bose-Einstein terbentuk ketika atom didinginkan hingga mendekati nol mutlak dan bergabung menjadi satu keadaan kuantum tunggal."
irredentism,"Irredentism fueled the nationalist movement's demand to reclaim historically contested territories.",영토회복주의,"영토회복주의는 역사적으로 분쟁이 있는 영토를 되찾으려는 민족주의 운동의 요구를 부추겼다.",イレデンティズム,"イレデンティズムは歴史的に争われてきた領土を取り戻す民族主義運動の要求を煽った。",领土收复主义,"领土收复主义助长了民族主义运动收回历史争议领土的要求。",irredentismo,"El irredentismo alimentó la demanda del movimiento nacionalista de reclamar territorios históricamente disputados.",chủ nghĩa phục thổ,"Chủ nghĩa phục thổ đã thúc đẩy yêu cầu của phong trào dân tộc chủ nghĩa nhằm thu hồi các vùng lãnh thổ tranh chấp lịch sử.",ลัทธิดินแดนนิยม,"ลัทธิดินแดนนิยมเป็นเชื้อเพลิงให้กับข้อเรียกร้องของขบวนการชาตินิยมในการเรียกคืนดินแดนที่เป็นข้อพิพาททางประวัติศาสตร์",iredentisme,"Iredentisme memicu tuntutan gerakan nasionalis untuk merebut kembali wilayah yang secara historis dipersengketakan."
compliance officer,"The compliance officer ensured all transactions adhered to anti-money laundering regulations.",준법감시인,"준법감시인은 모든 거래가 자금세탁 방지 규정을 준수하도록 보장했다.",コンプライアンスオフィサー,"コンプライアンスオフィサーは全ての取引がマネーロンダリング防止規制を遵守するよう確認した。",合规官,"合规官确保所有交易遵守反洗钱法规。",oficial de cumplimiento,"El oficial de cumplimiento aseguró que todas las transacciones cumplieran con las regulaciones contra el lavado de dinero.",cán bộ tuân thủ,"Cán bộ tuân thủ đảm bảo tất cả giao dịch tuân thủ các quy định chống rửa tiền.",เจ้าหน้าที่ฝ่ายกำกับดูแล,"เจ้าหน้าที่ฝ่ายกำกับดูแลรับรองว่าธุรกรรมทั้งหมดปฏิบัติตามกฎระเบียบป้องกันการฟอกเงิน",petugas kepatuhan,"Petugas kepatuhan memastikan semua transaksi mematuhi peraturan anti pencucian uang."
somatization,"Somatization converts psychological distress into physical symptoms without underlying organic cause.",신체화,"신체화는 기질적 원인 없이 심리적 고통을 신체적 증상으로 전환시킨다.",身体化,"身体化は根本的な器質的原因なく心理的苦痛を身体症状に変換する。",躯体化,"躯体化在没有潜在器质性原因的情况下将心理困扰转化为身体症状。",somatización,"La somatización convierte el malestar psicológico en síntomas físicos sin causa orgánica subyacente.",thể hóa,"Thể hóa chuyển đổi đau khổ tâm lý thành các triệu chứng thể chất mà không có nguyên nhân hữu cơ tiềm ẩn.",การแปลงเป็นอาการทางกาย,"การแปลงเป็นอาการทางกายเปลี่ยนความทุกข์ทางจิตใจเป็นอาการทางกายโดยไม่มีสาเหตุทางกายภาพ",somatisasi,"Somatisasi mengubah tekanan psikologis menjadi gejala fisik tanpa penyebab organik yang mendasari."
Machiavellian,"His Machiavellian tactics involved manipulating allies and adversaries alike to consolidate power.",마키아벨리적,"그의 마키아벨리적 전술은 권력을 공고히 하기 위해 동맹과 적을 모두 조종하는 것이었다.",マキャヴェリ的,"彼のマキャヴェリ的な戦術は権力を強化するために味方も敵も操ることを含んでいた。",马基雅维利式的,"他的马基雅维利式策略包括操纵盟友和对手以巩固权力。",maquiavélico,"Sus tácticas maquiavélicas implicaban manipular tanto a aliados como a adversarios para consolidar el poder.",mưu mô quyền lực,"Chiến thuật mưu mô quyền lực của ông ta bao gồm thao túng cả đồng minh lẫn đối thủ để củng cố quyền lực.",แบบมาเคียเวลลี,"กลยุทธ์แบบมาเคียเวลลีของเขาเกี่ยวข้องกับการบงการทั้งพันธมิตรและศัตรูเพื่อรวบอำนาจ",Machiavellian,"Taktik Machiavellian-nya melibatkan manipulasi sekutu dan musuh untuk mengonsolidasikan kekuasaan."
diaspora,"The diaspora maintained strong cultural ties to their ancestral homeland across generations.",디아스포라,"디아스포라는 세대를 넘어 조상의 고국과 강한 문화적 유대를 유지했다.",ディアスポラ,"ディアスポラは世代を超えて祖先の故国との強い文化的絆を維持した。",离散群体,"离散群体跨越世代保持着与祖先故土的强烈文化联系。",diáspora,"La diáspora mantuvo fuertes lazos culturales con su tierra ancestral a través de generaciones.",cộng đồng kiều bào,"Cộng đồng kiều bào duy trì mối liên kết văn hóa mạnh mẽ với quê hương tổ tiên qua nhiều thế hệ.",พลัดถิ่น,"ชุมชนพลัดถิ่นรักษาสายสัมพันธ์ทางวัฒนธรรมที่เข้มแข็งกับมาตุภูมิข้ามรุ่น",diaspora,"Diaspora mempertahankan ikatan budaya yang kuat dengan tanah leluhur mereka lintas generasi."
quantum field theory,"Quantum field theory unifies quantum mechanics and special relativity to describe particle interactions.",양자장 이론,"양자장 이론은 양자역학과 특수상대성이론을 통합하여 입자 상호작용을 설명한다.",場の量子論,"場の量子論は量子力学と特殊相対性理論を統合して粒子の相互作用を記述する。",量子场论,"量子场论统一了量子力学和狭义相对论来描述粒子相互作用。",teoría cuántica de campos,"La teoría cuántica de campos unifica la mecánica cuántica y la relatividad especial para describir las interacciones de partículas.",lý thuyết trường lượng tử,"Lý thuyết trường lượng tử thống nhất cơ học lượng tử và thuyết tương đối hẹp để mô tả tương tác hạt.",ทฤษฎีสนามควอนตัม,"ทฤษฎีสนามควอนตัมรวมกลศาสตร์ควอนตัมและทฤษฎีสัมพัทธภาพพิเศษเพื่ออธิบายปฏิสัมพันธ์ของอนุภาค",teori medan kuantum,"Teori medan kuantum menyatukan mekanika kuantum dan relativitas khusus untuk mendeskripsikan interaksi partikel."
emotional intelligence,"Emotional intelligence is a stronger predictor of leadership success than technical expertise alone.",감성 지능,"감성 지능은 기술적 전문성만보다 리더십 성공의 더 강력한 예측 변수이다.",感情的知性,"感情的知性は技術的専門性だけよりもリーダーシップの成功をより強く予測する。",情商,"情商比单纯的技术专长更能预测领导力的成功。",inteligencia emocional,"La inteligencia emocional es un predictor más fuerte del éxito en el liderazgo que la experiencia técnica sola.",trí tuệ cảm xúc,"Trí tuệ cảm xúc là yếu tố dự báo thành công lãnh đạo mạnh hơn so với chuyên môn kỹ thuật đơn thuần.",ความฉลาดทางอารมณ์,"ความฉลาดทางอารมณ์เป็นตัวทำนายความสำเร็จในการเป็นผู้นำที่แข็งแกร่งกว่าความเชี่ยวชาญทางเทคนิคเพียงอย่างเดียว",kecerdasan emosional,"Kecerdasan emosional merupakan prediktor kesuksesan kepemimpinan yang lebih kuat daripada keahlian teknis saja."
implicit bias,"Implicit bias can unconsciously influence hiring decisions despite diversity training programs.",암묵적 편견,"암묵적 편견은 다양성 교육 프로그램에도 불구하고 무의식적으로 채용 결정에 영향을 미칠 수 있다.",潜在的バイアス,"潜在的バイアスはダイバーシティ研修にもかかわらず無意識のうちに採用決定に影響を及ぼすことがある。",隐性偏见,"隐性偏见会在不知不觉中影响招聘决策即使有多元化培训项目。",sesgo implícito,"El sesgo implícito puede influir inconscientemente en las decisiones de contratación a pesar de los programas de capacitación en diversidad.",thiên kiến ngầm,"Thiên kiến ngầm có thể vô thức ảnh hưởng đến quyết định tuyển dụng bất chấp các chương trình đào tạo đa dạng.",อคติแฝง,"อคติแฝงสามารถมีอิทธิพลต่อการตัดสินใจจ้างงานอย่างไม่รู้ตัวแม้จะมีโปรแกรมฝึกอบรมด้านความหลากหลาย",bias implisit,"Bias implisit dapat secara tidak sadar memengaruhi keputusan perekrutan meskipun ada program pelatihan keragaman."
learned helplessness,"Learned helplessness occurs when repeated exposure to uncontrollable events leads to passive acceptance.",학습된 무기력,"학습된 무기력은 통제 불가능한 사건에 반복적으로 노출되면 수동적 수용으로 이어질 때 발생한다.",学習性無力感,"学習性無力感は制御不能な出来事への繰り返しの曝露が受動的な受容につながるときに起こる。",习得性无助,"习得性无助发生在反复接触不可控事件导致被动接受时。",indefensión aprendida,"La indefensión aprendida ocurre cuando la exposición repetida a eventos incontrolables lleva a la aceptación pasiva.",bất lực học được,"Bất lực học được xảy ra khi tiếp xúc lặp đi lặp lại với các sự kiện không thể kiểm soát dẫn đến sự chấp nhận thụ động.",ภาวะหมดหวังที่เรียนรู้มา,"ภาวะหมดหวังที่เรียนรู้มาเกิดขึ้นเมื่อการเผชิญกับเหตุการณ์ที่ควบคุมไม่ได้ซ้ำแล้วซ้ำเล่านำไปสู่การยอมรับอย่างเฉื่อยชา",ketidakberdayaan yang dipelajari,"Ketidakberdayaan yang dipelajari terjadi ketika paparan berulang terhadap peristiwa yang tidak dapat dikendalikan mengarah pada penerimaan pasif."
technocracy,"Critics warned that unchecked technocracy undermines democratic accountability.",기술관료주의,"비평가들은 견제되지 않는 기술관료주의가 민주적 책임을 훼손한다고 경고했다.",テクノクラシー,"批評家はチェックされないテクノクラシーが民主的説明責任を損なうと警告した。",技术官僚制,"批评者警告不受制约的技术官僚制会破坏民主问责。",tecnocracia,"Los críticos advirtieron que la tecnocracia descontrolada socava la rendición de cuentas democrática.",chế độ kỹ trị,"Các nhà phê bình cảnh báo rằng chế độ kỹ trị không được kiểm soát sẽ làm suy yếu trách nhiệm giải trình dân chủ.",เทคโนแครซี,"นักวิจารณ์เตือนว่าเทคโนแครซีที่ไม่มีการตรวจสอบจะบ่อนทำลายความรับผิดชอบตามระบอบประชาธิปไตย",teknokrasi,"Para kritikus memperingatkan bahwa teknokrasi yang tidak terkendali merusak akuntabilitas demokratis."
cognitive load,"Excessive cognitive load impairs working memory and degrades decision-making quality.",인지 부하,"과도한 인지 부하는 작업 기억을 손상시키고 의사결정의 질을 저하시킨다.",認知的負荷,"過度な認知的負荷は作業記憶を損ない意思決定の質を低下させる。",认知负荷,"过度的认知负荷会损害工作记忆并降低决策质量。",carga cognitiva,"La carga cognitiva excesiva deteriora la memoria de trabajo y degrada la calidad de la toma de decisiones.",tải nhận thức,"Tải nhận thức quá mức làm suy giảm trí nhớ làm việc và giảm chất lượng ra quyết định.",ภาระทางปัญญา,"ภาระทางปัญญาที่มากเกินไปทำให้หน่วยความจำใช้งานบกพร่องและลดคุณภาพการตัดสินใจ",beban kognitif,"Beban kognitif yang berlebihan merusak memori kerja dan menurunkan kualitas pengambilan keputusan."
paradigm shift,"The discovery of quantum mechanics triggered a paradigm shift in our understanding of physical reality.",패러다임 전환,"양자역학의 발견은 물리적 현실에 대한 이해의 패러다임 전환을 촉발했다.",パラダイムシフト,"量子力学の発見は物理的現実の理解におけるパラダイムシフトを引き起こした。",范式转换,"量子力学的发现引发了我们对物理现实理解的范式转换。",cambio de paradigma,"El descubrimiento de la mecánica cuántica desencadenó un cambio de paradigma en nuestra comprensión de la realidad física.",chuyển đổi mô hình,"Việc khám phá cơ học lượng tử đã kích hoạt một chuyển đổi mô hình trong nhận thức của chúng ta về thực tại vật lý.",การเปลี่ยนกระบวนทัศน์,"การค้นพบกลศาสตร์ควอนตัมก่อให้เกิดการเปลี่ยนกระบวนทัศน์ในความเข้าใจความจริงทางกายภาพของเรา",pergeseran paradigma,"Penemuan mekanika kuantum memicu pergeseran paradigma dalam pemahaman kita tentang realitas fisik."
