squirrel,A squirrel is eating nuts in the tree.,다람쥐,다람쥐가 나무에서 견과류를 먹고 있어요.,リス,リスが木の上でナッツを食べている。,松鼠,一只松鼠在树上吃坚果。,ardilla,Una ardilla está comiendo nueces en el árbol.,con sóc,Một con sóc đang ăn hạt trên cây.,กระรอก,กระรอกกำลังกินถั่วบนต้นไม้,tupai,Seekor tupai sedang makan kacang di pohon.
owl,The owl hunts at night.,올빼미; 부엉이,올빼미는 밤에 사냥을 해요.,フクロウ,フクロウは夜に狩りをする。,猫头鹰,猫头鹰在夜间捕猎。,búho,El búho caza de noche.,cú mèo,Cú mèo săn mồi vào ban đêm.,นกฮูก,นกฮูกล่าเหยื่อในเวลากลางคืน,burung hantu,Burung hantu berburu di malam hari.
eagle,The eagle flew high in the sky.,독수리,독수리가 하늘 높이 날았어요.,ワシ,ワシが空高く飛んだ。,鹰; 老鹰,老鹰在天空中高高飞翔。,águila,El águila voló alto en el cielo.,đại bàng,Đại bàng bay cao trên bầu trời.,นกอินทรี,นกอินทรีบินสูงในท้องฟ้า,elang,Elang terbang tinggi di langit.
fox,A fox ran across the field.,여우,여우가 들판을 가로질러 달렸어요.,キツネ,キツネが野原を横切って走った。,狐狸,一只狐狸跑过田野。,zorro,Un zorro corrió por el campo.,cáo,Một con cáo chạy qua cánh đồng.,สุนัขจิ้งจอก,สุนัขจิ้งจอกวิ่งข้ามทุ่ง,rubah,Seekor rubah berlari melintasi ladang.
deer,We saw a deer in the forest.,사슴,우리는 숲에서 사슴을 봤어요.,シカ,森で鹿を見ました。,鹿,我们在森林里看到了一只鹿。,ciervo; venado,Vimos un ciervo en el bosque.,hươu; nai,Chúng tôi thấy một con hươu trong rừng.,กวาง,เราเห็นกวางในป่า,rusa,Kami melihat rusa di hutan.
butterfly,A beautiful butterfly landed on the flower.,나비,아름다운 나비가 꽃에 앉았어요.,チョウ,きれいな蝶が花にとまった。,蝴蝶,一只美丽的蝴蝶落在花上。,mariposa,Una hermosa mariposa se posó en la flor.,bướm,Một con bướm đẹp đậu trên hoa.,ผีเสื้อ,ผีเสื้อสวยเกาะบนดอกไม้,kupu-kupu,Seekor kupu-kupu cantik hinggap di bunga.
grasshopper,The grasshopper jumped very high.,메뚜기,메뚜기가 아주 높이 뛰었어요.,バッタ,バッタがとても高く跳んだ。,蚱蜢; 蝗虫,蚱蜢跳得很高。,saltamontes,El saltamontes saltó muy alto.,châu chấu,Con châu chấu nhảy rất cao.,ตั๊กแตน,ตั๊กแตนกระโดดสูงมาก,belalang,Belalang itu melompat sangat tinggi.
frog,The frog jumped into the pond.,개구리,개구리가 연못에 뛰어들었어요.,カエル,カエルが池に飛び込んだ。,青蛙,青蛙跳进了池塘。,rana,La rana saltó al estanque.,con ếch,Con ếch nhảy vào ao.,กบ,กบกระโดดลงบ่อน้ำ,katak,Katak itu melompat ke kolam.
parrot,The parrot can say many words.,앵무새,앵무새는 많은 단어를 말할 수 있어요.,オウム,オウムはたくさんの言葉を話せる。,鹦鹉,鹦鹉能说很多词。,loro,El loro puede decir muchas palabras.,con vẹt,Con vẹt có thể nói nhiều từ.,นกแก้ว,นกแก้วพูดได้หลายคำ,burung beo,Burung beo bisa mengucapkan banyak kata.
swan,Two white swans swim in the lake.,백조,두 마리의 하얀 백조가 호수에서 헤엄치고 있어요.,白鳥,二羽の白い白鳥が湖で泳いでいる。,天鹅,两只白天鹅在湖里游泳。,cisne,Dos cisnes blancos nadan en el lago.,thiên nga,Hai con thiên nga trắng bơi trong hồ.,หงส์,หงส์ขาวสองตัวว่ายน้ำในทะเลสาบ,angsa,Dua angsa putih berenang di danau.
snail,The snail moves very slowly.,달팽이,달팽이는 매우 느리게 움직여요.,カタツムリ,カタツムリはとてもゆっくり動く。,蜗牛,蜗牛移动得非常慢。,caracol,El caracol se mueve muy lentamente.,ốc sên,Ốc sên di chuyển rất chậm.,หอยทาก,หอยทากเคลื่อนที่ช้ามาก,siput,Siput bergerak sangat lambat.
lizard,A small lizard is on the wall.,도마뱀,작은 도마뱀이 벽에 있어요.,トカゲ,小さなトカゲが壁にいる。,蜥蜴,一只小蜥蜴在墙上。,lagartija,Una pequeña lagartija está en la pared.,thằn lằn,Một con thằn lằn nhỏ trên tường.,จิ้งจก,จิ้งจกตัวเล็กอยู่บนกำแพง,kadal,Seekor kadal kecil di dinding.
mouse (animal),The cat chased the mouse.,생쥐,고양이가 생쥐를 쫓았어요.,ネズミ,猫がネズミを追いかけた。,老鼠,猫追着老鼠跑。,ratón,El gato persiguió al ratón.,chuột,Con mèo đuổi con chuột.,หนู,แมววิ่งไล่จับหนู,tikus,Kucing mengejar tikus.
goat,The farmer has ten goats.,염소,농부에게는 열 마리의 염소가 있어요.,ヤギ,農家は十匹のヤギを飼っている。,山羊,农夫养了十只山羊。,cabra,El granjero tiene diez cabras.,con dê,Người nông dân có mười con dê.,แพะ,เกษตรกรมีแพะสิบตัว,kambing,Petani itu memiliki sepuluh kambing.
sheep,The sheep are eating grass on the hill.,양,양들이 언덕에서 풀을 먹고 있어요.,ヒツジ,羊が丘の上で草を食べている。,绵羊,羊在山坡上吃草。,oveja,Las ovejas están comiendo hierba en la colina.,con cừu,Những con cừu đang ăn cỏ trên đồi.,แกะ,แกะกำลังกินหญ้าบนเนินเขา,domba,Domba-domba sedang makan rumput di bukit.
rooster,The rooster crows every morning.,수탉,수탉은 매일 아침 울어요.,雄鶏,雄鶏は毎朝鳴く。,公鸡,公鸡每天早上打鸣。,gallo,El gallo canta cada mañana.,gà trống,Gà trống gáy mỗi sáng.,ไก่ตัวผู้,ไก่ตัวผู้ขันทุกเช้า,ayam jantan,Ayam jantan berkokok setiap pagi.
hen,The hen laid three eggs.,암탉,암탉이 달걀 세 개를 낳았어요.,雌鶏,雌鶏が卵を三つ産んだ。,母鸡,母鸡下了三个蛋。,gallina,La gallina puso tres huevos.,gà mái,Gà mái đẻ ba quả trứng.,ไก่ตัวเมีย,ไก่ตัวเมียออกไข่สามฟอง,ayam betina,Ayam betina bertelur tiga butir.
continent,There are seven continents in the world.,대륙,세계에는 7개의 대륙이 있어요.,大陸,世界には七つの大陸がある。,大洲; 大陆,世界上有七大洲。,continente,Hay siete continentes en el mundo.,lục địa; châu,Có bảy châu lục trên thế giới.,ทวีป,มีเจ็ดทวีปในโลก,benua,Ada tujuh benua di dunia.
desert,The desert is very hot during the day.,사막,사막은 낮에 매우 더워요.,砂漠,砂漠は日中とても暑い。,沙漠,沙漠白天非常热。,desierto,El desierto es muy caluroso durante el día.,sa mạc,Sa mạc rất nóng vào ban ngày.,ทะเลทราย,ทะเลทรายร้อนมากในเวลากลางวัน,gurun,Gurun sangat panas di siang hari.
coast,We drove along the coast.,해안,우리는 해안을 따라 드라이브했어요.,海岸,私たちは海岸沿いを走った。,海岸,我们沿着海岸开车。,costa,Conducimos a lo largo de la costa.,bờ biển,Chúng tôi lái xe dọc bờ biển.,ชายฝั่ง,เราขับรถไปตามชายฝั่ง,pantai; pesisir,Kami berkendara di sepanjang pesisir.
cliff,Be careful near the edge of the cliff.,절벽,절벽 가장자리 근처에서 조심하세요.,崖,崖の端の近くは気をつけてください。,悬崖,在悬崖边要小心。,acantilado,Ten cuidado cerca del borde del acantilado.,vách đá,Cẩn thận gần mép vách đá.,หน้าผา,ระวังใกล้ขอบหน้าผา,tebing,Hati-hati di dekat tepi tebing.
cave,We explored a dark cave.,동굴,우리는 어두운 동굴을 탐험했어요.,洞窟,私たちは暗い洞窟を探検した。,洞穴,我们探索了一个黑暗的洞穴。,cueva,Exploramos una cueva oscura.,hang động,Chúng tôi khám phá một hang động tối.,ถ้ำ,เราสำรวจถ้ำมืด,gua,Kami menjelajahi gua gelap.
waterfall,The waterfall was very beautiful.,폭포,폭포가 매우 아름다웠어요.,滝,滝はとても美しかった。,瀑布,瀑布非常美丽。,cascada,La cascada era muy hermosa.,thác nước,Thác nước rất đẹp.,น้ำตก,น้ำตกสวยมาก,air terjun,Air terjun itu sangat indah.
meadow,The children played in the meadow.,초원; 풀밭,아이들이 초원에서 놀았어요.,草原; 牧草地,子供たちは草原で遊んだ。,草地; 牧场,孩子们在草地上玩耍。,pradera; prado,Los niños jugaron en el prado.,đồng cỏ,Bọn trẻ chơi trên đồng cỏ.,ทุ่งหญ้า,เด็ก ๆ เล่นบนทุ่งหญ้า,padang rumput,Anak-anak bermain di padang rumput.
pond,There are fish in the pond.,연못,연못에 물고기가 있어요.,池,池には魚がいる。,池塘,池塘里有鱼。,estanque,Hay peces en el estanque.,ao,Có cá trong ao.,สระน้ำ; บ่อน้ำ,มีปลาในสระน้ำ,kolam,Ada ikan di kolam.
stream,A small stream runs through the village.,시냇물; 개울,작은 시냇물이 마을을 흐르고 있어요.,小川,小さな小川が村を流れている。,小溪,一条小溪流过村庄。,arroyo,Un pequeño arroyo pasa por el pueblo.,suối; dòng suối,Một dòng suối nhỏ chảy qua ngôi làng.,ลำธาร,ลำธารเล็ก ๆ ไหลผ่านหมู่บ้าน,sungai kecil,Sebuah sungai kecil mengalir melewati desa.
harbor,The boats are safe in the harbor.,항구,배들이 항구에서 안전해요.,港,船は港で安全です。,港口,船在港口里很安全。,puerto,Los barcos están seguros en el puerto.,bến cảng,Các tàu an toàn trong bến cảng.,ท่าเรือ,เรืออยู่อย่างปลอดภัยในท่าเรือ,pelabuhan,Kapal-kapal aman di pelabuhan.
receipt,Keep the receipt for your return.,영수증,반품을 위해 영수증을 보관하세요.,レシート; 領収書,返品のためにレシートを保管してください。,收据,保留收据以便退货。,recibo,Guarda el recibo para tu devolución.,biên lai; hóa đơn,Giữ biên lai để đổi trả.,ใบเสร็จ,เก็บใบเสร็จไว้สำหรับการคืนสินค้า,kuitansi; struk,Simpan struk untuk pengembalian.
discount,There is a 20 percent discount today.,할인,오늘 20퍼센트 할인이 있어요.,割引,今日は20パーセント割引です。,折扣,今天有八折优惠。,descuento,Hay un descuento del 20 por ciento hoy.,giảm giá,Hôm nay giảm giá 20 phần trăm.,ส่วนลด,วันนี้มีส่วนลด 20 เปอร์เซ็นต์,diskon,Hari ini ada diskon 20 persen.
cashier,Pay at the cashier near the exit.,계산원; 캐셔,출구 근처 계산대에서 결제하세요.,レジ; レジ係,出口近くのレジで支払ってください。,收银员,在出口附近的收银台付款。,cajero,Paga en el cajero cerca de la salida.,thu ngân,Thanh toán tại quầy thu ngân gần lối ra.,แคชเชียร์,จ่ายเงินที่แคชเชียร์ใกล้ทางออก,kasir,Bayar di kasir dekat pintu keluar.
aisle,The cereal is in aisle three.,통로,시리얼은 3번 통로에 있어요.,通路,シリアルは3番通路にあります。,过道,麦片在第三过道。,pasillo,El cereal está en el pasillo tres.,lối đi,Ngũ cốc ở lối đi số ba.,ทางเดิน,ซีเรียลอยู่ทางเดินที่สาม,lorong,Sereal ada di lorong tiga.
bargain,I found a great bargain at the market.,득템; 싸게 산 물건,시장에서 좋은 물건을 싸게 샀어요.,お買い得品,市場でお買い得品を見つけた。,便宜货,我在市场上找到了一个好便宜的东西。,ganga,Encontré una gran ganga en el mercado.,món hời,Tôi tìm được món hời ở chợ.,ของถูก; ราคาดี,ฉันเจอของราคาดีที่ตลาด,barang murah,Saya menemukan barang murah di pasar.
refund,I asked for a refund for the broken item.,환불,깨진 물건에 대해 환불을 요청했어요.,返金; 払い戻し,壊れた商品の返金を求めた。,退款,我要求退款因为东西坏了。,reembolso,Pedí un reembolso por el artículo roto.,hoàn tiền,Tôi yêu cầu hoàn tiền cho món hàng hỏng.,เงินคืน,ฉันขอเงินคืนสำหรับสินค้าที่เสีย,pengembalian dana,Saya meminta pengembalian dana untuk barang yang rusak.
delivery,The delivery will arrive tomorrow.,배달,배달이 내일 도착할 거예요.,配達,配達は明日届きます。,送货; 快递,快递明天到。,entrega,La entrega llegará mañana.,giao hàng,Hàng sẽ giao vào ngày mai.,การจัดส่ง,การจัดส่งจะมาถึงพรุ่งนี้,pengiriman,Pengiriman akan tiba besok.
package,A package arrived for you today.,소포; 택배,오늘 당신에게 소포가 도착했어요.,荷物; パッケージ,今日あなたに荷物が届きました。,包裹; 快递,今天有你的包裹到了。,paquete,Un paquete llegó para ti hoy.,bưu kiện; gói hàng,Hôm nay có bưu kiện gửi đến cho bạn.,พัสดุ,มีพัสดุมาถึงสำหรับคุณวันนี้,paket,Ada paket datang untuk Anda hari ini.
dawn,We woke up at dawn to watch the sunrise.,새벽,우리는 일출을 보기 위해 새벽에 일어났어요.,夜明け,日の出を見るために夜明けに起きた。,黎明,我们黎明起床看日出。,amanecer,Nos despertamos al amanecer para ver el amanecer.,bình minh,Chúng tôi dậy lúc bình minh để ngắm mặt trời mọc.,รุ่งอรุณ,เราตื่นตอนรุ่งอรุณเพื่อดูพระอาทิตย์ขึ้น,fajar,Kami bangun saat fajar untuk melihat matahari terbit.
dusk,The sky is orange at dusk.,황혼; 해질녘,해질녘에 하늘이 주황색이에요.,夕暮れ,夕暮れ時に空がオレンジ色になる。,黄昏,黄昏时天空是橙色的。,crepúsculo; anochecer,El cielo es naranja al anochecer.,hoàng hôn,Bầu trời màu cam lúc hoàng hôn.,พลบค่ำ,ท้องฟ้าเป็นสีส้มเมื่อพลบค่ำ,senja,Langit berwarna oranye saat senja.
midnight,We celebrated at midnight on New Year.,자정,우리는 새해 자정에 축하했어요.,真夜中,新年の真夜中にお祝いをした。,午夜; 半夜,我们在新年的午夜庆祝。,medianoche,Celebramos a medianoche en Año Nuevo.,nửa đêm,Chúng tôi ăn mừng vào nửa đêm Giao thừa.,เที่ยงคืน,เราฉลองตอนเที่ยงคืนวันปีใหม่,tengah malam,Kami merayakan di tengah malam Tahun Baru.
decade,She lived abroad for a decade.,십 년; 10년,그녀는 10년간 해외에서 살았어요.,十年間,彼女は10年間海外に住んでいた。,十年,她在国外生活了十年。,década,Ella vivió en el extranjero por una década.,thập kỷ,Cô ấy sống ở nước ngoài một thập kỷ.,ทศวรรษ,เธออาศัยอยู่ต่างประเทศหนึ่งทศวรรษ,dekade,Dia tinggal di luar negeri selama satu dekade.
century,The castle is over a century old.,세기; 100년,그 성은 100년이 넘었어요.,世紀,その城は一世紀以上の歴史がある。,世纪,这座城堡有一百多年的历史。,siglo,El castillo tiene más de un siglo de antigüedad.,thế kỷ,Lâu đài hơn một thế kỷ tuổi.,ศตวรรษ,ปราสาทนี้มีอายุมากกว่าหนึ่งศตวรรษ,abad,Kastil itu berusia lebih dari satu abad.
weekday,I go to the gym on weekdays.,평일,나는 평일에 헬스장에 가요.,平日,私は平日にジムに行きます。,工作日,我工作日去健身房。,día de semana; entre semana,Voy al gimnasio entre semana.,ngày trong tuần,Tôi đi tập gym vào ngày trong tuần.,วันธรรมดา,ฉันไปยิมในวันธรรมดา,hari kerja,Saya pergi ke gym pada hari kerja.
schedule,Check the bus schedule online.,일정; 시간표,버스 시간표를 온라인으로 확인하세요.,時刻表; スケジュール,バスの時刻表をオンラインで確認してください。,时刻表; 日程,在网上查看公交时刻表。,horario,Consulta el horario del autobús en línea.,lịch trình,Kiểm tra lịch trình xe buýt trực tuyến.,ตารางเวลา,ตรวจสอบตารางเวลารถบัสออนไลน์,jadwal,Periksa jadwal bus secara online.
deadline,The deadline for the project is Friday.,마감일; 기한,프로젝트 마감일은 금요일이에요.,締め切り,プロジェクトの締め切りは金曜日です。,截止日期,项目的截止日期是星期五。,fecha límite,La fecha límite del proyecto es el viernes.,hạn chót,Hạn chót của dự án là thứ Sáu.,เส้นตาย,เส้นตายของโครงการคือวันศุกร์,tenggat waktu,Tenggat waktu proyek adalah hari Jumat.
caterpillar,The caterpillar will become a butterfly.,애벌레,애벌레는 나비가 될 거예요.,毛虫; イモムシ,イモムシは蝶になります。,毛毛虫,毛毛虫会变成蝴蝶。,oruga,La oruga se convertirá en mariposa.,sâu bướm,Sâu bướm sẽ thành bướm.,หนอนผีเสื้อ,หนอนผีเสื้อจะกลายเป็นผีเสื้อ,ulat,Ulat itu akan menjadi kupu-kupu.
pigeon,Pigeons are common in the city.,비둘기,비둘기는 도시에서 흔해요.,ハト,ハトは街中でよく見かける。,鸽子,鸽子在城市里很常见。,paloma,Las palomas son comunes en la ciudad.,bồ câu,Chim bồ câu rất phổ biến trong thành phố.,นกพิราบ,นกพิราบพบได้ทั่วไปในเมือง,merpati,Merpati umum di kota.
crow,The crow sat on the fence.,까마귀,까마귀가 울타리에 앉아 있었어요.,カラス,カラスが柵の上に止まっていた。,乌鸦,乌鸦坐在栅栏上。,cuervo,El cuervo se sentó en la cerca.,quạ,Con quạ đậu trên hàng rào.,อีกา,อีกาเกาะอยู่บนรั้ว,gagak,Gagak itu duduk di pagar.
worm,The bird caught a worm.,벌레; 지렁이,새가 벌레를 잡았어요.,虫; ミミズ,鳥がミミズを捕まえた。,虫子; 蠕虫,鸟抓住了一条虫子。,gusano,El pájaro atrapó un gusano.,sâu; giun,Con chim bắt được một con sâu.,หนอน; ไส้เดือน,นกจับหนอนได้,cacing,Burung itu menangkap cacing.
seagull,Seagulls fly over the beach.,갈매기,갈매기가 해변 위를 날아요.,カモメ,カモメがビーチの上を飛んでいる。,海鸥,海鸥在海滩上空飞翔。,gaviota,Las gaviotas vuelan sobre la playa.,mòng biển,Chim mòng biển bay trên bãi biển.,นกนางนวล,นกนางนวลบินเหนือชายหาด,camar,Burung camar terbang di atas pantai.
stork,A stork built a nest on the roof.,황새,황새가 지붕 위에 둥지를 지었어요.,コウノトリ,コウノトリが屋根の上に巣を作った。,鹳,一只鹳在屋顶上筑了巢。,cigüeña,Una cigüeña construyó un nido en el techo.,con cò,Con cò làm tổ trên mái nhà.,นกกระสา,นกกระสาสร้างรังบนหลังคา,bangau,Seekor bangau membangun sarang di atap.
hamster,My daughter has a pet hamster.,햄스터,딸이 애완 햄스터를 키우고 있어요.,ハムスター,娘はペットのハムスターを飼っている。,仓鼠,我女儿养了一只仓鼠。,hámster,Mi hija tiene un hámster como mascota.,chuột hamster,Con gái tôi nuôi một con chuột hamster.,หนูแฮมสเตอร์,ลูกสาวฉันเลี้ยงหนูแฮมสเตอร์,hamster,Putri saya memiliki hamster peliharaan.
goldfish,We have three goldfish in a bowl.,금붕어,우리는 어항에 금붕어 세 마리가 있어요.,金魚,金魚鉢に金魚が三匹いる。,金鱼,我们鱼缸里有三条金鱼。,pez dorado,Tenemos tres peces dorados en una pecera.,cá vàng,Chúng tôi có ba con cá vàng trong bể.,ปลาทอง,เรามีปลาทองสามตัวในโหล,ikan mas,Kami punya tiga ikan mas dalam mangkuk.
jungle,Many animals live in the jungle.,밀림; 정글,많은 동물이 정글에 살아요.,ジャングル,多くの動物がジャングルに住んでいる。,丛林,很多动物生活在丛林里。,selva; jungla,Muchos animales viven en la selva.,rừng rậm; rừng nhiệt đới,Nhiều động vật sống trong rừng rậm.,ป่าดงดิบ,สัตว์หลายชนิดอาศัยอยู่ในป่าดงดิบ,hutan rimba,Banyak hewan hidup di hutan rimba.
plain,The plains stretch for many miles.,평원; 평야,평원이 수 마일에 걸쳐 펼쳐져 있어요.,平原,平原は何マイルも続いている。,平原,平原延伸了很多英里。,llanura,Las llanuras se extienden por muchas millas.,đồng bằng,Đồng bằng trải dài nhiều dặm.,ที่ราบ,ที่ราบทอดยาวหลายไมล์,dataran,Dataran membentang bermil-mil.
swamp,The swamp is full of frogs.,늪; 습지,늪에 개구리가 가득해요.,沼,沼はカエルでいっぱいだ。,沼泽,沼泽里满是青蛙。,pantano,El pantano está lleno de ranas.,đầm lầy,Đầm lầy đầy ếch.,หนองบึง,หนองบึงเต็มไปด้วยกบ,rawa,Rawa itu penuh dengan katak.
glacier,The glacier is slowly melting.,빙하,빙하가 서서히 녹고 있어요.,氷河,氷河がゆっくり溶けている。,冰川,冰川正在慢慢融化。,glaciar,El glaciar se está derritiendo lentamente.,sông băng,Sông băng đang tan chảy từ từ.,ธารน้ำแข็ง,ธารน้ำแข็งกำลังละลายอย่างช้า ๆ,gletser,Gletser perlahan mencair.
peninsula,Italy is a famous peninsula.,반도,이탈리아는 유명한 반도예요.,半島,イタリアは有名な半島です。,半岛,意大利是一个著名的半岛。,península,Italia es una famosa península.,bán đảo,Ý là một bán đảo nổi tiếng.,คาบสมุทร,อิตาลีเป็นคาบสมุทรที่มีชื่อเสียง,semenanjung,Italia adalah semenanjung yang terkenal.
oasis,The travelers found an oasis in the desert.,오아시스,여행자들이 사막에서 오아시스를 찾았어요.,オアシス,旅人たちは砂漠でオアシスを見つけた。,绿洲,旅行者在沙漠中发现了一片绿洲。,oasis,Los viajeros encontraron un oasis en el desierto.,ốc đảo,Những người du hành tìm thấy ốc đảo trong sa mạc.,โอเอซิส,นักเดินทางพบโอเอซิสในทะเลทราย,oasis,Para pelancong menemukan oasis di gurun.
shopper,The mall was full of shoppers.,쇼핑객,쇼핑몰이 쇼핑객으로 가득했어요.,買い物客,ショッピングモールは買い物客でいっぱいだった。,购物者,商场里挤满了购物者。,comprador,El centro comercial estaba lleno de compradores.,người mua sắm,Trung tâm thương mại đầy người mua sắm.,นักช้อป,ห้างเต็มไปด้วยนักช้อป,pembeli,Mal penuh dengan pembeli.
brand,This is my favorite clothing brand.,브랜드,이것은 제가 가장 좋아하는 의류 브랜드예요.,ブランド,これは私のお気に入りの衣料品ブランドです。,品牌,这是我最喜欢的服装品牌。,marca,Esta es mi marca de ropa favorita.,thương hiệu,Đây là thương hiệu quần áo yêu thích của tôi.,แบรนด์,นี่คือแบรนด์เสื้อผ้าที่ฉันชอบที่สุด,merek,Ini adalah merek pakaian favorit saya.
coupon,Use this coupon for a free drink.,쿠폰,이 쿠폰으로 무료 음료를 받으세요.,クーポン,このクーポンを使って無料ドリンクをもらえます。,优惠券,用这张优惠券可以免费喝饮料。,cupón,Usa este cupón para una bebida gratis.,phiếu giảm giá,Dùng phiếu giảm giá này để được đồ uống miễn phí.,คูปอง,ใช้คูปองนี้สำหรับเครื่องดื่มฟรี,kupon,Gunakan kupon ini untuk minuman gratis.
