drawer,The keys are in the drawer.,서랍,열쇠는 서랍에 있어요.,引き出し,鍵は引き出しの中にあります。,抽屉,钥匙在抽屉里。,cajón,Las llaves están en el cajón.,ngăn kéo,Chìa khóa ở trong ngăn kéo.,ลิ้นชัก,กุญแจอยู่ในลิ้นชัก,laci,Kuncinya ada di laci.
mirror,She looked in the mirror.,거울,그녀는 거울을 봤어요.,鏡,彼女は鏡を見た。,镜子,她照了照镜子。,espejo,Ella se miró en el espejo.,gương,Cô ấy soi gương.,กระจก,เธอมองกระจก,cermin,Dia melihat ke cermin.
curtain,Open the curtains please.,커튼,커튼을 열어 주세요.,カーテン,カーテンを開けてください。,窗帘,请把窗帘打开。,cortina,Abre las cortinas por favor.,rèm cửa,Mở rèm cửa nhé.,ม่าน,เปิดม่านด้วย,tirai; gorden,Tolong buka tirainya.
carpet,The carpet is soft.,카펫; 양탄자,카펫이 부드러워요.,カーペット,カーペットは柔らかい。,地毯,地毯很柔软。,alfombra,La alfombra es suave.,thảm,Thảm rất mềm.,พรม,พรมนุ่ม,karpet,Karpetnya lembut.
soccer,He plays soccer after school.,축구,그는 방과 후에 축구를 해요.,サッカー,彼は放課後にサッカーをする。,足球,他放学后踢足球。,fútbol,Él juega fútbol después de la escuela.,bóng đá,Anh ấy chơi bóng đá sau giờ học.,ฟุตบอล,เขาเล่นฟุตบอลหลังเลิกเรียน,sepak bola,Dia bermain sepak bola setelah sekolah.
basketball,Basketball is my favorite sport.,농구,농구는 제가 가장 좋아하는 운동이에요.,バスケットボール,バスケットボールは一番好きなスポーツです。,篮球,篮球是我最喜欢的运动。,baloncesto; básquetbol,El baloncesto es mi deporte favorito.,bóng rổ,Bóng rổ là môn thể thao yêu thích của tôi.,บาสเก็ตบอล,บาสเก็ตบอลเป็นกีฬาที่ฉันชอบที่สุด,bola basket,Bola basket adalah olahraga favorit saya.
baseball,They watch baseball every weekend.,야구,그들은 매주 주말에 야구를 봐요.,野球,彼らは毎週末野球を見る。,棒球,他们每个周末看棒球。,béisbol,Ellos ven béisbol cada fin de semana.,bóng chày,Họ xem bóng chày mỗi cuối tuần.,เบสบอล,พวกเขาดูเบสบอลทุกสุดสัปดาห์,bisbol,Mereka menonton bisbol setiap akhir pekan.
tennis,She plays tennis twice a week.,테니스,그녀는 일주일에 두 번 테니스를 쳐요.,テニス,彼女は週に二回テニスをする。,网球,她每周打两次网球。,tenis,Ella juega tenis dos veces a la semana.,quần vợt; tennis,Cô ấy chơi tennis hai lần một tuần.,เทนนิส,เธอเล่นเทนนิสสัปดาห์ละสองครั้ง,tenis,Dia bermain tenis dua kali seminggu.
swimming,Swimming is good exercise.,수영,수영은 좋은 운동이에요.,水泳,水泳は良い運動です。,游泳,游泳是很好的运动。,natación,La natación es buen ejercicio.,bơi lội,Bơi lội là bài tập tốt.,ว่ายน้ำ,ว่ายน้ำเป็นการออกกำลังกายที่ดี,berenang,Berenang adalah olahraga yang baik.
running,I go running every morning.,달리기,저는 매일 아침 달리기를 해요.,ランニング,私は毎朝ランニングをする。,跑步,我每天早上跑步。,correr,Salgo a correr cada mañana.,chạy bộ,Tôi chạy bộ mỗi sáng.,วิ่ง,ฉันไปวิ่งทุกเช้า,berlari; lari,Saya berlari setiap pagi.
cycling,Cycling is fun and healthy.,자전거 타기,자전거 타기는 재미있고 건강에 좋아요.,サイクリング,サイクリングは楽しくて健康的だ。,骑自行车,骑自行车既有趣又健康。,ciclismo,El ciclismo es divertido y saludable.,đạp xe,Đạp xe vui và tốt cho sức khỏe.,ปั่นจักรยาน,ปั่นจักรยานสนุกและดีต่อสุขภาพ,bersepeda,Bersepeda itu menyenangkan dan sehat.
volleyball,We played volleyball at the beach.,배구,우리는 해변에서 배구를 했어요.,バレーボール,ビーチでバレーボールをした。,排球,我们在海滩上打了排球。,voleibol,Jugamos voleibol en la playa.,bóng chuyền,Chúng tôi chơi bóng chuyền ở bãi biển.,วอลเลย์บอล,เราเล่นวอลเลย์บอลที่ชายหาด,bola voli,Kami bermain bola voli di pantai.
golf,My dad plays golf on Sundays.,골프,아빠는 일요일에 골프를 치세요.,ゴルフ,父は日曜日にゴルフをする。,高尔夫,我爸爸周日打高尔夫。,golf,Mi papá juega golf los domingos.,gôn,Bố tôi chơi gôn vào Chủ nhật.,กอล์ฟ,พ่อเล่นกอล์ฟวันอาทิตย์,golf,Ayah saya bermain golf pada hari Minggu.
skiing,We went skiing in the mountains.,스키,우리는 산에서 스키를 탔어요.,スキー,私たちは山でスキーをした。,滑雪,我们去山上滑雪了。,esquí,Fuimos a esquiar en las montañas.,trượt tuyết,Chúng tôi đi trượt tuyết ở núi.,สกี,เราไปเล่นสกีบนภูเขา,ski,Kami pergi bermain ski di pegunungan.
coach,The coach is very strict.,코치; 감독,코치는 매우 엄격해요.,コーチ; 監督,コーチはとても厳しい。,教练,教练非常严格。,entrenador,El entrenador es muy estricto.,huấn luyện viên,Huấn luyện viên rất nghiêm khắc.,โค้ช,โค้ชเข้มงวดมาก,pelatih,Pelatihnya sangat ketat.
score,The final score was 3 to 1.,점수,최종 점수는 3대 1이었어요.,スコア; 得点,最終スコアは3対1だった。,比分,最终比分是3比1。,marcador; puntuación,El marcador final fue 3 a 1.,tỉ số,Tỉ số cuối cùng là 3-1.,คะแนน,คะแนนสุดท้ายคือ 3 ต่อ 1,skor,Skor akhirnya 3 banding 1.
team,Our team won the game.,팀,우리 팀이 경기에서 이겼어요.,チーム,私たちのチームが試合に勝った。,队; 团队,我们队赢了比赛。,equipo,Nuestro equipo ganó el juego.,đội,Đội chúng tôi thắng trận.,ทีม,ทีมของเราชนะเกม,tim,Tim kami memenangkan pertandingan.
champion,She became the champion.,챔피언; 우승자,그녀는 챔피언이 되었어요.,チャンピオン; 優勝者,彼女はチャンピオンになった。,冠军,她成了冠军。,campeón; campeona,Ella se convirtió en la campeona.,nhà vô địch,Cô ấy trở thành nhà vô địch.,แชมป์,เธอกลายเป็นแชมป์,juara,Dia menjadi juara.
medal,He won a gold medal.,메달,그는 금메달을 땄어요.,メダル,彼は金メダルを獲った。,奖牌,他赢得了金牌。,medalla,Él ganó una medalla de oro.,huy chương,Anh ấy giành huy chương vàng.,เหรียญรางวัล,เขาได้เหรียญทอง,medali,Dia memenangkan medali emas.
stadium,The stadium is full of fans.,경기장; 스타디움,경기장이 팬들로 가득해요.,スタジアム,スタジアムはファンでいっぱいだ。,体育场,体育场坐满了球迷。,estadio,El estadio está lleno de aficionados.,sân vận động,Sân vận động đầy khán giả.,สนามกีฬา,สนามกีฬาเต็มไปด้วยแฟนๆ,stadion,Stadionnya penuh dengan penggemar.
piano,She plays the piano beautifully.,피아노,그녀는 피아노를 아름답게 연주해요.,ピアノ,彼女はピアノを美しく弾く。,钢琴,她弹钢琴弹得很好听。,piano,Ella toca el piano hermosamente.,đàn piano,Cô ấy chơi piano rất đẹp.,เปียโน,เธอเล่นเปียโนได้สวยงาม,piano,Dia bermain piano dengan indah.
guitar,He is learning to play guitar.,기타,그는 기타 치는 것을 배우고 있어요.,ギター,彼はギターの弾き方を学んでいる。,吉他,他正在学弹吉他。,guitarra,Él está aprendiendo a tocar guitarra.,ghi-ta,Anh ấy đang học chơi ghi-ta.,กีตาร์,เขากำลังเรียนเล่นกีตาร์,gitar,Dia sedang belajar bermain gitar.
drum,The drums are very loud.,드럼,드럼 소리가 매우 커요.,ドラム; 太鼓,ドラムはとても大きな音がする。,鼓,鼓声非常响。,tambor; batería,Los tambores son muy ruidosos.,trống,Trống rất ồn.,กลอง,กลองดังมาก,drum,Drumnya sangat keras.
violin,The violin has a beautiful sound.,바이올린,바이올린은 아름다운 소리를 내요.,バイオリン,バイオリンは美しい音がする。,小提琴,小提琴声音很优美。,violín,El violín tiene un sonido hermoso.,vĩ cầm; violin,Violin có âm thanh rất đẹp.,ไวโอลิน,ไวโอลินมีเสียงไพเราะ,biola,Biola memiliki suara yang indah.
flute,She plays the flute in the orchestra.,플루트; 플룻,그녀는 오케스트라에서 플루트를 연주해요.,フルート,彼女はオーケストラでフルートを吹く。,长笛,她在管弦乐队里吹长笛。,flauta,Ella toca la flauta en la orquesta.,sáo,Cô ấy chơi sáo trong dàn nhạc.,ขลุ่ย,เธอเล่นขลุ่ยในวงออร์เคสตรา,seruling; flute,Dia bermain seruling di orkestra.
trumpet,He plays the trumpet in the band.,트럼펫,그는 밴드에서 트럼펫을 연주해요.,トランペット,彼はバンドでトランペットを吹く。,小号,他在乐队里吹小号。,trompeta,Él toca la trompeta en la banda.,kèn trumpet,Anh ấy chơi kèn trumpet trong ban nhạc.,ทรัมเป็ต,เขาเล่นทรัมเป็ตในวง,terompet,Dia bermain terompet di band.
cello,The cello sounds deep and warm.,첼로,첼로는 깊고 따뜻한 소리가 나요.,チェロ,チェロは深くて温かい音がする。,大提琴,大提琴声音低沉而温暖。,violonchelo; chelo,El chelo suena profundo y cálido.,đàn cello,Cello có âm thanh trầm và ấm.,เชลโล,เชลโลมีเสียงทุ้มและอบอุ่น,cello,Cello terdengar dalam dan hangat.
harmonica,He carries a harmonica in his pocket.,하모니카,그는 주머니에 하모니카를 넣고 다녀요.,ハーモニカ,彼はポケットにハーモニカを入れている。,口琴,他口袋里装着一个口琴。,armónica,Él lleva una armónica en su bolsillo.,kèn harmonica,Anh ấy mang kèn harmonica trong túi.,ฮาร์โมนิกา,เขาพกฮาร์โมนิกาไว้ในกระเป๋า,harmonika,Dia membawa harmonika di sakunya.
concert,We went to a concert last night.,콘서트; 연주회,우리는 어젯밤 콘서트에 갔어요.,コンサート,昨夜コンサートに行った。,音乐会,我们昨晚去了音乐会。,concierto,Fuimos a un concierto anoche.,buổi hòa nhạc,Chúng tôi đi xem hòa nhạc tối qua.,คอนเสิร์ต,เราไปคอนเสิร์ตเมื่อคืน,konser,Kami pergi ke konser tadi malam.
melody,This melody is very catchy.,멜로디; 선율,이 멜로디는 정말 귀에 감겨요.,メロディー,このメロディーはとてもキャッチーだ。,旋律,这个旋律很上头。,melodía,Esta melodía es muy pegajosa.,giai điệu,Giai điệu này rất bắt tai.,ท่วงทำนอง,ท่วงทำนองนี้ติดหูมาก,melodi,Melodi ini sangat menarik.
rhythm,Keep the rhythm steady.,리듬,리듬을 일정하게 유지하세요.,リズム,リズムを安定させて。,节奏,保持节奏稳定。,ritmo,Mantén el ritmo constante.,nhịp điệu,Giữ nhịp đều nhé.,จังหวะ,รักษาจังหวะให้สม่ำเสมอ,irama; ritme,Jaga iramanya tetap stabil.
pencil,I need a pencil to write.,연필,쓰려면 연필이 필요해요.,鉛筆,書くのに鉛筆が必要です。,铅笔,我需要一支铅笔来写字。,lápiz,Necesito un lápiz para escribir.,bút chì,Tôi cần bút chì để viết.,ดินสอ,ฉันต้องการดินสอเพื่อเขียน,pensil,Saya butuh pensil untuk menulis.
eraser,Can I borrow your eraser?,지우개,지우개 좀 빌려줄 수 있어요?,消しゴム,消しゴムを借りてもいい?,橡皮擦,可以借你的橡皮擦吗?,borrador; goma,¿Me prestas tu borrador?,cục tẩy,Cho tôi mượn cục tẩy nhé?,ยางลบ,ขอยืมยางลบได้ไหม,penghapus,Boleh saya pinjam penghapusmu?
notebook,Write it down in your notebook.,노트; 공책,공책에 적으세요.,ノート,ノートに書いてください。,笔记本,写在你的笔记本上。,cuaderno,Escríbelo en tu cuaderno.,vở; sổ tay,Ghi vào vở nhé.,สมุด,เขียนลงในสมุด,buku catatan,Tulis di buku catatanmu.
textbook,Open your textbook to page 10.,교과서,교과서 10쪽을 펴세요.,教科書,教科書の10ページを開いてください。,课本; 教科书,打开课本第10页。,libro de texto,Abre tu libro de texto en la página 10.,sách giáo khoa,Mở sách giáo khoa trang 10.,หนังสือเรียน,เปิดหนังสือเรียนหน้า 10,buku teks,Buka buku teks halaman 10.
backpack,My backpack is heavy today.,배낭; 책가방,오늘 가방이 무거워요.,リュック; カバン,今日はリュックが重い。,书包; 背包,我今天的书包很重。,mochila,Mi mochila está pesada hoy.,ba lô; cặp sách,Ba lô hôm nay nặng quá.,กระเป๋าเป้,กระเป๋าเป้วันนี้หนัก,ransel; tas punggung,Ransel saya berat hari ini.
calculator,Use a calculator for math.,계산기,수학에는 계산기를 사용하세요.,電卓,数学には電卓を使ってください。,计算器,数学用计算器。,calculadora,Usa una calculadora para matemáticas.,máy tính,Dùng máy tính cho môn toán.,เครื่องคิดเลข,ใช้เครื่องคิดเลขสำหรับคณิตศาสตร์,kalkulator,Gunakan kalkulator untuk matematika.
crayon,The children drew with crayons.,크레용,아이들은 크레용으로 그림을 그렸어요.,クレヨン,子どもたちはクレヨンで絵を描いた。,蜡笔,孩子们用蜡笔画画。,crayón; crayola,Los niños dibujaron con crayones.,bút sáp màu,Bọn trẻ vẽ bằng bút sáp màu.,สีเทียน,เด็กๆ วาดรูปด้วยสีเทียน,krayon,Anak-anak menggambar dengan krayon.
marker,Use a marker on the whiteboard.,마커,화이트보드에 마커를 사용하세요.,マーカー,ホワイトボードにはマーカーを使って。,马克笔,在白板上用马克笔。,marcador; plumón,Usa un marcador en la pizarra.,bút dạ,Dùng bút dạ trên bảng trắng.,ปากกาเมจิก,ใช้ปากกาเมจิกบนไวท์บอร์ด,spidol,Gunakan spidol di papan tulis.
stapler,The stapler is on the desk.,스테이플러,스테이플러가 책상 위에 있어요.,ホチキス,ホチキスは机の上にあります。,订书机,订书机在桌子上。,engrapadora; grapadora,La engrapadora está en el escritorio.,dập ghim,Dập ghim ở trên bàn.,ที่เย็บกระดาษ,ที่เย็บกระดาษอยู่บนโต๊ะ,stapler,Staplernya ada di atas meja.
globe,There is a globe in the classroom.,지구본,교실에 지구본이 있어요.,地球儀,教室に地球儀がある。,地球仪,教室里有一个地球仪。,globo terráqueo,Hay un globo terráqueo en el aula.,quả địa cầu,Có quả địa cầu trong lớp.,ลูกโลก,มีลูกโลกในห้องเรียน,globe,Ada globe di dalam kelas.
chalk,The teacher writes with chalk.,분필,선생님은 분필로 글씨를 써요.,チョーク,先生はチョークで書く。,粉笔,老师用粉笔写字。,tiza,El maestro escribe con tiza.,phấn,Thầy viết bằng phấn.,ชอล์ก,ครูเขียนด้วยชอล์ก,kapur,Guru menulis dengan kapur.
doctor,The doctor examined the patient.,의사,의사가 환자를 진찰했어요.,医者,医者が患者を診察した。,医生,医生给病人做了检查。,doctor; médico,El doctor examinó al paciente.,bác sĩ,Bác sĩ khám bệnh nhân.,หมอ,หมอตรวจคนไข้,dokter,Dokter memeriksa pasien.
nurse,The nurse gave me a shot.,간호사,간호사가 주사를 놓았어요.,看護師,看護師が注射をしてくれた。,护士,护士给我打了一针。,enfermera; enfermero,La enfermera me puso una inyección.,y tá,Y tá tiêm cho tôi.,พยาบาล,พยาบาลฉีดยาให้ฉัน,perawat,Perawat menyuntik saya.
teacher,My teacher is very patient.,선생님,제 선생님은 매우 인내심이 있으세요.,先生,先生はとても辛抱強い。,老师,我的老师非常有耐心。,maestro; profesor,Mi maestro es muy paciente.,giáo viên; thầy cô,Thầy cô rất kiên nhẫn.,ครู,ครูของฉันอดทนมาก,guru,Guru saya sangat sabar.
engineer,She works as an engineer.,엔지니어; 기술자,그녀는 엔지니어로 일해요.,エンジニア,彼女はエンジニアとして働いている。,工程师,她是一名工程师。,ingeniero; ingeniera,Ella trabaja como ingeniera.,kỹ sư,Cô ấy làm kỹ sư.,วิศวกร,เธอทำงานเป็นวิศวกร,insinyur,Dia bekerja sebagai insinyur.
lawyer,The lawyer prepared the documents.,변호사,변호사가 서류를 준비했어요.,弁護士,弁護士が書類を準備した。,律师,律师准备了文件。,abogado; abogada,El abogado preparó los documentos.,luật sư,Luật sư chuẩn bị hồ sơ.,ทนายความ,ทนายความเตรียมเอกสาร,pengacara,Pengacara menyiapkan dokumen.
firefighter,The firefighter saved the family.,소방관,소방관이 가족을 구했어요.,消防士,消防士が家族を救った。,消防员,消防员救了那个家庭。,bombero; bombera,El bombero salvó a la familia.,lính cứu hỏa,Lính cứu hỏa cứu gia đình đó.,นักดับเพลิง,นักดับเพลิงช่วยครอบครัว,pemadam kebakaran,Pemadam kebakaran menyelamatkan keluarga itu.
police officer,The police officer directed traffic.,경찰관,경찰관이 교통을 정리했어요.,警察官,警察官が交通整理をした。,警察,警察指挥了交通。,oficial de policía,El oficial de policía dirigió el tráfico.,cảnh sát,Cảnh sát điều tiết giao thông.,ตำรวจ,ตำรวจควบคุมจราจร,polisi,Polisi mengatur lalu lintas.
chef,The chef prepared a special dish.,셰프; 요리사,셰프가 특별 요리를 준비했어요.,シェフ; 料理長,シェフが特別な料理を準備した。,厨师,厨师准备了一道特别的菜。,chef; cocinero,El chef preparó un plato especial.,đầu bếp,Đầu bếp chuẩn bị món đặc biệt.,เชฟ,เชฟเตรียมเมนูพิเศษ,koki,Koki menyiapkan hidangan spesial.
farmer,The farmer grows vegetables.,농부,농부가 채소를 재배해요.,農家; 農民,農家は野菜を育てている。,农民,农民种蔬菜。,granjero; agricultor,El granjero cultiva verduras.,nông dân,Nông dân trồng rau.,ชาวนา; เกษตรกร,เกษตรกรปลูกผัก,petani,Petani menanam sayuran.
pilot,The pilot landed the plane safely.,조종사; 파일럿,조종사가 비행기를 안전하게 착륙시켰어요.,パイロット,パイロットが飛行機を安全に着陸させた。,飞行员,飞行员安全着陆了飞机。,piloto,El piloto aterrizó el avión de forma segura.,phi công,Phi công hạ cánh máy bay an toàn.,นักบิน,นักบินลงจอดเครื่องบินอย่างปลอดภัย,pilot,Pilot mendaratkan pesawat dengan selamat.
dentist,I go to the dentist twice a year.,치과의사,저는 1년에 두 번 치과에 가요.,歯科医; 歯医者,年に二回歯医者に行きます。,牙医,我一年去两次牙医。,dentista,Voy al dentista dos veces al año.,nha sĩ,Tôi đi nha sĩ hai lần một năm.,ทันตแพทย์,ฉันไปหาทันตแพทย์ปีละสองครั้ง,dokter gigi,Saya pergi ke dokter gigi dua kali setahun.
journalist,The journalist wrote an article.,기자,기자가 기사를 썼어요.,記者; ジャーナリスト,記者が記事を書いた。,记者,记者写了一篇文章。,periodista,El periodista escribió un artículo.,nhà báo,Nhà báo viết bài.,นักข่าว,นักข่าวเขียนบทความ,jurnalis; wartawan,Wartawan menulis sebuah artikel.
architect,The architect designed a new building.,건축가,건축가가 새 건물을 설계했어요.,建築家,建築家が新しいビルを設計した。,建筑师,建筑师设计了一座新大楼。,arquitecto; arquitecta,El arquitecto diseñó un nuevo edificio.,kiến trúc sư,Kiến trúc sư thiết kế tòa nhà mới.,สถาปนิก,สถาปนิกออกแบบอาคารใหม่,arsitek,Arsitek merancang gedung baru.
mechanic,The mechanic fixed my car.,정비사,정비사가 제 차를 고쳤어요.,整備士; 修理工,整備士が車を直してくれた。,机械师; 修理工,修理工修好了我的车。,mecánico,El mecánico arregló mi carro.,thợ sửa xe,Thợ sửa xe sửa xe cho tôi.,ช่าง,ช่างซ่อมรถให้ฉัน,mekanik; montir,Montir memperbaiki mobil saya.
accountant,The accountant checked the numbers.,회계사,회계사가 숫자를 확인했어요.,会計士,会計士が数字を確認した。,会计,会计核对了数字。,contador; contable,El contador revisó los números.,kế toán,Kế toán kiểm tra các con số.,นักบัญชี,นักบัญชีตรวจสอบตัวเลข,akuntan,Akuntan memeriksa angka-angkanya.
pharmacist,The pharmacist prepared the medicine.,약사,약사가 약을 조제했어요.,薬剤師,薬剤師が薬を調合した。,药剂师,药剂师配了药。,farmacéutico,El farmacéutico preparó la medicina.,dược sĩ,Dược sĩ bào chế thuốc.,เภสัชกร,เภสัชกรเตรียมยา,apoteker,Apoteker menyiapkan obatnya.
scientist,The scientist made a discovery.,과학자,과학자가 발견을 했어요.,科学者,科学者が発見をした。,科学家,科学家有了一个发现。,científico; científica,El científico hizo un descubrimiento.,nhà khoa học,Nhà khoa học có phát hiện mới.,นักวิทยาศาสตร์,นักวิทยาศาสตร์ค้นพบสิ่งใหม่,ilmuwan,Ilmuwan membuat penemuan.
artist,The artist painted a beautiful picture.,예술가; 화가,화가가 아름다운 그림을 그렸어요.,芸術家; 画家,画家が美しい絵を描いた。,艺术家; 画家,画家画了一幅美丽的画。,artista,El artista pintó un cuadro hermoso.,nghệ sĩ; họa sĩ,Họa sĩ vẽ bức tranh đẹp.,ศิลปิน,ศิลปินวาดภาพสวยงาม,seniman; pelukis,Pelukis melukis gambar yang indah.
baker,The baker makes fresh bread daily.,제빵사,제빵사는 매일 신선한 빵을 만들어요.,パン屋,パン屋は毎日焼きたてのパンを作る。,面包师,面包师每天做新鲜面包。,panadero; panadera,El panadero hace pan fresco cada día.,thợ làm bánh,Thợ làm bánh làm bánh mì tươi mỗi ngày.,ช่างทำขนมปัง,ช่างทำขนมปังทำขนมปังสดทุกวัน,tukang roti,Tukang roti membuat roti segar setiap hari.
librarian,The librarian helped me find a book.,사서,사서가 책 찾는 것을 도와줬어요.,司書,司書が本を探すのを手伝ってくれた。,图书管理员,图书管理员帮我找到了一本书。,bibliotecario; bibliotecaria,El bibliotecario me ayudó a encontrar un libro.,thủ thư,Thủ thư giúp tôi tìm sách.,บรรณารักษ์,บรรณารักษ์ช่วยฉันหาหนังสือ,pustakawan,Pustakawan membantu saya menemukan buku.
noodle,I love eating noodles.,국수; 면,저는 국수를 먹는 것을 좋아해요.,麺,私は麺が大好きです。,面条,我喜欢吃面条。,fideo; tallarín,Me encanta comer fideos.,mì,Tôi thích ăn mì.,เส้นก๋วยเตี๋ยว,ฉันชอบกินเส้นก๋วยเตี๋ยว,mie,Saya suka makan mie.
meat,The meat is well cooked.,고기,고기가 잘 익었어요.,肉,肉はよく焼けている。,肉,肉煮得很熟。,carne,La carne está bien cocida.,thịt,Thịt chín kỹ rồi.,เนื้อ,เนื้อสุกดีแล้ว,daging,Dagingnya dimasak dengan baik.
