grape,These grapes are sweet.,포도,이 포도는 달아요.,ブドウ,このブドウは甘い。,葡萄,这些葡萄很甜。,uva,Estas uvas son dulces.,nho,Những quả nho này ngọt.,องุ่น,องุ่นพวกนี้หวาน,anggur,Anggur ini manis.
strawberry,I love strawberry ice cream.,딸기,저는 딸기 아이스크림을 좋아해요.,イチゴ,私はイチゴアイスが大好きです。,草莓,我喜欢草莓冰淇淋。,fresa,Me encanta el helado de fresa.,dâu tây,Tôi thích kem dâu tây.,สตรอว์เบอร์รี,ฉันชอบไอศกรีมสตรอว์เบอร์รี,stroberi,Saya suka es krim stroberi.
watermelon,Watermelon is refreshing in summer.,수박,수박은 여름에 시원해요.,スイカ,スイカは夏にさっぱりする。,西瓜,西瓜在夏天很解暑。,sandía,La sandía es refrescante en verano.,dưa hấu,Dưa hấu mát lạnh vào mùa hè.,แตงโม,แตงโมสดชื่นในฤดูร้อน,semangka,Semangka menyegarkan di musim panas.
peach,The peach is very juicy.,복숭아,복숭아가 즙이 많아요.,モモ,この桃はとてもジューシーだ。,桃子,桃子非常多汁。,melocotón,El melocotón es muy jugoso.,đào,Quả đào rất mọng nước.,พีช,พีชฉ่ำมาก,persik,Persiknya sangat berair.
lemon,Squeeze some lemon on the fish.,레몬,생선에 레몬을 좀 짜세요.,レモン,魚にレモンを絞ってください。,柠檬,在鱼上挤一些柠檬汁。,limón,Exprime un poco de limón sobre el pescado.,chanh,Vắt chanh lên cá.,มะนาว,บีบมะนาวใส่ปลา,lemon,Peras sedikit lemon di atas ikan.
pear,This pear is crunchy.,배,이 배는 아삭해요.,ナシ,この梨はシャキシャキしている。,梨,这个梨很脆。,pera,Esta pera es crujiente.,lê,Quả lê này giòn.,ลูกแพร์,ลูกแพร์นี้กรอบ,pir,Pir ini renyah.
cherry,Cherry blossoms are beautiful.,체리; 벚꽃,벚꽃이 아름다워요.,サクランボ,桜の花は美しい。,樱桃,樱花很漂亮。,cereza,Las flores de cerezo son hermosas.,anh đào,Hoa anh đào rất đẹp.,เชอร์รี,ดอกเชอร์รีสวยงาม,ceri,Bunga sakura sangat indah.
tomato,Tomatoes are good for health.,토마토,토마토는 건강에 좋아요.,トマト,トマトは体にいい。,番茄; 西红柿,番茄对健康有益。,tomate,Los tomates son buenos para la salud.,cà chua,Cà chua tốt cho sức khỏe.,มะเขือเทศ,มะเขือเทศดีต่อสุขภาพ,tomat,Tomat baik untuk kesehatan.
potato,She boiled the potatoes.,감자,그녀는 감자를 삶았어요.,ジャガイモ,彼女はジャガイモをゆでた。,土豆,她煮了土豆。,papa; patata,Ella hirvió las papas.,khoai tây,Cô ấy luộc khoai tây.,มันฝรั่ง,เธอต้มมันฝรั่ง,kentang,Dia merebus kentang.
carrot,Carrots are good for your eyes.,당근,당근은 눈에 좋아요.,ニンジン,ニンジンは目にいい。,胡萝卜,胡萝卜对眼睛好。,zanahoria,Las zanahorias son buenas para los ojos.,cà rốt,Cà rốt tốt cho mắt.,แครอท,แครอทดีต่อดวงตา,wortel,Wortel baik untuk mata.
onion,Chopping onions makes me cry.,양파,양파를 자르면 눈물이 나요.,タマネギ,タマネギを切ると涙が出る。,洋葱,切洋葱让我流泪。,cebolla,Cortar cebollas me hace llorar.,hành tây,Cắt hành tây làm tôi chảy nước mắt.,หัวหอม,หั่นหัวหอมทำให้ร้องไห้,bawang bombay,Memotong bawang bombay membuat saya menangis.
cabbage,I added cabbage to the soup.,양배추,저는 수프에 양배추를 넣었어요.,キャベツ,スープにキャベツを入れました。,卷心菜,我在汤里加了卷心菜。,repollo; col,Agregué repollo a la sopa.,bắp cải,Tôi thêm bắp cải vào súp.,กะหล่ำปลี,ฉันใส่กะหล่ำปลีในซุป,kubis; kol,Saya menambahkan kubis ke dalam sup.
cucumber,Cucumber is cool and fresh.,오이,오이는 시원하고 신선해요.,キュウリ,キュウリはひんやりして新鮮だ。,黄瓜,黄瓜清凉爽口。,pepino,El pepino es fresco y refrescante.,dưa chuột,Dưa chuột mát và tươi.,แตงกวา,แตงกวาเย็นและสดชื่น,mentimun; timun,Mentimun segar dan sejuk.
garlic,Garlic adds flavor to the dish.,마늘,마늘은 요리에 맛을 더해요.,ニンニク,ニンニクは料理に風味を加える。,大蒜,大蒜给菜增添了风味。,ajo,El ajo le da sabor al plato.,tỏi,Tỏi thêm hương vị cho món ăn.,กระเทียม,กระเทียมเพิ่มรสชาติให้อาหาร,bawang putih,Bawang putih menambah rasa pada masakan.
mushroom,I like mushrooms on my pizza.,버섯,저는 피자 위에 버섯을 좋아해요.,キノコ,ピザの上のキノコが好きです。,蘑菇,我喜欢披萨上的蘑菇。,champiñón; hongo,Me gustan los champiñones en mi pizza.,nấm,Tôi thích nấm trên pizza.,เห็ด,ฉันชอบเห็ดบนพิซซ่า,jamur,Saya suka jamur di pizza saya.
spinach,Spinach is full of iron.,시금치,시금치는 철분이 풍부해요.,ほうれん草,ほうれん草は鉄分が豊富です。,菠菜,菠菜含有丰富的铁。,espinaca,La espinaca tiene mucho hierro.,rau bina,Rau bina giàu chất sắt.,ผักโขม,ผักโขมมีธาตุเหล็กสูง,bayam,Bayam kaya akan zat besi.
corn,We had grilled corn at the party.,옥수수,파티에서 구운 옥수수를 먹었어요.,トウモロコシ,パーティーで焼きトウモロコシを食べた。,玉米,我们在聚会上吃了烤玉米。,maíz,Comimos maíz asado en la fiesta.,ngô; bắp,Chúng tôi ăn bắp nướng ở bữa tiệc.,ข้าวโพด,เรากินข้าวโพดย่างที่งานเลี้ยง,jagung,Kami makan jagung bakar di pesta.
red,The car is red.,빨간; 빨간색,그 차는 빨간색이에요.,赤,その車は赤い。,红色,那辆车是红色的。,rojo,El carro es rojo.,đỏ,Chiếc xe màu đỏ.,แดง,รถคันนั้นสีแดง,merah,Mobilnya berwarna merah.
blue,The sky is blue today.,파란; 파란색,오늘 하늘이 파래요.,青,今日の空は青い。,蓝色,今天天空是蓝色的。,azul,El cielo está azul hoy.,xanh dương,Bầu trời hôm nay xanh.,ฟ้า,ท้องฟ้าวันนี้สีฟ้า,biru,Langit hari ini berwarna biru.
green,The leaves are green in spring.,초록; 초록색,봄에는 잎이 초록색이에요.,緑,春には葉が緑になる。,绿色,春天树叶是绿色的。,verde,Las hojas son verdes en primavera.,xanh lá,Lá cây xanh vào mùa xuân.,เขียว,ใบไม้สีเขียวในฤดูใบไม้ผลิ,hijau,Daun berwarna hijau di musim semi.
yellow,The sunflower is yellow.,노란; 노란색,해바라기는 노란색이에요.,黄色,ひまわりは黄色い。,黄色,向日葵是黄色的。,amarillo,El girasol es amarillo.,vàng,Hoa hướng dương màu vàng.,เหลือง,ดอกทานตะวันสีเหลือง,kuning,Bunga mataharinya berwarna kuning.
white,She wore a white dress.,하얀; 하얀색; 흰색,그녀는 하얀 드레스를 입었어요.,白,彼女は白いドレスを着た。,白色,她穿了一条白色裙子。,blanco,Ella usó un vestido blanco.,trắng,Cô ấy mặc váy trắng.,ขาว,เธอสวมชุดสีขาว,putih,Dia memakai gaun putih.
black,He has a black cat.,검은; 검은색,그는 검은 고양이를 키워요.,黒,彼は黒い猫を飼っている。,黑色,他有一只黑猫。,negro,Él tiene un gato negro.,đen,Anh ấy có một con mèo đen.,ดำ,เขามีแมวดำ,hitam,Dia punya kucing hitam.
pink,The flowers are pink.,분홍; 분홍색,꽃이 분홍색이에요.,ピンク,花はピンク色です。,粉色; 粉红色,花是粉色的。,rosa; rosado,Las flores son rosadas.,hồng,Hoa màu hồng.,ชมพู,ดอกไม้สีชมพู,merah muda,Bunganya berwarna merah muda.
purple,She likes purple the most.,보라; 보라색,그녀는 보라색을 가장 좋아해요.,紫,彼女は紫が一番好きです。,紫色,她最喜欢紫色。,morado; púrpura,A ella le gusta más el morado.,tím,Cô ấy thích màu tím nhất.,ม่วง,เธอชอบสีม่วงมากที่สุด,ungu,Dia paling suka warna ungu.
brown,The dog is brown.,갈색,그 개는 갈색이에요.,茶色,その犬は茶色です。,棕色,那只狗是棕色的。,marrón; café,El perro es marrón.,nâu,Con chó màu nâu.,น้ำตาล,สุนัขตัวนั้นสีน้ำตาล,cokelat,Anjingnya berwarna cokelat.
gray,The sky is gray on rainy days.,회색,비 오는 날에는 하늘이 회색이에요.,灰色,雨の日は空が灰色だ。,灰色,下雨天天空是灰色的。,gris,El cielo es gris en días lluviosos.,xám,Bầu trời xám vào ngày mưa.,เทา,ท้องฟ้าสีเทาในวันฝนตก,abu-abu,Langit berwarna abu-abu saat hujan.
gold,She wore a gold ring.,금색; 금,그녀는 금반지를 꼈어요.,金色,彼女は金の指輪をつけた。,金色,她戴了一枚金戒指。,dorado,Ella usó un anillo de oro.,vàng kim,Cô ấy đeo nhẫn vàng.,ทอง,เธอสวมแหวนทอง,emas,Dia memakai cincin emas.
silver,The silver necklace is pretty.,은색; 은,은 목걸이가 예뻐요.,銀色,銀のネックレスがきれいだ。,银色,银项链很漂亮。,plateado,El collar de plata es bonito.,bạc,Dây chuyền bạc rất đẹp.,เงิน,สร้อยคอเงินสวย,perak,Kalung perak itu cantik.
sunny,It is sunny today.,맑은; 화창한,오늘은 화창해요.,晴れ,今日は晴れです。,晴朗,今天天气晴朗。,soleado,Hoy está soleado.,nắng,Hôm nay trời nắng.,แดดจัด,วันนี้แดดจัง,cerah,Hari ini cerah.
cloudy,It is cloudy this afternoon.,흐린,오늘 오후는 흐려요.,曇り,今日の午後は曇りです。,多云,今天下午多云。,nublado,Está nublado esta tarde.,có mây,Chiều nay trời có mây.,มีเมฆ,บ่ายนี้มีเมฆ,berawan,Sore ini berawan.
rainy,Take an umbrella on rainy days.,비가 오는,비 오는 날에는 우산을 가져가세요.,雨の,雨の日は傘を持って行って。,下雨的,下雨天带上雨伞。,lluvioso,Lleva un paraguas en días lluviosos.,mưa,Mang ô vào ngày mưa.,ฝนตก,เอาร่มไปในวันที่ฝนตก,hujan,Bawa payung saat hari hujan.
snowy,The streets are snowy.,눈이 오는,거리에 눈이 쌓여 있어요.,雪の,道に雪が積もっている。,下雪的,街上积满了雪。,nevado,Las calles están nevadas.,tuyết,Đường phố đầy tuyết.,หิมะตก,ถนนมีหิมะ,bersalju,Jalanan bersalju.
windy,It is very windy outside.,바람이 부는,밖에 바람이 많이 불어요.,風が強い,外は風が強い。,刮风的,外面风很大。,ventoso,Hace mucho viento afuera.,gió,Bên ngoài gió rất lớn.,ลมแรง,ข้างนอกลมแรงมาก,berangin,Di luar sangat berangin.
storm,A big storm is coming.,폭풍,큰 폭풍이 오고 있어요.,嵐,大きな嵐が来ている。,暴风雨,大暴风雨要来了。,tormenta,Se acerca una gran tormenta.,bão,Một cơn bão lớn đang đến.,พายุ,พายุลูกใหญ่กำลังมา,badai,Badai besar akan datang.
fog,The fog is thick this morning.,안개,오늘 아침 안개가 짙어요.,霧,今朝は霧が濃い。,雾,今天早上雾很浓。,niebla,La niebla es espesa esta mañana.,sương mù,Sáng nay sương mù dày đặc.,หมอก,เช้านี้หมอกหนา,kabut,Kabutnya tebal pagi ini.
thunder,I heard loud thunder last night.,천둥,어젯밤에 큰 천둥소리를 들었어요.,雷,昨夜大きな雷が聞こえた。,雷,昨晚我听到了很响的雷声。,trueno,Escuché un trueno fuerte anoche.,sấm,Tôi nghe tiếng sấm lớn tối qua.,ฟ้าร้อง,ฉันได้ยินเสียงฟ้าร้องดังเมื่อคืน,petir; guntur,Saya mendengar petir keras tadi malam.
lightning,Lightning lit up the sky.,번개,번개가 하늘을 밝혔어요.,稲妻,稲妻が空を照らした。,闪电,闪电照亮了天空。,relámpago,El relámpago iluminó el cielo.,sét; chớp,Tia chớp chiếu sáng bầu trời.,ฟ้าแลบ,ฟ้าแลบสว่างจ้าบนท้องฟ้า,kilat,Kilat menerangi langit.
rainbow,A rainbow appeared after the rain.,무지개,비 온 뒤에 무지개가 나타났어요.,虹,雨の後に虹が現れた。,彩虹,雨后出现了彩虹。,arcoíris,Un arcoíris apareció después de la lluvia.,cầu vồng,Cầu vồng xuất hiện sau cơn mưa.,รุ้ง,รุ้งปรากฏหลังฝนตก,pelangi,Pelangi muncul setelah hujan.
temperature,The temperature dropped suddenly.,온도; 기온,기온이 갑자기 떨어졌어요.,気温,気温が急に下がった。,温度; 气温,气温突然下降了。,temperatura,La temperatura bajó de repente.,nhiệt độ,Nhiệt độ giảm đột ngột.,อุณหภูมิ,อุณหภูมิลดลงกะทันหัน,suhu,Suhunya turun mendadak.
father,My father works hard.,아버지; 아빠,아버지는 열심히 일하세요.,父; お父さん,父は一生懸命働いている。,父亲; 爸爸,我爸爸工作很努力。,padre; papá,Mi padre trabaja duro.,bố; cha,Bố tôi làm việc chăm chỉ.,พ่อ,พ่อทำงานหนัก,ayah,Ayah saya bekerja keras.
mother,My mother cooks delicious food.,어머니; 엄마,어머니는 맛있는 음식을 만드세요.,母; お母さん,母は美味しい料理を作る。,母亲; 妈妈,我妈妈做的菜很好吃。,madre; mamá,Mi madre cocina comida deliciosa.,mẹ,Mẹ tôi nấu ăn rất ngon.,แม่,แม่ทำอาหารอร่อย,ibu,Ibu saya memasak makanan yang enak.
brother,I have two brothers.,형제; 남동생; 오빠; 형,저는 형제가 둘 있어요.,兄弟,私には兄弟が二人いる。,兄弟,我有两个兄弟。,hermano,Tengo dos hermanos.,anh em trai,Tôi có hai anh em trai.,พี่ชาย; น้องชาย,ฉันมีพี่น้องชายสองคน,saudara laki-laki,Saya punya dua saudara laki-laki.
sister,My sister is older than me.,자매; 누나; 언니; 여동생,제 언니는 저보다 나이가 많아요.,姉妹,姉は私より年上です。,姐妹,我姐姐比我大。,hermana,Mi hermana es mayor que yo.,chị; em gái,Chị tôi lớn hơn tôi.,พี่สาว; น้องสาว,พี่สาวของฉันโตกว่าฉัน,saudara perempuan,Kakak perempuan saya lebih tua dari saya.
son,Their son is a doctor.,아들,그들의 아들은 의사예요.,息子,彼らの息子は医者です。,儿子,他们的儿子是医生。,hijo,Su hijo es doctor.,con trai,Con trai họ là bác sĩ.,ลูกชาย,ลูกชายของพวกเขาเป็นหมอ,anak laki-laki,Anak laki-laki mereka seorang dokter.
daughter,Their daughter studies abroad.,딸,그들의 딸은 유학 중이에요.,娘,彼らの娘は留学中です。,女儿,他们的女儿在国外留学。,hija,Su hija estudia en el extranjero.,con gái,Con gái họ du học.,ลูกสาว,ลูกสาวของพวกเขาเรียนต่างประเทศ,anak perempuan,Anak perempuan mereka belajar di luar negeri.
grandfather,My grandfather tells great stories.,할아버지,할아버지는 이야기를 잘 해 주세요.,祖父; おじいさん,祖父は素晴らしい話をしてくれる。,爷爷; 祖父,我爷爷讲故事很棒。,abuelo,Mi abuelo cuenta grandes historias.,ông,Ông tôi kể chuyện rất hay.,ปู่; ตา,ปู่เล่าเรื่องสนุกๆ,kakek,Kakek saya bercerita dengan baik.
grandmother,My grandmother makes the best cookies.,할머니,할머니는 최고의 쿠키를 만드세요.,祖母; おばあさん,祖母は最高のクッキーを作る。,奶奶; 祖母,我奶奶做的饼干最好吃。,abuela,Mi abuela hace las mejores galletas.,bà,Bà tôi làm bánh quy ngon nhất.,ย่า; ยาย,ยายทำคุกกี้อร่อยที่สุด,nenek,Nenek saya membuat kue terbaik.
uncle,My uncle lives in the city.,삼촌,삼촌은 도시에 살아요.,おじ; おじさん,おじは都市に住んでいる。,叔叔; 伯伯,我叔叔住在城市里。,tío,Mi tío vive en la ciudad.,chú; bác,Chú tôi sống ở thành phố.,ลุง,ลุงอาศัยอยู่ในเมือง,paman,Paman saya tinggal di kota.
aunt,My aunt visits us every weekend.,이모; 고모; 숙모,이모는 매주 주말에 우리를 방문해요.,おば; おばさん,おばは毎週末に会いに来る。,阿姨; 姑妈,我姑妈每个周末都来看我们。,tía,Mi tía nos visita cada fin de semana.,dì; cô,Dì tôi đến thăm mỗi cuối tuần.,ป้า; น้า; อา,ป้ามาเยี่ยมเราทุกสุดสัปดาห์,bibi; tante,Bibi saya mengunjungi kami setiap akhir pekan.
cousin,I play with my cousin.,사촌,저는 사촌과 놀아요.,いとこ,私はいとこと遊ぶ。,堂兄弟; 表兄弟,我和表弟一起玩。,primo; prima,Juego con mi primo.,anh em họ,Tôi chơi với anh họ.,ลูกพี่ลูกน้อง,ฉันเล่นกับลูกพี่ลูกน้อง,sepupu,Saya bermain dengan sepupu saya.
nephew,My nephew is five years old.,조카,제 조카는 다섯 살이에요.,甥,甥は五歳です。,侄子,我侄子五岁了。,sobrino,Mi sobrino tiene cinco años.,cháu trai,Cháu trai tôi năm tuổi.,หลานชาย,หลานชายอายุห้าขวบ,keponakan laki-laki,Keponakan saya berusia lima tahun.
niece,My niece loves drawing.,조카딸,제 조카딸은 그림 그리기를 좋아해요.,姪,姪は絵を描くのが好きです。,侄女,我侄女喜欢画画。,sobrina,A mi sobrina le encanta dibujar.,cháu gái,Cháu gái tôi thích vẽ.,หลานสาว,หลานสาวชอบวาดรูป,keponakan perempuan,Keponakan perempuan saya suka menggambar.
husband,Her husband is a teacher.,남편,그녀의 남편은 교사예요.,夫,彼女の夫は教師です。,丈夫,她丈夫是老师。,esposo; marido,Su esposo es maestro.,chồng,Chồng cô ấy là giáo viên.,สามี,สามีเธอเป็นครู,suami,Suaminya seorang guru.
wife,His wife is very kind.,아내,그의 아내는 매우 친절해요.,妻,彼の妻はとても親切です。,妻子,他妻子非常善良。,esposa,Su esposa es muy amable.,vợ,Vợ anh ấy rất tử tế.,ภรรยา,ภรรยาเขาใจดีมาก,istri,Istrinya sangat baik hati.
kitchen,She is cooking in the kitchen.,부엌; 주방,그녀는 부엌에서 요리하고 있어요.,台所; キッチン,彼女は台所で料理をしている。,厨房,她在厨房做饭。,cocina,Ella está cocinando en la cocina.,bếp; nhà bếp,Cô ấy đang nấu ăn trong bếp.,ครัว,เธอกำลังทำอาหารในครัว,dapur,Dia sedang memasak di dapur.
bedroom,My bedroom is upstairs.,침실,제 침실은 위층에 있어요.,寝室,私の寝室は二階にあります。,卧室,我的卧室在楼上。,dormitorio; habitación,Mi dormitorio está arriba.,phòng ngủ,Phòng ngủ của tôi ở trên lầu.,ห้องนอน,ห้องนอนของฉันอยู่ชั้นบน,kamar tidur,Kamar tidur saya ada di lantai atas.
bathroom,The bathroom is clean.,화장실; 욕실,화장실이 깨끗해요.,浴室; お風呂場,お風呂場はきれいです。,浴室; 卫生间,浴室很干净。,baño,El baño está limpio.,phòng tắm,Phòng tắm sạch sẽ.,ห้องน้ำ,ห้องน้ำสะอาด,kamar mandi,Kamar mandinya bersih.
living room,We watch TV in the living room.,거실,우리는 거실에서 TV를 봐요.,リビング; 居間,私たちはリビングでテレビを見る。,客厅,我们在客厅看电视。,sala de estar,Vemos TV en la sala de estar.,phòng khách,Chúng tôi xem TV ở phòng khách.,ห้องนั่งเล่น,เราดูทีวีในห้องนั่งเล่น,ruang tamu,Kami menonton TV di ruang tamu.
dining room,The family eats in the dining room.,식당,가족은 식당에서 식사해요.,ダイニング; 食堂,家族はダイニングで食事をする。,餐厅,一家人在餐厅吃饭。,comedor,La familia come en el comedor.,phòng ăn,Gia đình ăn ở phòng ăn.,ห้องอาหาร,ครอบครัวกินข้าวในห้องอาหาร,ruang makan,Keluarga makan di ruang makan.
garage,The car is in the garage.,차고,차가 차고에 있어요.,ガレージ; 車庫,車はガレージにあります。,车库,车在车库里。,garaje,El carro está en el garaje.,nhà xe; ga-ra,Xe ở trong nhà xe.,โรงรถ,รถอยู่ในโรงรถ,garasi,Mobilnya ada di garasi.
basement,We store old things in the basement.,지하실,지하실에 오래된 물건을 보관해요.,地下室,私たちは地下室に古い物を保管している。,地下室,我们把旧东西放在地下室。,sótano,Guardamos cosas viejas en el sótano.,tầng hầm,Chúng tôi cất đồ cũ ở tầng hầm.,ห้องใต้ดิน,เราเก็บของเก่าในห้องใต้ดิน,ruang bawah tanah,Kami menyimpan barang lama di ruang bawah tanah.
attic,The attic is full of boxes.,다락방,다락방이 상자로 가득해요.,屋根裏,屋根裏は箱でいっぱいだ。,阁楼,阁楼里全是箱子。,ático; desván,El ático está lleno de cajas.,gác mái,Gác mái đầy hộp.,ห้องใต้หลังคา,ห้องใต้หลังคาเต็มไปด้วยกล่อง,loteng,Lotengnya penuh dengan kotak.
balcony,I drink coffee on the balcony.,발코니; 베란다,발코니에서 커피를 마셔요.,バルコニー,バルコニーでコーヒーを飲む。,阳台,我在阳台上喝咖啡。,balcón,Tomo café en el balcón.,ban công,Tôi uống cà phê ở ban công.,ระเบียง,ฉันดื่มกาแฟบนระเบียง,balkon,Saya minum kopi di balkon.
hallway,The hallway is narrow.,복도,복도가 좁아요.,廊下,廊下は狭い。,走廊,走廊很窄。,pasillo,El pasillo es estrecho.,hành lang,Hành lang hẹp.,ทางเดิน,ทางเดินแคบ,lorong,Lorongnya sempit.
sofa,Sit on the sofa and relax.,소파,소파에 앉아서 쉬세요.,ソファ,ソファに座ってリラックスして。,沙发,坐在沙发上休息一下。,sofá,Siéntate en el sofá y relájate.,ghế sô-pha,Ngồi trên ghế sô-pha và thư giãn.,โซฟา,นั่งบนโซฟาแล้วพักผ่อน,sofa,Duduklah di sofa dan bersantai.
table,Put the books on the table.,테이블; 탁자,책을 테이블 위에 놓으세요.,テーブル,本をテーブルの上に置いて。,桌子,把书放在桌子上。,mesa,Pon los libros en la mesa.,bàn,Đặt sách lên bàn.,โต๊ะ,วางหนังสือบนโต๊ะ,meja,Taruh buku di atas meja.
chair,Please have a chair.,의자,의자에 앉으세요.,椅子,椅子に座ってください。,椅子,请坐。,silla,Por favor toma asiento.,ghế,Mời ngồi.,เก้าอี้,เชิญนั่งเก้าอี้,kursi,Silakan duduk.
bed,The bed is very comfortable.,침대,침대가 매우 편해요.,ベッド,ベッドはとても快適だ。,床,这张床非常舒服。,cama,La cama es muy cómoda.,giường,Giường rất thoải mái.,เตียง,เตียงนอนสบายมาก,tempat tidur,Tempat tidurnya sangat nyaman.
desk,I study at my desk.,책상,저는 책상에서 공부해요.,机,私は机で勉強します。,书桌,我在书桌前学习。,escritorio,Estudio en mi escritorio.,bàn học,Tôi học bài ở bàn.,โต๊ะทำงาน,ฉันเรียนที่โต๊ะทำงาน,meja belajar,Saya belajar di meja belajar.
shelf,Put the books on the shelf.,선반,책을 선반에 놓으세요.,棚,本を棚に置いてください。,架子; 书架,把书放到架子上。,estante,Pon los libros en el estante.,kệ,Để sách lên kệ.,ชั้นวาง,วางหนังสือบนชั้นวาง,rak,Taruh buku di rak.
closet,My clothes are in the closet.,옷장,제 옷은 옷장에 있어요.,クローゼット,私の服はクローゼットにあります。,衣柜,我的衣服在衣柜里。,armario; clóset,Mi ropa está en el armario.,tủ quần áo,Quần áo tôi ở trong tủ.,ตู้เสื้อผ้า,เสื้อผ้าของฉันอยู่ในตู้เสื้อผ้า,lemari pakaian,Pakaian saya ada di lemari.
