galaxy,Our galaxy is the Milky Way.,은하,우리 은하는 은하수예요.,銀河,私たちの銀河は天の川だ。,星系; 银河系,我们的星系是银河系。,galaxia,Nuestra galaxia es la Vía Láctea.,thiên hà,Thiên hà của chúng ta là Dải Ngân Hà.,กาแล็กซี,กาแล็กซีของเราคือทางช้างเผือก,galaksi,Galaksi kita adalah Bima Sakti.
orbit,The Earth orbits the sun.,궤도,지구는 태양 주위를 돌아요.,軌道,地球は太陽の周りを回る。,轨道,地球绕着太阳转。,órbita,La Tierra orbita alrededor del sol.,quỹ đạo,Trái Đất quay quanh mặt trời.,วงโคจร,โลกโคจรรอบดวงอาทิตย์,orbit,Bumi mengorbit matahari.
rocket,The rocket launched into space.,로켓,로켓이 우주로 발사됐어요.,ロケット,ロケットが宇宙に打ち上げられた。,火箭,火箭发射升空了。,cohete,El cohete se lanzó al espacio.,tên lửa,Tên lửa phóng vào vũ trụ.,จรวด,จรวดถูกปล่อยขึ้นสู่อวกาศ,roket,Roket diluncurkan ke luar angkasa.
astronaut,The astronaut floated in space.,우주비행사,우주비행사가 우주에서 떠다녔어요.,宇宙飛行士,宇宙飛行士が宇宙で浮いていた。,宇航员,宇航员在太空中飘浮。,astronauta,El astronauta flotó en el espacio.,phi hành gia,Phi hành gia lơ lửng trong vũ trụ.,นักบินอวกาศ,นักบินอวกาศลอยในอวกาศ,astronaut; antariksawan,Astronaut melayang di luar angkasa.
telescope,Look at the stars with a telescope.,망원경,망원경으로 별을 보세요.,望遠鏡,望遠鏡で星を見てください。,望远镜,用望远镜看星星。,telescopio,Mira las estrellas con un telescopio.,kính thiên văn,Ngắm sao bằng kính thiên văn.,กล้องโทรทรรศน์,ดูดาวด้วยกล้องโทรทรรศน์,teleskop,Lihat bintang dengan teleskop.
comet,A comet passed by last night.,혜성,어젯밤 혜성이 지나갔어요.,彗星,昨夜、彗星が通り過ぎた。,彗星,昨晚一颗彗星经过。,cometa,Un cometa pasó anoche.,sao chổi,Sao chổi đi qua tối qua.,ดาวหาง,ดาวหางผ่านไปเมื่อคืน,komet,Sebuah komet melintas tadi malam.
satellite,The satellite orbits the Earth.,위성; 인공위성,위성이 지구 주위를 돌아요.,衛星; 人工衛星,衛星が地球の周りを回っている。,卫星,卫星绕地球运行。,satélite,El satélite orbita la Tierra.,vệ tinh,Vệ tinh quay quanh Trái Đất.,ดาวเทียม,ดาวเทียมโคจรรอบโลก,satelit,Satelit mengorbit Bumi.
eclipse,We watched a solar eclipse.,일식,우리는 일식을 봤어요.,日食,私たちは日食を見た。,日食,我们观看了日食。,eclipse,Vimos un eclipse solar.,nhật thực,Chúng tôi xem nhật thực.,สุริยุปราคา,เราดูสุริยุปราคา,gerhana,Kami menyaksikan gerhana matahari.
gravity,Gravity keeps us on the ground.,중력,중력이 우리를 땅에 잡아둬요.,重力,重力が私たちを地面に留めている。,引力; 重力,重力使我们待在地面上。,gravedad,La gravedad nos mantiene en el suelo.,trọng lực,Trọng lực giữ chúng ta trên mặt đất.,แรงโน้มถ่วง,แรงโน้มถ่วงยึดเราไว้บนพื้น,gravitasi,Gravitasi menjaga kita di tanah.
constellation,I can see the Big Dipper constellation.,별자리,저는 북두칠성 별자리를 볼 수 있어요.,星座,北斗七星の星座が見える。,星座,我能看到北斗七星。,constelación,Puedo ver la constelación de la Osa Mayor.,chòm sao,Tôi có thể thấy chòm sao Bắc Đẩu.,กลุ่มดาว,ฉันเห็นกลุ่มดาวจระเข้,rasi bintang,Saya bisa melihat rasi bintang Biduk.
meteor,We saw a meteor in the sky.,유성,우리는 하늘에서 유성을 봤어요.,流星,空で流星を見た。,流星,我们在天空中看到了一颗流星。,meteoro,Vimos un meteoro en el cielo.,sao băng,Chúng tôi thấy sao băng trên trời.,ดาวตก,เราเห็นดาวตกบนท้องฟ้า,meteor,Kami melihat meteor di langit.
wood,The table is made of wood.,나무; 목재,이 테이블은 나무로 만들었어요.,木材; 木,このテーブルは木でできている。,木头; 木材,这张桌子是木头做的。,madera,La mesa está hecha de madera.,gỗ,Bàn làm bằng gỗ.,ไม้,โต๊ะทำจากไม้,kayu,Meja ini terbuat dari kayu.
metal,The gate is made of metal.,금속,그 문은 금속으로 만들었어요.,金属,その門は金属でできている。,金属,那扇门是金属做的。,metal,La puerta está hecha de metal.,kim loại,Cổng làm bằng kim loại.,โลหะ,ประตูทำจากโลหะ,logam,Gerbang itu terbuat dari logam.
plastic,This bottle is made of plastic.,플라스틱,이 병은 플라스틱으로 만들었어요.,プラスチック,このボトルはプラスチック製だ。,塑料,这个瓶子是塑料做的。,plástico,Esta botella es de plástico.,nhựa,Chai này làm bằng nhựa.,พลาสติก,ขวดนี้ทำจากพลาสติก,plastik,Botol ini terbuat dari plastik.
glass,Handle the glass carefully.,유리,유리를 조심히 다루세요.,ガラス,ガラスを注意して扱ってください。,玻璃,小心拿玻璃。,vidrio; cristal,Maneja el vidrio con cuidado.,thủy tinh; kính,Cầm thủy tinh cẩn thận.,แก้ว; กระจก,ถือแก้วอย่างระมัดระวัง,kaca,Pegang kaca dengan hati-hati.
cotton,This shirt is made of cotton.,면; 목화,이 셔츠는 면으로 만들었어요.,綿; コットン,このシャツは綿でできている。,棉花; 棉,这件衬衫是棉的。,algodón,Esta camisa es de algodón.,bông; vải cotton,Áo sơ mi này làm bằng cotton.,ผ้าฝ้าย,เสื้อตัวนี้ทำจากผ้าฝ้าย,kapas; katun,Kemeja ini terbuat dari katun.
leather,He bought a leather jacket.,가죽,그는 가죽 재킷을 샀어요.,革; レザー,彼はレザージャケットを買った。,皮革,他买了一件皮夹克。,cuero; piel,Él compró una chaqueta de cuero.,da,Anh ấy mua áo khoác da.,หนัง,เขาซื้อแจ็กเก็ตหนัง,kulit,Dia membeli jaket kulit.
rubber,Tires are made of rubber.,고무,타이어는 고무로 만들어요.,ゴム,タイヤはゴムでできている。,橡胶,轮胎是橡胶做的。,goma; caucho,Los neumáticos están hechos de goma.,cao su,Lốp xe làm bằng cao su.,ยาง,ยางรถทำจากยาง,karet,Ban terbuat dari karet.
silk,Silk feels very smooth.,비단; 실크,비단은 매우 매끄러워요.,絹; シルク,シルクはとてもなめらかだ。,丝绸,丝绸摸起来很光滑。,seda,La seda se siente muy suave.,lụa,Lụa rất mịn.,ผ้าไหม,ผ้าไหมสัมผัสเนียนลื่น,sutra,Sutra terasa sangat halus.
wool,This sweater is made of wool.,양모; 울,이 스웨터는 양모로 만들었어요.,ウール; 羊毛,このセーターはウールでできている。,羊毛,这件毛衣是羊毛做的。,lana,Este suéter es de lana.,len,Áo len này làm bằng len.,ขนแกะ,เสื้อกันหนาวตัวนี้ทำจากขนแกะ,wol,Sweater ini terbuat dari wol.
stone,The path is made of stone.,돌,길이 돌로 만들어져 있어요.,石,道は石でできている。,石头,小路是石头铺的。,piedra,El camino está hecho de piedra.,đá,Con đường lát bằng đá.,หิน,ทางเดินทำจากหิน,batu,Jalannya terbuat dari batu.
clay,She made a pot from clay.,점토; 찰흙,그녀는 찰흙으로 항아리를 만들었어요.,粘土,彼女は粘土で壺を作った。,陶土; 黏土,她用黏土做了一个罐子。,arcilla; barro,Ella hizo una olla de arcilla.,đất sét,Cô ấy nặn bình bằng đất sét.,ดินเหนียว,เธอปั้นหม้อจากดินเหนียว,tanah liat,Dia membuat pot dari tanah liat.
smooth,The surface is smooth.,매끄러운,표면이 매끄러워요.,滑らかな,表面が滑らかだ。,光滑的,表面很光滑。,liso; suave,La superficie es lisa.,mịn; trơn,Bề mặt trơn láng.,เรียบ,ผิวเรียบ,halus,Permukaannya halus.
rough,The rock has a rough surface.,거친,바위는 표면이 거칠어요.,粗い; ざらざらした,岩はざらざらした表面だ。,粗糙的,岩石表面很粗糙。,áspero; rugoso,La roca tiene una superficie áspera.,thô ráp,Đá có bề mặt thô ráp.,หยาบ,หินมีผิวหยาบ,kasar,Batu itu memiliki permukaan yang kasar.
soft,The pillow is soft.,부드러운,베개가 부드러워요.,柔らかい,枕は柔らかい。,柔软的,枕头很软。,suave; blando,La almohada es suave.,mềm,Gối rất mềm.,นุ่ม,หมอนนุ่ม,lembut,Bantalnya lembut.
hard,This rock is very hard.,딱딱한; 단단한,이 돌은 매우 딱딱해요.,硬い; 固い,この岩はとても硬い。,硬的,这块石头非常硬。,duro,Esta roca es muy dura.,cứng,Đá này rất cứng.,แข็ง,หินนี้แข็งมาก,keras,Batu ini sangat keras.
circle,Draw a circle on the paper.,원; 동그라미,종이에 동그라미를 그리세요.,円; 丸,紙に丸を描いてください。,圆; 圆形,在纸上画一个圆。,círculo,Dibuja un círculo en el papel.,hình tròn,Vẽ hình tròn trên giấy.,วงกลม,วาดวงกลมบนกระดาษ,lingkaran,Gambarlah lingkaran di atas kertas.
square,The box has a square shape.,정사각형; 네모,그 상자는 정사각형이에요.,正方形; 四角,その箱は四角い形だ。,正方形; 方形,箱子是方形的。,cuadrado,La caja tiene forma cuadrada.,hình vuông,Hộp có dạng hình vuông.,สี่เหลี่ยมจัตุรัส,กล่องเป็นรูปสี่เหลี่ยม,persegi,Kotaknya berbentuk persegi.
triangle,A triangle has three sides.,삼각형,삼각형은 세 변이 있어요.,三角形,三角形は三つの辺がある。,三角形,三角形有三条边。,triángulo,Un triángulo tiene tres lados.,hình tam giác,Hình tam giác có ba cạnh.,สามเหลี่ยม,สามเหลี่ยมมีสามด้าน,segitiga,Segitiga memiliki tiga sisi.
rectangle,The screen has a rectangle shape.,직사각형,화면은 직사각형이에요.,長方形,画面は長方形です。,长方形,屏幕是长方形的。,rectángulo,La pantalla tiene forma rectangular.,hình chữ nhật,Màn hình có dạng hình chữ nhật.,สี่เหลี่ยมผืนผ้า,หน้าจอเป็นรูปสี่เหลี่ยมผืนผ้า,persegi panjang,Layarnya berbentuk persegi panjang.
diamond,The diamond shape is on the card.,다이아몬드; 마름모,카드에 마름모 모양이 있어요.,ダイヤ; 菱形,カードにダイヤの形がある。,菱形,卡片上有菱形图案。,diamante; rombo,La forma de diamante está en la carta.,hình thoi,Hình thoi trên lá bài.,สี่เหลี่ยมขนมเปียกปูน,มีรูปสี่เหลี่ยมขนมเปียกปูนบนไพ่,belah ketupat,Bentuk belah ketupat ada di kartu.
oval,The mirror is oval.,타원형,거울이 타원형이에요.,楕円形,鏡は楕円形です。,椭圆形,镜子是椭圆形的。,óvalo; ovalado,El espejo es ovalado.,hình bầu dục,Gương hình bầu dục.,วงรี,กระจกเป็นรูปวงรี,oval; lonjong,Cerminnya berbentuk oval.
sphere,The Earth is a sphere.,구; 구체,지구는 구체예요.,球体; 球,地球は球体です。,球体,地球是一个球体。,esfera,La Tierra es una esfera.,hình cầu,Trái Đất hình cầu.,ทรงกลม,โลกเป็นทรงกลม,bola; bulat,Bumi adalah sebuah bola.
cube,A dice is shaped like a cube.,정육면체,주사위는 정육면체 모양이에요.,立方体; キューブ,サイコロは立方体の形だ。,立方体,骰子是立方体形状的。,cubo,Un dado tiene forma de cubo.,hình lập phương,Xúc xắc có dạng hình lập phương.,ลูกบาศก์,ลูกเต๋าเป็นรูปทรงลูกบาศก์,kubus,Dadu berbentuk kubus.
head,She nodded her head.,머리,그녀는 고개를 끄덕였어요.,頭,彼女は頭をうなずいた。,头,她点了点头。,cabeza,Ella asintió con la cabeza.,đầu,Cô ấy gật đầu.,หัว; ศีรษะ,เธอพยักหน้า,kepala,Dia menganggukkan kepalanya.
shoulder,My shoulder hurts.,어깨,어깨가 아파요.,肩,肩が痛い。,肩膀,我的肩膀疼。,hombro,Me duele el hombro.,vai,Vai tôi bị đau.,ไหล่,ไหล่ของฉันเจ็บ,bahu; pundak,Bahu saya sakit.
elbow,I hit my elbow on the table.,팔꿈치,팔꿈치를 테이블에 부딪혔어요.,ひじ; 肘,テーブルにひじをぶつけた。,手肘; 肘,我的手肘撞到了桌子。,codo,Me golpeé el codo en la mesa.,khuỷu tay,Tôi va khuỷu tay vào bàn.,ข้อศอก,ฉันชนข้อศอกกับโต๊ะ,siku,Saya membenturkan siku saya ke meja.
wrist,She wears a watch on her wrist.,손목,그녀는 손목에 시계를 차고 있어요.,手首,彼女は手首に時計をしている。,手腕,她手腕上戴着手表。,muñeca,Ella lleva un reloj en su muñeca.,cổ tay,Cô ấy đeo đồng hồ ở cổ tay.,ข้อมือ,เธอสวมนาฬิกาที่ข้อมือ,pergelangan tangan,Dia memakai jam di pergelangan tangannya.
knee,My knee hurts when I run.,무릎,달릴 때 무릎이 아파요.,ひざ; 膝,走ると膝が痛い。,膝盖,我跑步时膝盖疼。,rodilla,Me duele la rodilla cuando corro.,đầu gối,Đầu gối tôi đau khi chạy.,หัวเข่า,หัวเข่าเจ็บเวลาวิ่ง,lutut,Lutut saya sakit saat berlari.
ankle,She twisted her ankle.,발목,그녀는 발목을 삐었어요.,足首; くるぶし,彼女は足首をひねった。,脚踝,她扭伤了脚踝。,tobillo,Ella se torció el tobillo.,mắt cá chân,Cô ấy bị trẹo mắt cá chân.,ข้อเท้า,เธอเคล็ดข้อเท้า,pergelangan kaki,Dia keseleo pergelangan kakinya.
chin,He has a strong chin.,턱,그는 턱이 강해요.,あご; 顎,彼はしっかりしたあごをしている。,下巴,他的下巴很有力。,mentón; barbilla,Él tiene una barbilla fuerte.,cằm,Anh ấy có cái cằm khỏe.,คาง,เขามีคางแข็งแรง,dagu,Dia memiliki dagu yang kuat.
forehead,She has a wide forehead.,이마,그녀는 이마가 넓어요.,おでこ; 額,彼女はおでこが広い。,额头,她的额头很宽。,frente,Ella tiene una frente amplia.,trán,Cô ấy có trán rộng.,หน้าผาก,เธอมีหน้าผากกว้าง,dahi,Dia memiliki dahi yang lebar.
waist,The belt goes around the waist.,허리,벨트는 허리에 매요.,腰; ウエスト,ベルトは腰に巻く。,腰,皮带系在腰上。,cintura,El cinturón va alrededor de la cintura.,eo,Thắt lưng quanh eo.,เอว,เข็มขัดรัดรอบเอว,pinggang,Sabuk dipakai di sekitar pinggang.
heel,She wore high heels.,발뒤꿈치; 힐,그녀는 하이힐을 신었어요.,かかと; ヒール,彼女はハイヒールを履いた。,脚后跟; 高跟,她穿了高跟鞋。,talón; tacón,Ella usó tacones altos.,gót chân,Cô ấy mang giày cao gót.,ส้น; ส้นเท้า,เธอสวมรองเท้าส้นสูง,tumit,Dia memakai sepatu hak tinggi.
palm,He placed a coin on his palm.,손바닥,그는 손바닥에 동전을 올렸어요.,手のひら,彼は手のひらにコインを置いた。,手掌,他把硬币放在手心。,palma,Él puso una moneda en su palma.,lòng bàn tay,Anh ấy đặt đồng xu trên lòng bàn tay.,ฝ่ามือ,เขาวางเหรียญบนฝ่ามือ,telapak tangan,Dia meletakkan koin di telapak tangannya.
thumb,She gave a thumbs up.,엄지; 엄지손가락,그녀는 엄지를 치켜세웠어요.,親指,彼女は親指を立てた。,大拇指,她竖起了大拇指。,pulgar,Ella levantó el pulgar.,ngón cái,Cô ấy giơ ngón cái lên.,นิ้วหัวแม่มือ,เธอชูนิ้วหัวแม่มือขึ้น,jempol,Dia mengacungkan jempol.
toe,I stubbed my toe on the chair.,발가락,의자에 발가락을 찧었어요.,つま先; 足の指,椅子につま先をぶつけた。,脚趾,我的脚趾撞到椅子了。,dedo del pie,Me golpeé el dedo del pie con la silla.,ngón chân,Tôi va ngón chân vào ghế.,นิ้วเท้า,ฉันเตะนิ้วเท้าเข้าเก้าอี้,jari kaki,Saya menabrakkan jari kaki ke kursi.
eyebrow,She raised her eyebrow.,눈썹,그녀는 눈썹을 치켜올렸어요.,眉; 眉毛,彼女は眉を上げた。,眉毛,她挑了挑眉毛。,ceja,Ella levantó la ceja.,lông mày,Cô ấy nhướng mày.,คิ้ว,เธอยกคิ้ว,alis,Dia mengangkat alisnya.
cheek,The baby has chubby cheeks.,볼; 뺨,아기의 볼이 통통해요.,頬; ほっぺた,赤ちゃんのほっぺたがぷくぷくだ。,脸颊,宝宝的脸颊胖乎乎的。,mejilla,El bebé tiene mejillas gorditas.,má,Em bé có đôi má phúng phính.,แก้ม,ทารกมีแก้มอ้วน,pipi,Bayinya memiliki pipi yang gembul.
rib,He broke a rib in the accident.,갈비뼈,그는 사고로 갈비뼈가 부러졌어요.,肋骨; あばら骨,彼は事故であばら骨を折った。,肋骨,他在事故中折断了一根肋骨。,costilla,Él se rompió una costilla en el accidente.,xương sườn,Anh ấy gãy xương sườn trong tai nạn.,ซี่โครง,เขาซี่โครงหักจากอุบัติเหตุ,tulang rusuk,Dia patah tulang rusuk dalam kecelakaan.
wake up,I wake up at seven every day.,일어나다,저는 매일 7시에 일어나요.,起きる,私は毎日7時に起きます。,起床,我每天七点起床。,despertarse,Me despierto a las siete todos los días.,thức dậy,Tôi thức dậy lúc 7 giờ mỗi ngày.,ตื่นนอน,ฉันตื่นนอนเจ็ดโมงทุกวัน,bangun,Saya bangun jam tujuh setiap hari.
brush teeth,I brush my teeth after meals.,양치하다,식사 후에 양치를 해요.,歯を磨く,食後に歯を磨きます。,刷牙,我饭后刷牙。,cepillarse los dientes,Me cepillo los dientes después de comer.,đánh răng,Tôi đánh răng sau bữa ăn.,แปรงฟัน,ฉันแปรงฟันหลังอาหาร,sikat gigi,Saya menyikat gigi setelah makan.
take a shower,I take a shower every morning.,샤워하다,저는 매일 아침 샤워를 해요.,シャワーを浴びる,毎朝シャワーを浴びます。,洗澡; 淋浴,我每天早上淋浴。,ducharse; bañarse,Me ducho cada mañana.,tắm,Tôi tắm mỗi sáng.,อาบน้ำ,ฉันอาบน้ำทุกเช้า,mandi,Saya mandi setiap pagi.
get dressed,She gets dressed quickly.,옷을 입다,그녀는 빨리 옷을 입어요.,着替える; 服を着る,彼女はすぐに着替える。,穿衣服,她穿衣服很快。,vestirse,Ella se viste rápidamente.,mặc quần áo,Cô ấy mặc quần áo nhanh.,แต่งตัว,เธอแต่งตัวเร็ว,berpakaian,Dia berpakaian dengan cepat.
cook,She cooks dinner every evening.,요리하다,그녀는 매일 저녁 요리를 해요.,料理する,彼女は毎晩夕食を作る。,做饭; 烹饪,她每天晚上做晚饭。,cocinar,Ella cocina la cena cada noche.,nấu ăn,Cô ấy nấu ăn tối mỗi buổi chiều.,ทำอาหาร,เธอทำอาหารเย็นทุกวัน,memasak,Dia memasak makan malam setiap malam.
wash,Wash your hands before eating.,씻다,식사 전에 손을 씻으세요.,洗う,食べる前に手を洗ってください。,洗,吃饭前洗手。,lavar,Lava tus manos antes de comer.,rửa,Rửa tay trước khi ăn.,ล้าง,ล้างมือก่อนกิน,cuci; mencuci,Cuci tanganmu sebelum makan.
sweep,She sweeps the floor every day.,쓸다,그녀는 매일 바닥을 쓸어요.,掃く,彼女は毎日床を掃く。,扫,她每天扫地。,barrer,Ella barre el piso todos los días.,quét,Cô ấy quét nhà mỗi ngày.,กวาด,เธอกวาดพื้นทุกวัน,menyapu,Dia menyapu lantai setiap hari.
fold,Fold the clothes neatly.,접다,옷을 깔끔하게 접으세요.,たたむ; 折る,服をきれいにたたんでください。,折叠,把衣服叠整齐。,doblar,Dobla la ropa ordenadamente.,gấp,Gấp quần áo gọn gàng.,พับ,พับเสื้อผ้าให้เรียบร้อย,melipat,Lipat pakaiannya dengan rapi.
hang,Hang your coat on the hook.,걸다,코트를 갈고리에 거세요.,掛ける; 吊るす,コートをフックに掛けてください。,挂,把你的外套挂在钩子上。,colgar,Cuelga tu abrigo en el gancho.,treo,Treo áo khoác lên móc.,แขวน,แขวนเสื้อโค้ทบนตะขอ,menggantung,Gantungkan mantelmu di pengait.
lock,Lock the door before you leave.,잠그다,나가기 전에 문을 잠그세요.,鍵をかける,出かける前にドアに鍵をかけて。,锁,出门前锁好门。,cerrar con llave,Cierra la puerta con llave antes de irte.,khóa,Khóa cửa trước khi đi.,ล็อก,ล็อกประตูก่อนออกไป,mengunci,Kunci pintu sebelum pergi.
pour,Pour the water into the glass.,붓다,물을 잔에 부으세요.,注ぐ,水をグラスに注いでください。,倒,把水倒进杯子里。,verter; servir,Vierte el agua en el vaso.,rót,Rót nước vào ly.,เท,เทน้ำลงในแก้ว,menuang,Tuangkan air ke dalam gelas.
pack,Pack your bags for the trip.,짐을 싸다,여행을 위해 짐을 싸세요.,荷物をまとめる,旅行のために荷物をまとめて。,收拾; 打包,为旅行收拾行李。,hacer las maletas; empacar,Haz las maletas para el viaje.,đóng gói; xếp đồ,Xếp đồ cho chuyến đi.,แพ็คกระเป๋า,แพ็คกระเป๋าสำหรับทริป,mengemas; berkemas,Kemas tasmu untuk perjalanan.
water (verb),Please water the plants.,물을 주다,식물에 물을 주세요.,水をやる,植物に水をやってください。,浇水,请给植物浇水。,regar,Por favor riega las plantas.,tưới nước,Tưới nước cho cây nhé.,รดน้ำ,กรุณารดน้ำต้นไม้,menyiram,Tolong siram tanamannya.
chop,Chop the vegetables into small pieces.,자르다; 썰다,채소를 작게 썰어요.,切る; 刻む,野菜を小さく切ってください。,切; 剁,把蔬菜切成小块。,picar; cortar,Pica las verduras en trozos pequeños.,thái; cắt,Thái rau thành miếng nhỏ.,หั่น,หั่นผักเป็นชิ้นเล็กๆ,memotong; mencincang,Potong sayurannya menjadi potongan kecil.
peel,Peel the potatoes before cooking.,껍질을 벗기다,요리 전에 감자 껍질을 벗기세요.,皮をむく,料理の前にジャガイモの皮をむいて。,削皮; 剥皮,做饭前先削土豆皮。,pelar,Pela las papas antes de cocinar.,gọt vỏ,Gọt vỏ khoai tây trước khi nấu.,ปอก,ปอกมันฝรั่งก่อนทำอาหาร,mengupas,Kupas kentang sebelum dimasak.
mix,Mix the ingredients together.,섞다,재료를 함께 섞으세요.,混ぜる,材料を一緒に混ぜてください。,混合,把材料混合在一起。,mezclar,Mezcla los ingredientes juntos.,trộn,Trộn các nguyên liệu với nhau.,ผสม,ผสมส่วนผสมเข้าด้วยกัน,mencampur,Campurkan bahan-bahannya bersama.
dry,Dry the dishes with a towel.,말리다,수건으로 그릇을 말리세요.,乾かす,タオルで皿を乾かしてください。,擦干; 晾干,用毛巾擦干碗碟。,secar,Seca los platos con una toalla.,lau khô,Lau khô bát đĩa bằng khăn.,เช็ดแห้ง,เช็ดจานให้แห้งด้วยผ้าขนหนู,mengeringkan,Keringkan piringnya dengan handuk.
carry,Please carry this box for me.,나르다; 들다,이 상자를 좀 날라 주세요.,運ぶ,この箱を運んでください。,搬; 拿,请帮我搬这个箱子。,cargar; llevar,Por favor carga esta caja por mí.,mang; bê,Mang giúp tôi cái hộp này.,ยก; แบก,ช่วยยกกล่องนี้ให้หน่อย,membawa,Tolong bawakan kotak ini untuk saya.
stretch,Stretch your body before exercise.,스트레칭하다; 뻗다,운동 전에 스트레칭을 하세요.,ストレッチする; 伸ばす,運動前にストレッチをしてください。,拉伸; 伸展,运动前拉伸一下身体。,estirar,Estira tu cuerpo antes de hacer ejercicio.,giãn cơ,Giãn cơ trước khi tập.,ยืดเหยียด,ยืดเหยียดร่างกายก่อนออกกำลังกาย,meregangkan,Regangkan tubuhmu sebelum berolahraga.
