yawn,He yawned during the meeting.,하품하다,그는 회의 중에 하품을 했어요.,あくびをする,彼は会議中にあくびをした。,打哈欠,他在会议中打了个哈欠。,bostezar,Él bostezó durante la reunión.,ngáp,Anh ấy ngáp trong cuộc họp.,หาว,เขาหาวระหว่างประชุม,menguap,Dia menguap selama rapat.
sneeze,She sneezed because of the dust.,재채기하다,그녀는 먼지 때문에 재채기를 했어요.,くしゃみをする,彼女はほこりでくしゃみをした。,打喷嚏,她因为灰尘打了喷嚏。,estornudar,Ella estornudó por el polvo.,hắt hơi,Cô ấy hắt hơi vì bụi.,จาม,เธอจามเพราะฝุ่น,bersin,Dia bersin karena debu.
whisper,He whispered a secret to her.,속삭이다,그는 그녀에게 비밀을 속삭였어요.,ささやく,彼は彼女に秘密をささやいた。,低声说; 耳语,他悄悄对她说了个秘密。,susurrar,Él le susurró un secreto.,thì thầm,Anh ấy thì thầm bí mật với cô ấy.,กระซิบ,เขากระซิบความลับให้เธอ,berbisik,Dia membisikkan rahasia kepadanya.
nod,She nodded in agreement.,끄덕이다,그녀는 동의하며 고개를 끄덕였어요.,うなずく,彼女は同意してうなずいた。,点头,她点头表示同意。,asentir,Ella asintió en señal de acuerdo.,gật đầu,Cô ấy gật đầu đồng ý.,พยักหน้า,เธอพยักหน้าเห็นด้วย,mengangguk,Dia mengangguk setuju.
wave (verb),He waved goodbye to his friend.,손을 흔들다,그는 친구에게 작별 인사로 손을 흔들었어요.,手を振る,彼は友達に手を振って別れを告げた。,挥手,他向朋友挥手告别。,agitar la mano; despedirse,Él agitó la mano para despedirse.,vẫy tay,Anh ấy vẫy tay chào bạn.,โบกมือ,เขาโบกมือลาเพื่อน,melambaikan tangan,Dia melambaikan tangan kepada temannya.
clap,The audience clapped loudly.,박수치다,관객들이 크게 박수쳤어요.,拍手する,観客が大きな拍手をした。,鼓掌; 拍手,观众大声鼓掌。,aplaudir,El público aplaudió fuerte.,vỗ tay,Khán giả vỗ tay to.,ปรบมือ,ผู้ชมปรบมือดัง,bertepuk tangan,Penonton bertepuk tangan keras.
knock,Someone is knocking on the door.,두드리다; 노크하다,누군가 문을 두드리고 있어요.,ノックする,誰かがドアをノックしている。,敲,有人在敲门。,tocar; llamar a la puerta,Alguien está tocando la puerta.,gõ cửa,Có ai đó đang gõ cửa.,เคาะ,มีคนเคาะประตู,mengetuk,Seseorang mengetuk pintu.
squeeze,Squeeze the lemon into the water.,짜다,물에 레몬을 짜세요.,絞る; 搾る,水にレモンを絞って。,挤,把柠檬汁挤到水里。,exprimir,Exprime el limón en el agua.,vắt,Vắt chanh vào nước.,บีบ,บีบมะนาวลงในน้ำ,memeras,Peras lemon ke dalam air.
huge,The elephant is huge.,거대한; 엄청 큰,코끼리는 거대해요.,巨大な,象は巨大だ。,巨大的,大象非常巨大。,enorme; gigante,El elefante es enorme.,khổng lồ,Con voi rất khổng lồ.,ใหญ่โต,ช้างตัวใหญ่มาก,besar sekali; raksasa,Gajahnya sangat besar.
tiny,The ant is tiny.,아주 작은,개미는 아주 작아요.,とても小さい; 極小の,アリはとても小さい。,微小的,蚂蚁非常小。,diminuto; pequeñito,La hormiga es diminuta.,nhỏ xíu,Con kiến nhỏ xíu.,เล็กจิ๋ว,มดตัวเล็กจิ๋ว,mungil; sangat kecil,Semutnya sangat mungil.
thick,The wall is thick.,두꺼운,벽이 두꺼워요.,厚い,壁が厚い。,厚的,墙很厚。,grueso,La pared es gruesa.,dày,Bức tường dày.,หนา,ผนังหนา,tebal,Dindingnya tebal.
thin,The paper is thin.,얇은,종이가 얇아요.,薄い,紙が薄い。,薄的,纸很薄。,delgado; fino,El papel es delgado.,mỏng,Giấy mỏng.,บาง,กระดาษบาง,tipis,Kertasnya tipis.
wide,The river is very wide.,넓은,강이 매우 넓어요.,広い,川はとても広い。,宽的,河非常宽。,ancho,El río es muy ancho.,rộng,Sông rất rộng.,กว้าง,แม่น้ำกว้างมาก,lebar,Sungainya sangat lebar.
narrow,The alley is narrow.,좁은,골목이 좁아요.,狭い,路地は狭い。,窄的,胡同很窄。,estrecho; angosto,El callejón es estrecho.,hẹp,Con hẻm hẹp.,แคบ,ตรอกแคบ,sempit,Gangnya sempit.
deep,The lake is very deep.,깊은,호수가 매우 깊어요.,深い,湖はとても深い。,深的,湖很深。,profundo,El lago es muy profundo.,sâu,Hồ rất sâu.,ลึก,ทะเลสาบลึกมาก,dalam,Danaunya sangat dalam.
shallow,The water here is shallow.,얕은,여기 물이 얕아요.,浅い,ここの水は浅い。,浅的,这里的水很浅。,poco profundo,El agua aquí es poco profunda.,nông; cạn,Nước ở đây nông.,ตื้น,น้ำตรงนี้ตื้น,dangkal,Air di sini dangkal.
heavy,This bag is very heavy.,무거운,이 가방은 매우 무거워요.,重い,このカバンはとても重い。,重的,这个包很重。,pesado,Esta bolsa es muy pesada.,nặng,Cái túi này rất nặng.,หนัก,กระเป๋านี้หนักมาก,berat,Tas ini sangat berat.
light (weight),The feather is very light.,가벼운,깃털은 매우 가벼워요.,軽い,羽はとても軽い。,轻的,羽毛很轻。,ligero; liviano,La pluma es muy liviana.,nhẹ,Lông vũ rất nhẹ.,เบา,ขนนกเบามาก,ringan,Bulunya sangat ringan.
bright,The room is bright.,밝은,방이 밝아요.,明るい,部屋が明るい。,明亮的,房间很明亮。,brillante; luminoso,La habitación es brillante.,sáng,Phòng sáng.,สว่าง,ห้องสว่าง,terang,Ruangannya terang.
dark,It is dark outside.,어두운,밖이 어두워요.,暗い,外は暗い。,暗的; 黑的,外面很黑。,oscuro,Está oscuro afuera.,tối,Bên ngoài tối rồi.,มืด,ข้างนอกมืด,gelap,Di luar gelap.
sharp,The knife is very sharp.,날카로운,칼이 매우 날카로워요.,鋭い,ナイフはとても鋭い。,锋利的,刀非常锋利。,afilado; filoso,El cuchillo está muy afilado.,sắc; bén,Con dao rất sắc.,คม,มีดคมมาก,tajam,Pisaunya sangat tajam.
dull,This pencil is dull.,무딘; 뭉툭한,이 연필은 뭉툭해요.,鈍い,この鉛筆は鈍い。,钝的,这支铅笔钝了。,desafilado; sin filo,Este lápiz está sin filo.,cùn,Bút chì bị cùn.,ทื่อ,ดินสอนี้ทื่อ,tumpul,Pensilnya tumpul.
wet,My shoes are wet from the rain.,젖은,비 때문에 신발이 젖었어요.,濡れた,雨で靴が濡れた。,湿的,我的鞋子因为下雨湿了。,mojado,Mis zapatos están mojados por la lluvia.,ướt,Giày tôi bị ướt vì mưa.,เปียก,รองเท้าเปียกเพราะฝน,basah,Sepatu saya basah karena hujan.
dry (adj),The towel is dry now.,마른,수건이 이제 말랐어요.,乾いた,タオルが乾いた。,干的,毛巾现在干了。,seco,La toalla está seca ahora.,khô,Khăn đã khô rồi.,แห้ง,ผ้าขนหนูแห้งแล้ว,kering,Handuknya sudah kering sekarang.
empty,The bottle is empty.,빈; 비어 있는,병이 비어 있어요.,空の,ボトルが空だ。,空的,瓶子是空的。,vacío,La botella está vacía.,trống; rỗng,Chai trống rồi.,ว่างเปล่า,ขวดว่างเปล่า,kosong,Botolnya kosong.
full,The glass is full of water.,가득 찬,잔이 물로 가득해요.,いっぱいの; 満杯の,グラスが水でいっぱいだ。,满的,杯子里满是水。,lleno,El vaso está lleno de agua.,đầy,Ly đầy nước.,เต็ม,แก้วเต็มไปด้วยน้ำ,penuh,Gelasnya penuh air.
straight,Draw a straight line.,직선의; 곧은,직선을 그으세요.,まっすぐな,まっすぐな線を引いてください。,直的,画一条直线。,recto; derecho,Dibuja una línea recta.,thẳng,Vẽ đường thẳng.,ตรง,วาดเส้นตรง,lurus,Gambar garis lurus.
curved,The road is curved.,곡선의; 구부러진,도로가 구부러져 있어요.,曲がった; カーブした,道がカーブしている。,弯曲的,道路是弯曲的。,curvo,La carretera es curva.,cong,Con đường cong.,โค้ง,ถนนโค้ง,melengkung,Jalannya melengkung.
loose,The knot is loose.,느슨한,매듭이 느슨해요.,緩い,結び目が緩い。,松的,这个结松了。,suelto; flojo,El nudo está suelto.,lỏng,Nút thắt bị lỏng.,หลวม,ปมหลวม,longgar,Simpulnya longgar.
tight,These shoes are too tight.,꽉 끼는,이 신발은 너무 꽉 껴요.,きつい,この靴はきつすぎる。,紧的,这双鞋太紧了。,apretado; ajustado,Estos zapatos están muy apretados.,chật,Đôi giày này quá chật.,แน่น; คับ,รองเท้าคู่นี้คับเกินไป,ketat; sempit,Sepatu ini terlalu sempit.
flat,The road is flat.,평평한,도로가 평평해요.,平らな,道が平らだ。,平的,道路是平的。,plano,La carretera es plana.,phẳng; bằng,Đường bằng phẳng.,แบน; ราบ,ถนนราบเรียบ,datar,Jalannya datar.
steep,The hill is steep.,가파른,언덕이 가파르요.,急な; 険しい,丘が急だ。,陡的,山坡很陡。,empinado,La colina es empinada.,dốc,Đồi rất dốc.,ชัน,เนินชัน,curam; terjal,Bukitnya curam.
hollow,The tree trunk is hollow.,텅 빈; 속이 빈,나무 줄기가 속이 비어 있어요.,空洞の; 中空の,木の幹が空洞になっている。,中空的,树干是空心的。,hueco,El tronco del árbol está hueco.,rỗng,Thân cây bị rỗng.,กลวง,ลำต้นกลวง,berongga,Batang pohonnya berongga.
stiff,My neck is stiff.,뻣뻣한,목이 뻣뻣해요.,硬い; こわばった,首がこわばっている。,僵硬的,我的脖子很僵硬。,rígido; tieso,Mi cuello está tieso.,cứng; bị cứng,Cổ tôi bị cứng.,แข็ง; เกร็ง,คอแข็ง,kaku,Leher saya kaku.
flexible,This material is flexible.,유연한,이 소재는 유연해요.,柔軟な,この素材は柔軟だ。,柔韧的; 灵活的,这种材料很柔韧。,flexible,Este material es flexible.,dẻo; linh hoạt,Vật liệu này dẻo.,ยืดหยุ่น,วัสดุนี้ยืดหยุ่น,fleksibel; lentur,Material ini fleksibel.
transparent,The glass is transparent.,투명한,유리가 투명해요.,透明な,ガラスは透明だ。,透明的,玻璃是透明的。,transparente,El vidrio es transparente.,trong suốt,Kính trong suốt.,โปร่งใส,กระจกโปร่งใส,transparan,Kacanya transparan.
shiny,The coin is shiny.,반짝이는,동전이 반짝여요.,光っている; ピカピカの,コインがピカピカだ。,闪亮的,硬币闪闪发亮。,brillante,La moneda es brillante.,sáng bóng,Đồng xu sáng bóng.,เงาวาว,เหรียญเงาวาว,berkilau; mengkilap,Koinnya berkilau.
rusty,The old gate is rusty.,녹슨,오래된 문이 녹슬었어요.,さびた,古い門がさびている。,生锈的,旧门生锈了。,oxidado; herrumbroso,La puerta vieja está oxidada.,rỉ sét; gỉ,Cánh cổng cũ bị rỉ sét.,ขึ้นสนิม,ประตูเก่าขึ้นสนิม,berkarat,Gerbang tua itu berkarat.
sticky,The candy is sticky.,끈적끈적한,사탕이 끈적거려요.,ベタベタした; 粘着性の,キャンディーがベタベタする。,黏的,糖果很黏。,pegajoso,El dulce es pegajoso.,dính,Kẹo dính.,เหนียว,ลูกอมเหนียว,lengket,Permennya lengket.
fluffy,The cat is fluffy.,폭신한; 보송한,고양이가 폭신해요.,ふわふわの,猫がふわふわだ。,蓬松的,猫毛蓬松的。,esponjoso; mullido,El gato es esponjoso.,xù lông; mượt,Con mèo lông xù.,ฟู,แมวขนฟู,berbulu; lembut,Kucingnya berbulu lembut.
wrinkled,The shirt is wrinkled.,구겨진; 주름진,셔츠가 구겨졌어요.,しわのある; しわくちゃの,シャツがしわくちゃだ。,皱的; 起皱的,衬衫起皱了。,arrugado,La camisa está arrugada.,nhàu; nhăn,Áo sơ mi bị nhàu.,ยับ,เสื้อยับ,kusut,Kemejanya kusut.
crane,We saw a crane by the river.,두루미; 학,강가에서 두루미를 봤어요.,ツル; 鶴,川のそばでツルを見た。,鹤,我们在河边看到了一只鹤。,grulla,Vimos una grulla junto al río.,sếu; hạc,Chúng tôi thấy sếu bên sông.,นกกระเรียน,เราเห็นนกกระเรียนริมแม่น้ำ,burung bangau,Kami melihat bangau di sungai.
toucan,The toucan has a colorful beak.,투칸; 큰부리새,투칸은 화려한 부리를 가지고 있어요.,オオハシ; トゥカン,オオハシはカラフルなくちばしを持っている。,巨嘴鸟,巨嘴鸟有彩色的嘴。,tucán,El tucán tiene un pico colorido.,chim toucan,Chim toucan có mỏ đầy màu sắc.,นกทูแคน,นกทูแคนมีปากสีสันสดใส,burung tukan,Tukan memiliki paruh yang berwarna-warni.
kingfisher,The kingfisher dived into the water.,물총새,물총새가 물속으로 뛰어들었어요.,カワセミ,カワセミが水に飛び込んだ。,翠鸟,翠鸟跳入了水中。,martín pescador,El martín pescador se lanzó al agua.,chim bói cá,Chim bói cá lao xuống nước.,นกกระเต็น,นกกระเต็นดำน้ำ,burung pekakak; raja udang,Burung raja udang menyelam ke dalam air.
nest,The bird built a nest in the tree.,둥지,새가 나무에 둥지를 지었어요.,巣,鳥が木に巣を作った。,巢; 鸟窝,鸟在树上筑了巢。,nido,El pájaro construyó un nido en el árbol.,tổ,Chim làm tổ trên cây.,รัง,นกสร้างรังบนต้นไม้,sarang,Burung membangun sarang di pohon.
feather,The feather is very light.,깃털,깃털은 매우 가벼워요.,羽; 羽毛,羽はとても軽い。,羽毛,羽毛非常轻。,pluma,La pluma es muy ligera.,lông vũ,Lông vũ rất nhẹ.,ขนนก,ขนนกเบามาก,bulu,Bulunya sangat ringan.
eel,The eel is slippery.,장어; 뱀장어,장어는 미끄러워요.,ウナギ,ウナギはぬるぬるしている。,鳗鱼,鳗鱼很滑。,anguila,La anguila es resbaladiza.,lươn,Lươn rất trơn.,ปลาไหล,ปลาไหลลื่น,belut,Belut itu licin.
ray,We saw a stingray in the aquarium.,가오리,수족관에서 가오리를 봤어요.,エイ,水族館でエイを見た。,魟鱼; 鳐鱼,我们在水族馆看到了一条魟鱼。,raya; mantarraya,Vimos una mantarraya en el acuario.,cá đuối,Chúng tôi thấy cá đuối ở thủy cung.,ปลากระเบน,เราเห็นปลากระเบนในพิพิธภัณฑ์สัตว์น้ำ,ikan pari,Kami melihat ikan pari di akuarium.
clam,We dug clams at the beach.,조개,우리는 해변에서 조개를 캤어요.,アサリ; 貝,ビーチで貝を掘った。,蛤蜊,我们在海滩上挖了蛤蜊。,almeja,Cavamos almejas en la playa.,nghêu; sò,Chúng tôi đào nghêu ở bãi biển.,หอย,เราขุดหอยที่ชายหาด,kerang,Kami menggali kerang di pantai.
algae,Algae grow in the pond.,조류; 말,연못에 조류가 자라요.,藻,池に藻が生えている。,藻类,池塘里长了藻类。,alga,Las algas crecen en el estanque.,tảo,Tảo mọc trong ao.,สาหร่าย,สาหร่ายเติบโตในสระ,ganggang,Ganggang tumbuh di kolam.
willow,The willow tree is by the river.,버드나무,강가에 버드나무가 있어요.,ヤナギ; 柳,川のそばに柳がある。,柳树,柳树在河边。,sauce,El sauce está junto al río.,cây liễu,Cây liễu bên sông.,ต้นหลิว,ต้นหลิวอยู่ริมแม่น้ำ,pohon willow,Pohon willow ada di tepi sungai.
maple,Maple leaves turn red in fall.,단풍나무,단풍나무 잎이 가을에 빨갛게 변해요.,カエデ; モミジ,秋にカエデの葉が赤くなる。,枫树,枫树叶子在秋天变红。,arce,Las hojas de arce se ponen rojas en otoño.,cây phong,Lá phong đỏ vào mùa thu.,ต้นเมเปิ้ล,ใบเมเปิ้ลเปลี่ยนเป็นสีแดงในฤดูใบไม้ร่วง,pohon maple,Daun maple berubah merah di musim gugur.
tulip,Tulips bloom in spring.,튤립,튤립은 봄에 피어요.,チューリップ,チューリップは春に咲く。,郁金香,郁金香在春天开花。,tulipán,Los tulipanes florecen en primavera.,hoa tulip,Hoa tulip nở vào mùa xuân.,ทิวลิป,ทิวลิปบานในฤดูใบไม้ผลิ,tulip,Tulip mekar di musim semi.
sunflower,The sunflower faces the sun.,해바라기,해바라기는 해를 향해요.,ひまわり,ひまわりは太陽の方を向く。,向日葵,向日葵朝着太阳。,girasol,El girasol mira hacia el sol.,hoa hướng dương,Hoa hướng dương hướng về mặt trời.,ดอกทานตะวัน,ดอกทานตะวันหันหาดวงอาทิตย์,bunga matahari,Bunga matahari menghadap matahari.
rose,She received a beautiful rose.,장미,그녀는 아름다운 장미를 받았어요.,バラ,彼女は美しいバラをもらった。,玫瑰,她收到了一朵漂亮的玫瑰。,rosa,Ella recibió una rosa hermosa.,hoa hồng,Cô ấy nhận được bông hồng đẹp.,กุหลาบ,เธอได้รับกุหลาบสวยงาม,mawar,Dia menerima mawar yang indah.
lily,The lily smells wonderful.,백합,백합은 향기가 좋아요.,ユリ,ユリはいい匂いがする。,百合,百合花闻起来很香。,lirio; azucena,El lirio huele maravilloso.,hoa huệ; hoa lily,Hoa huệ thơm tuyệt vời.,ลิลลี่,ลิลลี่มีกลิ่นหอม,bunga lili; bakung,Bunga lili berbau harum.
caterpillar (more),The caterpillar will become a butterfly.,애벌레,애벌레는 나비가 될 거예요.,毛虫; イモムシ,毛虫はやがて蝶になる。,毛毛虫,毛毛虫会变成蝴蝶。,oruga,La oruga se convertirá en mariposa.,sâu bướm,Sâu bướm sẽ thành bướm.,หนอนผีเสื้อ,หนอนผีเสื้อจะกลายเป็นผีเสื้อ,ulat,Ulat akan menjadi kupu-kupu.
centipede,A centipede has many legs.,지네,지네는 다리가 많아요.,ムカデ,ムカデは足がたくさんある。,蜈蚣,蜈蚣有很多条腿。,ciempiés,Un ciempiés tiene muchas patas.,rết,Rết có nhiều chân.,ตะขาบ,ตะขาบมีขาหลายคู่,lipan; kelabang,Lipan memiliki banyak kaki.
scorpion,The scorpion has a dangerous sting.,전갈,전갈은 위험한 독침이 있어요.,サソリ,サソリは危険な毒針を持っている。,蝎子,蝎子有危险的毒刺。,escorpión; alacrán,El escorpión tiene una picadura peligrosa.,bọ cạp,Bọ cạp có nọc độc nguy hiểm.,แมงป่อง,แมงป่องมีเหล็กในอันตราย,kalajengking,Kalajengking memiliki sengatan berbahaya.
termite,Termites can damage wooden houses.,흰개미,흰개미는 목조 건물을 손상시킬 수 있어요.,シロアリ,シロアリは木造家屋に被害を与える。,白蚁,白蚁能损坏木头房子。,termita,Las termitas pueden dañar casas de madera.,mối,Mối có thể làm hỏng nhà gỗ.,ปลวก,ปลวกทำลายบ้านไม้ได้,rayap,Rayap bisa merusak rumah kayu.
wasp,A wasp stung my arm.,말벌,말벌이 제 팔을 쏘았어요.,スズメバチ,スズメバチに腕を刺された。,黄蜂,黄蜂蛰了我的手臂。,avispa,Una avispa me picó el brazo.,ong bắp cày,Ong bắp cày đốt tay tôi.,ตัวต่อ,ตัวต่อต่อยแขนฉัน,tawon,Tawon menyengat lengan saya.
point,She pointed at the map.,가리키다,그녀는 지도를 가리켰어요.,指す; 指差す,彼女は地図を指差した。,指; 指向,她指向地图。,señalar,Ella señaló el mapa.,chỉ,Cô ấy chỉ vào bản đồ.,ชี้,เธอชี้ไปที่แผนที่,menunjuk,Dia menunjuk ke peta.
shake,Shake the bottle before use.,흔들다,사용 전에 병을 흔드세요.,振る,使う前にボトルを振ってください。,摇,使用前摇一摇瓶子。,agitar; sacudir,Agita la botella antes de usar.,lắc,Lắc chai trước khi dùng.,เขย่า,เขย่าขวดก่อนใช้,mengocok; mengguncang,Kocok botolnya sebelum digunakan.
crawl,The baby is learning to crawl.,기어가다,아기가 기어가는 것을 배우고 있어요.,はう; ハイハイする,赤ちゃんがハイハイを覚えている。,爬,宝宝正在学爬。,gatear,El bebé está aprendiendo a gatear.,bò,Em bé đang tập bò.,คลาน,ทารกกำลังเรียนรู้การคลาน,merangkak,Bayinya sedang belajar merangkak.
grab,Grab my hand.,잡다,제 손을 잡으세요.,つかむ,私の手をつかんで。,抓; 抓住,抓住我的手。,agarrar,Agarra mi mano.,nắm; chụp,Nắm lấy tay tôi.,คว้า; จับ,จับมือฉัน,meraih; menggenggam,Genggam tangan saya.
lean,He leaned against the wall.,기대다,그는 벽에 기댔어요.,寄りかかる,彼は壁に寄りかかった。,靠,他靠在墙上。,apoyarse; recostarse,Él se recostó contra la pared.,tựa; dựa,Anh ấy tựa vào tường.,พิง; เอน,เขาพิงผนัง,bersandar,Dia bersandar ke dinding.
slip,I slipped on the wet floor.,미끄러지다,젖은 바닥에서 미끄러졌어요.,滑る,濡れた床で滑った。,滑倒,我在湿地板上滑倒了。,resbalarse,Me resbalé en el piso mojado.,trượt,Tôi bị trượt trên sàn ướt.,ลื่น,ฉันลื่นบนพื้นเปียก,terpeleset,Saya terpeleset di lantai yang basah.
toss,Toss the ball to me.,던지다,저에게 공을 던지세요.,投げる,ボールを投げて。,抛; 扔,把球扔给我。,lanzar; tirar,Lánzame la pelota.,ném,Ném bóng cho tôi.,โยน,โยนลูกบอลให้ฉัน,melempar,Lempar bolanya ke saya.
stack,Stack the books on the shelf.,쌓다,책을 선반에 쌓으세요.,積み重ねる,本を棚に積み重ねて。,叠; 堆,把书叠在架子上。,apilar,Apila los libros en el estante.,xếp chồng,Xếp chồng sách lên kệ.,กอง; ซ้อน,วางซ้อนหนังสือบนชั้นวาง,menumpuk,Tumpuk buku-buku di rak.
drag,He dragged the heavy suitcase.,끌다,그는 무거운 여행 가방을 끌었어요.,引きずる,彼は重いスーツケースを引きずった。,拖; 拽,他拖着沉重的行李箱。,arrastrar,Él arrastró la maleta pesada.,kéo,Anh ấy kéo cái vali nặng.,ลาก,เขาลากกระเป๋าเดินทางหนัก,menyeret,Dia menyeret koper yang berat.
twist,Twist the cap to open the bottle.,비틀다; 돌리다,뚜껑을 돌려서 병을 여세요.,ねじる; ひねる,キャップをひねってボトルを開けて。,拧,拧开盖子打开瓶子。,girar; torcer,Gira la tapa para abrir la botella.,xoay; vặn,Vặn nắp để mở chai.,บิด; หมุน,หมุนฝาเพื่อเปิดขวด,memutar,Putar tutupnya untuk membuka botol.
spin,The top is spinning fast.,돌다; 회전하다,팽이가 빠르게 돌고 있어요.,回る; 回転する,コマが速く回っている。,转; 旋转,陀螺转得很快。,girar,El trompo está girando rápido.,quay,Con quay đang quay nhanh.,หมุน,ลูกข่างหมุนเร็ว,berputar,Gansingnya berputar cepat.
bounce,The ball bounced high.,튀다,공이 높이 튀었어요.,弾む; バウンドする,ボールが高く弾んだ。,弹; 反弹,球弹得很高。,rebotar,La pelota rebotó alto.,nảy,Bóng nảy cao.,เด้ง,ลูกบอลเด้งสูง,memantul,Bolanya memantul tinggi.
crawl (insect),The insect crawled up the wall.,기다; 기어가다,벌레가 벽을 기어올라갔어요.,はう,虫が壁を這い上がった。,爬,虫子爬上了墙。,arrastrarse; trepar,El insecto trepó por la pared.,bò,Côn trùng bò lên tường.,คลาน; ไต่,แมลงไต่ขึ้นผนัง,merayap,Serangga itu merayap di dinding.
sprout,The seeds are sprouting.,싹이 트다,씨앗에서 싹이 트고 있어요.,芽が出る,種から芽が出ている。,发芽,种子正在发芽。,brotar,Las semillas están brotando.,nảy mầm,Hạt giống đang nảy mầm.,งอก,เมล็ดกำลังงอก,bertunas,Benihnya sedang bertunas.
bloom,The cherry trees are blooming.,꽃이 피다,벚나무에 꽃이 피고 있어요.,咲く; 開花する,桜の花が咲いている。,开花; 绽放,樱花正在开放。,florecer,Los cerezos están floreciendo.,nở,Hoa anh đào đang nở.,บาน,ต้นซากุระกำลังบาน,bermekaran; mekar,Pohon sakura sedang bermekaran.
