exchange,I want to exchange this shirt for a bigger size.,교환,이 셔츠를 더 큰 사이즈로 교환하고 싶어요.,交換,このシャツをもっと大きいサイズに交換したい。,换; 兑换,我想把这件衬衫换成大一号的。,cambiar; intercambiar,Quiero cambiar esta camisa por una talla más grande.,đổi,Tôi muốn đổi chiếc áo này sang cỡ lớn hơn.,แลกเปลี่ยน,ฉันอยากแลกเสื้อตัวนี้เป็นไซส์ใหญ่ขึ้น,menukar,Saya ingin menukar kemeja ini dengan ukuran yang lebih besar.
cart,Put the groceries in the shopping cart.,카트; 장바구니,식료품을 장바구니에 넣으세요.,カート,食料品をショッピングカートに入れてください。,购物车,把食品放进购物车里。,carrito,Pon los víveres en el carrito de compras.,xe đẩy,Cho đồ tạp hóa vào xe đẩy.,รถเข็น,ใส่ของชำในรถเข็นซื้อของ,keranjang; troli,Taruh belanjaan di keranjang belanja.
label,Read the label before buying.,라벨; 상표,사기 전에 라벨을 읽으세요.,ラベル,買う前にラベルを読んでください。,标签,买之前先看标签。,etiqueta,Lee la etiqueta antes de comprar.,nhãn,Đọc nhãn trước khi mua.,ฉลาก,อ่านฉลากก่อนซื้อ,label,Baca label sebelum membeli.
sunrise,We watched the sunrise from the mountain.,일출,우리는 산에서 일출을 봤어요.,日の出,山から日の出を見た。,日出,我们在山上看了日出。,amanecer; salida del sol,Vimos el amanecer desde la montaña.,bình minh,Chúng tôi ngắm bình minh từ trên núi.,พระอาทิตย์ขึ้น,เราดูพระอาทิตย์ขึ้นจากภูเขา,matahari terbit,Kami menyaksikan matahari terbit dari gunung.
sunset,The sunset was beautiful tonight.,일몰; 노을,오늘 밤 노을이 아름다웠어요.,日没; 夕焼け,今夜の夕焼けは美しかった。,日落,今晚的日落很美。,puesta de sol; atardecer,La puesta de sol fue hermosa esta noche.,hoàng hôn,Hoàng hôn tối nay thật đẹp.,พระอาทิตย์ตก,พระอาทิตย์ตกสวยมากคืนนี้,matahari terbenam,Matahari terbenam indah malam ini.
hourly,The bus runs on an hourly schedule.,매시간의,버스는 매시간 운행해요.,毎時の; 一時間ごとの,バスは一時間ごとに運行しています。,每小时的,公交车每小时一班。,cada hora; por hora,El autobús tiene un horario cada hora.,hàng giờ,Xe buýt chạy theo lịch hàng giờ.,ทุกชั่วโมง,รถบัสวิ่งทุกชั่วโมง,setiap jam,Bus beroperasi setiap jam.
daily,I drink coffee daily.,매일의; 일상의,나는 매일 커피를 마셔요.,毎日の; 日常の,私は毎日コーヒーを飲みます。,每天的; 日常的,我每天喝咖啡。,diario; diariamente,Bebo café diariamente.,hàng ngày,Tôi uống cà phê hàng ngày.,ทุกวัน; ประจำวัน,ฉันดื่มกาแฟทุกวัน,setiap hari; harian,Saya minum kopi setiap hari.
weekly,We have a weekly team meeting.,주간의; 매주,우리는 매주 팀 회의가 있어요.,毎週の; 週間の,毎週チームミーティングがあります。,每周的,我们每周有一次团队会议。,semanal,Tenemos una reunión de equipo semanal.,hàng tuần,Chúng tôi có cuộc họp nhóm hàng tuần.,รายสัปดาห์,เรามีประชุมทีมรายสัปดาห์,mingguan,Kami memiliki rapat tim mingguan.
monthly,The rent is paid monthly.,월간의; 매달,월세는 매달 지불해요.,毎月の; 月間の,家賃は毎月支払います。,每月的,房租每月支付。,mensual,La renta se paga mensualmente.,hàng tháng,Tiền thuê nhà trả hàng tháng.,รายเดือน,ค่าเช่าจ่ายเป็นรายเดือน,bulanan,Sewa dibayar setiap bulan.
annual,The company has an annual party.,연간의; 매년,회사에는 매년 파티가 있어요.,年間の; 毎年の,会社には毎年パーティーがある。,每年的; 年度的,公司每年举办一次派对。,anual,La empresa tiene una fiesta anual.,hàng năm,Công ty có tiệc hàng năm.,ประจำปี,บริษัทมีงานเลี้ยงประจำปี,tahunan,Perusahaan mengadakan pesta tahunan.whale,The whale is the largest animal.,고래,고래는 가장 큰 동물이에요.,クジラ,クジラは最も大きな動物です。,鲸鱼,鲸鱼是最大的动物。,ballena,La ballena es el animal más grande.,cá voi,Cá voi là động vật lớn nhất.,วาฬ,วาฬเป็นสัตว์ที่ใหญ่ที่สุด,paus,Paus adalah hewan terbesar.
dolphin,Dolphins are very intelligent.,돌고래,돌고래는 매우 똑똒해요.,イルカ,イルカはとても知能が高い。,海豚,海豚非常聪明。,delfín,Los delfines son muy inteligentes.,cá heo,Cá heo rất thông minh.,โลมา,โลมาฉลาดมาก,lumba-lumba,Lumba-lumba sangat cerdas.
shark,Sharks live in the ocean.,상어,상어는 바다에 살아요.,サメ,サメは海に住んでいる。,鲨鱼,鲨鱼生活在海洋里。,tiburón,Los tiburones viven en el océano.,cá mập,Cá mập sống ở đại dương.,ฉลาม,ฉลามอาศัยอยู่ในมหาสมุทร,hiu,Hiu hidup di lautan.
octopus,An octopus has eight arms.,문어,문어는 팔이 여덟 개예요.,タコ,タコは8本の腕がある。,章鱼,章鱼有八条手臂。,pulpo,Un pulpo tiene ocho brazos.,bạch tuộc,Bạch tuộc có tám cánh tay.,ปลาหมึกยักษ์,ปลาหมึกยักษ์มีแปดแขน,gurita,Gurita memiliki delapan lengan.
jellyfish,Be careful of jellyfish at the beach.,해파리,해변에서 해파리를 조심하세요.,クラゲ,ビーチでクラゲに気をつけて。,水母,在海滩要小心水母。,medusa,Ten cuidado con las medusas en la playa.,sứa,Cẩn thận sứa ở bãi biển.,แมงกะพรุน,ระวังแมงกะพรุนที่ชายหาด,ubur-ubur,Hati-hati dengan ubur-ubur di pantai.
coral,The coral reef is colorful.,산호,산호초는 다채롭어요.,サンゴ,サンゴ礁はカラフルだ。,珊瑚,珊瑚礁色彩缤纷。,coral,El arrecife de coral es colorido.,san hô,Rạn san hô đầy màu sắc.,ปะการัง,แนวปะการังมีสีสันสดใส,karang,Terumbu karang sangat berwarna.
seahorse,Seahorses are tiny and cute.,해마,해마는 작고 귀여워요.,タツノオトシゴ,タツノオトシゴは小さくてかわいい。,海马,海马又小又可爱。,caballito de mar,Los caballitos de mar son pequeños y lindos.,cá ngựa,Cá ngựa nhỏ và dễ thương.,ม้าน้ำ,ม้าน้ำตัวเล็กและน่ารัก,kuda laut,Kuda laut kecil dan lucu.
starfish,I found a starfish on the shore.,불가사리,해변에서 불가사리를 찾았어요.,ヒトデ,岸辺でヒトデを見つけた。,海星,我在岸边找到了一只海星。,estrella de mar,Encontré una estrella de mar en la orilla.,sao biển,Tôi tìm thấy sao biển trên bờ.,ปลาดาว,ฉันเจอปลาดาวบนชายฝั่ง,bintang laut,Saya menemukan bintang laut di pantai.
turtle (sea),Sea turtles swim long distances.,바다거북,바다거북은 먼 거리를 헤엄쳐요.,ウミガメ,ウミガメは長い距離を泳ぐ。,海龟,海龟游很长的距离。,tortuga marina,Las tortugas marinas nadan largas distancias.,rùa biển,Rùa biển bơi quãng đường dài.,เต่าทะเล,เต่าทะเลว่ายน้ำไกล,penyu,Penyu berenang jarak jauh.
crab,The crab walked sideways.,게,게가 옆으로 걸었어요.,カニ,カニは横に歩いた。,螃蟹,螃蟹横着走。,cangrejo,El cangrejo caminó de lado.,cua,Con cua đi ngang.,ปู,ปูเดินไปด้านข้าง,kepiting,Kepiting berjalan menyamping.
lobster,Lobster is an expensive seafood.,바닷가재,바닷가재는 비싼 해산물이에요.,ロブスター,ロブスターは高級な海産物だ。,龙虾,龙虾是很贵的海鲜。,langosta,La langosta es un marisco caro.,tôm hùm,Tôm hùm là hải sản đắt tiền.,ล็อบสเตอร์,ล็อบสเตอร์เป็นอาหารทะเลที่แพง,lobster,Lobster adalah makanan laut yang mahal.
seal,Seals rest on the rocks.,물개; 물범,물개가 바위에서 쉬고 있어요.,アザラシ,アザラシが岩の上で休んでいる。,海豹,海豹在岩石上休息。,foca,Las focas descansan sobre las rocas.,hải cẩu,Hải cẩu nghỉ ngơi trên đá.,แมวน้ำ,แมวน้ำพักผ่อนบนโขดหิน,anjing laut,Anjing laut beristirahat di atas batu.
wave,The waves are big today.,파도,오늘 파도가 커요.,波,今日は波が高い。,波浪,今天浪很大。,ola,Las olas están grandes hoy.,sóng,Hôm nay sóng lớn.,คลื่น,คลื่นวันนี้ใหญ่,ombak; gelombang,Ombaknya besar hari ini.
tide,The tide is coming in.,조수; 밀물,밀물이 들어오고 있어요.,潮,潮が満ちてきている。,潮汐,潮水正在上涨。,marea,La marea está subiendo.,thủy triều,Thủy triều đang lên.,น้ำขึ้น,น้ำกำลังขึ้น,pasang,Air pasang sedang naik.
anchor,Drop the anchor here.,닻,여기에 닻을 내리세요.,いかり; アンカー,ここでいかりを下ろして。,锚,在这里下锚。,ancla,Suelta el ancla aquí.,neo; mỏ neo,Thả neo ở đây.,สมอเรือ,ทิ้งสมอที่นี่,jangkar,Turunkan jangkar di sini.
reef,The reef protects the coast.,암초,암초가 해안을 보호해요.,礁; リーフ,礁が海岸を守っている。,礁石,礁石保护着海岸。,arrecife,El arrecife protege la costa.,rạn,Rạn bảo vệ bờ biển.,แนวปะการัง,แนวปะการังปกป้องชายฝั่ง,karang; terumbu,Terumbu melindungi pantai.
seaweed,Seaweed is used in many dishes.,해초; 미역,해초는 많은 요리에 사용돼요.,海藻,海藻は多くの料理に使われる。,海藻; 海带,海藻用于很多菜肴。,alga marina,Las algas se usan en muchos platos.,rong biển,Rong biển dùng trong nhiều món ăn.,สาหร่าย,สาหร่ายใช้ในอาหารหลายอย่าง,rumput laut,Rumput laut digunakan dalam banyak masakan.
pearl,She found a pearl in the oyster.,진주,그녀는 굴에서 진주를 찾았어요.,真珠,彼女は牡蠣の中から真珠を見つけた。,珍珠,她在牡蛎里发现了一颗珍珠。,perla,Ella encontró una perla en la ostra.,ngọc trai,Cô ấy tìm thấy ngọc trai trong con hàu.,ไข่มุก,เธอพบไข่มุกในหอยนางรม,mutiara,Dia menemukan mutiara di dalam tiram.
tree,The tree gives us shade.,나무,나무가 그늘을 만들어 줘요.,木,木が日陰を作ってくれる。,树,树给我们遮阴。,árbol,El árbol nos da sombra.,cây,Cây cho chúng ta bóng mát.,ต้นไม้,ต้นไม้ให้ร่มเงาเรา,pohon,Pohon memberi kita keteduhan.
flower,The flowers are blooming.,꽃,꽃이 피고 있어요.,花,花が咲いている。,花,花正在开放。,flor,Las flores están floreciendo.,hoa,Hoa đang nở.,ดอกไม้,ดอกไม้กำลังบาน,bunga,Bunga-bunga sedang mekar.
grass,The grass is wet after the rain.,잔디; 풀,비 온 후에 잔디가 젖어 있어요.,芝生; 草,雨の後、芝生が濡れている。,草,雨后草地湿了。,césped; hierba,El césped está mojado después de la lluvia.,cỏ,Cỏ ướt sau cơn mưa.,หญ้า,หญ้าเปียกหลังฝนตก,rumput,Rumputnya basah setelah hujan.
leaf,The leaves fall in autumn.,잎; 나뭇잎,가을에 나뭇잎이 떨어져요.,葉,秋に葉が落ちる。,叶子,秋天叶子落了。,hoja,Las hojas caen en otoño.,lá,Lá rụng vào mùa thu.,ใบไม้,ใบไม้ร่วงในฤดูใบไม้ร่วง,daun,Daun berguguran di musim gugur.
root,The roots of the tree are deep.,뿌리,나무 뿌리가 깊어요.,根,木の根は深い。,根,树根很深。,raíz,Las raíces del árbol son profundas.,rễ,Rễ cây rất sâu.,ราก,รากของต้นไม้ลึก,akar,Akar pohon itu dalam.
branch,A bird sat on the branch.,가지,새가 가지 위에 앉았어요.,枝,鳥が枝にとまった。,树枝,一只鸟停在树枝上。,rama,Un pájaro se sentó en la rama.,cành,Một con chim đậu trên cành.,กิ่ง,นกเกาะบนกิ่งไม้,cabang; dahan,Seekor burung duduk di dahan.
seed,Plant the seeds in the soil.,씨앗,흙에 씨앗을 심으세요.,種,土に種を植えてください。,种子,把种子种在土里。,semilla,Planta las semillas en la tierra.,hạt giống,Gieo hạt giống vào đất.,เมล็ด,ปลูกเมล็ดลงในดิน,benih; biji,Tanam benih di dalam tanah.
bush,The bush has beautiful flowers.,관목; 덤불,관목에 아름다운 꽃이 피었어요.,茂み; 低木,茂みにきれいな花が咲いている。,灌木,灌木上开着漂亮的花。,arbusto,El arbusto tiene flores hermosas.,bụi cây,Bụi cây có hoa đẹp.,พุ่มไม้,พุ่มไม้มีดอกไม้สวย,semak,Semak itu memiliki bunga yang indah.
vine,Grapes grow on vines.,덩굴,포도는 덩굴에서 자라요.,つる; ブドウの木,ブドウはつるに実る。,藤蔓,葡萄长在藤蔓上。,vid; enredadera,Las uvas crecen en vides.,dây leo,Nho mọc trên dây leo.,เถาวัลย์,องุ่นเติบโตบนเถาวัลย์,tanaman merambat,Anggur tumbuh di tanaman merambat.
pine,Pine trees stay green all year.,소나무,소나무는 일년 내내 푸르러요.,松,松は一年中緑のままだ。,松树,松树一年四季常绿。,pino,Los pinos se mantienen verdes todo el año.,cây thông,Cây thông xanh quanh năm.,ต้นสน,ต้นสนเขียวตลอดปี,pinus; pohon pinus,Pohon pinus tetap hijau sepanjang tahun.
oak,The oak tree is very old.,참나무; 떡갈나무,참나무가 매우 오래됐어요.,オーク; 樫の木,この樫の木はとても古い。,橡树,这棵橡树非常古老。,roble,El roble es muy antiguo.,cây sồi,Cây sồi rất cổ thụ.,ต้นโอ๊ก,ต้นโอ๊กเก่าแก่มาก,pohon ek,Pohon ek itu sangat tua.
bamboo,Bamboo grows very fast.,대나무,대나무는 매우 빨리 자라요.,竹,竹はとても速く伸びる。,竹子,竹子长得非常快。,bambú,El bambú crece muy rápido.,tre,Tre mọc rất nhanh.,ไผ่,ไผ่เติบโตเร็วมาก,bambu,Bambu tumbuh sangat cepat.
cactus,A cactus needs very little water.,선인장,선인장은 물이 거의 필요 없어요.,サボテン,サボテンはほとんど水がいらない。,仙人掌,仙人掌几乎不需要水。,cactus; cacto,Un cactus necesita muy poca agua.,xương rồng,Xương rồng cần rất ít nước.,กระบองเพชร,กระบองเพชรต้องการน้ำน้อยมาก,kaktus,Kaktus membutuhkan sedikit air.
moss,Moss grows on wet rocks.,이끼,이끼는 축축한 바위에서 자라요.,コケ; 苔,苔は湿った岩に生える。,苔藓,苔藓长在潮湿的石头上。,musgo,El musgo crece en rocas húmedas.,rêu,Rêu mọc trên đá ẩm.,มอส,มอสขึ้นบนหินที่เปียก,lumut,Lumut tumbuh di batu yang basah.
petal,The petals fell to the ground.,꽃잎,꽃잎이 땅에 떨어졌어요.,花びら,花びらが地面に落ちた。,花瓣,花瓣落到了地上。,pétalo,Los pétalos cayeron al suelo.,cánh hoa,Cánh hoa rơi xuống đất.,กลีบดอก,กลีบดอกร่วงลงพื้น,kelopak bunga,Kelopak bunga jatuh ke tanah.
thorn,Be careful of the thorns on the rose.,가시,장미의 가시를 조심하세요.,とげ; トゲ,バラのとげに気をつけて。,刺,小心玫瑰上的刺。,espina,Ten cuidado con las espinas de la rosa.,gai,Cẩn thận gai hồng.,หนาม,ระวังหนามของกุหลาบ,duri,Hati-hati dengan duri pada mawar.
ant,Ants work very hard.,개미,개미는 매우 열심히 일해요.,アリ,アリはとても勤勉だ。,蚂蚁,蚂蚁非常勤劳。,hormiga,Las hormigas trabajan muy duro.,kiến,Kiến làm việc rất chăm chỉ.,มด,มดทำงานหนักมาก,semut,Semut bekerja sangat keras.
bee,The bee makes honey.,벌,벌은 꿀을 만들어요.,ハチ; ミツバチ,ハチは蜂蜜を作る。,蜜蜂,蜜蜂酿蜜。,abeja,La abeja hace miel.,ong,Ong làm mật.,ผึ้ง,ผึ้งผลิตน้ำผึ้ง,lebah,Lebah membuat madu.
mosquito,Mosquitoes bite at night.,모기,모기는 밤에 물어요.,蚊; モスキート,蚊は夜に刺す。,蚊子,蚊子在晚上叮人。,mosquito,Los mosquitos pican de noche.,muỗi,Muỗi đốt vào ban đêm.,ยุง,ยุงกัดตอนกลางคืน,nyamuk,Nyamuk menggigit di malam hari.
spider,A spider made a web in the corner.,거미,거미가 구석에 거미줄을 쳤어요.,クモ,クモが隅に巣を張った。,蜘蛛,蜘蛛在角落里结了网。,araña,Una araña hizo una telaraña en la esquina.,nhện,Nhện giăng tơ ở góc.,แมงมุม,แมงมุมทำใยที่มุมห้อง,laba-laba,Laba-laba membuat jaring di sudut.
beetle,The beetle has a hard shell.,딱정벌레,딱정벌레는 딱딱한 껍질이 있어요.,カブトムシ; 甲虫,甲虫は硬い殻を持っている。,甲虫,甲虫有坚硬的壳。,escarabajo,El escarabajo tiene un caparazón duro.,bọ cánh cứng,Bọ cánh cứng có mai cứng.,ด้วง,ด้วงมีเปลือกแข็ง,kumbang,Kumbang memiliki cangkang yang keras.
firefly,Fireflies glow at night.,반딧불이,반딧불이는 밤에 빛나요.,ホタル,ホタルは夜に光る。,萤火虫,萤火虫在夜晚发光。,luciérnaga,Las luciérnagas brillan de noche.,đom đóm,Đom đóm phát sáng ban đêm.,หิ่งห้อย,หิ่งห้อยเรืองแสงตอนกลางคืน,kunang-kunang,Kunang-kunang bersinar di malam hari.
dragonfly,A dragonfly flew over the pond.,잠자리,잠자리가 연못 위를 날았어요.,トンボ,トンボが池の上を飛んだ。,蜻蜓,蜻蜓飞过池塘。,libélula,Una libélula voló sobre el estanque.,chuồn chuồn,Chuồn chuồn bay trên ao.,แมลงปอ,แมลงปอบินข้ามสระ,capung,Capung terbang di atas kolam.
cockroach,I saw a cockroach in the kitchen.,바퀴벌레,부엌에서 바퀴벌레를 봤어요.,ゴキブリ,台所でゴキブリを見た。,蟑螂,我在厨房看到了一只蟑螂。,cucaracha,Vi una cucaracha en la cocina.,gián,Tôi thấy con gián trong bếp.,แมลงสาบ,ฉันเห็นแมลงสาบในครัว,kecoak,Saya melihat kecoak di dapur.
ladybug,A ladybug landed on my hand.,무당벌레,무당벌레가 제 손에 앉았어요.,テントウムシ,テントウムシが手にとまった。,瓢虫,一只瓢虫落在我手上。,mariquita; catarina,Una mariquita se posó en mi mano.,bọ rùa,Bọ rùa đậu trên tay tôi.,เต่าทอง,เต่าทองเกาะมือฉัน,kepik,Kepik mendarat di tangan saya.
moth,A moth flew toward the light.,나방,나방이 불빛 쪽으로 날아왔어요.,蛾; ガ,蛾が明かりに向かって飛んだ。,飞蛾,飞蛾朝着灯光飞去。,polilla,Una polilla voló hacia la luz.,bướm đêm,Bướm đêm bay về phía ánh sáng.,ผีเสื้อกลางคืน,ผีเสื้อกลางคืนบินเข้าหาแสง,ngengat,Ngengat terbang menuju cahaya.
cricket,Crickets chirp at night.,귀뚜라미,귀뚜라미가 밤에 울어요.,コオロギ,コオロギは夜に鳴く。,蟋蟀,蟋蟀在夜里叫。,grillo,Los grillos cantan de noche.,dế,Dế kêu vào ban đêm.,จิ้งหรีด,จิ้งหรีดส่งเสียงร้องตอนกลางคืน,jangkrik,Jangkrik berbunyi di malam hari.
fly,A fly is buzzing around the room.,파리,파리가 방 안에서 윙윙거려요.,ハエ,ハエが部屋の中を飛び回っている。,苍蝇,一只苍蝇在房间里嗡嗡叫。,mosca,Una mosca zumba por la habitación.,ruồi,Ruồi vo ve quanh phòng.,แมลงวัน,แมลงวันบินวนรอบห้อง,lalat,Lalat berdengung di sekitar ruangan.
pelican,The pelican caught a fish.,펠리컨,펠리컨이 물고기를 잡았어요.,ペリカン,ペリカンが魚を捕まえた。,鹈鹕,鹈鹕抓到了一条鱼。,pelícano,El pelícano atrapó un pez.,bồ nông,Bồ nông bắt được cá.,นกกระทุง,นกกระทุงจับปลาได้,pelikan,Pelikan menangkap seekor ikan.
flamingo,Flamingos are pink and tall.,플라밍고,플라밍고는 분홍색이고 키가 커요.,フラミンゴ,フラミンゴはピンク色で背が高い。,火烈鸟,火烈鸟是粉色的且很高。,flamenco,Los flamencos son rosados y altos.,hồng hạc,Hồng hạc có màu hồng và cao.,นกฟลามิงโก,นกฟลามิงโกสีชมพูและสูง,flamingo,Flamingo berwarna merah muda dan tinggi.
penguin,Penguins cannot fly.,펭귄,펭귄은 날 수 없어요.,ペンギン,ペンギンは飛べない。,企鹅,企鹅不会飞。,pingüino,Los pingüinos no pueden volar.,chim cánh cụt,Chim cánh cụt không biết bay.,เพนกวิน,เพนกวินบินไม่ได้,penguin,Penguin tidak bisa terbang.
woodpecker,The woodpecker pecks the tree.,딱따구리,딱따구리가 나무를 쪼고 있어요.,キツツキ,キツツキが木をつついている。,啄木鸟,啄木鸟在啄树。,pájaro carpintero,El pájaro carpintero picotea el árbol.,chim gõ kiến,Chim gõ kiến mổ cây.,นกหัวขวาน,นกหัวขวานเจาะต้นไม้,burung pelatuk,Burung pelatuk mematuk pohon.
hummingbird,The hummingbird is very small.,벌새,벌새는 매우 작아요.,ハチドリ,ハチドリはとても小さい。,蜂鸟,蜂鸟非常小。,colibrí,El colibrí es muy pequeño.,chim ruồi,Chim ruồi rất nhỏ.,นกฮัมมิ่งเบิร์ด,นกฮัมมิ่งเบิร์ดตัวเล็กมาก,burung kolibri,Kolibri sangat kecil.
sparrow,Sparrows sing in the morning.,참새,참새가 아침에 노래해요.,スズメ,スズメは朝に歌う。,麻雀,麻雀在早上唱歌。,gorrión,Los gorriones cantan por la mañana.,chim sẻ,Chim sẻ hót vào buổi sáng.,นกกระจอก,นกกระจอกร้องตอนเช้า,burung pipit; burung gereja,Burung pipit berkicau di pagi hari.
hawk,The hawk hunts small animals.,매,매는 작은 동물을 사냥해요.,タカ,タカは小動物を狩る。,鹰; 隼,鹰捕猎小动物。,halcón,El halcón caza animales pequeños.,diều hâu,Diều hâu săn động vật nhỏ.,เหยี่ยว,เหยี่ยวล่าสัตว์เล็กๆ,elang; rajawali,Elang memburu hewan kecil.
robin,A robin is sitting on the fence.,울새; 로빈새,로빈새가 울타리에 앉아 있어요.,コマドリ; ロビン,コマドリが柵にとまっている。,知更鸟,一只知更鸟坐在篱笆上。,petirrojo,Un petirrojo está sentado en la cerca.,chim cổ đỏ,Chim cổ đỏ đậu trên hàng rào.,นกโรบิน,นกโรบินเกาะรั้ว,burung robin,Seekor robin duduk di pagar.
star,The stars are bright tonight.,별,오늘 밤 별이 밝아요.,星,今夜は星が明るい。,星星,今晚星星很亮。,estrella,Las estrellas están brillantes esta noche.,ngôi sao,Ngôi sao sáng đêm nay.,ดาว,ดาวสว่างคืนนี้,bintang,Bintang-bintang terang malam ini.
moon,The moon is full tonight.,달,오늘 밤 보름달이에요.,月,今夜は満月だ。,月亮,今晚是满月。,luna,La luna está llena esta noche.,mặt trăng,Đêm nay trăng tròn.,พระจันทร์,พระจันทร์เต็มดวงคืนนี้,bulan,Bulan purnama malam ini.
sun,The sun rises in the east.,태양; 해,태양은 동쪽에서 떠요.,太陽,太陽は東から昇る。,太阳,太阳从东方升起。,sol,El sol sale por el este.,mặt trời,Mặt trời mọc ở hướng đông.,ดวงอาทิตย์,ดวงอาทิตย์ขึ้นทางทิศตะวันออก,matahari,Matahari terbit dari timur.
planet,Mars is a planet.,행성,화성은 행성이에요.,惑星,火星は惑星です。,行星,火星是一颗行星。,planeta,Marte es un planeta.,hành tinh,Sao Hỏa là một hành tinh.,ดาวเคราะห์,ดาวอังคารเป็นดาวเคราะห์,planet,Mars adalah sebuah planet.
