english,example,ko_meaning,ko_example,ja_meaning,ja_example,zh_meaning,zh_example,es_meaning,es_example,vi_meaning,vi_example,th_meaning,th_example,id_meaning,id_example
format,The essay must follow the prescribed academic format.,형식,에세이는 규정된 학술 형식을 따라야 한다.,形式,エッセイは規定の学術形式に従わなければならない。,格式,论文必须遵循规定的学术格式。,formato,El ensayo debe seguir el formato académico prescrito.,định dạng,Bài luận phải tuân theo định dạng học thuật quy định.,รูปแบบ,บทความต้องเป็นไปตามรูปแบบทางวิชาการที่กำหนด,format,Esai harus mengikuti format akademis yang ditentukan.
abrupt,The meeting came to an abrupt end when the fire alarm rang.,갑작스러운,화재 경보가 울리자 회의가 갑작스럽게 끝났다.,突然の,火災警報が鳴り会議が突然終了した。,突然的,火灾警报响起，会议突然结束。,abrupto,La reunión llegó a un final abrupto cuando sonó la alarma de incendio.,đột ngột,Cuộc họp kết thúc đột ngột khi chuông báo cháy vang lên.,กะทันหัน,การประชุมสิ้นสุดลงอย่างกะทันหันเมื่อสัญญาณเตือนไฟไหม้ดังขึ้น,mendadak,Rapat berakhir secara mendadak ketika alarm kebakaran berbunyi.
abstain,Several members abstained from voting on the proposal.,기권하다,몇몇 회원은 제안에 대한 투표를 기권했다.,棄権する,数人の委員が提案の投票を棄権した。,弃权,几名成员对该提案投票弃权。,abstenerse,Varios miembros se abstuvieron de votar la propuesta.,bỏ phiếu trắng,Một số thành viên bỏ phiếu trắng đối với đề xuất.,งดออกเสียง,สมาชิกหลายคนงดออกเสียงในข้อเสนอ,abstain,Beberapa anggota abstain dari pemungutan suara atas proposal tersebut.
acclaim,The film received widespread critical acclaim.,찬사,그 영화는 폭넓은 비평적 찬사를 받았다.,称賛,その映画は幅広い批評家の称賛を受けた。,赞誉,这部电影获得了广泛的好评。,aclamación,La película recibió una amplia aclamación de la crítica.,hoan nghênh,Bộ phim nhận được sự hoan nghênh rộng rãi từ giới phê bình.,เสียงชื่นชม,ภาพยนตร์ได้รับเสียงชื่นชมจากนักวิจารณ์อย่างกว้างขวาง,pujian,Film tersebut mendapat pujian kritis yang luas.
adhere,All employees must adhere to the company policy.,준수하다,모든 직원은 회사 정책을 준수해야 한다.,遵守する,全従業員は会社の方針を遵守しなければならない。,遵守,所有员工必须遵守公司政策。,adherirse,Todos los empleados deben adherirse a la política de la empresa.,tuân thủ,Tất cả nhân viên phải tuân thủ chính sách công ty.,ปฏิบัติตาม,พนักงานทุกคนต้องปฏิบัติตามนโยบายบริษัท,mematuhi,Semua karyawan harus mematuhi kebijakan perusahaan.
adversary,The two countries were long-standing adversaries.,적,두 나라는 오랜 적이었다.,敵,両国は長年の敵対国だった。,对手,两国是长期的对手。,adversario,Los dos países eran adversarios de larga data.,đối thủ,Hai quốc gia là đối thủ lâu năm.,ศัตรู,ทั้งสองประเทศเป็นศัตรูกันมายาวนาน,musuh,Kedua negara adalah musuh lama.
aesthetic,The building was designed with both aesthetic and functional goals.,미적인,"건물은 미적, 기능적 목표를 모두 고려해 설계되었다.",美的な,その建物は美的かつ機能的な目標で設計された。,审美的,该建筑的设计兼顾了审美和功能目标。,estético,El edificio fue diseñado con objetivos estéticos y funcionales.,thẩm mỹ,Tòa nhà được thiết kế với mục tiêu thẩm mỹ và chức năng.,สุนทรียภาพ,อาคารได้รับการออกแบบโดยคำนึงถึงสุนทรียภาพและการใช้งาน,estetika,Bangunan dirancang dengan tujuan estetika dan fungsional.
afflict,The disease afflicts millions of people worldwide.,괴롭히다,이 질병은 전 세계 수백만 명을 괴롭히고 있다.,苦しめる,この病気は世界中の何百万人もの人々を苦しめている。,折磨,这种疾病折磨着全世界数百万人。,afligir,La enfermedad aflige a millones de personas en todo el mundo.,gây đau khổ,Căn bệnh gây đau khổ cho hàng triệu người trên toàn thế giới.,ทำให้ทุกข์,โรคนี้ทำให้ผู้คนหลายล้านคนทั่วโลกทุกข์ทรมาน,menimpa,Penyakit ini menimpa jutaan orang di seluruh dunia.
aggravate,Pollution can aggravate respiratory conditions.,악화시키다,오염은 호흡기 질환을 악화시킬 수 있다.,悪化させる,汚染は呼吸器疾患を悪化させる可能性がある。,加重,污染会加重呼吸系统疾病。,agravar,La contaminación puede agravar las condiciones respiratorias.,làm trầm trọng,Ô nhiễm có thể làm trầm trọng các bệnh hô hấp.,ทำให้แย่ลง,มลพิษสามารถทำให้สภาวะทางเดินหายใจแย่ลง,memperburuk,Polusi dapat memperburuk kondisi pernapasan.
agile,The company adopted an agile approach to software development.,민첩한,회사는 소프트웨어 개발에 민첩한 접근법을 채택했다.,機敏な,会社はソフトウェア開発にアジャイルアプローチを採用した。,敏捷的,公司采用了敏捷的软件开发方法。,ágil,La empresa adoptó un enfoque ágil para el desarrollo de software.,linh hoạt,Công ty áp dụng phương pháp linh hoạt trong phát triển phần mềm.,คล่องแคล่ว,บริษัทนำแนวทางแบบคล่องแคล่วมาใช้ในการพัฒนาซอฟต์แวร์,tangkas,Perusahaan mengadopsi pendekatan tangkas untuk pengembangan perangkat lunak.
ailment,Common ailments such as colds can be treated at home.,질병,감기 같은 흔한 질병은 집에서 치료할 수 있다.,病気,風邪のような一般的な病気は自宅で治療できる。,疾病,感冒等常见疾病可以在家治疗。,dolencia,Dolencias comunes como los resfriados pueden tratarse en casa.,bệnh,Các bệnh thông thường như cảm lạnh có thể điều trị tại nhà.,อาการเจ็บป่วย,อาการเจ็บป่วยทั่วไปเช่นหวัดสามารถรักษาได้ที่บ้าน,penyakit,Penyakit umum seperti flu dapat diobati di rumah.
allegiance,Citizens pledged allegiance to their country.,충성,시민들은 나라에 충성을 맹세했다.,忠誠,市民は国への忠誠を誓った。,忠诚,公民宣誓效忠国家。,lealtad,Los ciudadanos juraron lealtad a su país.,trung thành,Công dân cam kết trung thành với đất nước.,ความจงรักภักดี,ประชาชนให้คำมั่นสัญญาความจงรักภักดีต่อประเทศ,kesetiaan,Warga negara bersumpah setia kepada negara mereka.
allot,Each team was allotted a specific budget for the project.,할당하다,각 팀은 프로젝트를 위한 특정 예산을 할당받았다.,割り当てる,各チームはプロジェクトのために特定の予算が割り当てられた。,分配,每个团队被分配了特定的项目预算。,asignar,A cada equipo se le asignó un presupuesto específico para el proyecto.,phân bổ,Mỗi nhóm được phân bổ ngân sách cụ thể cho dự án.,จัดสรร,แต่ละทีมได้รับการจัดสรรงบประมาณเฉพาะสำหรับโครงการ,mengalokasikan,Setiap tim dialokasikan anggaran khusus untuk proyek tersebut.
altruistic,Her altruistic nature led her to volunteer regularly.,이타적인,그녀의 이타적인 성격은 정기적으로 봉사하게 만들었다.,利他的な,彼女の利他的な性格から定期的にボランティアをしていた。,利他的,她的利他本性使她定期做志愿者。,altruista,Su naturaleza altruista la llevó a hacer voluntariado regularmente.,vị tha,Bản tính vị tha khiến cô thường xuyên làm tình nguyện.,เห็นแก่ผู้อื่น,นิสัยเห็นแก่ผู้อื่นทำให้เธออาสาสมัครอย่างสม่ำเสมอ,altruistis,Sifat altruistisnya membuatnya rutin menjadi sukarelawan.
amalgamate,The two companies decided to amalgamate to increase market share.,합병하다,두 회사는 시장 점유율을 높이기 위해 합병하기로 했다.,合併する,両社は市場シェアを高めるために合併することを決定した。,合并,两家公司决定合并以增加市场份额。,fusionar,Las dos empresas decidieron fusionarse para aumentar su cuota de mercado.,hợp nhất,Hai công ty quyết định hợp nhất để tăng thị phần.,รวมกัน,สองบริษัทตัดสินใจรวมกันเพื่อเพิ่มส่วนแบ่งตลาด,menggabungkan,Kedua perusahaan memutuskan untuk menggabungkan diri guna meningkatkan pangsa pasar.
ample,There is ample evidence to support the theory.,충분한,이론을 뒷받침할 충분한 증거가 있다.,十分な,理論を裏付ける十分な証拠がある。,充足的,有充足的证据支持这一理论。,amplio,Hay amplia evidencia para apoyar la teoría.,dồi dào,Có bằng chứng dồi dào để hỗ trợ lý thuyết.,เพียงพอ,มีหลักฐานเพียงพอที่จะสนับสนุนทฤษฎี,cukup,Ada cukup bukti untuk mendukung teori tersebut.
anchor,The news anchor reported on the latest developments.,앵커,뉴스 앵커가 최신 동향을 보도했다.,アンカー,ニュースアンカーが最新の動向を報じた。,主播,新闻主播报道了最新动态。,ancla,El presentador de noticias informó sobre los últimos desarrollos.,người dẫn,Người dẫn tin đã đưa tin về diễn biến mới nhất.,ผู้ประกาศ,ผู้ประกาศข่าวรายงานความคืบหน้าล่าสุด,pembawa berita,Pembawa berita melaporkan perkembangan terbaru.
annex,The country attempted to annex the neighboring territory.,합병하다,그 나라는 이웃 영토를 합병하려 했다.,併合する,その国は隣接する領土を併合しようとした。,吞并,该国试图吞并邻国领土。,anexar,El país intentó anexar el territorio vecino.,sáp nhập,Quốc gia đã cố gắng sáp nhập lãnh thổ lân cận.,ผนวก,ประเทศพยายามผนวกดินแดนใกล้เคียง,mencaplok,Negara tersebut berusaha mencaplok wilayah tetangga.
anthropology,She studied anthropology at university to understand human cultures.,인류학,그녀는 인류 문화를 이해하기 위해 대학에서 인류학을 공부했다.,人類学,彼女は人類の文化を理解するために大学で人類学を学んだ。,人类学,她在大学学习人类学以了解人类文化。,antropología,Estudió antropología en la universidad para entender las culturas humanas.,nhân học,Cô ấy học nhân học ở đại học để hiểu các nền văn hóa.,มานุษยวิทยา,เธอเรียนมานุษยวิทยาที่มหาวิทยาลัยเพื่อทำความเข้าใจวัฒนธรรมมนุษย์,antropologi,Dia belajar antropologi di universitas untuk memahami budaya manusia.
appraisal,The annual performance appraisal determines salary increases.,평가,연간 성과 평가가 급여 인상을 결정한다.,評価,年間の業績評価が昇給を決定する。,评估,年度绩效评估决定加薪幅度。,evaluación,La evaluación anual de desempeño determina los aumentos salariales.,đánh giá,Đánh giá hiệu suất hàng năm quyết định mức tăng lương.,การประเมิน,การประเมินผลงานประจำปีกำหนดการขึ้นเงินเดือน,penilaian,Penilaian kinerja tahunan menentukan kenaikan gaji.
arable,Only a small percentage of land in the region is arable.,경작할 수 있는,이 지역의 토지 중 경작 가능한 것은 소수에 불과하다.,耕作可能な,この地域の土地のわずかな割合だけが耕作可能である。,可耕的,该地区只有少量土地是可耕的。,cultivable,Solo un pequeño porcentaje de la tierra en la región es cultivable.,canh tác được,Chỉ một tỷ lệ nhỏ đất đai trong khu vực có thể canh tác được.,เพาะปลูกได้,มีเพียงพื้นที่เล็กน้อยในภูมิภาคที่เพาะปลูกได้,dapat ditanami,Hanya sebagian kecil lahan di wilayah tersebut yang dapat ditanami.
archive,The library maintains an extensive digital archive.,기록 보관소,도서관은 광범위한 디지털 기록 보관소를 유지하고 있다.,アーカイブ,図書館は大規模なデジタルアーカイブを維持している。,档案,图书馆维护着一个庞大的数字档案。,archivo,La biblioteca mantiene un extenso archivo digital.,kho lưu trữ,Thư viện duy trì kho lưu trữ kỹ thuật số rộng lớn.,คลังเอกสาร,ห้องสมุดดูแลรักษาคลังเอกสารดิจิทัลที่กว้างขวาง,arsip,Perpustakaan memelihara arsip digital yang luas.
arid,Crops struggle to grow in arid climates.,건조한,농작물은 건조한 기후에서 자라기 어렵다.,乾燥した,乾燥した気候では作物の生育が困難である。,干旱的,农作物在干旱气候中难以生长。,árido,Los cultivos luchan por crecer en climas áridos.,khô cằn,Cây trồng khó phát triển trong khí hậu khô cằn.,แห้งแล้ง,พืชผลเติบโตได้ยากในสภาพอากาศแห้งแล้ง,gersang,Tanaman sulit tumbuh di iklim gersang.
articulate,She was able to articulate her ideas clearly.,명확히 표현하다,그녀는 자신의 생각을 명확히 표현할 수 있었다.,明確に述べる,彼女は自分の考えを明確に述べることができた。,清楚表达,她能够清楚地表达自己的想法。,articular,Ella pudo articular sus ideas con claridad.,diễn đạt,Cô ấy có thể diễn đạt ý tưởng rõ ràng.,แสดงออก,เธอสามารถแสดงออกความคิดของเธอได้อย่างชัดเจน,mengartikulasikan,Dia mampu mengartikulasikan ide-idenya dengan jelas.
asylum,The refugees sought asylum in a neighboring country.,망명,난민들은 이웃 나라에서 망명을 구했다.,亡命,難民は隣国に亡命を求めた。,庇护,难民在邻国寻求庇护。,asilo,Los refugiados buscaron asilo en un país vecino.,tị nạn,Người tị nạn tìm kiếm sự tị nạn ở nước láng giềng.,ลี้ภัย,ผู้ลี้ภัยขอลี้ภัยในประเทศเพื่อนบ้าน,suaka,Para pengungsi mencari suaka di negara tetangga.
atrocity,The report documented atrocities committed during the conflict.,만행,보고서는 분쟁 중 자행된 만행을 기록했다.,残虐行為,報告書は紛争中に行われた残虐行為を記録した。,暴行,报告记录了冲突期间犯下的暴行。,atrocidad,El informe documentó las atrocidades cometidas durante el conflicto.,hành vi tàn bạo,Báo cáo ghi nhận các hành vi tàn bạo trong xung đột.,ความโหดร้าย,รายงานบันทึกความโหดร้ายที่เกิดขึ้นระหว่างความขัดแย้ง,kekejaman,Laporan tersebut mendokumentasikan kekejaman yang dilakukan selama konflik.
autonomous,The vehicle can operate in fully autonomous mode.,자율적인,이 차량은 완전 자율 모드로 운행할 수 있다.,自律的な,この車両は完全自律モードで運転できる。,自主的,该车辆可以在完全自主模式下运行。,autónomo,El vehículo puede operar en modo completamente autónomo.,tự động,Xe có thể hoạt động ở chế độ tự động hoàn toàn.,อัตโนมัติ,ยานพาหนะสามารถทำงานในโหมดอัตโนมัติเต็มรูปแบบ,otonom,Kendaraan dapat beroperasi dalam mode sepenuhnya otonom.
avert,Quick action helped avert a major disaster.,방지하다,신속한 조치가 대재앙을 방지하는 데 도움이 되었다.,回避する,迅速な行動が大災害の回避に役立った。,避免,迅速的行动帮助避免了重大灾难。,evitar,La acción rápida ayudó a evitar un desastre mayor.,ngăn chặn,Hành động nhanh chóng đã giúp ngăn chặn thảm họa lớn.,ป้องกัน,การดำเนินการอย่างรวดเร็วช่วยป้องกันหายนะครั้งใหญ่,mencegah,Tindakan cepat membantu mencegah bencana besar.
backlash,The new policy faced a strong public backlash.,반발,새 정책은 강한 대중의 반발에 직면했다.,反発,新しい政策は強い世論の反発に直面した。,反弹,新政策遭到了强烈的公众反弹。,reacción,La nueva política enfrentó una fuerte reacción pública.,phản ứng dữ dội,Chính sách mới đối mặt với phản ứng dữ dội từ công chúng.,กระแสต่อต้าน,นโยบายใหม่เผชิญกระแสต่อต้านอย่างรุนแรงจากประชาชน,reaksi keras,Kebijakan baru menghadapi reaksi keras dari publik.
benevolent,The benevolent organization provided aid to disaster victims.,자비로운,자비로운 단체가 재난 피해자들에게 도움을 제공했다.,慈善的な,慈善団体が災害被害者に援助を提供した。,仁慈的,这个仁慈的组织为灾难受害者提供了援助。,benevolente,La organización benevolente brindó ayuda a las víctimas del desastre.,từ thiện,Tổ chức từ thiện đã cung cấp viện trợ cho nạn nhân thiên tai.,เมตตา,องค์กรที่เมตตาให้ความช่วยเหลือแก่ผู้ประสบภัย,dermawan,Organisasi dermawan memberikan bantuan kepada korban bencana.
betray,He felt betrayed by his closest friend.,배신하다,그는 가장 가까운 친구에게 배신당했다고 느꼈다.,裏切る,彼は最も親しい友人に裏切られたと感じた。,背叛,他觉得被最亲密的朋友背叛了。,traicionar,Se sintió traicionado por su amigo más cercano.,phản bội,Anh ấy cảm thấy bị phản bội bởi người bạn thân nhất.,ทรยศ,เขารู้สึกถูกทรยศโดยเพื่อนที่ใกล้ชิดที่สุด,mengkhianati,Dia merasa dikhianati oleh sahabat terdekatnya.
bizarre,The experiment produced bizarre and unexpected results.,기이한,실험은 기이하고 예상치 못한 결과를 낳았다.,奇妙な,実験は奇妙で予想外の結果を生んだ。,奇怪的,实验产生了奇怪且意想不到的结果。,bizarro,El experimento produjo resultados bizarros e inesperados.,kỳ lạ,Thí nghiệm tạo ra kết quả kỳ lạ và bất ngờ.,แปลกประหลาด,การทดลองให้ผลลัพธ์ที่แปลกประหลาดและไม่คาดคิด,aneh,Eksperimen tersebut menghasilkan hasil yang aneh dan tidak terduga.
bolster,The government introduced measures to bolster the economy.,강화하다,정부는 경제를 강화하기 위한 조치를 도입했다.,強化する,政府は経済を強化するための措置を導入した。,加强,政府出台了加强经济的措施。,reforzar,El gobierno introdujo medidas para reforzar la economía.,củng cố,Chính phủ đưa ra các biện pháp củng cố nền kinh tế.,เสริม,รัฐบาลออกมาตรการเพื่อเสริมเศรษฐกิจ,memperkuat,Pemerintah memperkenalkan langkah-langkah untuk memperkuat ekonomi.
boycott,Consumers decided to boycott the company over its labor practices.,불매하다,소비자들은 노동 관행에 대해 회사를 불매하기로 했다.,ボイコットする,消費者は労働慣行を理由にその企業をボイコットすることにした。,抵制,消费者决定因其劳动行为抵制该公司。,boicotear,Los consumidores decidieron boicotear la empresa por sus prácticas laborales.,tẩy chay,Người tiêu dùng quyết định tẩy chay công ty vì hành vi lao động.,คว่ำบาตร,ผู้บริโภคตัดสินใจคว่ำบาตรบริษัทเรื่องแนวปฏิบัติด้านแรงงาน,memboikot,Konsumen memutuskan untuk memboikot perusahaan atas praktik ketenagakerjaannya.
breach,The company was fined for a breach of data protection regulations.,위반,회사는 데이터 보호 규정 위반으로 벌금을 부과받았다.,違反,会社はデータ保護規制の違反で罰金を科された。,违反,公司因违反数据保护法规而被罚款。,incumplimiento,La empresa fue multada por un incumplimiento de las regulaciones de protección de datos.,vi phạm,Công ty bị phạt vì vi phạm quy định bảo vệ dữ liệu.,การละเมิด,บริษัทถูกปรับเนื่องจากการละเมิดกฎระเบียบการคุ้มครองข้อมูล,pelanggaran,Perusahaan didenda karena pelanggaran peraturan perlindungan data.
brink,The species is on the brink of extinction.,가장자리,그 종은 멸종 위기에 처해 있다.,瀬戸際,その種は絶滅の瀬戸際にある。,边缘,该物种濒临灭绝。,borde,La especie está al borde de la extinción.,bờ vực,Loài này đang trên bờ vực tuyệt chủng.,ขอบ,สายพันธุ์นี้อยู่บนขอบของการสูญพันธุ์,ambang,Spesies ini berada di ambang kepunahan.
candid,The politician gave a candid interview about her mistakes.,솔직한,그 정치인은 자신의 실수에 대해 솔직한 인터뷰를 했다.,率直な,その政治家は自身の過ちについて率直なインタビューに応じた。,坦率的,这位政治家就自己的错误接受了坦率的采访。,sincero,La política dio una entrevista sincera sobre sus errores.,thẳng thắn,Chính trị gia đã trả lời phỏng vấn thẳng thắn về sai lầm của mình.,ตรงไปตรงมา,นักการเมืองให้สัมภาษณ์ตรงไปตรงมาเกี่ยวกับข้อผิดพลาดของเธอ,terus terang,Politisi itu memberikan wawancara terus terang tentang kesalahannya.
captive,The captive animals were eventually released into the wild.,포획된,포획된 동물들은 결국 야생으로 방사되었다.,捕らわれた,捕らわれた動物たちはやがて野生に放された。,被俘的,被俘的动物最终被放归野外。,cautivo,Los animales cautivos fueron finalmente liberados en la naturaleza.,bị giam giữ,Các động vật bị giam giữ cuối cùng được thả về tự nhiên.,ถูกกักขัง,สัตว์ที่ถูกกักขังในที่สุดก็ถูกปล่อยคืนสู่ธรรมชาติ,tawanan,Hewan-hewan tawanan akhirnya dilepaskan ke alam liar.
circumvent,The company tried to circumvent the new regulations.,우회하다,회사는 새 규정을 우회하려 했다.,回避する,会社は新しい規制を回避しようとした。,规避,公司试图规避新规。,eludir,La empresa intentó eludir las nuevas regulaciones.,lách,Công ty cố gắng lách các quy định mới.,หลีกเลี่ยง,บริษัทพยายามหลีกเลี่ยงกฎระเบียบใหม่,mengelak,Perusahaan mencoba mengelak dari peraturan baru.
clamp,The authorities clamped down on illegal gambling.,단속하다,당국은 불법 도박을 단속했다.,取り締まる,当局は違法賭博を取り締まった。,打击,当局打击了非法赌博。,reprimir,Las autoridades reprimieron el juego ilegal.,trấn áp,Chính quyền trấn áp cờ bạc bất hợp pháp.,ปราบปราม,เจ้าหน้าที่ปราบปรามการพนันผิดกฎหมาย,menindak,Pihak berwenang menindak perjudian ilegal.
