english,example,ko_meaning,ko_example,ja_meaning,ja_example,zh_meaning,zh_example,es_meaning,es_example,vi_meaning,vi_example,th_meaning,th_example,id_meaning,id_example
validity,The validity of the test was confirmed through replication.,타당성,시험의 타당성은 반복을 통해 확인되었다.,妥当性,テストの妥当性は再現によって確認された。,有效性,测试的有效性通过重复得到了确认。,validez,La validez de la prueba fue confirmada a través de la replicación.,tính hợp lệ,Tính hợp lệ của bài kiểm tra được xác nhận thông qua lặp lại.,ความถูกต้อง,ความถูกต้องของการทดสอบได้รับการยืนยันผ่านการทำซ้ำ,validitas,Validitas tes dikonfirmasi melalui replikasi.
vast,The vast majority of students pass the exam.,มากมาย; 광대한,대다수의 학생이 시험에 합격한다.,膨大な,膨大な数の学生が試験に合格する。,大量的,绝大多数学生通过了考试。,vasto,La gran mayoría de estudiantes aprueba el examen.,phần lớn,Phần lớn sinh viên vượt qua kỳ thi.,ส่วนใหญ่,นักเรียนส่วนใหญ่สอบผ่าน,sebagian besar,Sebagian besar siswa lulus ujian.
verify,The data was verified by an independent auditor.,검증하다,데이터는 독립 감사인에 의해 검증되었다.,検証する,データは独立した監査人によって検証された。,验证,数据由独立审计师验证。,verificar,Los datos fueron verificados por un auditor independiente.,xác minh,Dữ liệu đã được xác minh bởi kiểm toán viên độc lập.,ตรวจสอบ,ข้อมูลได้รับการตรวจสอบโดยผู้ตรวจสอบอิสระ,memverifikasi,Data diverifikasi oleh auditor independen.
viable,The plan is economically viable.,실행 가능한,그 계획은 경제적으로 실행 가능하다.,実行可能な,その計画は経済的に実行可能だ。,可行的,该计划在经济上是可行的。,viable,El plan es económicamente viable.,khả thi,Kế hoạch khả thi về mặt kinh tế.,เป็นไปได้,แผนนี้เป็นไปได้ทางเศรษฐกิจ,layak,Rencana tersebut layak secara ekonomi.
vicinity,There are several research centers in the vicinity.,근처,근처에 여러 연구 센터가 있다.,近辺,近辺にはいくつかの研究センターがある。,附近,附近有几个研究中心。,vecindad,Hay varios centros de investigación en la vecindad.,lân cận,Có một số trung tâm nghiên cứu trong vùng lân cận.,บริเวณใกล้เคียง,มีศูนย์วิจัยหลายแห่งในบริเวณใกล้เคียง,sekitar,Ada beberapa pusat penelitian di sekitar.
vigorous,The economy experienced vigorous growth.,활발한,경제는 활발한 성장을 경험했다.,活発な,経済は活発な成長を経験した。,强劲的,经济经历了强劲增长。,vigoroso,La economía experimentó un crecimiento vigoroso.,mạnh mẽ,Nền kinh tế trải qua tăng trưởng mạnh mẽ.,เข้มแข็ง,เศรษฐกิจเติบโตอย่างเข้มแข็ง,giat,Ekonomi mengalami pertumbuhan yang giat.
volatile,The stock market has been volatile recently.,변동성이 큰,주식 시장이 최근 변동성이 크다.,不安定な,最近、株式市場は不安定だ。,波动的,股市最近波动很大。,volátil,El mercado de valores ha sido volátil recientemente.,biến động,Thị trường chứng khoán gần đây biến động mạnh.,ผันผวน,ตลาดหุ้นผันผวนเมื่อเร็วๆ นี้,bergejolak,Pasar saham bergejolak baru-baru ini.
vow,The government vowed to reduce carbon emissions.,맹세하다,정부는 탄소 배출을 줄이겠다고 맹세했다.,誓う,政府は炭素排出を削減すると誓った。,发誓,政府发誓要减少碳排放。,prometer,El gobierno prometió reducir las emisiones de carbono.,cam kết,Chính phủ cam kết giảm lượng khí thải carbon.,สาบาน,รัฐบาลสาบานว่าจะลดการปล่อยคาร์บอน,bersumpah,Pemerintah bersumpah mengurangi emisi karbon.
vulnerable,Elderly people are particularly vulnerable to the disease.,취약한,노인들은 그 질병에 특히 취약하다.,脆弱な,高齢者はその病気に特に脆弱だ。,脆弱的,老年人特别容易感染这种疾病。,vulnerable,Las personas mayores son particularmente vulnerables a la enfermedad.,dễ bị tổn thương,Người già đặc biệt dễ bị tổn thương bởi bệnh.,เปราะบาง,ผู้สูงอายุเปราะบางต่อโรคเป็นพิเศษ,rentan,Orang tua sangat rentan terhadap penyakit.
wage,Minimum wage legislation protects low-income workers.,임금,최저 임금 법률은 저소득 근로자를 보호한다.,賃金,最低賃金法は低所得労働者を保護する。,工资,最低工资立法保护低收入工人。,salario,La legislación de salario mínimo protege a los trabajadores de bajos ingresos.,lương,Luật lương tối thiểu bảo vệ người lao động thu nhập thấp.,ค่าจ้าง,กฎหมายค่าจ้างขั้นต่ำปกป้องแรงงานรายได้ต่ำ,upah,Legislasi upah minimum melindungi pekerja berpendapatan rendah.
warranty,The product comes with a two-year warranty.,보증,그 제품은 2년 보증이 함께 제공된다.,保証,その製品には2年間の保証が付いている。,保修,该产品附带两年保修。,garantía,El producto viene con una garantía de dos años.,bảo hành,Sản phẩm đi kèm bảo hành hai năm.,การรับประกัน,ผลิตภัณฑ์มาพร้อมการรับประกันสองปี,garansi,Produk dilengkapi garansi dua tahun.
wealth,The distribution of wealth is unequal across nations.,부,부의 분배는 국가 간에 불평등하다.,富,富の分配は国家間で不平等だ。,财富,财富分配在各国之间不平等。,riqueza,La distribución de la riqueza es desigual entre naciones.,sự giàu có,Sự phân bổ của cải không đều giữa các quốc gia.,ความมั่งคั่ง,การกระจายความมั่งคั่งไม่เท่าเทียมกันระหว่างประเทศ,kekayaan,Distribusi kekayaan tidak merata antar negara.
withdraw,The company withdrew its proposal after criticism.,철회하다,회사는 비판 후 제안을 철회했다.,撤回する,会社は批判を受けてその提案を撤回した。,撤回,公司在批评后撤回了提案。,retirar,La empresa retiró su propuesta tras las críticas.,rút,Công ty đã rút đề xuất sau khi bị chỉ trích.,ถอน,บริษัทถอนข้อเสนอหลังจากถูกวิพากษ์วิจารณ์,menarik,Perusahaan menarik proposalnya setelah dikritik.
yield,The experiment yielded significant results.,산출하다,실험은 유의미한 결과를 산출했다.,もたらす,実験は重要な結果をもたらした。,产生,实验产生了重要结果。,producir,El experimento produjo resultados significativos.,mang lại,Thí nghiệm đã mang lại kết quả đáng kể.,ให้ผล,การทดลองให้ผลลัพธ์ที่สำคัญ,menghasilkan,Eksperimen menghasilkan hasil yang signifikan.
zone,The coastal zone is protected by environmental law.,구역,해안 구역은 환경법에 의해 보호된다.,区域,沿岸区域は環境法により保護されている。,区域,沿海区域受环境法保护。,zona,La zona costera está protegida por la ley ambiental.,khu vực,Khu vực ven biển được bảo vệ bởi luật môi trường.,เขต,เขตชายฝั่งได้รับการคุ้มครองโดยกฎหมายสิ่งแวดล้อม,zona,Zona pesisir dilindungi oleh hukum lingkungan.
abolish,The government abolished the outdated regulation.,폐지하다,정부는 구식 규정을 폐지했다.,廃止する,政府は時代遅れの規制を廃止した。,废除,政府废除了过时的法规。,abolir,El gobierno abolió la regulación obsoleta.,bãi bỏ,Chính phủ đã bãi bỏ quy định lỗi thời.,ยกเลิก,รัฐบาลยกเลิกกฎระเบียบที่ล้าสมัย,menghapuskan,Pemerintah menghapuskan peraturan yang sudah usang.
absorb,Plants absorb carbon dioxide from the atmosphere.,흡수하다,식물은 대기에서 이산화탄소를 흡수한다.,吸収する,植物は大気から二酸化炭素を吸収する。,吸收,植物从大气中吸收二氧化碳。,absorber,Las plantas absorben dióxido de carbono de la atmósfera.,hấp thụ,Thực vật hấp thụ carbon dioxide từ khí quyển.,ดูดซับ,พืชดูดซับคาร์บอนไดออกไซด์จากบรรยากาศ,menyerap,Tanaman menyerap karbon dioksida dari atmosfer.
abundance,There is an abundance of research on this topic.,풍부,이 주제에 대한 연구가 풍부하다.,豊富さ,このトピックに関する研究は豊富にある。,大量,关于这个话题有大量的研究。,abundancia,Hay una abundancia de investigación sobre este tema.,sự phong phú,Có sự phong phú của nghiên cứu về chủ đề này.,ความอุดมสมบูรณ์,มีงานวิจัยจำนวนมากเกี่ยวกับหัวข้อนี้,kelimpahan,Ada kelimpahan penelitian tentang topik ini.
acquaint,New employees are acquainted with company policies.,익숙하게 하다,신입 사원들은 회사 정책에 익숙해진다.,慣れさせる,新入社員は会社の方針に慣れさせられる。,使熟悉,新员工了解公司政策。,familiarizar,Los nuevos empleados se familiarizan con las políticas de la empresa.,làm quen,Nhân viên mới được làm quen với chính sách công ty.,ทำให้คุ้นเคย,พนักงานใหม่ทำให้คุ้นเคยกับนโยบายของบริษัท,memperkenalkan,Karyawan baru diperkenalkan dengan kebijakan perusahaan.
acquisition,Language acquisition occurs naturally in childhood.,습득,언어 습득은 어린 시절에 자연스럽게 일어난다.,習得,言語習得は幼少期に自然に起こる。,习得,语言习得在童年时期自然发生。,adquisición,La adquisición del lenguaje ocurre naturalmente en la infancia.,sự tiếp thu,Sự tiếp thu ngôn ngữ xảy ra tự nhiên trong thời thơ ấu.,การได้มา,การได้มาซึ่งภาษาเกิดขึ้นตามธรรมชาติในวัยเด็ก,pemerolehan,Pemerolehan bahasa terjadi secara alami pada masa kanak-kanak.
adolescent,Adolescent mental health has become a major concern.,청소년의,청소년 정신 건강이 주요 관심사가 되었다.,青年期の,思春期のメンタルヘルスが大きな関心事となっている。,青少年的,青少年心理健康已成为一个重大问题。,adolescente,La salud mental adolescente se ha convertido en una gran preocupación.,vị thành niên,Sức khỏe tâm thần vị thành niên đã trở thành mối quan tâm lớn.,วัยรุ่น,สุขภาพจิตของวัยรุ่นกลายเป็นความกังวลสำคัญ,remaja,Kesehatan mental remaja telah menjadi perhatian utama.
advent,The advent of the internet changed communication forever.,도래,인터넷의 도래는 의사소통을 영원히 변화시켰다.,到来,インターネットの到来はコミュニケーションを永遠に変えた。,出现,互联网的出现永远改变了通信方式。,advenimiento,El advenimiento de Internet cambió la comunicación para siempre.,sự ra đời,Sự ra đời của internet đã thay đổi giao tiếp mãi mãi.,การมาถึง,การมาถึงของอินเทอร์เน็ตเปลี่ยนแปลงการสื่อสารตลอดกาล,kemunculan,Kemunculan internet mengubah komunikasi selamanya.
allege,The company is alleged to have violated safety standards.,주장하다,그 회사는 안전 기준을 위반했다고 주장된다.,申し立てる,その会社は安全基準に違反したと申し立てられている。,声称,据称该公司违反了安全标准。,alegar,Se alega que la empresa violó los estándares de seguridad.,cáo buộc,Công ty bị cáo buộc đã vi phạm tiêu chuẩn an toàn.,กล่าวหา,บริษัทถูกกล่าวหาว่าละเมิดมาตรฐานความปลอดภัย,diduga,Perusahaan diduga telah melanggar standar keselamatan.
alleviate,The program aims to alleviate poverty in rural areas.,완화하다,그 프로그램은 농촌 지역의 빈곤을 완화하는 것을 목표로 한다.,緩和する,そのプログラムは農村地域の貧困を緩和することを目指している。,减轻,该项目旨在减轻农村地区的贫困。,aliviar,El programa busca aliviar la pobreza en áreas rurales.,giảm bớt,Chương trình nhằm giảm bớt nghèo đói ở nông thôn.,บรรเทา,โครงการมุ่งบรรเทาความยากจนในพื้นที่ชนบท,meringankan,Program bertujuan meringankan kemiskinan di daerah pedesaan.
ambiguity,The ambiguity of the results makes interpretation difficult.,모호성,결과의 모호성이 해석을 어렵게 만든다.,あいまいさ,結果のあいまいさが解釈を困難にしている。,模糊性,结果的模糊性使解释变得困难。,ambigüedad,La ambigüedad de los resultados dificulta la interpretación.,sự mơ hồ,Sự mơ hồ của kết quả khiến việc diễn giải trở nên khó khăn.,ความคลุมเครือ,ความคลุมเครือของผลลัพธ์ทำให้การตีความยาก,ambiguitas,Ambiguitas hasil membuat interpretasi sulit.
analogue,Vinyl records are analogue devices.,아날로그,비닐 레코드는 아날로그 장치이다.,アナログ,レコードはアナログ機器だ。,模拟的,黑胶唱片是模拟设备。,análogo,Los discos de vinilo son dispositivos análogos.,tương tự,Đĩa than là thiết bị tương tự.,แอนะล็อก,แผ่นเสียงเป็นอุปกรณ์แอนะล็อก,analog,Piringan hitam adalah perangkat analog.
anonymous,The survey was conducted anonymously.,익명의,설문조사는 익명으로 실시되었다.,匿名の,アンケートは匿名で行われた。,匿名的,调查以匿名方式进行。,anónimo,La encuesta se realizó de forma anónima.,ẩn danh,Cuộc khảo sát được tiến hành ẩn danh.,นิรนาม,การสำรวจดำเนินการแบบนิรนาม,anonim,Survei dilakukan secara anonim.
apparatus,Scientific apparatus must be calibrated regularly.,장치,과학 장치는 정기적으로 보정되어야 한다.,装置,科学装置は定期的に校正されなければならない。,仪器,科学仪器必须定期校准。,aparato,El aparato científico debe calibrarse regularmente.,thiết bị,Thiết bị khoa học phải được hiệu chuẩn thường xuyên.,เครื่องมือ,เครื่องมือทางวิทยาศาสตร์ต้องปรับเทียบอย่างสม่ำเสมอ,peralatan,Peralatan ilmiah harus dikalibrasi secara teratur.
ascribe,The decline can be ascribed to several factors.,귀인시키다,그 감소는 여러 요인에 귀인시킬 수 있다.,帰する,その減少はいくつかの要因に帰することができる。,归因于,下降可归因于几个因素。,atribuir,El declive puede atribuirse a varios factores.,quy cho,Sự suy giảm có thể quy cho nhiều yếu tố.,สาเหตุมาจาก,การลดลงสาเหตุมาจากหลายปัจจัย,dikaitkan,Penurunan dapat dikaitkan dengan beberapa faktor.
assemble,The students assembled in the lecture hall.,집합하다,학생들이 강당에 집합했다.,集合する,学生たちは講堂に集合した。,集合,学生们在讲堂集合。,reunirse,Los estudiantes se reunieron en el salón de conferencias.,tập hợp,Sinh viên tập hợp tại giảng đường.,รวมตัว,นักศึกษารวมตัวกันที่ห้องบรรยาย,berkumpul,Mahasiswa berkumpul di ruang kuliah.
assert,The researcher asserted that the hypothesis was valid.,주장하다,연구원은 가설이 유효하다고 주장했다.,主張する,研究者はその仮説が有効だと主張した。,断言,研究人员断言假设是有效的。,afirmar,El investigador afirmó que la hipótesis era válida.,khẳng định,Nhà nghiên cứu khẳng định rằng giả thuyết hợp lệ.,ยืนยัน,นักวิจัยยืนยันว่าสมมติฐานถูกต้อง,menegaskan,Peneliti menegaskan bahwa hipotesis itu valid.
audit,The university conducted an internal audit.,감사,대학은 내부 감사를 실시했다.,監査,大学は内部監査を実施した。,审计,大学进行了内部审计。,auditoría,La universidad realizó una auditoría interna.,kiểm toán,Trường đại học đã tiến hành kiểm toán nội bộ.,ตรวจสอบบัญชี,มหาวิทยาลัยดำเนินการตรวจสอบบัญชีภายใน,audit,Universitas melakukan audit internal.
authentic,The research is based on authentic historical documents.,진정한,그 연구는 진정한 역사 문서에 기반한다.,本物の,その研究は本物の歴史的文書に基づいている。,真实的,研究基于真实的历史文献。,auténtico,La investigación se basa en documentos históricos auténticos.,xác thực,Nghiên cứu dựa trên tài liệu lịch sử xác thực.,แท้จริง,การวิจัยอิงเอกสารประวัติศาสตร์ที่แท้จริง,otentik,Penelitian didasarkan pada dokumen sejarah yang otentik.
authorize,The committee authorized the use of additional funds.,승인하다,위원회는 추가 자금 사용을 승인했다.,認可する,委員会は追加資金の使用を認可した。,授权,委员会授权使用额外资金。,autorizar,El comité autorizó el uso de fondos adicionales.,cho phép,Ủy ban đã cho phép sử dụng thêm kinh phí.,อนุมัติ,คณะกรรมการอนุมัติการใช้เงินทุนเพิ่มเติม,mengotorisasi,Komite mengotorisasi penggunaan dana tambahan.
benchmark,International test scores serve as a benchmark.,기준,국제 시험 점수는 기준으로 사용된다.,ベンチマーク,国際テストのスコアはベンチマークとして機能する。,基准,国际考试成绩作为基准。,punto de referencia,Las puntuaciones de exámenes internacionales sirven como punto de referencia.,tiêu chuẩn,Điểm thi quốc tế dùng làm tiêu chuẩn.,มาตรฐาน,คะแนนสอบระหว่างประเทศทำหน้าที่เป็นมาตรฐาน,tolok ukur,Skor tes internasional berfungsi sebagai tolok ukur.
bureaucracy,Excessive bureaucracy slows down the process.,관료주의,과도한 관료주의가 과정을 느리게 한다.,官僚主義,過度な官僚主義がプロセスを遅らせる。,官僚主义,过度的官僚主义拖慢了进程。,burocracia,La burocracia excesiva ralentiza el proceso.,bộ máy quan liêu,Bộ máy quan liêu quá mức làm chậm quá trình.,ระบบราชการ,ระบบราชการที่มากเกินไปทำให้กระบวนการล่าช้า,birokrasi,Birokrasi yang berlebihan memperlambat proses.
calibrate,Instruments must be calibrated before use.,보정하다,기기는 사용 전에 보정되어야 한다.,校正する,機器は使用前に校正されなければならない。,校准,仪器在使用前必须校准。,calibrar,Los instrumentos deben calibrarse antes de su uso.,hiệu chuẩn,Thiết bị phải được hiệu chuẩn trước khi sử dụng.,ปรับเทียบ,เครื่องมือต้องปรับเทียบก่อนใช้งาน,mengkalibrasi,Instrumen harus dikalibrasi sebelum digunakan.
catastrophe,The earthquake was a major catastrophe.,재난,그 지진은 대규모 재난이었다.,大惨事,その地震は大惨事だった。,灾难,地震是一场重大灾难。,catástrofe,El terremoto fue una catástrofe mayor.,thảm họa,Trận động đất là một thảm họa lớn.,ภัยพิบัติ,แผ่นดินไหวเป็นภัยพิบัติครั้งใหญ่,bencana,Gempa bumi adalah bencana besar.
chronic,Chronic diseases are a major public health concern.,만성의,만성 질환은 주요 공중 보건 관심사이다.,慢性の,慢性疾患は主要な公衆衛生上の懸念だ。,慢性的,慢性病是主要的公共卫生问题。,crónico,Las enfermedades crónicas son una gran preocupación de salud pública.,mãn tính,Bệnh mãn tính là mối quan tâm lớn về sức khỏe cộng đồng.,เรื้อรัง,โรคเรื้อรังเป็นปัญหาสาธารณสุขที่สำคัญ,kronis,Penyakit kronis merupakan perhatian kesehatan masyarakat utama.
circulate,The report was circulated among committee members.,유포하다,보고서는 위원회 위원들 사이에 유포되었다.,回覧する,報告書は委員会メンバーの間で回覧された。,传阅,报告在委员会成员中传阅。,circular,El informe se circuló entre los miembros del comité.,lưu hành,Báo cáo được lưu hành giữa các thành viên ủy ban.,เผยแพร่,รายงานถูกเผยแพร่ในหมู่สมาชิกคณะกรรมการ,diedarkan,Laporan diedarkan di antara anggota komite.
civic,Civic education promotes active citizenship.,시민의,시민 교육은 적극적인 시민 의식을 촉진한다.,市民の,市民教育は積極的な市民参加を促進する。,公民的,公民教育促进积极公民参与。,cívico,La educación cívica promueve la ciudadanía activa.,công dân,Giáo dục công dân thúc đẩy tinh thần công dân tích cực.,พลเมือง,การศึกษาพลเมืองส่งเสริมความเป็นพลเมืองที่กระตือรือร้น,kewarganegaraan,Pendidikan kewarganegaraan mempromosikan kewarganegaraan aktif.
cognitive,Cognitive development is crucial in early childhood.,인지적,인지 발달은 유아기에 중요하다.,認知の,認知発達は幼児期に重要だ。,认知的,认知发展在幼儿期至关重要。,cognitivo,El desarrollo cognitivo es crucial en la primera infancia.,nhận thức,Phát triển nhận thức rất quan trọng trong giai đoạn mầm non.,ทางปัญญา,การพัฒนาทางปัญญาสำคัญยิ่งในวัยเด็กตอนต้น,kognitif,Perkembangan kognitif sangat penting pada anak usia dini.
compulsory,Education is compulsory until the age of 16.,의무적인,교육은 16세까지 의무적이다.,義務的な,教育は16歳まで義務的だ。,义务的,教育到16岁为止是义务的。,obligatorio,La educación es obligatoria hasta los 16 años.,bắt buộc,Giáo dục bắt buộc đến 16 tuổi.,ภาคบังคับ,การศึกษาเป็นภาคบังคับจนถึงอายุ 16 ปี,wajib,Pendidikan wajib hingga usia 16 tahun.
conceive,Newton conceived the theory of gravity.,구상하다,뉴턴은 중력 이론을 구상했다.,考案する,ニュートンは重力の理論を考案した。,构想,牛顿构想了万有引力理论。,concebir,Newton concibió la teoría de la gravedad.,thai nghén; hình thành,Newton đã hình thành lý thuyết về trọng lực.,คิดค้น,นิวตันคิดค้นทฤษฎีแรงโน้มถ่วง,merumuskan,Newton merumuskan teori gravitasi.
concurrent,There were concurrent sessions at the conference.,동시의,학회에서 동시 세션이 있었다.,同時の,会議では同時セッションがあった。,并行的,会议上有并行的会议。,concurrente,Hubo sesiones concurrentes en la conferencia.,đồng thời,Có các phiên đồng thời tại hội nghị.,พร้อมกัน,มีเซสชันพร้อมกันในการประชุม,bersamaan,Ada sesi bersamaan di konferensi.
