english,example,ko_meaning,ko_example,ja_meaning,ja_example,zh_meaning,zh_example,es_meaning,es_example,vi_meaning,vi_example,th_meaning,th_example,id_meaning,id_example
analyze,The researcher analyzed the data carefully.,분석하다,연구원은 데이터를 신중하게 분석했다.,分析する,研究者はデータを慎重に分析した。,分析,研究人员仔细分析了数据。,analizar,El investigador analizó los datos cuidadosamente.,phân tích,Nhà nghiên cứu đã phân tích dữ liệu một cách cẩn thận.,วิเคราะห์,นักวิจัยวิเคราะห์ข้อมูลอย่างรอบคอบ,menganalisis,Peneliti menganalisis data dengan cermat.
approach,We need a new approach to solve this problem.,접근법,이 문제를 해결하기 위해 새로운 접근법이 필요하다.,アプローチ,この問題を解決するために新しいアプローチが必要だ。,方法,我们需要一种新方法来解决这个问题。,enfoque,Necesitamos un nuevo enfoque para resolver este problema.,cách tiếp cận,Chúng ta cần một cách tiếp cận mới để giải quyết vấn đề này.,แนวทาง,เราต้องการแนวทางใหม่ในการแก้ปัญหานี้,pendekatan,Kita membutuhkan pendekatan baru untuk menyelesaikan masalah ini.
area,This area of research is growing rapidly.,영역,이 연구 영역은 빠르게 성장하고 있다.,分野,この研究分野は急速に成長している。,领域,这个研究领域正在快速发展。,área,Esta área de investigación está creciendo rápidamente.,lĩnh vực,Lĩnh vực nghiên cứu này đang phát triển nhanh chóng.,พื้นที่,พื้นที่การวิจัยนี้กำลังเติบโตอย่างรวดเร็ว,bidang,Bidang penelitian ini berkembang pesat.
assess,Teachers assess students through various methods.,평가하다,교사들은 다양한 방법으로 학생들을 평가한다.,評価する,教師はさまざまな方法で学生を評価する。,评估,教师通过各种方法评估学生。,evaluar,Los profesores evalúan a los estudiantes mediante varios métodos.,đánh giá,Giáo viên đánh giá học sinh thông qua nhiều phương pháp khác nhau.,ประเมิน,ครูประเมินนักเรียนผ่านวิธีการต่างๆ,menilai,Guru menilai siswa melalui berbagai metode.
assume,We cannot assume that the theory is correct.,가정하다,우리는 그 이론이 맞다고 가정할 수 없다.,仮定する,その理論が正しいと仮定することはできない。,假设,我们不能假设该理论是正确的。,asumir,No podemos asumir que la teoría es correcta.,giả định,Chúng ta không thể giả định rằng lý thuyết đó là đúng.,สมมติ,เราไม่สามารถสมมติว่าทฤษฎีนั้นถูกต้อง,mengasumsikan,Kita tidak bisa mengasumsikan bahwa teori itu benar.
authority,The local authority approved the new policy.,당국,지역 당국이 새로운 정책을 승인했다.,当局,地方当局が新しい政策を承認した。,当局,地方当局批准了新政策。,autoridad,La autoridad local aprobó la nueva política.,cơ quan chức năng,Cơ quan chức năng địa phương đã phê duyệt chính sách mới.,หน่วยงาน,หน่วยงานท้องถิ่นอนุมัติยโยบายใหม่,otoritas,Otoritas lokal menyetujui kebijakan baru.
available,The report is now available online.,이용 가능한,그 보고서는 이제 온라인에서 이용 가능하다.,利用可能な,そのレポートは現在オンラインで利用可能だ。,可用的,该报告现在可以在线获取。,disponible,El informe ahora está disponible en línea.,có sẵn,Báo cáo hiện đã có sẵn trực tuyến.,มีอยู่,รายงานนี้สามารถใช้ได้ทางออนไลน์แล้ว,tersedia,Laporan tersebut sekarang tersedia secara online.
benefit,Students benefit from collaborative learning.,이익; 혜택을 받다,학생들은 협력 학습으로부터 혜택을 받는다.,利益; 恩恵を受ける,学生は協同学習から恩恵を受ける。,益处; 受益,学生从合作学习中受益。,beneficio; beneficiarse,Los estudiantes se benefician del aprendizaje colaborativo.,lợi ích; hưởng lợi,Học sinh hưởng lợi từ việc học hợp tác.,ประโยชน์; ได้ประโยชน์,นักเรียนได้ประโยชน์จากการเรียนรู้แบบร่วมมือ,manfaat; mendapat manfaat,Siswa mendapat manfaat dari pembelajaran kolaboratif.
concept,The concept of sustainability is widely discussed.,개념,지속가능성이라는 개념은 널리 논의된다.,概念,持続可能性の概念は広く議論されている。,概念,可持续发展的概念被广泛讨论。,concepto,El concepto de sostenibilidad es ampliamente discutido.,khái niệm,Khái niệm về phát triển bền vững được thảo luận rộng rãi.,แนวคิด,แนวคิดเรื่องความยั่งยืนได้รับการถกเถียงอย่างกว้างขวาง,konsep,Konsep keberlanjutan banyak didiskusikan.
consist,The committee consists of twelve members.,구성되다,위원회는 12명의 위원으로 구성되어 있다.,構成される,委員会は12名のメンバーで構成されている。,由…组成,委员会由十二名成员组成。,consistir,El comité consiste en doce miembros.,bao gồm,Ủy ban bao gồm mười hai thành viên.,ประกอบด้วย,คณะกรรมการประกอบด้วยสมาชิกสิบสองคน,terdiri dari,Komite terdiri dari dua belas anggota.
constitute,Women constitute 60% of the workforce.,구성하다,여성이 전체 노동력의 60%를 구성한다.,構成する,女性が労働力の60%を構成している。,构成,女性构成了劳动力的60%。,constituir,Las mujeres constituyen el 60% de la fuerza laboral.,chiếm,Phụ nữ chiếm 60% lực lượng lao động.,ประกอบเป็น,ผู้หญิงเป็นแรงงาน 60% ของทั้งหมด,merupakan,Perempuan merupakan 60% dari tenaga kerja.
context,You must understand the context of the passage.,맥락,지문의 맥락을 이해해야 한다.,文脈,文章の文脈を理解しなければならない。,背景,你必须理解这篇文章的背景。,contexto,Debes entender el contexto del pasaje.,bối cảnh,Bạn phải hiểu bối cảnh của đoạn văn.,บริบท,คุณต้องเข้าใจบริบทของข้อความ,konteks,Anda harus memahami konteks dari bacaan tersebut.
contract,The company signed a contract with the supplier.,계약,회사는 공급업체와 계약을 체결했다.,契約,会社はサプライヤーと契約を結んだ。,合同,公司与供应商签订了合同。,contrato,La empresa firmó un contrato con el proveedor.,hợp đồng,Công ty đã ký hợp đồng với nhà cung cấp.,สัญญา,บริษัทลงนามในสัญญากับผู้จัดหา,kontrak,Perusahaan menandatangani kontrak dengan pemasok.
create,The government aims to create more jobs.,창출하다,정부는 더 많은 일자리를 창출하는 것을 목표로 한다.,創出する,政府はより多くの雇用を創出することを目指している。,创造,政府旨在创造更多就业机会。,crear,El gobierno busca crear más empleos.,tạo ra,Chính phủ nhằm tạo ra nhiều việc làm hơn.,สร้าง,รัฐบาลมุ่งสร้างงานเพิ่มขึ้น,menciptakan,Pemerintah bertujuan menciptakan lebih banyak lapangan kerja.
data,The data suggests a significant trend.,데이터,데이터는 중요한 추세를 시사한다.,データ,データは重要な傾向を示唆している。,数据,数据表明了一个显著的趋势。,datos,Los datos sugieren una tendencia significativa.,dữ liệu,Dữ liệu cho thấy một xu hướng đáng kể.,ข้อมูล,ข้อมูลบ่งชี้ถึงแนวโน้มที่สำคัญ,data,Data menunjukkan tren yang signifikan.
define,It is important to define key terms clearly.,정의하다,핵심 용어를 명확하게 정의하는 것이 중요하다.,定義する,重要な用語を明確に定義することが重要だ。,定义,清楚地定义关键术语很重要。,definir,Es importante definir los términos clave claramente.,định nghĩa,Việc định nghĩa rõ ràng các thuật ngữ chính là rất quan trọng.,นิยาม,สิ่งสำคัญคือต้องนิยามคำศัพท์สำคัญให้ชัดเจน,mendefinisikan,Penting untuk mendefinisikan istilah kunci dengan jelas.
derive,The word derives from Latin origins.,유래하다,그 단어는 라틴어에서 유래한다.,由来する,その単語はラテン語に由来する。,源于,这个词源于拉丁语。,derivar,La palabra deriva de orígenes latinos.,bắt nguồn,Từ này bắt nguồn từ tiếng Latinh.,มาจาก,คำนี้มาจากภาษาละติน,berasal,Kata tersebut berasal dari bahasa Latin.
distribute,The organization distributes food to the needy.,분배하다,그 단체는 빈곤층에게 음식을 분배한다.,分配する,その組織は困っている人々に食料を分配する。,分发,该组织向贫困者分发食物。,distribuir,La organización distribuye alimentos a los necesitados.,phân phối,Tổ chức phân phối thực phẩm cho người nghèo.,แจกจ่าย,องค์กรแจกจ่ายอาหารให้ผู้ยากไร้,mendistribusikan,Organisasi mendistribusikan makanan kepada yang membutuhkan.
economy,The economy has shown signs of recovery.,경제,경제가 회복 조짐을 보이고 있다.,経済,経済は回復の兆しを見せている。,经济,经济已显示出复苏迹象。,economía,La economía ha mostrado signos de recuperación.,nền kinh tế,Nền kinh tế đã cho thấy dấu hiệu phục hồi.,เศรษฐกิจ,เศรษฐกิจแสดงสัญญาณของการฟื้นตัว,ekonomi,Ekonomi telah menunjukkan tanda-tanda pemulihan.
environment,Protecting the environment is everyone's responsibility.,환경,환경 보호는 모두의 책임이다.,環境,環境を守ることは皆の責任だ。,环境,保护环境是每个人的责任。,medio ambiente,Proteger el medio ambiente es responsabilidad de todos.,môi trường,Bảo vệ môi trường là trách nhiệm của mọi người.,สิ่งแวดล้อม,การปกป้องสิ่งแวดล้อมเป็นความรับผิดชอบของทุกคน,lingkungan,Melindungi lingkungan adalah tanggung jawab semua orang.
establish,The university was established in 1900.,설립하다,그 대학은 1900년에 설립되었다.,設立する,その大学は1900年に設立された。,建立,这所大学成立于1900年。,establecer,La universidad fue establecida en 1900.,thành lập,Trường đại học được thành lập vào năm 1900.,ก่อตั้ง,มหาวิทยาลัยก่อตั้งขึ้นในปี 1900,mendirikan,Universitas didirikan pada tahun 1900.
estimate,Scientists estimate the population will grow by 10%.,추정하다,과학자들은 인구가 10% 증가할 것으로 추정한다.,推定する,科学者は人口が10%増加すると推定している。,估计,科学家估计人口将增长10%。,estimar,Los científicos estiman que la población crecerá un 10%.,ước tính,Các nhà khoa học ước tính dân số sẽ tăng 10%.,ประมาณการ,นักวิทยาศาสตร์ประมาณการว่าประชากรจะเพิ่มขึ้น 10%,memperkirakan,Para ilmuwan memperkirakan populasi akan tumbuh 10%.
evident,It is evident that climate change affects agriculture.,명백한,기후 변화가 농업에 영향을 미치는 것은 명백하다.,明白な,気候変動が農業に影響を与えることは明白だ。,明显的,气候变化影响农业这一点是显而易见的。,evidente,Es evidente que el cambio climático afecta la agricultura.,rõ ràng,Rõ ràng là biến đổi khí hậu ảnh hưởng đến nông nghiệp.,ชัดเจน,เห็นได้ชัดว่าการเปลี่ยนแปลงสภาพภูมิอากาศส่งผลต่อเกษตรกรรม,jelas,Jelas bahwa perubahan iklim mempengaruhi pertanian.
export,The country exports oil to many nations.,수출하다,그 나라는 많은 국가에 석유를 수출한다.,輸出する,その国は多くの国に石油を輸出している。,出口,该国向许多国家出口石油。,exportar,El país exporta petróleo a muchas naciones.,xuất khẩu,Đất nước xuất khẩu dầu sang nhiều quốc gia.,ส่งออก,ประเทศส่งออกน้ำมันไปยังหลายประเทศ,mengekspor,Negara mengekspor minyak ke banyak negara.
factor,Several factors contributed to the decline.,요인,여러 요인이 그 감소에 기여했다.,要因,いくつかの要因がその減少に寄与した。,因素,几个因素导致了下降。,factor,Varios factores contribuyeron al declive.,yếu tố,Một số yếu tố đã góp phần vào sự suy giảm.,ปัจจัย,หลายปัจจัยมีส่วนทำให้เกิดการลดลง,faktor,Beberapa faktor berkontribusi terhadap penurunan.
finance,The project is financed by the government.,재정; 자금을 대다,그 프로젝트는 정부에 의해 자금이 지원된다.,財政; 資金を出す,そのプロジェクトは政府が資金を提供している。,金融; 资助,该项目由政府资助。,finanzas; financiar,El proyecto es financiado por el gobierno.,tài chính; tài trợ,Dự án được chính phủ tài trợ.,การเงิน; ให้เงินทุน,โครงการนี้ได้รับเงินทุนจากรัฐบาล,keuangan; membiayai,Proyek ini dibiayai oleh pemerintah.
formula,The mathematical formula is used in engineering.,공식,그 수학 공식은 공학에서 사용된다.,公式,その数学の公式は工学で使われている。,公式,该数学公式用于工程学。,fórmula,La fórmula matemática se usa en ingeniería.,công thức,Công thức toán học được sử dụng trong kỹ thuật.,สูตร,สูตรทางคณิตศาสตร์ใช้ในวิศวกรรม,rumus,Rumus matematika digunakan dalam teknik.
function,The function of the brain is complex.,기능,뇌의 기능은 복잡하다.,機能,脳の機能は複雑だ。,功能,大脑的功能是复杂的。,función,La función del cerebro es compleja.,chức năng,Chức năng của não bộ rất phức tạp.,หน้าที่,หน้าที่ของสมองนั้นซับซ้อน,fungsi,Fungsi otak itu kompleks.
identify,Researchers identified the main cause of the disease.,식별하다,연구원들은 그 질병의 주요 원인을 식별했다.,特定する,研究者たちはその病気の主な原因を特定した。,识别,研究人员确定了该疾病的主要原因。,identificar,Los investigadores identificaron la causa principal de la enfermedad.,xác định,Các nhà nghiên cứu đã xác định nguyên nhân chính của bệnh.,ระบุ,นักวิจัยระบุสาเหตุหลักของโรค,mengidentifikasi,Para peneliti mengidentifikasi penyebab utama penyakit.
income,Average income has increased over the decade.,소득,평균 소득이 지난 10년간 증가했다.,収入,平均収入はこの10年間で増加した。,收入,过去十年平均收入有所增加。,ingreso,El ingreso promedio ha aumentado durante la década.,thu nhập,Thu nhập trung bình đã tăng trong thập kỷ qua.,รายได้,รายได้เฉลี่ยเพิ่มขึ้นในช่วงทศวรรษ,pendapatan,Pendapatan rata-rata telah meningkat selama dekade ini.
indicate,The results indicate a positive outcome.,나타내다,결과는 긍정적인 성과를 나타낸다.,示す,結果は肯定的な結果を示している。,表明,结果表明了积极的成果。,indicar,Los resultados indican un resultado positivo.,cho thấy,Kết quả cho thấy một kết quả tích cực.,บ่งบอก,ผลลัพธ์บ่งบอกถึงผลลัพธ์ที่ดี,menunjukkan,Hasilnya menunjukkan hasil yang positif.
individual,Each individual has unique learning needs.,개인,각 개인은 고유한 학습 요구가 있다.,個人,各個人には固有の学習ニーズがある。,个人,每个人都有独特的学习需求。,individuo,Cada individuo tiene necesidades de aprendizaje únicas.,cá nhân,Mỗi cá nhân đều có nhu cầu học tập riêng.,บุคคล,แต่ละบุคคลมีความต้องการในการเรียนรู้ที่เป็นเอกลักษณ์,individu,Setiap individu memiliki kebutuhan belajar yang unik.
interpret,Students must interpret the data correctly.,해석하다,학생들은 데이터를 정확하게 해석해야 한다.,解釈する,学生はデータを正しく解釈しなければならない。,解释,学生必须正确解释数据。,interpretar,Los estudiantes deben interpretar los datos correctamente.,diễn giải,Học sinh phải diễn giải dữ liệu một cách chính xác.,ตีความ,นักเรียนต้องตีความข้อมูลอย่างถูกต้อง,menafsirkan,Siswa harus menafsirkan data dengan benar.
involve,The project involves extensive research.,포함하다,그 프로젝트는 광범위한 연구를 포함한다.,伴う,そのプロジェクトには広範な研究が伴う。,涉及,该项目涉及广泛的研究。,involucrar,El proyecto involucra investigación extensa.,bao gồm,Dự án bao gồm nghiên cứu rộng rãi.,เกี่ยวข้อง,โครงการนี้เกี่ยวข้องกับการวิจัยอย่างกว้างขวาง,melibatkan,Proyek ini melibatkan penelitian yang luas.
issue,Climate change is a global issue.,문제,기후 변화는 세계적인 문제이다.,問題,気候変動は世界的な問題だ。,问题,气候变化是一个全球性问题。,asunto,El cambio climático es un asunto global.,vấn đề,Biến đổi khí hậu là một vấn đề toàn cầu.,ประเด็น,การเปลี่ยนแปลงสภาพภูมิอากาศเป็นประเด็นระดับโลก,isu,Perubahan iklim adalah isu global.
labour,The country faces a labour shortage.,노동,그 나라는 노동력 부족에 직면해 있다.,労働,その国は労働力不足に直面している。,劳动,该国面临劳动力短缺。,mano de obra,El país enfrenta una escasez de mano de obra.,lao động,Đất nước đối mặt với tình trạng thiếu lao động.,แรงงาน,ประเทศเผชิญกับปัญหาการขาดแคลนแรงงาน,tenaga kerja,Negara menghadapi kekurangan tenaga kerja.
legal,Legal reforms are necessary for progress.,법적인,법적 개혁은 발전을 위해 필요하다.,法的な,法的改革は進歩に必要だ。,法律的,法律改革对进步是必要的。,legal,Las reformas legales son necesarias para el progreso.,pháp lý,Cải cách pháp lý là cần thiết cho sự tiến bộ.,ทางกฎหมาย,การปฏิรูปทางกฎหมายจำเป็นสำหรับความก้าวหน้า,hukum,Reformasi hukum diperlukan untuk kemajuan.
legislate,The parliament legislated new environmental laws.,입법하다,의회는 새로운 환경법을 입법했다.,立法する,議会は新しい環境法を立法した。,立法,议会立法通过了新的环境法。,legislar,El parlamento legisló nuevas leyes ambientales.,lập pháp,Quốc hội đã lập pháp các luật môi trường mới.,ออกกฎหมาย,รัฐสภาออกกฎหมายสิ่งแวดล้อมใหม่,membuat undang-undang,Parlemen membuat undang-undang lingkungan baru.
major,Education is a major factor in development.,주요한,교육은 발전의 주요한 요인이다.,主要な,教育は発展の主要な要因だ。,主要的,教育是发展的主要因素。,principal,La educación es un factor principal en el desarrollo.,chính,Giáo dục là yếu tố chính trong phát triển.,สำคัญ,การศึกษาเป็นปัจจัยสำคัญในการพัฒนา,utama,Pendidikan adalah faktor utama dalam pembangunan.
method,The scientific method requires careful observation.,방법,과학적 방법은 세심한 관찰을 요구한다.,方法,科学的方法は慎重な観察を必要とする。,方法,科学方法需要仔细观察。,método,El método científico requiere observación cuidadosa.,phương pháp,Phương pháp khoa học đòi hỏi quan sát cẩn thận.,วิธีการ,วิธีการทางวิทยาศาสตร์ต้องการการสังเกตอย่างรอบคอบ,metode,Metode ilmiah memerlukan pengamatan yang cermat.
occur,Earthquakes frequently occur in this region.,발생하다,지진이 이 지역에서 빈번하게 발생한다.,発生する,地震がこの地域で頻繁に発生する。,发生,地震在该地区频繁发生。,ocurrir,Los terremotos ocurren frecuentemente en esta región.,xảy ra,Động đất thường xảy ra ở khu vực này.,เกิดขึ้น,แผ่นดินไหวเกิดขึ้นบ่อยในภูมิภาคนี้,terjadi,Gempa bumi sering terjadi di wilayah ini.
percent,About 30 percent of students study abroad.,퍼센트,약 30퍼센트의 학생들이 해외에서 공부한다.,パーセント,約30パーセントの学生が海外で学ぶ。,百分之,大约百分之三十的学生出国留学。,por ciento,Alrededor del 30 por ciento de estudiantes estudian en el extranjero.,phần trăm,Khoảng 30 phần trăm sinh viên du học.,เปอร์เซ็นต์,ประมาณ 30 เปอร์เซ็นต์ของนักศึกษาเรียนต่อต่างประเทศ,persen,Sekitar 30 persen siswa belajar di luar negeri.
period,The study covers a ten-year period.,기간,그 연구는 10년의 기간을 다룬다.,期間,その研究は10年間を対象としている。,时期,该研究涵盖了十年的时期。,período,El estudio cubre un período de diez años.,giai đoạn,Nghiên cứu bao gồm giai đoạn mười năm.,ช่วงเวลา,การศึกษาครอบคลุมช่วงเวลาสิบปี,periode,Studi ini mencakup periode sepuluh tahun.
policy,Government policy affects the education system.,정책,정부 정책은 교육 체계에 영향을 미친다.,政策,政府の政策は教育制度に影響を与える。,政策,政府政策影响教育系统。,política,La política gubernamental afecta el sistema educativo.,chính sách,Chính sách của chính phủ ảnh hưởng đến hệ thống giáo dục.,นโยบาย,นโยบายของรัฐบาลส่งผลต่อระบบการศึกษา,kebijakan,Kebijakan pemerintah mempengaruhi sistem pendidikan.
principle,The principle of equality is fundamental.,원칙,평등의 원칙은 근본적이다.,原則,平等の原則は基本的だ。,原则,平等原则是根本性的。,principio,El principio de igualdad es fundamental.,nguyên tắc,Nguyên tắc bình đẳng là nền tảng.,หลักการ,หลักการความเท่าเทียมเป็นสิ่งพื้นฐาน,prinsip,Prinsip kesetaraan adalah fundamental.
proceed,We will proceed with the experiment tomorrow.,진행하다,우리는 내일 실험을 진행할 것이다.,進める,私たちは明日実験を進める。,进行,我们明天将继续进行实验。,proceder,Procederemos con el experimento mañana.,tiến hành,Chúng tôi sẽ tiến hành thí nghiệm vào ngày mai.,ดำเนินการ,เราจะดำเนินการทดลองในวันพรุ่งนี้,melanjutkan,Kami akan melanjutkan eksperimen besok.
process,The manufacturing process is highly automated.,과정,제조 과정은 고도로 자동화되어 있다.,過程,製造過程は高度に自動化されている。,过程,制造过程高度自动化。,proceso,El proceso de fabricación está altamente automatizado.,quy trình,Quy trình sản xuất được tự động hóa cao.,กระบวนการ,กระบวนการผลิตเป็นระบบอัตโนมัติสูง,proses,Proses manufaktur sangat terotomatisasi.
