english,example,ko_meaning,ko_example,ja_meaning,ja_example,zh_meaning,zh_example,es_meaning,es_example,vi_meaning,vi_example,th_meaning,th_example,id_meaning,id_example
substitute,Online classes can substitute for in-person lectures.,대체하다,온라인 수업이 대면 강의를 대체할 수 있다.,代替する,オンライン授業は対面講義の代替となりうる。,替代,在线课程可以替代面对面的讲座。,sustituir,Las clases en línea pueden sustituir las conferencias presenciales.,thay thế,Lớp học trực tuyến có thể thay thế bài giảng trực tiếp.,ทดแทน,ชั้นเรียนออนไลน์สามารถทดแทนการบรรยายแบบตัวต่อตัว,menggantikan,Kelas online dapat menggantikan kuliah tatap muka.
successor,The new director is the successor to the founder.,후임자,새 이사는 설립자의 후임자이다.,後継者,新しいディレクターは創設者の後継者だ。,继任者,新董事是创始人的继任者。,sucesor,El nuevo director es el sucesor del fundador.,người kế nhiệm,Giám đốc mới là người kế nhiệm của người sáng lập.,ผู้สืบทอด,ผู้อำนวยการคนใหม่เป็นผู้สืบทอดตำแหน่งจากผู้ก่อตั้ง,penerus,Direktur baru adalah penerus pendiri.
sufficient,There was sufficient evidence to support the theory.,충분한,그 이론을 뒷받침할 충분한 증거가 있었다.,十分な,その理論を裏付ける十分な証拠があった。,充足的,有充足的证据支持该理论。,suficiente,Había suficiente evidencia para apoyar la teoría.,đủ,Có đủ bằng chứng để hỗ trợ lý thuyết.,เพียงพอ,มีหลักฐานเพียงพอที่จะสนับสนุนทฤษฎี,cukup,Ada cukup bukti untuk mendukung teori tersebut.
sum,The sum of the research grants totaled one million.,합계,연구 보조금의 합계는 총 100만이었다.,合計,研究助成金の合計は100万に達した。,总和,研究拨款总额达到一百万。,suma,La suma de las becas de investigación totalizó un millón.,tổng,Tổng các khoản tài trợ nghiên cứu lên tới một triệu.,ผลรวม,ผลรวมของทุนวิจัยรวมเป็นหนึ่งล้าน,jumlah,Jumlah hibah penelitian mencapai satu juta.
summary,The summary provides an overview of the main points.,요약,요약은 주요 요점에 대한 개요를 제공한다.,要約,要約は主要なポイントの概要を提供する。,摘要,摘要提供了要点的概述。,resumen,El resumen proporciona una visión general de los puntos principales.,tóm tắt,Bản tóm tắt cung cấp tổng quan về các điểm chính.,สรุป,บทสรุปให้ภาพรวมของประเด็นหลัก,ringkasan,Ringkasan memberikan gambaran umum tentang poin-poin utama.
supplement,Vitamins supplement a balanced diet.,보충하다,비타민은 균형 잡힌 식단을 보충한다.,補う,ビタミンはバランスの取れた食事を補う。,补充,维生素补充均衡饮食。,complementar,Las vitaminas complementan una dieta equilibrada.,bổ sung,Vitamin bổ sung cho chế độ ăn cân bằng.,เสริม,วิตามินเสริมอาหารที่สมดุล,melengkapi,Vitamin melengkapi diet seimbang.
survey,The survey collected data from 1000 respondents.,조사,그 조사는 1000명의 응답자로부터 데이터를 수집했다.,調査,その調査は1000人の回答者からデータを収集した。,调查,调查收集了1000名受访者的数据。,encuesta,La encuesta recopiló datos de 1000 encuestados.,khảo sát,Cuộc khảo sát thu thập dữ liệu từ 1000 người trả lời.,สำรวจ,การสำรวจรวบรวมข้อมูลจากผู้ตอบ 1000 คน,survei,Survei mengumpulkan data dari 1000 responden.
survive,Many small businesses did not survive the recession.,생존하다,많은 소기업이 불황에서 생존하지 못했다.,生き残る,多くの中小企業が不況を生き残れなかった。,存活,许多小企业没有在经济衰退中存活下来。,sobrevivir,Muchas pequeñas empresas no sobrevivieron la recesión.,sống sót,Nhiều doanh nghiệp nhỏ không sống sót qua suy thoái.,อยู่รอด,ธุรกิจขนาดเล็กหลายแห่งไม่อยู่รอดจากภาวะเศรษฐกิจถดถอย,bertahan,Banyak usaha kecil tidak bertahan dari resesi.
suspend,The university suspended the exchange program.,중단하다,대학은 교환 프로그램을 중단했다.,停止する,大学は交換プログラムを停止した。,暂停,大学暂停了交流项目。,suspender,La universidad suspendió el programa de intercambio.,đình chỉ,Trường đại học đã đình chỉ chương trình trao đổi.,ระงับ,มหาวิทยาลัยระงับโครงการแลกเปลี่ยน,menangguhkan,Universitas menangguhkan program pertukaran.
sustain,Sustainable development sustains economic growth.,지속시키다,지속 가능한 개발은 경제 성장을 지속시킨다.,持続させる,持続可能な開発は経済成長を持続させる。,维持,可持续发展维持经济增长。,sostener,El desarrollo sostenible sostiene el crecimiento económico.,duy trì,Phát triển bền vững duy trì tăng trưởng kinh tế.,รักษา,การพัฒนาที่ยั่งยืนรักษาการเติบโตทางเศรษฐกิจ,mempertahankan,Pembangunan berkelanjutan mempertahankan pertumbuhan ekonomi.
symbol,The dove is a symbol of peace.,상징,비둘기는 평화의 상징이다.,象徴,鳩は平和の象徴だ。,象征,鸽子是和平的象征。,símbolo,La paloma es un símbolo de paz.,biểu tượng,Chim bồ câu là biểu tượng của hòa bình.,สัญลักษณ์,นกพิราบเป็นสัญลักษณ์ของสันติภาพ,simbol,Merpati adalah simbol perdamaian.
tape,The interview was recorded on tape.,테이프; 녹음하다,인터뷰는 테이프에 녹음되었다.,テープ,インタビューはテープに録音された。,磁带,采访被录在磁带上。,cinta,La entrevista fue grabada en cinta.,băng,Cuộc phỏng vấn được ghi trên băng.,เทป,การสัมภาษณ์ถูกบันทึกลงเทป,rekaman,Wawancara direkam pada pita.
target,The government set a target to reduce emissions by 30%.,목표,정부는 배출량을 30% 줄이는 목표를 설정했다.,目標,政府は排出量を30%削減する目標を設定した。,目标,政府设定了减排30%的目标。,meta,El gobierno estableció una meta de reducir emisiones en un 30%.,mục tiêu,Chính phủ đặt mục tiêu giảm 30% lượng khí thải.,เป้าหมาย,รัฐบาลตั้งเป้าหมายลดการปล่อยมลพิษ 30%,target,Pemerintah menetapkan target mengurangi emisi sebesar 30%.
task,The main task was to analyze the survey data.,과제,주요 과제는 설문 데이터를 분석하는 것이었다.,課題,主な課題は調査データを分析することだった。,任务,主要任务是分析调查数据。,tarea,La tarea principal fue analizar los datos de la encuesta.,nhiệm vụ,Nhiệm vụ chính là phân tích dữ liệu khảo sát.,งาน,งานหลักคือวิเคราะห์ข้อมูลการสำรวจ,tugas,Tugas utama adalah menganalisis data survei.
team,The research team includes members from five countries.,팀,연구 팀은 5개국 출신의 구성원을 포함한다.,チーム,研究チームは5カ国からのメンバーを含む。,团队,研究团队包括来自五个国家的成员。,equipo,El equipo de investigación incluye miembros de cinco países.,nhóm,Nhóm nghiên cứu bao gồm thành viên từ năm quốc gia.,ทีม,ทีมวิจัยรวมสมาชิกจากห้าประเทศ,tim,Tim penelitian mencakup anggota dari lima negara.
technical,Technical skills are essential in the modern workplace.,기술적인,기술적 기술은 현대 직장에서 필수적이다.,技術的な,技術的なスキルは現代の職場で不可欠だ。,技术的,技术技能在现代工作场所至关重要。,técnico,Las habilidades técnicas son esenciales en el lugar de trabajo moderno.,kỹ thuật,Kỹ năng kỹ thuật rất cần thiết trong nơi làm việc hiện đại.,เทคนิค,ทักษะด้านเทคนิคเป็นสิ่งจำเป็นในที่ทำงานสมัยใหม่,teknis,Keterampilan teknis sangat penting di tempat kerja modern.
technique,New teaching techniques improve student engagement.,기법,새로운 교수 기법이 학생 참여를 향상시킨다.,技法,新しい教授法は学生の関与を向上させる。,技术,新的教学技术提高了学生的参与度。,técnica,Las nuevas técnicas de enseñanza mejoran la participación estudiantil.,kỹ thuật,Kỹ thuật giảng dạy mới cải thiện sự tham gia của sinh viên.,เทคนิค,เทคนิคการสอนใหม่ช่วยเพิ่มการมีส่วนร่วมของนักเรียน,teknik,Teknik pengajaran baru meningkatkan keterlibatan siswa.
technology,Technology has transformed modern education.,기술,기술이 현대 교육을 변화시켰다.,テクノロジー,テクノロジーが現代の教育を変革した。,技术,技术改变了现代教育。,tecnología,La tecnología ha transformado la educación moderna.,công nghệ,Công nghệ đã biến đổi giáo dục hiện đại.,เทคโนโลยี,เทคโนโลยีเปลี่ยนแปลงการศึกษาสมัยใหม่,teknologi,Teknologi telah mentransformasi pendidikan modern.
temporary,The position is temporary and lasts six months.,임시의,그 직위는 임시이며 6개월간 지속된다.,一時的な,そのポジションは一時的で6ヶ月間だ。,临时的,该职位是临时的，为期六个月。,temporal,El puesto es temporal y dura seis meses.,tạm thời,Vị trí này là tạm thời và kéo dài sáu tháng.,ชั่วคราว,ตำแหน่งนี้เป็นการชั่วคราวและอยู่หกเดือน,sementara,Posisi ini bersifat sementara dan berlangsung enam bulan.
tense,The political situation remained tense.,긴장된,정치 상황은 긴장 상태를 유지했다.,緊張した,政治情勢は緊張したままだった。,紧张的,政治局势依然紧张。,tenso,La situación política permaneció tensa.,căng thẳng,Tình hình chính trị vẫn căng thẳng.,ตึงเครียด,สถานการณ์ทางการเมืองยังคงตึงเครียด,tegang,Situasi politik tetap tegang.
terminate,The contract was terminated by mutual agreement.,종료하다,계약은 상호 합의에 의해 종료되었다.,終了する,契約は合意により終了した。,终止,合同经双方同意终止。,terminar,El contrato fue terminado por acuerdo mutuo.,chấm dứt,Hợp đồng đã được chấm dứt theo thỏa thuận chung.,ยุติ,สัญญาถูกยุติโดยข้อตกลงร่วมกัน,mengakhiri,Kontrak diakhiri dengan kesepakatan bersama.
text,The text analyzes the causes of urbanization.,텍스트; 본문,그 텍스트는 도시화의 원인을 분석한다.,テキスト,そのテキストは都市化の原因を分析している。,文本,该文本分析了城市化的原因。,texto,El texto analiza las causas de la urbanización.,văn bản,Văn bản phân tích nguyên nhân của đô thị hóa.,ข้อความ,ข้อความวิเคราะห์สาเหตุของการขยายตัวเป็นเมือง,teks,Teks menganalisis penyebab urbanisasi.
theme,The main theme of the essay is social inequality.,주제,에세이의 주요 주제는 사회적 불평등이다.,テーマ,エッセイの主なテーマは社会的不平等だ。,主题,论文的主题是社会不平等。,tema,El tema principal del ensayo es la desigualdad social.,chủ đề,Chủ đề chính của bài luận là bất bình đẳng xã hội.,ธีม,ธีมหลักของเรียงความคือความไม่เท่าเทียมทางสังคม,tema,Tema utama esai adalah ketidaksetaraan sosial.
thereby,"She earned a degree, thereby improving her job prospects.",따라서; 그로 인해,그녀는 학위를 취득했고 그로 인해 취업 전망이 개선되었다.,それによって,彼女は学位を取得し、それによって就職の見通しが改善された。,从而,她获得了学位，从而改善了就业前景。,de ese modo,"Ella obtuvo un título, mejorando de ese modo sus perspectivas laborales.",do đó,"Cô ấy lấy được bằng, do đó cải thiện triển vọng việc làm.",ดังนั้น,เธอได้รับปริญญา ดังนั้นจึงปรับปรุงโอกาสในการทำงาน,sehingga,"Dia memperoleh gelar, sehingga meningkatkan prospek pekerjaannya."
thesis,Her doctoral thesis explored language acquisition.,논문,그녀의 박사 논문은 언어 습득을 탐구했다.,論文,彼女の博士論文は言語習得を探求した。,论文,她的博士论文探讨了语言习得。,tesis,Su tesis doctoral exploró la adquisición del lenguaje.,luận văn,Luận văn tiến sĩ của cô ấy nghiên cứu về tiếp thu ngôn ngữ.,วิทยานิพนธ์,วิทยานิพนธ์ปริญญาเอกของเธอสำรวจการเรียนรู้ภาษา,tesis,Tesis doktoralnya mengeksplorasi pemerolehan bahasa.
topic,The topic of the lecture was artificial intelligence.,주제,강의의 주제는 인공 지능이었다.,トピック,講義のトピックは人工知能だった。,话题,讲座的主题是人工智能。,tema,El tema de la conferencia fue la inteligencia artificial.,chủ đề,Chủ đề của bài giảng là trí tuệ nhân tạo.,หัวข้อ,หัวข้อของการบรรยายคือปัญญาประดิษฐ์,topik,Topik kuliah adalah kecerdasan buatan.
trace,Scientists traced the origins of the virus.,추적하다,과학자들은 바이러스의 기원을 추적했다.,追跡する,科学者たちはウイルスの起源を追跡した。,追踪,科学家追踪了病毒的起源。,rastrear,Los científicos rastrearon los orígenes del virus.,truy tìm,Các nhà khoa học đã truy tìm nguồn gốc của virus.,ติดตาม,นักวิทยาศาสตร์ติดตามต้นกำเนิดของไวรัส,melacak,Para ilmuwan melacak asal usul virus.
tradition,The tradition of academic research dates back centuries.,전통,학술 연구의 전통은 수 세기 전으로 거슬러 올라간다.,伝統,学術研究の伝統は数世紀前にさかのぼる。,传统,学术研究的传统可以追溯到几个世纪前。,tradición,La tradición de la investigación académica se remonta a siglos.,truyền thống,Truyền thống nghiên cứu học thuật có từ nhiều thế kỷ trước.,ประเพณี,ประเพณีของการวิจัยทางวิชาการย้อนกลับไปหลายศตวรรษ,tradisi,Tradisi penelitian akademis sudah ada selama berabad-abad.
transfer,Students can transfer credits between universities.,이전하다,학생들은 대학 간에 학점을 이전할 수 있다.,移転する,学生は大学間で単位を移転できる。,转移,学生可以在大学之间转学分。,transferir,Los estudiantes pueden transferir créditos entre universidades.,chuyển,Sinh viên có thể chuyển tín chỉ giữa các trường đại học.,โอน,นักศึกษาสามารถโอนหน่วยกิตระหว่างมหาวิทยาลัย,mentransfer,Mahasiswa dapat mentransfer kredit antar universitas.
transform,Technology has transformed the way we communicate.,변환시키다,기술은 우리가 소통하는 방식을 변환시켰다.,変革する,テクノロジーは私たちのコミュニケーション方法を変革した。,改变,技术改变了我们的沟通方式。,transformar,La tecnología ha transformado la forma en que nos comunicamos.,biến đổi,Công nghệ đã biến đổi cách chúng ta giao tiếp.,เปลี่ยนแปลง,เทคโนโลยีเปลี่ยนแปลงวิธีที่เราสื่อสาร,mengubah,Teknologi telah mengubah cara kita berkomunikasi.
transmit,The disease is transmitted through contaminated water.,전파하다,그 병은 오염된 물을 통해 전파된다.,伝播する,その病気は汚染された水を通じて伝播する。,传播,该疾病通过受污染的水传播。,transmitir,La enfermedad se transmite a través de agua contaminada.,lây truyền,Bệnh lây truyền qua nước bị ô nhiễm.,แพร่,โรคแพร่ผ่านน้ำที่ปนเปื้อน,menularkan,Penyakit ini ditularkan melalui air yang terkontaminasi.
transport,Public transport reduces carbon emissions.,교통; 수송하다,대중교통은 탄소 배출을 줄인다.,輸送,公共交通は炭素排出を削減する。,交通,公共交通减少碳排放。,transporte,El transporte público reduce las emisiones de carbono.,giao thông,Giao thông công cộng giảm lượng khí thải carbon.,ขนส่ง,การขนส่งสาธารณะลดการปล่อยคาร์บอน,transportasi,Transportasi umum mengurangi emisi karbon.
trend,There is a growing trend toward remote work.,추세,재택 근무에 대한 추세가 증가하고 있다.,傾向,リモートワークへの傾向が高まっている。,趋势,远程办公趋势日益增长。,tendencia,Hay una tendencia creciente hacia el trabajo remoto.,xu hướng,Có xu hướng ngày càng tăng về làm việc từ xa.,แนวโน้ม,มีแนวโน้มที่เพิ่มขึ้นในการทำงานทางไกล,tren,Ada tren yang berkembang menuju kerja jarak jauh.
trigger,The economic crisis triggered widespread unemployment.,유발하다,경제 위기가 광범위한 실업을 유발했다.,引き起こす,経済危機が広範な失業を引き起こした。,触发,经济危机引发了大范围的失业。,desencadenar,La crisis económica desencadenó un desempleo generalizado.,gây ra,Cuộc khủng hoảng kinh tế đã gây ra tình trạng thất nghiệp lan rộng.,กระตุ้น,วิกฤตเศรษฐกิจกระตุ้นให้เกิดการว่างงานอย่างกว้างขวาง,memicu,Krisis ekonomi memicu pengangguran yang meluas.
ultimate,The ultimate goal is to achieve universal education.,궁극적인,궁극적인 목표는 보편적 교육을 달성하는 것이다.,究極の,究極の目標は普遍的教育を達成することだ。,最终的,最终目标是实现全民教育。,último,El objetivo último es lograr la educación universal.,cuối cùng,Mục tiêu cuối cùng là đạt được giáo dục phổ cập.,สูงสุด,เป้าหมายสูงสุดคือการบรรลุการศึกษาที่ทั่วถึง,utama,Tujuan utama adalah mencapai pendidikan universal.
undergo,The curriculum underwent major revisions.,겪다,교육 과정이 대대적인 수정을 겪었다.,経る,カリキュラムは大幅な改訂を経た。,经历,课程经历了重大修订。,someterse,El currículo se sometió a revisiones importantes.,trải qua,Chương trình đã trải qua những sửa đổi lớn.,ผ่าน,หลักสูตรผ่านการปรับปรุงครั้งใหญ่,menjalani,Kurikulum menjalani revisi besar.
underlie,Several factors underlie the economic recession.,근본적 원인이 되다,여러 요인이 경제 불황의 근본적 원인이 된다.,根底にある,いくつかの要因が経済不況の根底にある。,构成…的基础,几个因素是经济衰退的根本原因。,subyacer,Varios factores subyacen a la recesión económica.,làm nền tảng,Một số yếu tố làm nền tảng cho suy thoái kinh tế.,เป็นรากฐาน,หลายปัจจัยเป็นรากฐานของภาวะเศรษฐกิจถดถอย,mendasari,Beberapa faktor mendasari resesi ekonomi.
undertake,The university undertook a comprehensive review.,착수하다,대학은 포괄적인 검토에 착수했다.,着手する,大学は包括的なレビューに着手した。,承担,大学进行了全面审查。,emprender,La universidad emprendió una revisión integral.,tiến hành,Trường đại học đã tiến hành đánh giá toàn diện.,ดำเนินการ,มหาวิทยาลัยดำเนินการทบทวนอย่างครอบคลุม,melakukan,Universitas melakukan tinjauan komprehensif.
uniform,The results were uniform across all groups.,균일한,결과는 모든 그룹에서 균일했다.,均一な,結果は全てのグループで均一だった。,统一的,结果在所有组中都是统一的。,uniforme,Los resultados fueron uniformes en todos los grupos.,đồng đều,Kết quả đồng đều trên tất cả các nhóm.,สม่ำเสมอ,ผลลัพธ์สม่ำเสมอในทุกกลุ่ม,seragam,Hasilnya seragam di semua kelompok.
unify,The policy aims to unify educational standards.,통합하다,그 정책은 교육 표준을 통합하는 것을 목표로 한다.,統一する,その政策は教育基準を統一することを目指している。,统一,该政策旨在统一教育标准。,unificar,La política busca unificar los estándares educativos.,thống nhất,Chính sách nhằm thống nhất các tiêu chuẩn giáo dục.,รวม,นโยบายมุ่งรวมมาตรฐานการศึกษา,menyatukan,Kebijakan bertujuan menyatukan standar pendidikan.
unique,Each culture has its own unique characteristics.,독특한,각 문화에는 고유한 독특한 특성이 있다.,ユニークな,各文化にはそれぞれユニークな特徴がある。,独特的,每种文化都有其独特的特征。,único,Cada cultura tiene sus propias características únicas.,độc đáo,Mỗi nền văn hóa có những đặc điểm độc đáo riêng.,เฉพาะ,แต่ละวัฒนธรรมมีลักษณะเฉพาะของตัวเอง,unik,Setiap budaya memiliki karakteristik uniknya sendiri.
utilize,The project utilizes advanced data analytics.,활용하다,그 프로젝트는 고급 데이터 분석을 활용한다.,活用する,そのプロジェクトは高度なデータ分析を活用している。,利用,该项目利用先进的数据分析。,utilizar,El proyecto utiliza análisis de datos avanzados.,sử dụng,Dự án sử dụng phân tích dữ liệu tiên tiến.,ใช้ประโยชน์,โครงการใช้ประโยชน์จากการวิเคราะห์ข้อมูลขั้นสูง,memanfaatkan,Proyek memanfaatkan analitik data canggih.
valid,The research must use valid measurement tools.,유효한,연구는 유효한 측정 도구를 사용해야 한다.,有効な,研究は有効な測定ツールを使用しなければならない。,有效的,研究必须使用有效的测量工具。,válido,La investigación debe usar herramientas de medición válidas.,hợp lệ,Nghiên cứu phải sử dụng công cụ đo lường hợp lệ.,ถูกต้อง,การวิจัยต้องใช้เครื่องมือวัดที่ถูกต้อง,valid,Penelitian harus menggunakan alat pengukuran yang valid.
vehicle,Electric vehicles reduce air pollution.,차량,전기 차량은 대기 오염을 줄인다.,車両,電気自動車は大気汚染を減らす。,车辆,电动汽车减少空气污染。,vehículo,Los vehículos eléctricos reducen la contaminación del aire.,xe cộ,Xe điện giảm ô nhiễm không khí.,ยานพาหนะ,ยานพาหนะไฟฟ้าลดมลพิษทางอากาศ,kendaraan,Kendaraan listrik mengurangi polusi udara.
version,The revised version of the paper was accepted.,버전,논문의 수정된 버전이 수락되었다.,バージョン,論文の改訂版が受理された。,版本,论文的修订版被接受了。,versión,La versión revisada del artículo fue aceptada.,phiên bản,Phiên bản sửa đổi của bài báo đã được chấp nhận.,เวอร์ชัน,เวอร์ชันแก้ไขของบทความได้รับการยอมรับ,versi,Versi revisi makalah diterima.
