wellness,Corporate wellness programs improve employee health.,웰니스,기업 웰니스 프로그램은 직원 건강을 향상시킨다.,ウェルネス,企業のウェルネスプログラムは従業員の健康を改善する。,健康,企业健康计划改善了员工的健康状况。,bienestar,Los programas de bienestar corporativo mejoran la salud de los empleados.,sức khỏe toàn diện,Chương trình sức khỏe toàn diện của doanh nghiệp cải thiện sức khỏe nhân viên.,สุขภาวะ,โปรแกรมสุขภาวะขององค์กรปรับปรุงสุขภาพพนักงาน,kesehatan,Program kesehatan perusahaan meningkatkan kesehatan karyawan.
gentrify,The neighborhood began to gentrify when new cafes opened.,젠트리파이하다,새 카페가 열리면서 동네가 젠트리피케이션되기 시작했다.,ジェントリフィケーションする,新しいカフェが開店し始めて地域がジェントリフィケーションし始めた。,中产阶级化,随着新咖啡馆的开业，该社区开始中产阶级化。,gentrificar,El barrio comenzó a gentrificarse cuando abrieron nuevos cafés.,quý tộc hóa,Khu phố bắt đầu quý tộc hóa khi các quán cà phê mới mở.,เปลี่ยนเป็นย่านหรู,ย่านนั้นเริ่มเปลี่ยนเป็นย่านหรูเมื่อมีคาเฟ่ใหม่เปิด,gentrifikasi,Lingkungan itu mulai mengalami gentrifikasi ketika kafe baru dibuka.
amenity,The apartment complex offers many amenities including a gym and pool.,편의 시설,아파트 단지는 체육관과 수영장을 포함한 많은 편의 시설을 제공한다.,設備,そのマンションはジムやプールなど多くの設備を提供している。,便利设施,该公寓小区提供许多便利设施，包括健身房和游泳池。,comodidad,El complejo de apartamentos ofrece muchas comodidades incluyendo un gimnasio y piscina.,tiện nghi,Khu chung cư cung cấp nhiều tiện nghi bao gồm phòng tập và hồ bơi.,สิ่งอำนวยความสะดวก,คอนโดมิเนียมมีสิ่งอำนวยความสะดวกมากมายรวมถึงยิมและสระว่ายน้ำ,fasilitas,Kompleks apartemen menawarkan banyak fasilitas termasuk gym dan kolam renang.
sprawl,Urban sprawl has consumed much of the surrounding farmland.,무분별한 확장,도시의 무분별한 확장이 주변 농지의 많은 부분을 잠식했다.,スプロール,都市のスプロールは周辺の農地の多くを消費してきた。,蔓延,城市蔓延已经吞噬了大量周边农田。,expansión urbana,La expansión urbana ha consumido gran parte de las tierras agrícolas circundantes.,mở rộng tràn lan,Sự mở rộng tràn lan của đô thị đã chiếm nhiều đất nông nghiệp xung quanh.,การขยายตัวของเมือง,การขยายตัวของเมืองได้กลืนกินพื้นที่เกษตรกรรมโดยรอบเป็นจำนวนมาก,perluasan kota,Perluasan kota telah menghabiskan banyak lahan pertanian di sekitarnya.
affiliate,She became an affiliate of the professional organization.,제휴하다,그녀는 전문 기관의 제휴 회원이 되었다.,提携する,彼女はその専門組織の提携メンバーになった。,附属,她成为该专业组织的附属成员。,afiliarse,Ella se afilió a la organización profesional.,liên kết,Cô ấy trở thành thành viên liên kết của tổ chức chuyên nghiệp.,สังกัด,เธอเข้าสังกัดองค์กรวิชาชีพ,berafiliasi,Dia menjadi afiliasi dari organisasi profesional tersebut.
disrupt,New technology continues to disrupt traditional industries.,파괴하다,새로운 기술이 전통 산업을 계속 파괴하고 있다.,破壊する,新しいテクノロジーは伝統的な産業を破壊し続けている。,颠覆,新技术持续颠覆传统行业。,disrumpir,La nueva tecnología continúa disrumpiendo las industrias tradicionales.,phá vỡ,Công nghệ mới tiếp tục phá vỡ các ngành công nghiệp truyền thống.,ก่อกวน,เทคโนโลยีใหม่ยังคงก่อกวนอุตสาหกรรมดั้งเดิม,mengganggu,Teknologi baru terus mengganggu industri tradisional.
retention,Employee retention is a priority for the HR department.,유지,직원 유지는 인사부의 우선 과제이다.,維持,従業員の維持は人事部の優先事項である。,留任,员工留任是人力资源部的优先事项。,retención,La retención de empleados es una prioridad para el departamento de recursos humanos.,giữ chân,Giữ chân nhân viên là ưu tiên của phòng nhân sự.,การรักษาไว้,การรักษาพนักงานเป็นสิ่งสำคัญอันดับแรกของฝ่ายทรัพยากรบุคคล,retensi,Retensi karyawan adalah prioritas bagi departemen SDM.
deregulate,The government plans to deregulate the energy sector.,규제를 철폐하다,정부는 에너지 부문의 규제를 철폐할 계획이다.,規制緩和する,政府はエネルギー部門の規制緩和を計画している。,放松管制,政府计划放松能源行业的管制。,desregular,El gobierno planea desregular el sector energético.,bãi bỏ quy định,Chính phủ có kế hoạch bãi bỏ quy định ngành năng lượng.,ยกเลิกกฎระเบียบ,รัฐบาลวางแผนที่จะยกเลิกกฎระเบียบภาคพลังงาน,deregulasi,Pemerintah berencana melakukan deregulasi sektor energi.
socialize,Children learn to socialize through play and group activities.,사회화하다,아이들은 놀이와 단체 활동을 통해 사회화를 배운다.,社会化する,子どもたちは遊びや集団活動を通じて社会化を学ぶ。,社交,孩子们通过游戏和集体活动学会社交。,socializar,Los niños aprenden a socializar a través del juego y actividades grupales.,giao tiếp xã hội,Trẻ em học giao tiếp xã hội thông qua trò chơi và hoạt động nhóm.,เข้าสังคม,เด็กเรียนรู้การเข้าสังคมผ่านการเล่นและกิจกรรมกลุ่ม,bersosialisasi,Anak-anak belajar bersosialisasi melalui permainan dan kegiatan kelompok.
stigma,There is still a stigma attached to seeking psychiatric help.,낙인,정신과 도움을 구하는 것에 여전히 낙인이 붙어 있다.,スティグマ,精神科の助けを求めることにはまだスティグマが付きまとう。,污名,寻求精神科帮助仍然存在污名。,estigma,Todavía existe un estigma asociado a buscar ayuda psiquiátrica.,kỳ thị,Vẫn còn sự kỳ thị gắn liền với việc tìm kiếm trợ giúp tâm thần.,ตราบาป,ยังมีตราบาปที่เกี่ยวข้องกับการขอความช่วยเหลือทางจิตเวช,stigma,Masih ada stigma yang melekat pada pencarian bantuan psikiatri.
stratify,Society tends to stratify people based on wealth.,계층화하다,사회는 부에 기반하여 사람들을 계층화하는 경향이 있다.,階層化する,社会は富に基づいて人々を階層化する傾向がある。,分层,社会往往根据财富对人进行分层。,estratificar,La sociedad tiende a estratificar a las personas según su riqueza.,phân tầng,Xã hội có xu hướng phân tầng con người dựa trên sự giàu có.,แบ่งชนชั้น,สังคมมักแบ่งชนชั้นผู้คนตามความมั่งคั่ง,menstratifikasi,Masyarakat cenderung menstratifikasi orang berdasarkan kekayaan.
advocacy,Advocacy groups pushed for stronger environmental laws.,옹호,옹호 단체들이 더 강력한 환경법을 추진했다.,支援活動,支援活動団体はより強力な環境法の制定を推進した。,倡导,倡导团体推动了更强有力的环境法律。,defensa,Los grupos de defensa presionaron por leyes ambientales más fuertes.,vận động,Các nhóm vận động thúc đẩy luật môi trường mạnh mẽ hơn.,การสนับสนุน,กลุ่มสนับสนุนผลักดันกฎหมายสิ่งแวดล้อมที่เข้มงวดขึ้น,advokasi,Kelompok advokasi mendorong undang-undang lingkungan yang lebih kuat.
correlate,Studies correlate regular exercise with improved mental health.,상관관계가 있다,연구에 따르면 규칙적인 운동은 개선된 정신 건강과 상관관계가 있다.,相関する,研究は定期的な運動と精神的健康の改善の相関を示している。,相关,研究表明规律运动与心理健康改善相关。,correlacionar,Los estudios correlacionan el ejercicio regular con una mejor salud mental.,tương quan,Các nghiên cứu cho thấy mối tương quan giữa tập thể dục thường xuyên và sức khỏe tâm thần cải thiện.,สัมพันธ์กัน,การศึกษาพบว่าการออกกำลังกายสม่ำเสมอสัมพันธ์กับสุขภาพจิตที่ดีขึ้น,berkorelasi,Studi mengkorelasikan olahraga teratur dengan peningkatan kesehatan mental.
allocate,The government decided to allocate more funds to renewable energy research.,할당하다,정부는 재생 에너지 연구에 더 많은 자금을 할당하기로 결정했다.,割り当てる,政府は再生可能エネルギー研究により多くの資金を割り当てることを決定した。,分配,政府决定将更多资金分配给可再生能源研究。,asignar,El gobierno decidió asignar más fondos a la investigación de energía renovable.,phân bổ,Chính phủ quyết định phân bổ thêm ngân sách cho nghiên cứu năng lượng tái tạo.,จัดสรร,รัฐบาลตัดสินใจจัดสรรเงินทุนเพิ่มเติมให้กับการวิจัยพลังงานหมุนเวียน,mengalokasikan,Pemerintah memutuskan untuk mengalokasikan lebih banyak dana untuk penelitian energi terbarukan.
automate,Many factories automate their production lines to increase efficiency.,자동화하다,많은 공장이 효율성을 높이기 위해 생산 라인을 자동화한다.,自動化する,多くの工場は効率を上げるために生産ラインを自動化している。,自动化,许多工厂自动化生产线以提高效率。,automatizar,Muchas fábricas automatizan sus líneas de producción para aumentar la eficiencia.,tự động hóa,Nhiều nhà máy tự động hóa dây chuyền sản xuất để tăng hiệu quả.,ทำให้เป็นอัตโนมัติ,หลายโรงงานทำให้สายการผลิตเป็นอัตโนมัติเพื่อเพิ่มประสิทธิภาพ,mengotomatisasi,Banyak pabrik mengotomatisasi lini produksi mereka untuk meningkatkan efisiensi.
bilateral,The two countries signed a bilateral trade agreement last month.,양자간의,두 나라는 지난달 양자간 무역 협정에 서명했다.,二国間の,両国は先月二国間貿易協定に署名した。,双边的,两国上个月签署了双边贸易协定。,bilateral,Los dos países firmaron un acuerdo comercial bilateral el mes pasado.,song phương,Hai nước đã ký thỏa thuận thương mại song phương vào tháng trước.,ทวิภาคี,ทั้งสองประเทศลงนามข้อตกลงการค้าทวิภาคีเมื่อเดือนที่แล้ว,bilateral,Kedua negara menandatangani perjanjian perdagangan bilateral bulan lalu.
biodiversity,Protecting biodiversity is essential for maintaining healthy ecosystems.,생물 다양성,생물 다양성을 보호하는 것은 건강한 생태계를 유지하는 데 필수적이다.,生物多様性,生物多様性を守ることは健全な生態系の維持に不可欠である。,生物多样性,保护生物多样性对于维持健康的生态系统至关重要。,biodiversidad,Proteger la biodiversidad es esencial para mantener ecosistemas saludables.,đa dạng sinh học,Bảo vệ đa dạng sinh học là điều cần thiết để duy trì hệ sinh thái khỏe mạnh.,ความหลากหลายทางชีวภาพ,การปกป้องความหลากหลายทางชีวภาพเป็นสิ่งจำเป็นสำหรับการรักษาระบบนิเวศที่ดี,keanekaragaman hayati,Melindungi keanekaragaman hayati sangat penting untuk menjaga ekosistem yang sehat.
blueprint,The education reform blueprint includes plans for digital literacy programs.,청사진,교육 개혁 청사진에는 디지털 리터러시 프로그램 계획이 포함되어 있다.,青写真,教育改革の青写真にはデジタルリテラシープログラムの計画が含まれている。,蓝图,教育改革蓝图包括数字素养项目的计划。,plan maestro,El plan maestro de reforma educativa incluye programas de alfabetización digital.,kế hoạch chi tiết,Kế hoạch chi tiết cải cách giáo dục bao gồm các chương trình xóa mù công nghệ số.,แผนพิมพ์เขียว,แผนพิมพ์เขียวการปฏิรูปการศึกษารวมถึงแผนงานด้านการรู้ดิจิทัล,cetak biru,Cetak biru reformasi pendidikan mencakup rencana program literasi digital.
boost,The new policy aims to boost economic growth in rural areas.,촉진하다,새로운 정책은 농촌 지역의 경제 성장을 촉진하는 것을 목표로 한다.,促進する,新しい政策は農村地域の経済成長を促進することを目指している。,促进,新政策旨在促进农村地区的经济增长。,impulsar,La nueva política tiene como objetivo impulsar el crecimiento económico en áreas rurales.,thúc đẩy,Chính sách mới nhằm thúc đẩy tăng trưởng kinh tế ở vùng nông thôn.,กระตุ้น,นโยบายใหม่มีเป้าหมายเพื่อกระตุ้นการเติบโตทางเศรษฐกิจในพื้นที่ชนบท,mendorong,Kebijakan baru ini bertujuan untuk mendorong pertumbuhan ekonomi di daerah pedesaan.
carbon,Reducing carbon emissions is a global priority for combating climate change.,탄소,탄소 배출을 줄이는 것은 기후 변화에 대응하기 위한 전 세계적 우선 과제이다.,炭素,炭素排出量の削減は気候変動対策の世界的な優先事項である。,碳,减少碳排放是应对气候变化的全球优先事项。,carbono,Reducir las emisiones de carbono es una prioridad global para combatir el cambio climático.,carbon,Giảm phát thải carbon là ưu tiên toàn cầu để chống biến đổi khí hậu.,คาร์บอน,การลดการปล่อยคาร์บอนเป็นสิ่งสำคัญระดับโลกเพื่อต่อสู้กับการเปลี่ยนแปลงสภาพภูมิอากาศ,karbon,Mengurangi emisi karbon adalah prioritas global untuk memerangi perubahan iklim.
certificate,She earned a professional certificate in data science.,자격증,그녀는 데이터 과학 전문 자격증을 취득했다.,資格証,彼女はデータサイエンスの専門資格証を取得した。,证书,她获得了数据科学专业证书。,certificado,Ella obtuvo un certificado profesional en ciencia de datos.,chứng chỉ,Cô ấy đã đạt được chứng chỉ chuyên nghiệp về khoa học dữ liệu.,ใบรับรอง,เธอได้รับใบรับรองวิชาชีพด้านวิทยาศาสตร์ข้อมูล,sertifikat,Dia memperoleh sertifikat profesional dalam ilmu data.
compatible,The new software is compatible with most operating systems.,호환되는,새로운 소프트웨어는 대부분의 운영 체제와 호환된다.,互換性のある,新しいソフトウェアはほとんどのオペレーティングシステムと互換性がある。,兼容的,新软件与大多数操作系统兼容。,compatible,El nuevo software es compatible con la mayoría de los sistemas operativos.,tương thích,Phần mềm mới tương thích với hầu hết các hệ điều hành.,เข้ากันได้,ซอฟต์แวร์ใหม่เข้ากันได้กับระบบปฏิบัติการส่วนใหญ่,kompatibel,Perangkat lunak baru ini kompatibel dengan sebagian besar sistem operasi.
compliance,All companies must ensure compliance with environmental regulations.,준수,모든 기업은 환경 규정 준수를 보장해야 한다.,遵守,すべての企業は環境規制の遵守を確保しなければならない。,合规,所有公司必须确保遵守环境法规。,cumplimiento,Todas las empresas deben garantizar el cumplimiento de las regulaciones ambientales.,tuân thủ,Tất cả các công ty phải đảm bảo tuân thủ các quy định về môi trường.,การปฏิบัติตาม,บริษัททุกแห่งต้องมั่นใจว่าปฏิบัติตามกฎระเบียบด้านสิ่งแวดล้อม,kepatuhan,Semua perusahaan harus memastikan kepatuhan terhadap peraturan lingkungan.
comprehensive,The university offers a comprehensive curriculum for engineering students.,포괄적인,그 대학교는 공학과 학생들을 위한 포괄적인 교육 과정을 제공한다.,包括的な,その大学は工学部の学生に包括的なカリキュラムを提供している。,全面的,该大学为工程专业学生提供全面的课程体系。,integral,La universidad ofrece un currículo integral para los estudiantes de ingeniería.,toàn diện,Trường đại học cung cấp chương trình giảng dạy toàn diện cho sinh viên kỹ thuật.,ครอบคลุม,มหาวิทยาลัยเสนอหลักสูตรที่ครอบคลุมสำหรับนักศึกษาวิศวกรรม,komprehensif,Universitas menawarkan kurikulum yang komprehensif untuk mahasiswa teknik.
consensus,The committee reached a consensus on the new trade policy.,합의,위원회는 새로운 무역 정책에 대한 합의에 도달했다.,合意,委員会は新しい貿易政策について合意に達した。,共识,委员会就新贸易政策达成了共识。,consenso,El comité alcanzó un consenso sobre la nueva política comercial.,đồng thuận,Ủy ban đã đạt được đồng thuận về chính sách thương mại mới.,ฉันทามติ,คณะกรรมการบรรลุฉันทามติเกี่ยวกับนโยบายการค้าใหม่,konsensus,Komite mencapai konsensus tentang kebijakan perdagangan baru.
constraint,Budget constraints forced the school to reduce its staff.,제약,예산 제약으로 학교는 직원을 줄여야 했다.,制約,予算の制約により学校はスタッフを削減せざるを得なかった。,限制,预算限制迫使学校减少员工。,restricción,Las restricciones presupuestarias obligaron a la escuela a reducir su personal.,ràng buộc,Các ràng buộc về ngân sách buộc trường phải giảm nhân sự.,ข้อจำกัด,ข้อจำกัดด้านงบประมาณทำให้โรงเรียนต้องลดจำนวนพนักงาน,kendala,Kendala anggaran memaksa sekolah untuk mengurangi stafnya.
consultant,The firm hired a consultant to improve their cybersecurity.,컨설턴트,그 회사는 사이버 보안을 개선하기 위해 컨설턴트를 고용했다.,コンサルタント,その企業はサイバーセキュリティを改善するためにコンサルタントを雇った。,顾问,该公司聘请了一名顾问来改善网络安全。,consultor,La empresa contrató a un consultor para mejorar su ciberseguridad.,chuyên gia tư vấn,Công ty đã thuê một chuyên gia tư vấn để cải thiện an ninh mạng.,ที่ปรึกษา,บริษัทจ้างที่ปรึกษาเพื่อปรับปรุงความปลอดภัยทางไซเบอร์,konsultan,Perusahaan menyewa konsultan untuk meningkatkan keamanan siber mereka.
contaminate,Industrial waste can contaminate nearby water sources.,오염시키다,산업 폐기물은 인근 수원을 오염시킬 수 있다.,汚染する,産業廃棄物は近くの水源を汚染する可能性がある。,污染,工业废物可能会污染附近的水源。,contaminar,Los desechos industriales pueden contaminar las fuentes de agua cercanas.,ô nhiễm,Chất thải công nghiệp có thể gây ô nhiễm các nguồn nước gần đó.,ปนเปื้อน,ของเสียจากอุตสาหกรรมสามารถปนเปื้อนแหล่งน้ำใกล้เคียง,mencemari,Limbah industri dapat mencemari sumber air terdekat.
coordinate,Different departments must coordinate their efforts during the project.,조정하다,다른 부서들은 프로젝트 기간 동안 노력을 조정해야 한다.,調整する,各部門はプロジェクト中に取り組みを調整しなければならない。,协调,不同部门在项目期间必须协调工作。,coordinar,Los diferentes departamentos deben coordinar sus esfuerzos durante el proyecto.,phối hợp,Các phòng ban khác nhau phải phối hợp nỗ lực trong suốt dự án.,ประสานงาน,แผนกต่าง ๆ ต้องประสานงานกันในระหว่างโครงการ,mengoordinasikan,Departemen yang berbeda harus mengoordinasikan upaya mereka selama proyek.
delegate,The manager decided to delegate tasks to her team members.,위임하다,관리자는 팀원들에게 업무를 위임하기로 결정했다.,委任する,マネージャーはチームメンバーにタスクを委任することを決めた。,委派,经理决定将任务委派给团队成员。,delegar,La gerente decidió delegar tareas a los miembros de su equipo.,ủy quyền,Quản lý quyết định ủy quyền công việc cho các thành viên trong nhóm.,มอบหมาย,ผู้จัดการตัดสินใจมอบหมายงานให้สมาชิกในทีม,mendelegasikan,Manajer memutuskan untuk mendelegasikan tugas kepada anggota timnya.
deploy,The army plans to deploy additional troops to the border region.,배치하다,군은 국경 지역에 추가 병력을 배치할 계획이다.,展開する,軍は国境地域に追加の部隊を展開する計画だ。,部署,军队计划向边境地区部署更多部队。,desplegar,El ejército planea desplegar tropas adicionales en la región fronteriza.,triển khai,Quân đội lên kế hoạch triển khai thêm quân đến khu vực biên giới.,ส่งกำลัง,กองทัพวางแผนส่งกำลังพลเพิ่มเติมไปยังพื้นที่ชายแดน,mengerahkan,Tentara berencana mengerahkan pasukan tambahan ke wilayah perbatasan.
diagnostic,The technician ran a diagnostic test on the network system.,진단의,기술자가 네트워크 시스템에 대한 진단 테스트를 실행했다.,診断の,技術者はネットワークシステムの診断テストを実施した。,诊断的,技术人员对网络系统进行了诊断测试。,diagnóstico,El técnico ejecutó una prueba diagnóstica en el sistema de red.,chẩn đoán,Kỹ thuật viên đã chạy thử nghiệm chẩn đoán trên hệ thống mạng.,การวินิจฉัย,ช่างเทคนิคทำการทดสอบวินิจฉัยระบบเครือข่าย,diagnostik,Teknisi menjalankan tes diagnostik pada sistem jaringan.
diplomacy,Diplomacy is essential for resolving international disputes peacefully.,외교,외교는 국제 분쟁을 평화적으로 해결하는 데 필수적이다.,外交,外交は国際紛争を平和的に解決するために不可欠である。,外交,外交对于和平解决国际争端至关重要。,diplomacia,La diplomacia es esencial para resolver disputas internacionales de manera pacífica.,ngoại giao,Ngoại giao là điều cần thiết để giải quyết các tranh chấp quốc tế một cách hòa bình.,การทูต,การทูตเป็นสิ่งจำเป็นสำหรับการแก้ไขข้อพิพาทระหว่างประเทศอย่างสันติ,diplomasi,Diplomasi sangat penting untuk menyelesaikan sengketa internasional secara damai.
