curfew,The city imposed a curfew from midnight to five in the morning.,통행금지,도시는 자정부터 새벽 5시까지 통행금지를 시행했다.,夜間外出禁止令,市は深夜から朝5時まで夜間外出禁止令を発令した。,宵禁,该市实施了从午夜到凌晨五点的宵禁。,toque de queda,La ciudad impuso un toque de queda desde la medianoche hasta las cinco de la mañana.,giới nghiêm,Thành phố áp đặt lệnh giới nghiêm từ nửa đêm đến năm giờ sáng.,เคอร์ฟิว,เมืองประกาศเคอร์ฟิวตั้งแต่เที่ยงคืนถึงตีห้า,jam malam,Kota memberlakukan jam malam dari tengah malam hingga pukul lima pagi.
embezzlement,The accountant was found guilty of embezzlement of company funds.,횡령,그 회계사는 회사 자금 횡령 혐의로 유죄 판결을 받았다.,横領,その会計士は会社資金の横領で有罪となった。,挪用公款,该会计被判挪用公司资金罪。,malversación,El contador fue declarado culpable de malversación de fondos de la empresa.,biển thủ,Kế toán bị kết tội biển thủ quỹ công ty.,การยักยอก,นักบัญชีถูกตัดสินว่ามีความผิดฐานยักยอกเงินของบริษัท,penggelapan,Akuntan itu dinyatakan bersalah atas penggelapan dana perusahaan.
logo,The company redesigned its logo to appeal to a younger audience.,로고,회사는 젊은 층에게 어필하기 위해 로고를 재설계했다.,ロゴ,会社は若い顧客層にアピールするためにロゴをリデザインした。,标志,公司重新设计了标志以吸引年轻受众。,logotipo,La empresa rediseñó su logotipo para atraer a un público más joven.,logo,Công ty thiết kế lại logo để thu hút khán giả trẻ hơn.,โลโก้,บริษัทออกแบบโลโก้ใหม่เพื่อดึงดูดกลุ่มเป้าหมายที่อายุน้อยกว่า,logo,Perusahaan mendesain ulang logonya untuk menarik audiens yang lebih muda.
slogan,"Our new slogan, 'Think Different,' quickly became famous.",슬로건,우리의 새 슬로건 '다르게 생각하라'는 빠르게 유명해졌다.,スローガン,新しいスローガン「Think Different」はすぐに有名になった。,口号,我们的新口号'Think Different'很快就出名了。,eslogan,"Nuestro nuevo eslogan, 'Piensa Diferente', rápidamente se hizo famoso.",khẩu hiệu,"Khẩu hiệu mới của chúng tôi, 'Think Different', nhanh chóng trở nên nổi tiếng.",สโลแกน,สโลแกนใหม่ของเรา 'Think Different' กลายเป็นที่รู้จักอย่างรวดเร็ว,slogan,"Slogan baru kami, 'Think Different', dengan cepat menjadi terkenal."
consumer,Modern consumers expect fast delivery and easy returns.,소비자,현대 소비자들은 빠른 배송과 쉬운 반품을 기대한다.,消費者,現代の消費者は迅速な配送と簡単な返品を期待する。,消费者,现代消费者期望快速配送和轻松退货。,consumidor,Los consumidores modernos esperan entregas rápidas y devoluciones fáciles.,người tiêu dùng,Người tiêu dùng hiện đại mong đợi giao hàng nhanh và đổi trả dễ dàng.,ผู้บริโภค,ผู้บริโภคยุคใหม่คาดหวังการจัดส่งที่รวดเร็วและการคืนสินค้าที่ง่าย,konsumen,Konsumen modern mengharapkan pengiriman cepat dan pengembalian yang mudah.
loyalty,The company rewards customer loyalty with exclusive discounts.,충성도,회사는 독점 할인으로 고객 충성도에 보답한다.,ロイヤルティ,会社は独占割引で顧客ロイヤルティに報いている。,忠诚度,公司以独家折扣奖励客户忠诚度。,lealtad,La empresa premia la lealtad del cliente con descuentos exclusivos.,sự trung thành,Công ty thưởng cho sự trung thành của khách hàng bằng giảm giá độc quyền.,ความภักดี,บริษัทให้รางวัลความภักดีของลูกค้าด้วยส่วนลดพิเศษ,loyalitas,Perusahaan memberi penghargaan loyalitas pelanggan dengan diskon eksklusif.
endorsement,The celebrity endorsement boosted the product's visibility enormously.,추천; 보증,유명인의 추천이 제품의 인지도를 크게 높였다.,推薦,セレブリティの推薦が製品の認知度を大幅に向上させた。,代言,名人代言极大地提升了产品的知名度。,respaldo,El respaldo de la celebridad impulsó enormemente la visibilidad del producto.,sự ủng hộ,Sự ủng hộ của người nổi tiếng đã tăng cường đáng kể sự nhận diện sản phẩm.,การรับรอง,การรับรองจากคนดังทำให้ผลิตภัณฑ์เป็นที่รู้จักอย่างมาก,dukungan,Dukungan selebriti meningkatkan visibilitas produk secara luar biasa.
demographic,The product targets a young demographic between eighteen and thirty.,인구통계학적 집단,이 제품은 18세에서 30세 사이의 젊은 인구통계학적 집단을 대상으로 한다.,人口統計層,この製品は18歳から30歳の若い人口統計層をターゲットにしている。,人口群体,该产品瞄准十八岁到三十岁之间的年轻人群。,grupo demográfico,El producto se dirige a un grupo demográfico joven de entre dieciocho y treinta años.,nhóm nhân khẩu học,Sản phẩm nhắm đến nhóm nhân khẩu học trẻ từ mười tám đến ba mươi tuổi.,กลุ่มประชากร,ผลิตภัณฑ์มุ่งเป้าไปที่กลุ่มประชากรอายุน้อยระหว่างสิบแปดถึงสามสิบปี,demografis,Produk ini menargetkan demografis muda antara delapan belas dan tiga puluh tahun.
billboard,They placed a huge billboard on the highway to advertise the new car.,광고판,그들은 신차를 광고하기 위해 고속도로에 거대한 광고판을 설치했다.,看板,彼らは新車を宣伝するために高速道路に巨大な看板を設置した。,广告牌,他们在高速公路上放置了巨大的广告牌来宣传新车。,valla publicitaria,Colocaron una enorme valla publicitaria en la autopista para anunciar el nuevo auto.,biển quảng cáo,Họ đặt một biển quảng cáo lớn trên đường cao tốc để quảng cáo xe mới.,ป้ายโฆษณา,พวกเขาติดป้ายโฆษณาขนาดใหญ่บนทางหลวงเพื่อโฆษณารถยนต์รุ่นใหม่,papan reklame,Mereka memasang papan reklame besar di jalan tol untuk mengiklankan mobil baru.
sponsor,A major bank agreed to sponsor the local football team.,후원하다,대형 은행이 지역 축구팀을 후원하기로 합의했다.,スポンサーになる,大手銀行が地元のサッカーチームのスポンサーになることに合意した。,赞助,一家大银行同意赞助当地足球队。,patrocinar,Un banco importante aceptó patrocinar al equipo local de fútbol.,tài trợ,Một ngân hàng lớn đồng ý tài trợ cho đội bóng đá địa phương.,สนับสนุน,ธนาคารรายใหญ่ตกลงที่จะสนับสนุนทีมฟุตบอลท้องถิ่น,mensponsori,Sebuah bank besar setuju untuk mensponsori tim sepak bola lokal.
brochure,We designed a brochure to promote our new range of products.,브로셔,우리는 새로운 제품군을 홍보하기 위해 브로셔를 디자인했다.,パンフレット,私たちは新しい製品ラインを宣伝するためのパンフレットをデザインした。,宣传册,我们设计了一本宣传册来推广我们的新系列产品。,folleto,Diseñamos un folleto para promocionar nuestra nueva gama de productos.,tờ rơi,Chúng tôi thiết kế một tờ rơi để quảng bá dòng sản phẩm mới.,โบรชัวร์,เราออกแบบโบรชัวร์เพื่อโปรโมตสินค้ากลุ่มใหม่ของเรา,brosur,Kami mendesain brosur untuk mempromosikan rangkaian produk baru kami.
merchandise,The band sells merchandise such as T-shirts and posters at concerts.,상품,그 밴드는 콘서트에서 티셔츠와 포스터 같은 상품을 판매한다.,グッズ,そのバンドはコンサートでTシャツやポスターなどのグッズを販売する。,商品,乐队在演唱会上出售T恤和海报等商品。,mercancía,La banda vende mercancía como camisetas y pósteres en los conciertos.,hàng hóa,Ban nhạc bán các mặt hàng như áo phông và áp phích tại các buổi hòa nhạc.,สินค้า,วงดนตรีขายสินค้าเช่นเสื้อยืดและโปสเตอร์ในคอนเสิร์ต,merchandise,Band ini menjual merchandise seperti kaos dan poster di konser.
trademark,The company registered its trademark to protect its brand identity.,상표,회사는 브랜드 정체성을 보호하기 위해 상표를 등록했다.,商標,会社はブランドアイデンティティを守るために商標を登録した。,商标,公司注册了商标以保护其品牌形象。,marca registrada,La empresa registró su marca para proteger su identidad de marca.,nhãn hiệu,Công ty đã đăng ký nhãn hiệu để bảo vệ bản sắc thương hiệu.,เครื่องหมายการค้า,บริษัทจดทะเบียนเครื่องหมายการค้าเพื่อปกป้องเอกลักษณ์ของแบรนด์,merek dagang,Perusahaan mendaftarkan merek dagangnya untuk melindungi identitas mereknya.
newsletter,Subscribers receive a monthly newsletter with tips and special offers.,뉴스레터,구독자들은 팁과 특별 혜택이 담긴 월간 뉴스레터를 받는다.,ニュースレター,購読者はヒントや特別オファーが掲載された月刊ニュースレターを受け取る。,通讯,订阅者每月收到包含提示和特别优惠的通讯。,boletín,Los suscriptores reciben un boletín mensual con consejos y ofertas especiales.,bản tin,Người đăng ký nhận bản tin hàng tháng với mẹo và ưu đãi đặc biệt.,จดหมายข่าว,สมาชิกจะได้รับจดหมายข่าวรายเดือนพร้อมเคล็ดลับและข้อเสนอพิเศษ,buletin,Pelanggan menerima buletin bulanan berisi tips dan penawaran khusus.
testimonial,Customer testimonials helped build trust in the new product.,고객 후기,고객 후기가 신제품에 대한 신뢰를 구축하는 데 도움이 되었다.,お客様の声,顧客の声が新製品への信頼構築に役立った。,客户评价,客户评价帮助建立了对新产品的信任。,testimonio,Los testimonios de clientes ayudaron a generar confianza en el nuevo producto.,lời chứng thực,Lời chứng thực của khách hàng giúp xây dựng niềm tin vào sản phẩm mới.,คำรับรอง,คำรับรองจากลูกค้าช่วยสร้างความเชื่อมั่นในผลิตภัณฑ์ใหม่,testimoni,Testimoni pelanggan membantu membangun kepercayaan pada produk baru.
niche,The company found a profitable niche in the organic food market.,틈새시장,회사는 유기농 식품 시장에서 수익성 있는 틈새시장을 찾았다.,ニッチ,その会社はオーガニック食品市場で収益性のあるニッチを見つけた。,利基市场,公司在有机食品市场找到了一个有利可图的利基市场。,nicho,La empresa encontró un nicho rentable en el mercado de alimentos orgánicos.,thị trường ngách,Công ty tìm thấy thị trường ngách có lợi nhuận trong thị trường thực phẩm hữu cơ.,ตลาดเฉพาะ,บริษัทค้นพบตลาดเฉพาะที่ทำกำไรได้ในตลาดอาหารออร์แกนิก,ceruk,Perusahaan menemukan ceruk yang menguntungkan di pasar makanan organik.
outreach,The outreach program connected the brand with local communities.,홍보 활동,홍보 활동 프로그램이 브랜드를 지역 사회와 연결시켰다.,アウトリーチ,アウトリーチプログラムがブランドと地域コミュニティをつなげた。,推广,推广项目将品牌与当地社区联系起来。,difusión,El programa de difusión conectó la marca con las comunidades locales.,tiếp cận,Chương trình tiếp cận kết nối thương hiệu với cộng đồng địa phương.,การเข้าถึง,โปรแกรมการเข้าถึงเชื่อมต่อแบรนด์กับชุมชนท้องถิ่น,penjangkauan,Program penjangkauan menghubungkan merek dengan komunitas lokal.
jingle,The catchy jingle from the commercial stuck in everyone's head.,징글,광고의 중독성 있는 징글이 모든 사람의 머릿속에 남았다.,ジングル,CMのキャッチーなジングルがみんなの頭に残った。,广告歌,广告中朗朗上口的广告歌让每个人都记住了。,jingle,El pegadizo jingle del comercial se quedó en la cabeza de todos.,nhạc quảng cáo,Nhạc quảng cáo bắt tai trong đoạn quảng cáo cứ vang mãi trong đầu mọi người.,เพลงโฆษณา,เพลงโฆษณาจากโฆษณาที่ติดหูวนเวียนอยู่ในหัวของทุกคน,jingle,Jingle yang menarik dari iklan itu menempel di kepala semua orang.
rebate,"After purchasing the appliance, she applied for a fifty-dollar mail-in rebate.",리베이트,가전제품을 구매한 후 그녀는 50달러의 우편 리베이트를 신청했다.,リベート,家電を購入した後、彼女は50ドルの郵送リベートを申請した。,返利,购买电器后她申请了五十美元的邮寄返利。,reembolso,"Después de comprar el electrodoméstico, solicitó un reembolso de cincuenta dólares por correo.",hoàn tiền,"Sau khi mua thiết bị, cô ấy nộp đơn xin hoàn tiền năm mươi đô la qua đường bưu điện.",เงินคืน,หลังจากซื้อเครื่องใช้ไฟฟ้า เธอสมัครขอเงินคืนห้าสิบดอลลาร์ทางไปรษณีย์,rabat,"Setelah membeli peralatan, dia mengajukan rabat lima puluh dolar melalui pos."
engagement,Social media engagement increased after the company started posting videos.,참여도,회사가 동영상을 게시하기 시작한 후 소셜 미디어 참여도가 증가했다.,エンゲージメント,会社が動画投稿を始めてからSNSのエンゲージメントが増加した。,互动,公司开始发布视频后社交媒体互动量增加了。,interacción,La interacción en redes sociales aumentó después de que la empresa empezó a publicar videos.,tương tác,Tương tác trên mạng xã hội tăng sau khi công ty bắt đầu đăng video.,การมีส่วนร่วม,การมีส่วนร่วมบนโซเชียลมีเดียเพิ่มขึ้นหลังจากบริษัทเริ่มโพสต์วิดีโอ,keterlibatan,Keterlibatan media sosial meningkat setelah perusahaan mulai memposting video.
tagline,A good tagline makes a brand instantly recognizable.,태그라인,좋은 태그라인은 브랜드를 즉시 인식할 수 있게 한다.,タグライン,良いタグラインはブランドを即座に認知させる。,宣传语,好的宣传语能让品牌立刻被辨认出来。,lema,Un buen lema hace que una marca sea reconocible al instante.,câu khẩu hiệu,Một câu khẩu hiệu tốt giúp thương hiệu được nhận biết ngay lập tức.,สโลแกนประจำ,สโลแกนประจำที่ดีทำให้แบรนด์เป็นที่จดจำได้ทันที,tagline,Tagline yang bagus membuat merek langsung dikenali.
retail,The retail industry has been transformed by online shopping.,소매,소매 산업은 온라인 쇼핑에 의해 변혁되었다.,小売,小売業界はオンラインショッピングによって変革された。,零售,零售行业已被在线购物所改变。,minorista,La industria minorista ha sido transformada por las compras en línea.,bán lẻ,Ngành bán lẻ đã được chuyển đổi bởi mua sắm trực tuyến.,ค้าปลีก,อุตสาหกรรมค้าปลีกถูกเปลี่ยนแปลงโดยการช้อปปิ้งออนไลน์,ritel,Industri ritel telah ditransformasi oleh belanja online.
wholesale,They buy goods at wholesale prices and sell them at a markup.,도매,그들은 도매가로 상품을 구입하고 마진을 붙여 판매한다.,卸売,彼らは卸売価格で商品を買い、利益を上乗せして販売する。,批发,他们以批发价购买商品然后加价出售。,mayorista,Compran productos a precios mayoristas y los venden con un margen de ganancia.,bán buôn,Họ mua hàng với giá bán buôn và bán lại với giá cao hơn.,ขายส่ง,พวกเขาซื้อสินค้าในราคาขายส่งและขายต่อในราคาที่สูงขึ้น,grosir,Mereka membeli barang dengan harga grosir dan menjualnya dengan margin keuntungan.
franchise,She opened a franchise of the popular coffee chain in her city.,프랜차이즈,그녀는 자기 도시에 인기 있는 커피 체인의 프랜차이즈를 열었다.,フランチャイズ,彼女は自分の町に人気コーヒーチェーンのフランチャイズを開いた。,特许经营,她在自己的城市开了一家热门咖啡连锁的特许经营店。,franquicia,Ella abrió una franquicia de la popular cadena de café en su ciudad.,nhượng quyền,Cô ấy mở một cửa hàng nhượng quyền của chuỗi cà phê nổi tiếng trong thành phố.,แฟรนไชส์,เธอเปิดแฟรนไชส์ของร้านกาแฟชื่อดังในเมืองของเธอ,waralaba,Dia membuka waralaba jaringan kopi populer di kotanya.
markup,The store applies a forty percent markup on all imported goods.,마진,가게는 모든 수입 상품에 40%의 마진을 적용한다.,値上げ幅,その店はすべての輸入品に40%の値上げ幅を適用する。,加价,商店对所有进口商品加价百分之四十。,margen de ganancia,La tienda aplica un margen de ganancia del cuarenta por ciento en todos los productos importados.,mức tăng giá,Cửa hàng áp dụng mức tăng giá bốn mươi phần trăm cho tất cả hàng nhập khẩu.,กำไรส่วนเพิ่ม,ร้านค้าบวกกำไรส่วนเพิ่มสี่สิบเปอร์เซ็นต์สำหรับสินค้านำเข้าทั้งหมด,margin,Toko menerapkan margin empat puluh persen pada semua barang impor.
existence,The existence of life on other planets remains an open question.,존재,다른 행성에 생명체의 존재는 여전히 미해결 문제이다.,存在,他の惑星における生命の存在は未解決の問題のままだ。,存在,其他星球上是否存在生命仍然是一个悬而未决的问题。,existencia,La existencia de vida en otros planetas sigue siendo una pregunta abierta.,sự tồn tại,Sự tồn tại của sự sống trên các hành tinh khác vẫn là câu hỏi mở.,การดำรงอยู่,การดำรงอยู่ของสิ่งมีชีวิตบนดาวเคราะห์อื่นยังคงเป็นคำถามที่ยังไม่มีคำตอบ,keberadaan,Keberadaan kehidupan di planet lain masih menjadi pertanyaan terbuka.
perception,Our perception of time changes depending on what we are doing.,인식,우리의 시간에 대한 인식은 우리가 무엇을 하고 있는지에 따라 변한다.,知覚,時間の知覚は何をしているかによって変わる。,感知,我们对时间的感知会随着所做事情的不同而改变。,percepción,Nuestra percepción del tiempo cambia dependiendo de lo que estemos haciendo.,nhận thức,Nhận thức của chúng ta về thời gian thay đổi tùy thuộc vào việc chúng ta đang làm gì.,การรับรู้,การรับรู้เวลาของเราเปลี่ยนแปลงขึ้นอยู่กับสิ่งที่เรากำลังทำ,persepsi,Persepsi kita tentang waktu berubah tergantung pada apa yang sedang kita lakukan.
rationality,Good decision-making depends on rationality rather than emotion.,합리성,좋은 의사결정은 감정보다 합리성에 달려 있다.,合理性,良い意思決定は感情よりも合理性に依存する。,理性,好的决策取决于理性而非情感。,racionalidad,La buena toma de decisiones depende de la racionalidad más que de la emoción.,lý trí,Việc ra quyết định tốt phụ thuộc vào lý trí hơn là cảm xúc.,ความมีเหตุผล,การตัดสินใจที่ดีขึ้นอยู่กับความมีเหตุผลมากกว่าอารมณ์,rasionalitas,Pengambilan keputusan yang baik bergantung pada rasionalitas daripada emosi.
contradiction,"His actions were in direct contradiction to his words, which confused everyone.",모순,그의 행동은 말과 직접적으로 모순되어 모든 사람을 혼란스럽게 했다.,矛盾,彼の行動は言葉と直接矛盾しており、皆を混乱させた。,矛盾,他的行为与他的言辞直接矛盾让所有人困惑。,contradicción,"Sus acciones estaban en directa contradicción con sus palabras, lo que confundió a todos.",mâu thuẫn,"Hành động của anh ta mâu thuẫn trực tiếp với lời nói, khiến mọi người bối rối.",ความขัดแย้ง,การกระทำของเขาขัดแย้งกับคำพูดโดยตรง ซึ่งทำให้ทุกคนสับสน,kontradiksi,"Tindakannya bertentangan langsung dengan kata-katanya, yang membingungkan semua orang."
paradox,"It is a paradox that the more we learn, the more we realize how little we know.",역설,우리가 더 많이 배울수록 우리가 얼마나 적게 아는지 깨닫게 된다는 것은 역설이다.,パラドックス,学べば学ぶほど自分がいかに無知であるか気づくのはパラドックスだ。,悖论,我们学得越多就越意识到自己知之甚少这是一个悖论。,paradoja,"Es una paradoja que cuanto más aprendemos, más nos damos cuenta de lo poco que sabemos.",nghịch lý,"Thật nghịch lý rằng càng học nhiều, chúng ta càng nhận ra mình biết ít đến nhường nào.",ความขัดแย้งในตัวเอง,เป็นความขัดแย้งในตัวเองที่ยิ่งเราเรียนรู้มากขึ้น เรายิ่งตระหนักว่าเรารู้น้อยเพียงใด,paradoks,"Ini adalah paradoks bahwa semakin banyak kita belajar, semakin kita menyadari betapa sedikit yang kita ketahui."
metaphor,The poet used the ocean as a metaphor for the vastness of human emotion.,은유,시인은 인간 감정의 광대함에 대한 은유로 바다를 사용했다.,メタファー,詩人は人間の感情の広大さのメタファーとして海を使った。,隐喻,诗人用大海作为人类情感广阔的隐喻。,metáfora,El poeta usó el océano como metáfora de la inmensidad de la emoción humana.,ẩn dụ,Nhà thơ dùng đại dương như một ẩn dụ cho sự bao la của cảm xúc con người.,อุปมา,กวีใช้มหาสมุทรเป็นอุปมาสำหรับความกว้างใหญ่ของอารมณ์มนุษย์,metafora,Penyair menggunakan lautan sebagai metafora untuk luasnya emosi manusia.
analogy,She drew an analogy between the brain and a computer to explain memory.,유추,그녀는 기억을 설명하기 위해 뇌와 컴퓨터 사이의 유추를 했다.,類推,彼女は記憶を説明するために脳とコンピュータの類推を行った。,类比,她将大脑与计算机做类比来解释记忆。,analogía,Hizo una analogía entre el cerebro y una computadora para explicar la memoria.,phép so sánh,Cô ấy đưa ra phép so sánh giữa bộ não và máy tính để giải thích trí nhớ.,การเปรียบเทียบ,เธอเปรียบเทียบสมองกับคอมพิวเตอร์เพื่ออธิบายเรื่องความจำ,analogi,Dia membuat analogi antara otak dan komputer untuk menjelaskan memori.
