launch,The company will launch a new product next month.,출시하다; 시작하다,회사가 다음 달에 새 제품을 출시할 거예요.,発売する; 打ち上げる,会社が来月新製品を発売する。,推出; 发射,公司下个月将推出新产品。,lanzar,La empresa lanzará un nuevo producto el próximo mes.,ra mắt; phóng,Công ty sẽ ra mắt sản phẩm mới tháng tới.,เปิดตัว; ปล่อย,บริษัทจะเปิดตัวผลิตภัณฑ์ใหม่เดือนหน้า,meluncurkan,Perusahaan akan meluncurkan produk baru bulan depan.
layer,The cake has three layers of cream.,층; 겹,케이크에 크림이 3층으로 되어 있어요.,層; レイヤー,ケーキにはクリームが3層ある。,层; 层次,蛋糕有三层奶油。,capa,El pastel tiene tres capas de crema.,lớp; tầng,Bánh có ba lớp kem.,ชั้น,เค้กมีครีมสามชั้น,lapisan,Kuenya memiliki tiga lapis krim.
legitimate,Is this website legitimate or a scam?,합법적인; 정당한,이 웹사이트가 합법적인 건가요 사기인가요?,合法的な; 正当な,このウェブサイトは合法的か詐欺か?,合法的; 正当的,这个网站是合法的还是骗局？,legítimo,¿Este sitio web es legítimo o una estafa?,hợp pháp; chính đáng,Trang web này hợp pháp hay lừa đảo?,ถูกกฎหมาย; ถูกต้อง,เว็บไซต์นี้ถูกกฎหมายหรือเป็นการหลอกลวง,sah; resmi,Apakah situs web ini sah atau penipuan?
liberal,The university has a liberal arts program.,자유주의의; 진보적인,대학에 자유 교양 프로그램이 있어요.,自由な; 教養の,大学にはリベラルアーツのプログラムがある。,自由的; 开明的,大学有文科项目。,liberal,La universidad tiene un programa de artes liberales.,tự do; cấp tiến,Trường có chương trình giáo dục khai phóng.,เสรีนิยม,มหาวิทยาลัยมีหลักสูตรศิลปศาสตร์,liberal,Universitas memiliki program seni liberal.
liberty,People fought for their liberty and freedom.,자유; 해방,사람들은 자유를 위해 싸웠어요.,自由; 解放,人々は自由のために戦った。,自由,人们为自由而战。,libertad,La gente luchó por su libertad.,tự do; quyền tự do,Mọi người đấu tranh cho tự do.,เสรีภาพ; อิสรภาพ,ผู้คนต่อสู้เพื่อเสรีภาพ,kebebasan; kemerdekaan,Orang-orang berjuang untuk kebebasan mereka.
likewise,She is kind and likewise her brother is too.,마찬가지로; 똑같이,그녀는 친절하고 마찬가지로 남동생도 그래요.,同様に; 同じく,彼女は優しく同様に彼女の兄弟もそうだ。,同样地,她很善良，她的弟弟也同样如此。,igualmente; asimismo,Ella es amable e igualmente su hermano también.,tương tự,Cô ấy tốt bụng và anh trai cũng tương tự.,เช่นเดียวกัน,เธอใจดีและพี่ชายก็เช่นเดียวกัน,demikian juga; begitu pula,Dia baik hati dan begitu pula saudaranya.
maintain,You should maintain your car regularly.,유지하다; 관리하다,차를 정기적으로 관리해야 해요.,維持する; 整備する,車は定期的に整備すべきだ。,维持; 保养,你应该定期保养你的车。,mantener,Debes mantener tu auto regularmente.,duy trì; bảo trì,Bạn nên bảo trì xe thường xuyên.,ดูแลรักษา; คงไว้,คุณควรดูแลรักษารถยนต์เป็นประจำ,merawat; memelihara,Anda harus merawat mobil Anda secara teratur.
majority,The majority of students passed the exam.,다수; 과반수,대다수의 학생이 시험에 합격했어요.,多数; 大多数,大多数の学生が試験に合格した。,大多数; 多数,大多数学生通过了考试。,mayoría,La mayoría de los estudiantes aprobó el examen.,đa số; phần lớn,Đa số sinh viên đã đỗ kỳ thi.,ส่วนใหญ่; เสียงข้างมาก,นักเรียนส่วนใหญ่สอบผ่าน,mayoritas; sebagian besar,Mayoritas siswa lulus ujian.
manifest,His anxiety manifested as headaches.,나타나다; 표명하다,그의 불안은 두통으로 나타났어요.,現れる; 示す,彼の不安は頭痛として現れた。,表现; 显示,他的焦虑表现为头痛。,manifestarse,Su ansiedad se manifestó como dolores de cabeza.,biểu hiện,Sự lo lắng của anh biểu hiện qua đau đầu.,แสดงออก; ปรากฏ,ความวิตกกังวลของเขาแสดงออกเป็นอาการปวดหัว,bermanifestasi; terwujud,Kecemasannya bermanifestasi sebagai sakit kepala.
manipulate,He tried to manipulate the results.,조작하다; 조종하다,그는 결과를 조작하려고 했어요.,操作する; 操る,彼は結果を操作しようとした。,操纵; 篡改,他试图操纵结果。,manipular,Intentó manipular los resultados.,thao túng; thay đổi,Anh ấy cố thao túng kết quả.,บิดเบือน; ชักใย,เขาพยายามบิดเบือนผลลัพธ์,memanipulasi,Dia mencoba memanipulasi hasilnya.
mature,He has become more mature since college.,성숙한; 성장한,그는 대학 이후로 더 성숙해졌어요.,成熟した; 大人の,大学以降彼はより成熟した。,成熟的,他大学毕业后变得更成熟了。,maduro,Se ha vuelto más maduro desde la universidad.,trưởng thành; chín chắn,Anh ấy trưởng thành hơn kể từ đại học.,เติบโต; สุกงอม,เขาเป็นผู้ใหญ่ขึ้นตั้งแต่เรียนมหาวิทยาลัย,dewasa; matang,Dia menjadi lebih dewasa sejak kuliah.
mechanism,The clock has a complex mechanism inside.,메커니즘; 기제,시계 내부에 복잡한 기계 장치가 있어요.,メカニズム; 機構,時計の中には複雑な機構がある。,机制; 机械装置,这个钟表内部有一个复杂的机制。,mecanismo,El reloj tiene un mecanismo complejo en su interior.,cơ chế; bộ máy,Đồng hồ có cơ chế phức tạp bên trong.,กลไก,นาฬิกามีกลไกซับซ้อนอยู่ข้างใน,mekanisme,Jam itu memiliki mekanisme yang rumit di dalamnya.
medium,Social media is a powerful communication medium.,매체; 중간,소셜 미디어는 강력한 소통 매체예요.,媒体; メディア; 中間,ソーシャルメディアは強力なコミュニケーション媒体だ。,媒介; 中等的,社交媒体是一种强大的传播媒介。,medio,Las redes sociales son un medio de comunicación poderoso.,phương tiện; truyền thông,Mạng xã hội là phương tiện giao tiếp mạnh mẽ.,สื่อ; ปานกลาง,สื่อสังคมเป็นสื่อการสื่อสารที่ทรงพลัง,media; medium,Media sosial adalah medium komunikasi yang kuat.
merit,The proposal has several merits.,장점; 가치,그 제안에는 여러 장점이 있어요.,利点; 長所; 功績,その提案にはいくつかの利点がある。,优点; 价值,该提案有几个优点。,mérito; ventaja,La propuesta tiene varios méritos.,ưu điểm; giá trị,Đề xuất có nhiều ưu điểm.,ข้อดี; คุณค่า,ข้อเสนอมีข้อดีหลายประการ,keunggulan; prestasi,Proposal itu memiliki beberapa keunggulan.
migration,Bird migration occurs every autumn.,이주; 이동,새의 이동은 매년 가을에 일어나요.,渡り; 移動; 移住,鳥の渡りは毎年秋に起こる。,迁徙; 移民,鸟类迁徙每年秋天发生。,migración,La migración de aves ocurre cada otoño.,sự di cư,Di cư chim xảy ra mỗi mùa thu.,การอพยพ,การอพยพของนกเกิดขึ้นทุกฤดูใบไม้ร่วง,migrasi,Migrasi burung terjadi setiap musim gugur.
minimize,We should minimize waste in the office.,최소화하다,사무실에서 낭비를 최소화해야 해요.,最小限にする,オフィスでの無駄を最小限にすべきだ。,最小化; 减少,我们应该尽量减少办公室浪费。,minimizar,Debemos minimizar los desperdicios en la oficina.,giảm thiểu,Chúng ta nên giảm thiểu lãng phí ở văn phòng.,ลดให้น้อยที่สุด,เราควรลดการสิ้นเปลืองในสำนักงานให้น้อยที่สุด,meminimalkan,Kita harus meminimalkan limbah di kantor.
minor,It was only a minor injury.,사소한; 경미한,그것은 사소한 부상에 불과했어요.,軽微な; 小さな,軽微なけがに過ぎなかった。,轻微的; 次要的,那只是一个轻微的伤。,menor; leve,Fue solo una lesión menor.,nhỏ; nhẹ,Đó chỉ là vết thương nhẹ.,เล็กน้อย; ไม่สำคัญ,มันเป็นเพียงอาการบาดเจ็บเล็กน้อย,kecil; ringan,Itu hanya cedera ringan.
modify,We need to modify the design slightly.,수정하다; 변경하다,디자인을 약간 수정해야 해요.,修正する; 変更する,デザインを少し修正する必要がある。,修改; 更改,我们需要稍微修改设计。,modificar,Necesitamos modificar el diseño ligeramente.,sửa đổi; thay đổi,Chúng tôi cần sửa đổi thiết kế một chút.,ปรับเปลี่ยน; แก้ไข,เราต้องปรับเปลี่ยนการออกแบบเล็กน้อย,memodifikasi; mengubah,Kami perlu memodifikasi desainnya sedikit.
motive,Police are trying to find the motive for the crime.,동기,경찰이 범죄의 동기를 찾으려고 해요.,動機,警察は犯罪の動機を見つけようとしている。,动机,警方正在试图找出犯罪动机。,motivo,La policía está tratando de encontrar el motivo del crimen.,động cơ; lý do,Cảnh sát đang tìm động cơ gây án.,แรงจูงใจ; สาเหตุ,ตำรวจพยายามหาแรงจูงใจในการก่ออาชญากรรม,motif; alasan,Polisi mencoba menemukan motif kejahatan tersebut.
mutual,They have a mutual respect for each other.,상호의; 서로의,그들은 서로를 존중해요.,互いの; 相互の,彼らは互いに尊敬し合っている。,互相的; 共同的,他们互相尊重。,mutuo; recíproco,Tienen un respeto mutuo el uno por el otro.,chung; lẫn nhau,Họ có sự tôn trọng lẫn nhau.,ร่วมกัน; ต่างตอบแทน,พวกเขามีความเคารพซึ่งกันและกัน,saling; timbal balik,Mereka saling menghormati satu sama lain.
neutral,Switzerland remained neutral during the war.,중립적인,스위스는 전쟁 동안 중립을 유지했어요.,中立の,スイスは戦争中中立を保った。,中立的,瑞士在战争期间保持中立。,neutral,Suiza permaneció neutral durante la guerra.,trung lập,Thụy Sĩ giữ trung lập trong chiến tranh.,เป็นกลาง,สวิตเซอร์แลนด์วางตัวเป็นกลางระหว่างสงคราม,netral,Swiss tetap netral selama perang.
norm,Tipping is a cultural norm in the United States.,규범; 기준,팁을 주는 것은 미국의 문화적 규범이에요.,規範; 基準,チップを渡すことはアメリカの文化的規範だ。,规范; 准则,给小费是美国的文化规范。,norma,Dar propina es una norma cultural en Estados Unidos.,chuẩn mực,Tiền tip là chuẩn mực văn hóa ở Mỹ.,บรรทัดฐาน,การให้ทิปเป็นบรรทัดฐานทางวัฒนธรรมในสหรัฐอเมริกา,norma; standar,Memberi tip adalah norma budaya di Amerika Serikat.
notion,I reject the notion that money brings happiness.,개념; 견해,돈이 행복을 가져온다는 생각을 거부해요.,概念; 考え,お金が幸福をもたらすという考えを拒否する。,概念; 想法,我拒绝金钱能带来幸福的观点。,noción; idea,Rechazo la noción de que el dinero trae felicidad.,quan niệm; ý kiến,Tôi bác bỏ quan niệm tiền mua được hạnh phúc.,ความคิด; แนวคิด,ฉันปฏิเสธแนวคิดที่ว่าเงินนำมาซึ่งความสุข,gagasan; anggapan,Saya menolak anggapan bahwa uang membawa kebahagiaan.
numerous,She has published numerous research papers.,다수의; 수많은,그녀는 수많은 연구 논문을 출판했어요.,多数の; 多くの,彼女は多数の研究論文を発表した。,许多的; 大量的,她发表了大量研究论文。,numeroso,Ha publicado numerosos artículos de investigación.,nhiều; vô số,Cô ấy đã công bố nhiều bài nghiên cứu.,จำนวนมาก; มากมาย,เธอตีพิมพ์บทความวิจัยจำนวนมาก,banyak; beberapa,Dia telah menerbitkan banyak makalah penelitian.
obstacle,Lack of funding is a major obstacle.,장애물; 방해,자금 부족이 주요 장애물이에요.,障害; 障壁,資金不足が大きな障害だ。,障碍,缺乏资金是一个主要障碍。,obstáculo,La falta de financiación es un gran obstáculo.,trở ngại; chướng ngại,Thiếu vốn là trở ngại lớn.,อุปสรรค,การขาดเงินทุนเป็นอุปสรรคสำคัญ,hambatan; rintangan,Kurangnya pendanaan adalah hambatan utama.
obtain,How can I obtain a visa for Japan?,얻다; 획득하다,일본 비자를 어떻게 얻을 수 있나요?,取得する; 入手する,日本のビザをどうやって取得できますか?,获得; 取得,我怎样才能获得日本签证？,obtener,¿Cómo puedo obtener una visa para Japón?,đạt được; xin,Làm sao tôi có thể xin visa đi Nhật?,ได้มา; ขอ,ฉันจะขอวีซ่าไปญี่ปุ่นได้อย่างไร,memperoleh; mendapatkan,Bagaimana saya bisa mendapatkan visa untuk Jepang?
occupy,The army occupied the city for two years.,점령하다; 차지하다,군대가 도시를 2년간 점령했어요.,占領する; 占める,軍が2年間その街を占領した。,占领; 占据,军队占领了这座城市两年。,ocupar,El ejército ocupó la ciudad durante dos años.,chiếm đóng,Quân đội chiếm đóng thành phố hai năm.,ยึดครอง; ครอบครอง,กองทัพยึดครองเมืองเป็นเวลาสองปี,menduduki; menempati,Tentara menduduki kota itu selama dua tahun.
ongoing,The investigation is still ongoing.,진행 중인,조사가 아직 진행 중이에요.,進行中の,調査はまだ進行中だ。,正在进行的,调查仍在进行中。,en curso; continuo,La investigación sigue en curso.,đang diễn ra,Cuộc điều tra vẫn đang diễn ra.,อยู่ระหว่างดำเนินการ,การสืบสวนยังคงดำเนินอยู่,sedang berlangsung,Penyelidikan masih berlangsung.
oppose,Many citizens opposed the new law.,반대하다,많은 시민들이 새 법에 반대했어요.,反対する,多くの市民が新しい法律に反対した。,反对,许多市民反对新法律。,oponerse a,Muchos ciudadanos se opusieron a la nueva ley.,phản đối,Nhiều công dân phản đối luật mới.,คัดค้าน; ต่อต้าน,พลเมืองจำนวนมากคัดค้านกฎหมายใหม่,menentang; menolak,Banyak warga menentang undang-undang baru itu.
orient,We need to orient new employees to the office.,적응시키다; 방향을 잡다,새 직원들을 사무실에 적응시켜야 해요.,適応させる; 方向付ける,新しい従業員をオフィスに適応させる必要がある。,使适应; 引导,我们需要让新员工适应办公室。,orientar,Necesitamos orientar a los nuevos empleados en la oficina.,hướng dẫn; định hướng,Chúng tôi cần hướng dẫn nhân viên mới.,ปฐมนิเทศ; จัดทิศทาง,เราต้องปฐมนิเทศพนักงานใหม่,mengorientasikan; memperkenalkan,Kami perlu mengorientasikan karyawan baru ke kantor.
outcome,The outcome of the election surprised everyone.,결과,선거 결과가 모두를 놀라게 했어요.,結果; 成果,選挙の結果が皆を驚かせた。,结果; 成果,选举结果让所有人都感到惊讶。,resultado; desenlace,El resultado de la elección sorprendió a todos.,kết quả,Kết quả bầu cử khiến mọi người ngạc nhiên.,ผลลัพธ์,ผลการเลือกตั้งทำให้ทุกคนประหลาดใจ,hasil; akibat,Hasil pemilihan mengejutkan semua orang.
outline,She outlined the main points of her presentation.,개요; 개략적으로 설명하다,그녀는 발표의 요점을 개략적으로 설명했어요.,概要; 概略を述べる,彼女はプレゼンテーションの要点を概説した。,概述; 大纲,她概述了演示的要点。,resumir; esquema,Ella delineó los puntos principales de su presentación.,phác thảo; nêu khái quát,Cô ấy phác thảo các điểm chính của bài thuyết trình.,สรุป; ร่าง,เธอสรุปประเด็นหลักของการนำเสนอ,menguraikan; garis besar,Dia menguraikan poin-poin utama presentasinya.
output,The factory increased its output by twenty percent.,생산량; 산출,공장 생산량이 20% 증가했어요.,生産量; 出力,工場が生産量を20%増加させた。,产量; 输出,工厂产量增加了百分之二十。,producción; resultado,La fábrica aumentó su producción un veinte por ciento.,sản lượng; đầu ra,Nhà máy tăng sản lượng hai mươi phần trăm.,ผลผลิต; เอาต์พุต,โรงงานเพิ่มผลผลิตขึ้นร้อยละยี่สิบ,output; produksi,Pabrik meningkatkan outputnya dua puluh persen.
overall,The overall quality of the product is good.,전체적인; 총체적인,제품의 전체적인 품질은 좋아요.,全体的な; 総合的な,製品の全体的な品質は良い。,总体的; 整体的,产品的整体质量很好。,general; total,La calidad general del producto es buena.,tổng thể; chung,Chất lượng tổng thể của sản phẩm tốt.,โดยรวม; ทั้งหมด,คุณภาพโดยรวมของผลิตภัณฑ์ดี,secara keseluruhan; menyeluruh,Kualitas keseluruhan produk itu bagus.
overcome,She overcame her fear of public speaking.,극복하다,그녀는 대중 연설에 대한 두려움을 극복했어요.,克服する; 乗り越える,彼女は人前で話す恐怖を克服した。,克服; 战胜,她克服了公开演讲的恐惧。,superar; vencer,Superó su miedo a hablar en público.,vượt qua; khắc phục,Cô ấy vượt qua nỗi sợ nói trước đám đông.,เอาชนะ; ข้ามพ้น,เธอเอาชนะความกลัวการพูดในที่สาธารณะ,mengatasi; menang atas,Dia mengatasi ketakutannya berbicara di depan umum.
overlap,The two projects overlap in several areas.,겹치다; 중복되다,두 프로젝트가 여러 영역에서 겹쳐요.,重なる; 重複する,二つのプロジェクトはいくつかの分野で重なっている。,重叠; 交叉,两个项目在几个方面有重叠。,superponerse; coincidir,Los dos proyectos se superponen en varias áreas.,trùng lặp; chồng chéo,Hai dự án chồng chéo ở nhiều lĩnh vực.,ทับซ้อน; เหลื่อมล้ำ,สองโปรเจกต์ทับซ้อนกันในหลายด้าน,tumpang tindih,Kedua proyek tumpang tindih di beberapa area.
perceive,Children perceive the world differently from adults.,인식하다,아이들은 어른과 다르게 세상을 인식한다.,知覚する,子どもは大人とは異なる方法で世界を知覚する。,感知,孩子们对世界的感知与成人不同。,percibir,Los niños perciben el mundo de manera diferente a los adultos.,nhận thức,Trẻ em nhận thức thế giới khác với người lớn.,รับรู้,เด็กรับรู้โลกแตกต่างจากผู้ใหญ่,memahami,Anak-anak memahami dunia secara berbeda dari orang dewasa.
cognitive,Cognitive development is rapid during early childhood.,인지적인,인지 발달은 유아기에 빠르게 진행된다.,認知の,認知発達は幼児期に急速に進む。,认知的,认知发展在幼儿期进展迅速。,cognitivo,El desarrollo cognitivo es rápido durante la primera infancia.,nhận thức,Phát triển nhận thức diễn ra nhanh chóng trong thời thơ ấu.,ทางปัญญา,พัฒนาการทางปัญญาเป็นไปอย่างรวดเร็วในช่วงวัยเด็ก,kognitif,Perkembangan kognitif berlangsung cepat selama masa kanak-kanak awal.
stimulus,The loud noise was an unexpected stimulus that startled everyone.,자극,큰 소음은 모두를 놀라게 한 예상치 못한 자극이었다.,刺激,大きな音は皆を驚かせた予想外の刺激だった。,刺激,那声巨响是一个让所有人吃惊的意外刺激。,estímulo,El ruido fuerte fue un estímulo inesperado que asustó a todos.,kích thích,Tiếng ồn lớn là một kích thích bất ngờ khiến mọi người giật mình.,สิ่งกระตุ้น,เสียงดังเป็นสิ่งกระตุ้นที่ไม่คาดคิดที่ทำให้ทุกคนตกใจ,rangsangan,Suara keras itu adalah rangsangan tak terduga yang mengejutkan semua orang.
disorder,Anxiety disorder affects millions of people worldwide.,장애,불안 장애는 전 세계 수백만 명에게 영향을 미친다.,障害,不安障害は世界中の何百万人もの人々に影響を与えている。,障碍,焦虑障碍影响着全球数百万人。,trastorno,El trastorno de ansiedad afecta a millones de personas en todo el mundo.,rối loạn,Rối loạn lo âu ảnh hưởng đến hàng triệu người trên thế giới.,ความผิดปกติ,โรควิตกกังวลส่งผลกระทบต่อผู้คนนับล้านทั่วโลก,gangguan,Gangguan kecemasan memengaruhi jutaan orang di seluruh dunia.
stereotype,We should challenge harmful stereotypes in society.,고정관념,우리는 사회의 해로운 고정관념에 도전해야 한다.,ステレオタイプ,私たちは社会の有害なステレオタイプに挑戦すべきだ。,刻板印象,我们应该挑战社会中有害的刻板印象。,estereotipo,Debemos desafiar los estereotipos dañinos en la sociedad.,định kiến,Chúng ta nên thách thức các định kiến có hại trong xã hội.,อคติแบบเหมารวม,เราควรท้าทายอคติแบบเหมารวมที่เป็นอันตรายในสังคม,stereotip,Kita harus menantang stereotip berbahaya dalam masyarakat.
poverty,Reducing poverty requires investment in education.,빈곤,빈곤을 줄이려면 교육에 대한 투자가 필요하다.,貧困,貧困の削減には教育への投資が必要である。,贫困,减少贫困需要对教育进行投资。,pobreza,Reducir la pobreza requiere inversión en educación.,nghèo đói,Giảm nghèo đói đòi hỏi đầu tư vào giáo dục.,ความยากจน,การลดความยากจนต้องมีการลงทุนในการศึกษา,kemiskinan,Mengurangi kemiskinan memerlukan investasi dalam pendidikan.
assimilate,Immigrants often struggle to assimilate into a new culture.,동화되다,이민자들은 종종 새로운 문화에 동화되는 데 어려움을 겪는다.,同化する,移民はしばしば新しい文化に同化するのに苦労する。,融入,移民常常很难融入新文化。,asimilarse,Los inmigrantes a menudo luchan por asimilarse a una nueva cultura.,hòa nhập,Người nhập cư thường gặp khó khăn khi hòa nhập vào nền văn hóa mới.,กลมกลืน,ผู้อพยพมักมีปัญหาในการกลมกลืนเข้ากับวัฒนธรรมใหม่,berasimilasi,Imigran sering kesulitan untuk berasimilasi ke dalam budaya baru.
hierarchy,The company has a strict management hierarchy.,위계,그 회사는 엄격한 경영 위계를 가지고 있다.,階層,その会社は厳格な経営階層を持っている。,等级制度,该公司有严格的管理等级制度。,jerarquía,La empresa tiene una estricta jerarquía de gestión.,hệ thống cấp bậc,Công ty có hệ thống cấp bậc quản lý nghiêm ngặt.,ลำดับชั้น,บริษัทมีลำดับชั้นการบริหารที่เข้มงวด,hierarki,Perusahaan itu memiliki hierarki manajemen yang ketat.
