english,example,ko_meaning,ko_example,ja_meaning,ja_example,zh_meaning,zh_example,es_meaning,es_example,vi_meaning,vi_example,th_meaning,th_example,id_meaning,id_example
photosynthesis,Photosynthesis converts sunlight into chemical energy in plants.,광합성,식물은 광합성을 통해 햇빛을 화학 에너지로 전환한다.,光合成,植物は光合成によって太陽光を化学エネルギーに変換する。,光合作用,植物通过光合作用将阳光转化为化学能。,fotosíntesis,La fotosíntesis convierte la luz solar en energía química en las plantas.,quang hợp,Quang hợp chuyển đổi ánh sáng mặt trời thành năng lượng hóa học trong thực vật.,การสังเคราะห์แสง,การสังเคราะห์แสงเปลี่ยนแสงแดดเป็นพลังงานเคมีในพืช,fotosintesis,Fotosintesis mengubah sinar matahari menjadi energi kimia pada tumbuhan.
empirical,The researcher relied on empirical evidence to support her hypothesis.,경험적인,연구자는 자신의 가설을 뒷받침하기 위해 경험적 증거에 의존했다.,経験的な,研究者は仮説を裏付けるために経験的証拠に頼った。,经验的,研究人员依靠经验证据来支持她的假设。,empírico,La investigadora se basó en evidencia empírica para respaldar su hipótesis.,thực nghiệm,Nhà nghiên cứu dựa vào bằng chứng thực nghiệm để hỗ trợ giả thuyết của mình.,เชิงประจักษ์,นักวิจัยพึ่งพาหลักฐานเชิงประจักษ์เพื่อสนับสนุนสมมติฐานของเธอ,empiris,Peneliti mengandalkan bukti empiris untuk mendukung hipotesisnya.
disambiguation,Disambiguation of the term was necessary for the academic paper.,명확화,해당 용어의 명확화는 학술 논문에 필수적이었다.,曖昧性の解消,その用語の曖昧性解消は学術論文に必要だった。,消歧,该术语的消歧对于学术论文是必要的。,desambiguación,La desambiguación del término era necesaria para el artículo académico.,định rõ nghĩa,Việc định rõ nghĩa của thuật ngữ là cần thiết cho bài báo học thuật.,การแก้ความกำกวม,การแก้ความกำกวมของคำนี้จำเป็นสำหรับบทความวิชาการ,disambiguasi,Disambiguasi istilah tersebut diperlukan untuk makalah akademis.
anthropology,Anthropology examines human societies across different time periods.,인류학,인류학은 다양한 시대에 걸친 인간 사회를 연구한다.,人類学,人類学はさまざまな時代の人間社会を調査する。,人类学,人类学研究不同时期的人类社会。,antropología,La antropología examina las sociedades humanas en diferentes períodos.,nhân chủng học,Nhân chủng học nghiên cứu các xã hội loài người qua các thời kỳ khác nhau.,มานุษยวิทยา,มานุษยวิทยาศึกษาสังคมมนุษย์ในช่วงเวลาต่างๆ,antropologi,Antropologi mempelajari masyarakat manusia di berbagai periode waktu.
stratification,Social stratification creates distinct hierarchies within communities.,계층화,사회적 계층화는 공동체 내에 뚜렷한 위계를 만든다.,階層化,社会的階層化はコミュニティ内に明確な階層を作り出す。,分层,社会分层在社区内创造了不同的等级制度。,estratificación,La estratificación social crea jerarquías distintas dentro de las comunidades.,phân tầng,Phân tầng xã hội tạo ra các hệ thống phân cấp riêng biệt trong cộng đồng.,การแบ่งชั้น,การแบ่งชั้นทางสังคมสร้างลำดับชั้นที่ชัดเจนภายในชุมชน,stratifikasi,Stratifikasi sosial menciptakan hierarki yang berbeda dalam komunitas.
assimilate,Immigrants often assimilate into the dominant culture over generations.,동화하다,이민자들은 세대를 거쳐 지배적 문화에 동화되는 경우가 많다.,同化する,移民は世代を経て支配的文化に同化することが多い。,同化,移民往往经过几代人逐渐同化到主流文化中。,asimilar,Los inmigrantes a menudo se asimilan a la cultura dominante con el tiempo.,đồng hóa,Người nhập cư thường đồng hóa vào văn hóa chủ đạo qua nhiều thế hệ.,กลมกลืน,ผู้อพยพมักจะกลมกลืนเข้ากับวัฒนธรรมหลักเมื่อเวลาผ่านไป,berasimilasi,Imigran sering berasimilasi ke dalam budaya dominan dari generasi ke generasi.
biodiversity,Biodiversity loss threatens the stability of global ecosystems.,생물 다양성,생물 다양성의 손실은 전 세계 생태계의 안정성을 위협한다.,生物多様性,生物多様性の喪失は地球規模の生態系の安定を脅かす。,生物多样性,生物多样性的丧失威胁着全球生态系统的稳定。,biodiversidad,La pérdida de biodiversidad amenaza la estabilidad de los ecosistemas globales.,đa dạng sinh học,Mất đa dạng sinh học đe dọa sự ổn định của các hệ sinh thái toàn cầu.,ความหลากหลายทางชีวภาพ,การสูญเสียความหลากหลายทางชีวภาพคุกคามเสถียรภาพของระบบนิเวศโลก,keanekaragaman hayati,Hilangnya keanekaragaman hayati mengancam stabilitas ekosistem global.
catalyst,The enzyme acts as a catalyst in the biochemical reaction.,촉매,그 효소는 생화학 반응에서 촉매로 작용한다.,触媒,その酵素は生化学反応において触媒として作用する。,催化剂,该酶在生化反应中充当催化剂。,catalizador,La enzima actúa como catalizador en la reacción bioquímica.,chất xúc tác,Enzyme hoạt động như một chất xúc tác trong phản ứng sinh hóa.,ตัวเร่งปฏิกิริยา,เอนไซม์ทำหน้าที่เป็นตัวเร่งปฏิกิริยาในปฏิกิริยาทางชีวเคมี,katalis,Enzim bertindak sebagai katalis dalam reaksi biokimia.
circumscribe,The professor circumscribed the scope of the research project.,제한하다,교수는 연구 프로젝트의 범위를 제한했다.,制限する,教授は研究プロジェクトの範囲を制限した。,限制,教授限制了研究项目的范围。,circunscribir,El profesor circunscribió el alcance del proyecto de investigación.,giới hạn,Giáo sư đã giới hạn phạm vi của dự án nghiên cứu.,จำกัดขอบเขต,ศาสตราจารย์จำกัดขอบเขตของโครงการวิจัย,membatasi,Profesor membatasi ruang lingkup proyek penelitian.
cognition,Cognition encompasses all mental processes involved in thinking.,인지,인지는 사고에 관련된 모든 정신적 과정을 포괄한다.,認知,認知は思考に関わるすべての精神的プロセスを包含する。,认知,认知涵盖了与思维相关的所有心理过程。,cognición,La cognición abarca todos los procesos mentales involucrados en el pensamiento.,nhận thức,Nhận thức bao gồm tất cả các quá trình tinh thần liên quan đến tư duy.,การรับรู้,การรับรู้ครอบคลุมกระบวนการทางจิตทั้งหมดที่เกี่ยวข้องกับการคิด,kognisi,Kognisi mencakup semua proses mental yang terlibat dalam berpikir.
corroborate,New findings corroborate the original theory proposed in 1998.,확증하다,새로운 발견은 1998년에 제안된 원래 이론을 확증한다.,裏付ける,新たな発見は1998年に提唱された元の理論を裏付ける。,证实,新发现证实了1998年提出的原始理论。,corroborar,Los nuevos hallazgos corroboran la teoría original propuesta en 1998.,chứng thực,Những phát hiện mới chứng thực lý thuyết ban đầu được đề xuất năm 1998.,ยืนยัน,การค้นพบใหม่ยืนยันทฤษฎีดั้งเดิมที่เสนอในปี 1998,menguatkan,Temuan baru menguatkan teori asli yang diajukan pada tahun 1998.
demographic,Demographic shifts have altered the political landscape of the region.,인구통계학적,인구통계학적 변화가 해당 지역의 정치적 지형을 변화시켰다.,人口統計学的,人口統計学的変化がその地域の政治的状況を変えた。,人口统计的,人口统计变化改变了该地区的政治格局。,demográfico,Los cambios demográficos han alterado el panorama político de la región.,nhân khẩu học,Những thay đổi nhân khẩu học đã làm thay đổi bối cảnh chính trị của khu vực.,ประชากรศาสตร์,การเปลี่ยนแปลงทางประชากรศาสตร์ได้เปลี่ยนแปลงภูมิทัศน์ทางการเมืองของภูมิภาค,demografis,Pergeseran demografis telah mengubah lanskap politik kawasan tersebut.
dichotomy,The dichotomy between nature and nurture remains a central debate.,이분법,본성과 양육 사이의 이분법은 여전히 핵심적인 논쟁으로 남아 있다.,二分法,自然と育ちの二分法は依然として中心的な議論である。,二分法,先天与后天的二分法仍然是一个核心争论。,dicotomía,La dicotomía entre naturaleza y crianza sigue siendo un debate central.,sự phân đôi,Sự phân đôi giữa bản chất và nuôi dưỡng vẫn là một cuộc tranh luận trung tâm.,ทวิภาวะ,ทวิภาวะระหว่างธรรมชาติและการเลี้ยงดูยังคงเป็นการถกเถียงหลัก,dikotomi,Dikotomi antara bawaan dan lingkungan tetap menjadi perdebatan utama.
disseminate,Researchers disseminate their findings through peer-reviewed journals.,보급하다,연구자들은 동료 심사 학술지를 통해 연구 결과를 보급한다.,普及する,研究者は査読付き雑誌を通じて研究結果を普及させる。,传播,研究人员通过同行评审期刊传播他们的研究结果。,difundir,Los investigadores difunden sus hallazgos a través de revistas revisadas por pares.,phổ biến,Các nhà nghiên cứu phổ biến kết quả của họ thông qua các tạp chí bình duyệt.,เผยแพร่,นักวิจัยเผยแพร่ผลการค้นพบผ่านวารสารที่ผ่านการตรวจสอบโดยผู้เชี่ยวชาญ,menyebarkan,Peneliti menyebarkan temuan mereka melalui jurnal yang ditinjau sejawat.
ecosystem,The coral reef ecosystem supports thousands of marine species.,생태계,산호초 생태계는 수천 종의 해양 생물을 지원한다.,生態系,サンゴ礁の生態系は何千もの海洋種を支えている。,生态系统,珊瑚礁生态系统支撑着数千种海洋物种。,ecosistema,El ecosistema del arrecife de coral sustenta miles de especies marinas.,hệ sinh thái,Hệ sinh thái rạn san hô hỗ trợ hàng nghìn loài sinh vật biển.,ระบบนิเวศ,ระบบนิเวศแนวปะการังสนับสนุนสิ่งมีชีวิตทางทะเลนับพันชนิด,ekosistem,Ekosistem terumbu karang mendukung ribuan spesies laut.
efficacy,Clinical trials measure the efficacy of new pharmaceutical drugs.,효능,임상 시험은 신약의 효능을 측정한다.,有効性,臨床試験は新薬の有効性を測定する。,功效,临床试验衡量新药的功效。,eficacia,Los ensayos clínicos miden la eficacia de nuevos fármacos.,hiệu quả,Các thử nghiệm lâm sàng đo lường hiệu quả của thuốc mới.,ประสิทธิภาพ,การทดลองทางคลินิกวัดประสิทธิภาพของยาใหม่,kemanjuran,Uji klinis mengukur kemanjuran obat farmasi baru.
endemic,Malaria is endemic to many tropical regions of the world.,풍토병의,말라리아는 세계의 많은 열대 지역에 풍토병이다.,風土病の,マラリアは世界の多くの熱帯地域に風土病である。,地方性的,疟疾是世界许多热带地区的地方性疾病。,endémico,La malaria es endémica en muchas regiones tropicales del mundo.,đặc hữu,Sốt rét là bệnh đặc hữu ở nhiều vùng nhiệt đới trên thế giới.,เฉพาะถิ่น,มาลาเรียเป็นโรคเฉพาะถิ่นในหลายภูมิภาคเขตร้อนของโลก,endemik,Malaria bersifat endemik di banyak wilayah tropis dunia.
episodic,Episodic memory allows humans to recall specific past events.,일화적인,일화적 기억은 인간이 특정 과거 사건을 회상할 수 있게 한다.,エピソード的な,エピソード記憶により人間は特定の過去の出来事を思い出せる。,情景的,情景记忆使人类能够回忆特定的过去事件。,episódico,La memoria episódica permite a los humanos recordar eventos pasados específicos.,theo giai đoạn,Trí nhớ theo giai đoạn cho phép con người nhớ lại các sự kiện cụ thể trong quá khứ.,เป็นตอนๆ,ความจำแบบเป็นตอนๆ ช่วยให้มนุษย์สามารถระลึกถึงเหตุการณ์ในอดีตได้,episodik,Memori episodik memungkinkan manusia mengingat peristiwa masa lalu tertentu.
erosion,Soil erosion is accelerated by deforestation and poor land management.,침식,토양 침식은 삼림 벌채와 부실한 토지 관리로 가속화된다.,浸食,土壌浸食は森林伐採と不適切な土地管理によって加速される。,侵蚀,森林砍伐和不良的土地管理加速了土壤侵蚀。,erosión,La erosión del suelo se acelera por la deforestación y la mala gestión del terreno.,xói mòn,Xói mòn đất được đẩy nhanh bởi nạn phá rừng và quản lý đất đai kém.,การกัดเซาะ,การกัดเซาะดินถูกเร่งโดยการตัดไม้ทำลายป่าและการจัดการที่ดินที่ไม่ดี,erosi,Erosi tanah dipercepat oleh deforestasi dan pengelolaan lahan yang buruk.
fermentation,Fermentation is a metabolic process that produces alcohol from sugars.,발효,발효는 당에서 알코올을 생성하는 대사 과정이다.,発酵,発酵は糖からアルコールを生成する代謝プロセスである。,发酵,发酵是一种从糖类产生酒精的代谢过程。,fermentación,La fermentación es un proceso metabólico que produce alcohol a partir de azúcares.,lên men,Lên men là một quá trình trao đổi chất tạo ra rượu từ đường.,การหมัก,การหมักเป็นกระบวนการเผาผลาญที่ผลิตแอลกอฮอล์จากน้ำตาล,fermentasi,Fermentasi adalah proses metabolisme yang menghasilkan alkohol dari gula.
geothermal,Geothermal energy harnesses heat from beneath the Earth's surface.,지열의,지열 에너지는 지구 표면 아래의 열을 활용한다.,地熱の,地熱エネルギーは地球の表面下の熱を利用する。,地热的,地热能利用地球表面下的热量。,geotérmico,La energía geotérmica aprovecha el calor del subsuelo terrestre.,địa nhiệt,Năng lượng địa nhiệt khai thác nhiệt từ bên dưới bề mặt Trái Đất.,ความร้อนใต้พิภพ,พลังงานความร้อนใต้พิภพใช้ความร้อนจากใต้พื้นผิวโลก,geotermal,Energi geotermal memanfaatkan panas dari bawah permukaan bumi.
herbivore,Herbivores play a crucial role in controlling plant population growth.,초식동물,초식동물은 식물 개체군 성장을 조절하는 데 중요한 역할을 한다.,草食動物,草食動物は植物の個体数増加を制御する重要な役割を果たす。,食草动物,食草动物在控制植物种群增长方面起着关键作用。,herbívoro,Los herbívoros desempeñan un papel crucial en el control del crecimiento vegetal.,động vật ăn cỏ,Động vật ăn cỏ đóng vai trò quan trọng trong việc kiểm soát sự tăng trưởng của quần thể thực vật.,สัตว์กินพืช,สัตว์กินพืชมีบทบาทสำคัญในการควบคุมการเติบโตของประชากรพืช,herbivora,Herbivora memainkan peran penting dalam mengendalikan pertumbuhan populasi tanaman.
homogeneous,The solution must be homogeneous for the experiment to yield accurate results.,균질의,실험에서 정확한 결과를 얻으려면 용액이 균질해야 한다.,均質な,実験で正確な結果を得るには溶液は均質でなければならない。,均匀的,溶液必须是均匀的才能使实验产生准确的结果。,homogéneo,La solución debe ser homogénea para que el experimento dé resultados precisos.,đồng nhất,Dung dịch phải đồng nhất để thí nghiệm cho kết quả chính xác.,เป็นเนื้อเดียวกัน,สารละลายต้องเป็นเนื้อเดียวกันเพื่อให้การทดลองได้ผลลัพธ์ที่แม่นยำ,homogen,Larutan harus homogen agar eksperimen menghasilkan hasil yang akurat.
indigenous,Indigenous populations possess invaluable knowledge of local ecosystems.,토착의,토착 주민들은 지역 생태계에 대한 귀중한 지식을 보유하고 있다.,先住民の,先住民は地域の生態系に関する貴重な知識を持っている。,土著的,土著居民拥有关于当地生态系统的宝贵知识。,indígena,Las poblaciones indígenas poseen un conocimiento invaluable de los ecosistemas locales.,bản địa,Các dân tộc bản địa sở hữu kiến thức vô giá về hệ sinh thái địa phương.,พื้นเมือง,ประชากรพื้นเมืองมีความรู้อันล้ำค่าเกี่ยวกับระบบนิเวศท้องถิ่น,pribumi,Populasi pribumi memiliki pengetahuan yang sangat berharga tentang ekosistem lokal.
isotope,Carbon-14 is a radioactive isotope used in archaeological dating.,동위원소,탄소-14는 고고학적 연대 측정에 사용되는 방사성 동위원소이다.,同位体,炭素14は考古学的年代測定に使用される放射性同位体である。,同位素,碳-14是一种用于考古测年的放射性同位素。,isótopo,El carbono-14 es un isótopo radiactivo utilizado en la datación arqueológica.,đồng vị,Carbon-14 là một đồng vị phóng xạ được sử dụng trong xác định niên đại khảo cổ.,ไอโซโทป,คาร์บอน-14 เป็นไอโซโทปกัมมันตรังสีที่ใช้ในการหาอายุทางโบราณคดี,isotop,Karbon-14 adalah isotop radioaktif yang digunakan dalam penanggalan arkeologi.
kinetic,Kinetic energy increases proportionally with the square of velocity.,운동의,운동 에너지는 속도의 제곱에 비례하여 증가한다.,運動の,運動エネルギーは速度の二乗に比例して増加する。,动能的,动能与速度的平方成正比增加。,cinético,La energía cinética aumenta proporcionalmente con el cuadrado de la velocidad.,động học,Năng lượng động học tăng tỷ lệ thuận với bình phương vận tốc.,จลน์,พลังงานจลน์เพิ่มขึ้นตามสัดส่วนกับกำลังสองของความเร็ว,kinetik,Energi kinetik meningkat secara proporsional dengan kuadrat kecepatan.
metamorphosis,Metamorphosis transforms a caterpillar into a butterfly through distinct stages.,변태,변태는 뚜렷한 단계를 거쳐 애벌레를 나비로 변화시킨다.,変態,変態は明確な段階を経て毛虫を蝶に変える。,变态发育,变态发育通过不同阶段将毛虫转变为蝴蝶。,metamorfosis,La metamorfosis transforma una oruga en mariposa a través de etapas distintas.,biến thái,Biến thái biến đổi sâu bướm thành bướm qua các giai đoạn riêng biệt.,การเปลี่ยนแปลงรูปร่าง,การเปลี่ยนแปลงรูปร่างเปลี่ยนหนอนผีเสื้อเป็นผีเสื้อผ่านขั้นตอนที่แตกต่าง,metamorfosis,Metamorfosis mengubah ulat menjadi kupu-kupu melalui tahapan yang berbeda.
mitigate,Governments must mitigate the effects of climate change through policy reform.,완화하다,정부는 정책 개혁을 통해 기후 변화의 영향을 완화해야 한다.,軽減する,政府は政策改革を通じて気候変動の影響を軽減しなければならない。,减轻,政府必须通过政策改革来减轻气候变化的影响。,mitigar,Los gobiernos deben mitigar los efectos del cambio climático mediante reformas.,giảm thiểu,Chính phủ phải giảm thiểu tác động của biến đổi khí hậu thông qua cải cách chính sách.,บรรเทา,รัฐบาลต้องบรรเทาผลกระทบของการเปลี่ยนแปลงสภาพภูมิอากาศผ่านการปฏิรูปนโยบาย,mengurangi,Pemerintah harus mengurangi dampak perubahan iklim melalui reformasi kebijakan.
nomenclature,Binomial nomenclature assigns every species a two-part Latin name.,명명법,이명법은 모든 종에 두 부분으로 된 라틴어 이름을 부여한다.,命名法,二名法はすべての種に二部構成のラテン語名を付ける。,命名法,二名法为每个物种分配一个由两部分组成的拉丁名。,nomenclatura,La nomenclatura binomial asigna a cada especie un nombre latino de dos partes.,danh pháp,Danh pháp nhị thức gán cho mỗi loài một tên Latin gồm hai phần.,การตั้งชื่อ,การตั้งชื่อแบบทวินามกำหนดชื่อภาษาละตินสองส่วนให้กับทุกสปีชีส์,nomenklatur,Nomenklatur binomial memberikan setiap spesies nama Latin dua bagian.
paradigm,The discovery of DNA shifted the paradigm in biological sciences.,패러다임,DNA의 발견은 생물과학의 패러다임을 전환시켰다.,パラダイム,DNAの発見は生物科学のパラダイムを転換させた。,范式,DNA的发现改变了生物科学的范式。,paradigma,El descubrimiento del ADN cambió el paradigma en las ciencias biológicas.,mô hình,Việc phát hiện DNA đã thay đổi mô hình trong khoa học sinh học.,กระบวนทัศน์,การค้นพบดีเอ็นเอเปลี่ยนกระบวนทัศน์ในวิทยาศาสตร์ชีวภาพ,paradigma,Penemuan DNA mengubah paradigma dalam ilmu biologi.
quantitative,Quantitative analysis uses numerical data to identify statistical patterns.,정량적인,정량적 분석은 통계적 패턴을 식별하기 위해 수치 데이터를 사용한다.,定量的な,定量分析は統計的パターンを特定するために数値データを使用する。,定量的,定量分析使用数值数据来识别统计模式。,cuantitativo,El análisis cuantitativo usa datos numéricos para identificar patrones estadísticos.,định lượng,Phân tích định lượng sử dụng dữ liệu số để xác định các mô hình thống kê.,เชิงปริมาณ,การวิเคราะห์เชิงปริมาณใช้ข้อมูลตัวเลขเพื่อระบุรูปแบบทางสถิติ,kuantitatif,Analisis kuantitatif menggunakan data numerik untuk mengidentifikasi pola statistik.
replicate,Scientists must replicate experiments to validate their conclusions.,재현하다,과학자들은 결론을 검증하기 위해 실험을 재현해야 한다.,再現する,科学者は結論を検証するために実験を再現しなければならない。,复制,科学家必须复制实验以验证其结论。,replicar,Los científicos deben replicar experimentos para validar sus conclusiones.,tái tạo,Các nhà khoa học phải tái tạo thí nghiệm để xác nhận kết luận của họ.,ทำซ้ำ,นักวิทยาศาสตร์ต้องทำซ้ำการทดลองเพื่อยืนยันข้อสรุป,mereplikasi,Ilmuwan harus mereplikasi eksperimen untuk memvalidasi kesimpulan mereka.
