english,example,ko_meaning,ko_example,ja_meaning,ja_example,zh_meaning,zh_example,es_meaning,es_example,vi_meaning,vi_example,th_meaning,th_example,id_meaning,id_example
dubious,The committee expressed dubious views regarding the proposal's feasibility.,의심스러운,위원회는 제안의 실행 가능성에 대해 의심스러운 견해를 표명했다.,疑わしい,委員会は提案の実現可能性について疑わしい見解を示した。,可疑的,委员会对该提案的可行性表示了可疑的看法。,dudoso,El comité expresó opiniones dudosas sobre la viabilidad de la propuesta.,đáng ngờ,Ủy ban bày tỏ quan điểm đáng ngờ về tính khả thi của đề xuất.,น่าสงสัย,คณะกรรมการแสดงความเห็นที่น่าสงสัยเกี่ยวกับความเป็นไปได้ของข้อเสนอ,meragukan,Komite menyatakan pandangan yang meragukan mengenai kelayakan proposal tersebut.
durable,Researchers developed a durable synthetic material resistant to extreme temperatures.,내구성 있는,연구자들은 극한 온도에 견디는 내구성 있는 합성 소재를 개발했다.,耐久性のある,研究者たちは極端な温度に耐える耐久性のある合成素材を開発した。,耐用的,研究人员开发了一种耐极端温度的耐用合成材料。,duradero,Los investigadores desarrollaron un material sintético duradero resistente a temperaturas extremas.,bền,Các nhà nghiên cứu đã phát triển vật liệu tổng hợp bền chịu được nhiệt độ khắc nghiệt.,ทนทาน,นักวิจัยพัฒนาวัสดุสังเคราะห์ที่ทนทานต่ออุณหภูมิสุดขั้ว,tahan lama,Peneliti mengembangkan material sintetis tahan lama yang tahan terhadap suhu ekstrem.
dynamic,The dynamic interplay between supply and demand determines market equilibrium.,역동적인,수요와 공급 간의 역동적인 상호작용이 시장 균형을 결정한다.,動的な,需要と供給の動的な相互作用が市場均衡を決定する。,动态的,供需之间的动态相互作用决定了市场均衡。,dinámico,La interacción dinámica entre oferta y demanda determina el equilibrio del mercado.,năng động,Sự tương tác năng động giữa cung và cầu quyết định trạng thái cân bằng thị trường.,พลวัต,ปฏิสัมพันธ์ที่เป็นพลวัตระหว่างอุปสงค์และอุปทานกำหนดดุลยภาพของตลาด,dinamis,Interaksi dinamis antara penawaran dan permintaan menentukan keseimbangan pasar.
elaborate,The professor asked students to elaborate on their thesis arguments.,정교한,교수는 학생들에게 논문 주장을 더 자세히 설명하도록 요청했다.,詳述する,教授は学生たちに論文の主張を詳述するよう求めた。,阐述,教授要求学生们阐述他们的论文论点。,elaborar,El profesor pidió a los estudiantes elaborar sus argumentos de tesis.,trình bày chi tiết,Giáo sư yêu cầu sinh viên trình bày chi tiết các luận điểm của luận văn.,อธิบายเพิ่มเติม,ศาสตราจารย์ขอให้นักศึกษาอธิบายเพิ่มเติมเกี่ยวกับข้อโต้แย้งในวิทยานิพนธ์,menjelaskan,Profesor meminta mahasiswa untuk menjelaskan argumen tesis mereka.
elicit,The survey was designed to elicit honest responses from all participants.,이끌어 내다,그 설문 조사는 모든 참가자로부터 솔직한 응답을 이끌어 내도록 설계되었다.,引き出す,その調査はすべての参加者から正直な回答を引き出すように設計された。,引出,该调查旨在引出所有参与者的诚实回答。,provocar,La encuesta fue diseñada para provocar respuestas honestas de todos los participantes.,gợi ra,Cuộc khảo sát được thiết kế để gợi ra phản hồi trung thực từ tất cả người tham gia.,กระตุ้น,แบบสำรวจถูกออกแบบเพื่อกระตุ้นให้ผู้เข้าร่วมทุกคนตอบอย่างตรงไปตรงมา,memperoleh,Survei dirancang untuk memperoleh tanggapan jujur dari semua peserta.
eliminate,The new treatment aims to eliminate harmful bacteria without damaging tissue.,제거하다,새로운 치료법은 조직을 손상시키지 않고 유해 박테리아를 제거하는 것을 목표로 한다.,除去する,新しい治療法は組織を傷つけずに有害な細菌を除去することを目指している。,消除,新疗法旨在消除有害细菌而不损伤组织。,eliminar,El nuevo tratamiento busca eliminar las bacterias dañinas sin dañar el tejido.,loại bỏ,Phương pháp điều trị mới nhằm loại bỏ vi khuẩn có hại mà không làm tổn thương mô.,กำจัด,การรักษาใหม่มุ่งกำจัดแบคทีเรียที่เป็นอันตรายโดยไม่ทำลายเนื้อเยื่อ,menghilangkan,Perawatan baru bertujuan menghilangkan bakteri berbahaya tanpa merusak jaringan.
eloquent,The diplomat delivered an eloquent speech advocating for international cooperation.,웅변의,외교관은 국제 협력을 옹호하는 웅변적인 연설을 했다.,雄弁な,外交官は国際協力を訴える雄弁な演説を行った。,雄辩的,外交官发表了一篇雄辩的演讲，倡导国际合作。,elocuente,El diplomático pronunció un discurso elocuente abogando por la cooperación internacional.,hùng biện,Nhà ngoại giao đã đọc một bài phát biểu hùng biện ủng hộ hợp tác quốc tế.,มีวาทศิลป์,นักการทูตกล่าวสุนทรพจน์ที่มีวาทศิลป์สนับสนุนความร่วมมือระหว่างประเทศ,fasih,Diplomat itu menyampaikan pidato yang fasih mengadvokasi kerja sama internasional.
emanate,The philosophical ideas emanate from ancient Greek intellectual traditions.,발산하다,그 철학적 사상은 고대 그리스 지적 전통에서 발산한다.,発する,その哲学的思想は古代ギリシャの知的伝統から発している。,源于,这些哲学思想源于古希腊知识传统。,emanar,Las ideas filosóficas emanan de las tradiciones intelectuales griegas antiguas.,xuất phát,Các ý tưởng triết học xuất phát từ truyền thống trí thức Hy Lạp cổ đại.,เปล่งออกมา,แนวคิดทางปรัชญาเปล่งออกมาจากประเพณีทางปัญญาของกรีกโบราณ,berasal,Ide-ide filosofis tersebut berasal dari tradisi intelektual Yunani kuno.
embark,The university decided to embark on an ambitious five-year research initiative.,착수하다,대학은 야심찬 5개년 연구 계획에 착수하기로 결정했다.,乗り出す,大学は野心的な5年間の研究イニシアチブに乗り出すことを決定した。,着手,大学决定着手一项雄心勃勃的五年研究计划。,emprender,La universidad decidió emprender una ambiciosa iniciativa de investigación de cinco años.,bắt tay vào,Trường đại học quyết định bắt tay vào sáng kiến nghiên cứu đầy tham vọng kéo dài năm năm.,เริ่มต้น,มหาวิทยาลัยตัดสินใจเริ่มต้นโครงการวิจัยระยะห้าปีที่ทะเยอทะยาน,memulai,Universitas memutuskan untuk memulai inisiatif penelitian ambisius lima tahun.
embed,Cultural values are deeply embedded within a society's educational institutions.,내재하다,문화적 가치는 사회의 교육 기관에 깊이 내재되어 있다.,埋め込む,文化的価値観は社会の教育機関に深く埋め込まれている。,嵌入,文化价值深深嵌入在一个社会的教育机构中。,incrustar,Los valores culturales están profundamente incrustados en las instituciones educativas.,gắn sâu,Các giá trị văn hóa được gắn sâu trong các tổ chức giáo dục của xã hội.,ฝังลึก,ค่านิยมทางวัฒนธรรมฝังลึกอยู่ภายในสถาบันการศึกษาของสังคม,tertanam,Nilai-nilai budaya tertanam secara mendalam dalam institusi pendidikan masyarakat.
emerge,New theories often emerge from the intersection of different academic disciplines.,출현하다,새로운 이론은 종종 서로 다른 학문 분야의 교차점에서 출현한다.,現れる,新しい理論はしばしば異なる学問分野の交差点から現れる。,出现,新理论通常从不同学科的交叉点出现。,surgir,Nuevas teorías a menudo surgen de la intersección de diferentes disciplinas académicas.,xuất hiện,Các lý thuyết mới thường xuất hiện từ giao điểm của các ngành học khác nhau.,ปรากฏ,ทฤษฎีใหม่มักปรากฏจากจุดตัดของสาขาวิชาการที่แตกต่างกัน,muncul,Teori-teori baru sering muncul dari persinggungan berbagai disiplin ilmu.
emission,Industrial emission of greenhouse gases accelerates the pace of global warming.,배출,산업적 온실가스 배출은 지구 온난화의 속도를 가속화한다.,排出,産業による温室効果ガスの排出は地球温暖化のペースを加速させる。,排放,工业温室气体排放加速了全球变暖的步伐。,emisión,La emisión industrial de gases de efecto invernadero acelera el calentamiento global.,phát thải,Phát thải khí nhà kính công nghiệp đẩy nhanh tốc độ nóng lên toàn cầu.,การปล่อย,การปล่อยก๊าซเรือนกระจกจากอุตสาหกรรมเร่งความเร็วของภาวะโลกร้อน,emisi,Emisi gas rumah kaca industri mempercepat laju pemanasan global.
empathy,Empathy enables healthcare professionals to understand their patients' emotional needs.,공감,공감은 의료 전문가가 환자의 감정적 필요를 이해할 수 있게 한다.,共感,共感は医療専門家が患者の感情的ニーズを理解することを可能にする。,共情,共情使医疗专业人员能够理解患者的情感需求。,empatía,La empatía permite a los profesionales sanitarios comprender las necesidades emocionales.,sự đồng cảm,Sự đồng cảm giúp các chuyên gia y tế hiểu được nhu cầu cảm xúc của bệnh nhân.,ความเห็นอกเห็นใจ,ความเห็นอกเห็นใจช่วยให้บุคลากรทางการแพทย์เข้าใจความต้องการทางอารมณ์ของผู้ป่วย,empati,Empati memungkinkan profesional kesehatan memahami kebutuhan emosional pasien mereka.
encompass,The new curriculum will encompass a broader range of interdisciplinary subjects.,포괄하다,새 교과 과정은 더 넓은 범위의 학제간 과목을 포괄할 것이다.,包含する,新しいカリキュラムはより広範な学際的科目を包含する予定だ。,涵盖,新课程将涵盖更广泛的跨学科科目。,abarcar,El nuevo plan de estudios abarcará una gama más amplia de materias interdisciplinarias.,bao gồm,Chương trình giảng dạy mới sẽ bao gồm phạm vi rộng hơn các môn liên ngành.,ครอบคลุม,หลักสูตรใหม่จะครอบคลุมวิชาสหสาขาวิชาที่กว้างขวางยิ่งขึ้น,mencakup,Kurikulum baru akan mencakup berbagai mata pelajaran interdisipliner yang lebih luas.
endorse,The scientific community overwhelmingly endorsed the findings of the landmark study.,지지하다,과학계는 그 획기적인 연구의 결과를 압도적으로 지지했다.,支持する,科学界はその画期的な研究の結果を圧倒的に支持した。,认可,科学界压倒性地认可了这项里程碑式研究的发现。,respaldar,La comunidad científica respaldó abrumadoramente los hallazgos del estudio pionero.,ủng hộ,Cộng đồng khoa học áp đảo ủng hộ các phát hiện của nghiên cứu mang tính bước ngoặt.,รับรอง,ชุมชนวิทยาศาสตร์รับรองผลการวิจัยของการศึกษาสำคัญอย่างท่วมท้น,mendukung,Komunitas ilmiah secara luas mendukung temuan dari studi penting tersebut.
enhance,Modern technology can significantly enhance the quality of remote education.,향상시키다,현대 기술은 원격 교육의 질을 크게 향상시킬 수 있다.,向上させる,現代技術はリモート教育の質を大幅に向上させることができる。,提高,现代技术可以显著提高远程教育的质量。,mejorar,La tecnología moderna puede mejorar significativamente la calidad de la educación remota.,nâng cao,Công nghệ hiện đại có thể nâng cao đáng kể chất lượng giáo dục từ xa.,เสริม,เทคโนโลยีสมัยใหม่สามารถเสริมคุณภาพการศึกษาทางไกลได้อย่างมีนัยสำคัญ,meningkatkan,Teknologi modern dapat secara signifikan meningkatkan kualitas pendidikan jarak jauh.
enormous,The project required an enormous investment of both time and financial resources.,막대한,그 프로젝트는 시간과 재정 자원 모두의 막대한 투자를 필요로 했다.,莫大な,そのプロジェクトは時間と財政資源の莫大な投資を必要とした。,巨大的,该项目需要在时间和财务资源方面进行巨大的投资。,enorme,El proyecto requirió una enorme inversión de tiempo y recursos financieros.,to lớn,Dự án đòi hỏi sự đầu tư to lớn về cả thời gian và nguồn lực tài chính.,มหาศาล,โครงการนี้ต้องใช้การลงทุนมหาศาลทั้งเวลาและทรัพยากรทางการเงิน,besar,Proyek tersebut membutuhkan investasi yang besar baik waktu maupun sumber daya keuangan.
entail,Implementing the reform will entail substantial changes to existing infrastructure.,수반하다,개혁을 시행하면 기존 기반 시설에 상당한 변화가 수반될 것이다.,伴う,その改革の実施は既存のインフラへの大幅な変更を伴う。,需要,实施改革将需要对现有基础设施进行重大变革。,implicar,Implementar la reforma implicará cambios sustanciales en la infraestructura existente.,đòi hỏi,Thực hiện cải cách sẽ đòi hỏi những thay đổi đáng kể đối với cơ sở hạ tầng hiện có.,เกี่ยวข้องกับ,การดำเนินการปฏิรูปจะเกี่ยวข้องกับการเปลี่ยนแปลงอย่างมากต่อโครงสร้างพื้นฐานที่มีอยู่,memerlukan,Menerapkan reformasi akan memerlukan perubahan substansial pada infrastruktur yang ada.
enumerate,The report proceeds to enumerate the key factors affecting population growth.,열거하다,보고서는 인구 증가에 영향을 미치는 주요 요인을 열거한다.,列挙する,報告書は人口増加に影響を与える主要な要因を列挙している。,列举,报告接着列举了影响人口增长的关键因素。,enumerar,El informe procede a enumerar los factores clave que afectan el crecimiento poblacional.,liệt kê,Báo cáo tiếp tục liệt kê các yếu tố chính ảnh hưởng đến tăng trưởng dân số.,ระบุ,รายงานดำเนินการระบุปัจจัยสำคัญที่ส่งผลต่อการเติบโตของประชากร,menyebutkan,Laporan tersebut menyebutkan faktor-faktor kunci yang mempengaruhi pertumbuhan populasi.
envision,Urban planners envision a future where cities are entirely carbon neutral.,구상하다,도시 계획가들은 도시가 완전히 탄소 중립인 미래를 구상한다.,構想する,都市計画者たちは都市が完全にカーボンニュートラルな未来を構想している。,设想,城市规划者设想一个城市完全碳中和的未来。,imaginar,Los urbanistas imaginan un futuro donde las ciudades sean completamente carbono neutrales.,hình dung,Các nhà quy hoạch đô thị hình dung một tương lai nơi các thành phố hoàn toàn trung hòa carbon.,จินตนาการ,นักผังเมืองจินตนาการถึงอนาคตที่เมืองเป็นกลางทางคาร์บอนทั้งหมด,membayangkan,Perencana kota membayangkan masa depan di mana kota-kota sepenuhnya karbon netral.
equilibrium,The market eventually reaches equilibrium when supply precisely matches demand.,균형,시장은 공급이 수요와 정확히 일치할 때 결국 균형에 도달한다.,均衡,市場は供給が需要と正確に一致したとき最終的に均衡に達する。,均衡,当供给恰好与需求匹配时，市场最终达到均衡。,equilibrio,El mercado eventualmente alcanza el equilibrio cuando la oferta coincide con la demanda.,cân bằng,Thị trường cuối cùng đạt cân bằng khi cung khớp chính xác với cầu.,สมดุล,ตลาดจะเข้าสู่สมดุลเมื่ออุปทานตรงกับอุปสงค์อย่างแม่นยำ,keseimbangan,Pasar akhirnya mencapai keseimbangan ketika penawaran tepat sesuai dengan permintaan.
equitable,The organization strives to ensure equitable distribution of educational resources.,공평한,그 조직은 교육 자원의 공평한 분배를 보장하기 위해 노력한다.,公平な,その組織は教育資源の公平な配分を確保するよう努めている。,公平的,该组织努力确保教育资源的公平分配。,equitativo,La organización se esfuerza por garantizar la distribución equitativa de recursos educativos.,công bằng,Tổ chức nỗ lực đảm bảo phân phối công bằng các nguồn lực giáo dục.,เท่าเทียม,องค์กรมุ่งมั่นที่จะรับรองการกระจายทรัพยากรการศึกษาอย่างเท่าเทียม,adil,Organisasi berupaya memastikan distribusi sumber daya pendidikan yang adil.
equivalent,One kilogram is roughly equivalent to two point two standard pounds.,동등한,1킬로그램은 대략 2.2 파운드와 동등하다.,同等の,1キログラムは約2.2標準ポンドに同等である。,等价的,一公斤大约等价于二点二标准磅。,equivalente,Un kilogramo es aproximadamente equivalente a dos punto dos libras estándar.,tương đương,Một kilogram gần tương đương với hai phẩy hai pound tiêu chuẩn.,เทียบเท่า,หนึ่งกิโลกรัมเทียบเท่ากับสองจุดสองปอนด์มาตรฐานโดยประมาณ,setara,Satu kilogram kira-kira setara dengan dua koma dua pon standar.
eradicate,International efforts aim to eradicate poverty in developing nations worldwide.,근절하다,국제적 노력은 전 세계 개발도상국의 빈곤을 근절하는 것을 목표로 한다.,根絶する,国際的な取り組みは世界中の発展途上国の貧困を根絶することを目指している。,根除,国际努力旨在根除全球发展中国家的贫困。,erradicar,Los esfuerzos internacionales buscan erradicar la pobreza en naciones en desarrollo.,xóa bỏ,Các nỗ lực quốc tế nhằm xóa bỏ nghèo đói ở các nước đang phát triển trên toàn thế giới.,กำจัดให้หมด,ความพยายามระหว่างประเทศมุ่งกำจัดความยากจนในประเทศกำลังพัฒนาทั่วโลกให้หมด,memberantas,Upaya internasional bertujuan memberantas kemiskinan di negara-negara berkembang di seluruh dunia.
erratic,The patient exhibited erratic behavior patterns throughout the clinical observation.,불규칙한,환자는 임상 관찰 기간 동안 불규칙한 행동 패턴을 보였다.,不規則な,患者は臨床観察を通じて不規則な行動パターンを示した。,不稳定的,患者在整个临床观察期间表现出不稳定的行为模式。,errático,El paciente exhibió patrones de comportamiento erráticos durante la observación clínica.,thất thường,Bệnh nhân thể hiện các kiểu hành vi thất thường trong suốt quá trình quan sát lâm sàng.,ผิดปกติ,ผู้ป่วยแสดงรูปแบบพฤติกรรมที่ผิดปกติตลอดการสังเกตทางคลินิก,tidak menentu,Pasien menunjukkan pola perilaku yang tidak menentu selama observasi klinis.
erroneous,The study was retracted after researchers discovered erroneous data calculations.,잘못된,연구자들이 잘못된 데이터 계산을 발견한 후 그 연구는 철회되었다.,誤った,研究者たちが誤ったデータ計算を発見した後その研究は撤回された。,错误的,在研究人员发现错误的数据计算后，该研究被撤回。,erróneo,El estudio fue retirado después de que se descubrieron cálculos de datos erróneos.,sai lầm,Nghiên cứu bị thu hồi sau khi các nhà nghiên cứu phát hiện tính toán dữ liệu sai lầm.,ผิดพลาด,การศึกษาถูกถอนหลังจากนักวิจัยค้นพบการคำนวณข้อมูลที่ผิดพลาด,keliru,Studi tersebut ditarik setelah peneliti menemukan perhitungan data yang keliru.
espouse,Many economists espouse free market principles as the basis of growth.,옹호하다,많은 경제학자들은 자유 시장 원칙을 성장의 기반으로 옹호한다.,支持する,多くの経済学者は自由市場原理を成長の基盤として支持している。,拥护,许多经济学家拥护自由市场原则作为增长的基础。,abogar,Muchos economistas abogan por los principios del libre mercado como base del crecimiento.,ủng hộ,Nhiều nhà kinh tế học ủng hộ nguyên tắc thị trường tự do là nền tảng cho tăng trưởng.,สนับสนุน,นักเศรษฐศาสตร์หลายคนสนับสนุนหลักการตลาดเสรีเป็นพื้นฐานของการเติบโต,mendukung,Banyak ekonom mendukung prinsip pasar bebas sebagai dasar pertumbuhan.
esteem,The professor is held in high esteem by colleagues across the discipline.,존경,그 교수는 학계 전반의 동료들에게 높은 존경을 받고 있다.,尊敬,その教授は学問分野全体の同僚から高く尊敬されている。,尊重,该教授受到整个学科同行的高度尊重。,estima,El profesor es tenido en alta estima por colegas de toda la disciplina.,sự kính trọng,Giáo sư được đồng nghiệp trong toàn ngành kính trọng rất cao.,ความนับถือ,ศาสตราจารย์ได้รับความนับถืออย่างสูงจากเพื่อนร่วมงานทั่วทั้งสาขาวิชา,dihormati,Profesor tersebut sangat dihormati oleh rekan-rekan di seluruh disiplin ilmu.
ethical,The research must comply with ethical guidelines established by the institution.,윤리적인,그 연구는 기관에 의해 수립된 윤리 지침을 준수해야 한다.,倫理的な,その研究は機関によって定められた倫理的ガイドラインに従わなければならない。,伦理的,该研究必须遵守机构制定的伦理准则。,ético,La investigación debe cumplir con las directrices éticas establecidas por la institución.,đạo đức,Nghiên cứu phải tuân thủ các hướng dẫn đạo đức do tổ chức thiết lập.,จริยธรรม,การวิจัยต้องปฏิบัติตามแนวทางจริยธรรมที่สถาบันกำหนดขึ้น,etis,Penelitian harus mematuhi pedoman etis yang ditetapkan oleh institusi.
