english,example,ko_meaning,ko_example,ja_meaning,ja_example,zh_meaning,zh_example,es_meaning,es_example,vi_meaning,vi_example,th_meaning,th_example,id_meaning,id_example
objective,Maintaining an objective perspective is essential when evaluating scientific data.,객관적인,과학적 데이터를 평가할 때 객관적인 관점을 유지하는 것이 필수적이다.,客観的な,科学的データを評価する際に客観的な視点を維持することが不可欠である。,客观的,在评估科学数据时保持客观视角至关重要。,objetivo,Mantener una perspectiva objetiva es esencial al evaluar datos científicos.,khách quan,Duy trì quan điểm khách quan là điều cần thiết khi đánh giá dữ liệu khoa học.,เป็นกลาง,การรักษามุมมองที่เป็นกลางเป็นสิ่งจำเป็นเมื่อประเมินข้อมูลทางวิทยาศาสตร์,objektif,Mempertahankan perspektif objektif sangat penting saat mengevaluasi data ilmiah.
obligate,The new regulation will obligate manufacturers to disclose all chemical ingredients.,의무화하다,새로운 규정은 제조업체에 모든 화학 성분을 공개하도록 의무화할 것이다.,義務付ける,新しい規制は製造業者にすべての化学成分の開示を義務付ける。,强制,新法规将强制制造商公开所有化学成分。,obligar,La nueva regulación obligará a los fabricantes a revelar todos los ingredientes químicos.,bắt buộc,Quy định mới sẽ bắt buộc các nhà sản xuất công bố tất cả thành phần hóa học.,บังคับ,กฎระเบียบใหม่จะบังคับให้ผู้ผลิตเปิดเผยส่วนผสมทางเคมีทั้งหมด,mewajibkan,Peraturan baru akan mewajibkan produsen untuk mengungkapkan semua bahan kimia.
obscure,The manuscript contained obscure references that required extensive scholarly research.,모호한,그 원고에는 광범위한 학술 연구가 필요한 모호한 참고 문헌이 포함되어 있었다.,曖昧な,その写本には広範な学術研究を必要とする曖昧な参考文献が含まれていた。,晦涩的,该手稿包含需要大量学术研究的晦涩引用。,oscuro,El manuscrito contenía referencias oscuras que requerían una extensa investigación académica.,mơ hồ,Bản thảo chứa các tham chiếu mơ hồ đòi hỏi nghiên cứu học thuật sâu rộng.,คลุมเครือ,ต้นฉบับมีข้อมูลอ้างอิงที่คลุมเครือซึ่งต้องการการวิจัยทางวิชาการอย่างละเอียด,tidak jelas,Manuskrip tersebut berisi referensi tidak jelas yang memerlukan penelitian akademis ekstensif.
obsolete,Rapid technological advances have rendered many traditional manufacturing methods obsolete.,구식의,급속한 기술 발전으로 많은 전통적인 제조 방법이 구식이 되었다.,時代遅れの,急速な技術の進歩により多くの伝統的な製造方法が時代遅れになった。,过时的,技术的快速发展使许多传统制造方法变得过时。,obsoleto,Los rápidos avances tecnológicos han hecho obsoletos muchos métodos de fabricación tradicionales.,lỗi thời,Tiến bộ công nghệ nhanh chóng đã khiến nhiều phương pháp sản xuất truyền thống trở nên lỗi thời.,ล้าสมัย,ความก้าวหน้าทางเทคโนโลยีอย่างรวดเร็วทำให้วิธีการผลิตแบบดั้งเดิมหลายอย่างล้าสมัย,usang,Kemajuan teknologi yang pesat telah membuat banyak metode manufaktur tradisional menjadi usang.
obstruct,Bureaucratic procedures can obstruct the progress of important scientific research projects.,방해하다,관료적 절차는 중요한 과학 연구 프로젝트의 진행을 방해할 수 있다.,妨げる,官僚的な手続きは重要な科学研究プロジェクトの進捗を妨げることがある。,阻碍,官僚程序可能阻碍重要科学研究项目的进展。,obstaculizar,Los procedimientos burocráticos pueden obstaculizar el progreso de proyectos de investigación.,cản trở,Các thủ tục quan liêu có thể cản trở tiến trình của các dự án nghiên cứu khoa học quan trọng.,ขัดขวาง,ขั้นตอนราชการสามารถขัดขวางความก้าวหน้าของโครงการวิจัยทางวิทยาศาสตร์ที่สำคัญ,menghalangi,Prosedur birokrasi dapat menghalangi kemajuan proyek penelitian ilmiah yang penting.
obtain,Students must obtain written permission before accessing restricted laboratory facilities.,얻다,학생들은 제한된 실험실 시설에 접근하기 전에 서면 허가를 얻어야 한다.,取得する,学生は制限された実験室施設にアクセスする前に書面による許可を取得しなければならない。,获得,学生必须在进入限制实验室设施之前获得书面许可。,obtener,Los estudiantes deben obtener permiso escrito antes de acceder a instalaciones restringidas.,có được,Sinh viên phải có được sự cho phép bằng văn bản trước khi vào phòng thí nghiệm hạn chế.,ได้รับ,นักศึกษาต้องได้รับอนุญาตเป็นลายลักษณ์อักษรก่อนเข้าถึงห้องปฏิบัติการที่จำกัด,memperoleh,Mahasiswa harus memperoleh izin tertulis sebelum mengakses fasilitas laboratorium terbatas.
obviate,Preventive medicine can obviate the need for costly surgical interventions later.,불필요하게 하다,예방 의학은 나중에 비용이 많이 드는 외과적 개입의 필요성을 불필요하게 할 수 있다.,不要にする,予防医学は後の高額な外科的介入の必要性を不要にすることができる。,消除,预防医学可以消除日后进行昂贵手术干预的需要。,obviar,La medicina preventiva puede obviar la necesidad de intervenciones quirúrgicas costosas.,loại bỏ,Y học dự phòng có thể loại bỏ nhu cầu can thiệp phẫu thuật tốn kém sau này.,ขจัด,การแพทย์เชิงป้องกันสามารถขจัดความจำเป็นในการผ่าตัดที่มีค่าใช้จ่ายสูง,menghilangkan,Pengobatan preventif dapat menghilangkan kebutuhan akan intervensi bedah yang mahal.
occupy,The military forces continued to occupy the territory for nearly a decade.,점령하다,군대는 거의 10년 동안 그 영토를 계속 점령했다.,占領する,軍隊はほぼ十年間その領土を占領し続けた。,占领,军队继续占领该领土近十年之久。,ocupar,Las fuerzas militares continuaron ocupando el territorio durante casi una década.,chiếm đóng,Lực lượng quân đội tiếp tục chiếm đóng lãnh thổ trong gần một thập kỷ.,ยึดครอง,กองกำลังทหารยังคงยึดครองดินแดนนั้นเกือบสิบปี,menduduki,Pasukan militer terus menduduki wilayah tersebut selama hampir satu dekade.
offset,Renewable energy investments can offset carbon emissions from industrial processes.,상쇄하다,재생 에너지 투자는 산업 공정에서 나오는 탄소 배출을 상쇄할 수 있다.,相殺する,再生可能エネルギーへの投資は産業プロセスからの炭素排出を相殺できる。,抵消,可再生能源投资可以抵消工业过程中的碳排放。,compensar,Las inversiones en energía renovable pueden compensar las emisiones de carbono industriales.,bù đắp,Đầu tư năng lượng tái tạo có thể bù đắp lượng khí thải carbon từ các quy trình công nghiệp.,ชดเชย,การลงทุนในพลังงานหมุนเวียนสามารถชดเชยการปล่อยคาร์บอนจากกระบวนการอุตสาหกรรม,mengimbangi,Investasi energi terbarukan dapat mengimbangi emisi karbon dari proses industri.
omit,The author chose to omit several controversial chapters from the final edition.,생략하다,저자는 최종판에서 몇 개의 논쟁적인 장을 생략하기로 선택했다.,省略する,著者は最終版からいくつかの物議を醸す章を省略することを選んだ。,省略,作者选择在最终版中省略了几个有争议的章节。,omitir,El autor eligió omitir varios capítulos controvertidos de la edición final.,bỏ qua,Tác giả đã chọn bỏ qua một số chương gây tranh cãi trong ấn bản cuối cùng.,ละเว้น,ผู้เขียนเลือกที่จะละเว้นบทที่ถกเถียงหลายบทจากฉบับสุดท้าย,menghilangkan,Penulis memilih untuk menghilangkan beberapa bab kontroversial dari edisi terakhir.
onset,The onset of symptoms typically occurs within forty-eight hours after exposure.,발병,증상의 발병은 일반적으로 노출 후 48시간 이내에 발생한다.,発症,症状の発症は通常曝露後48時間以内に起こる。,发病,症状的发病通常在接触后四十八小时内出现。,inicio,El inicio de los síntomas generalmente ocurre dentro de las cuarenta y ocho horas.,khởi phát,Sự khởi phát triệu chứng thường xảy ra trong vòng bốn mươi tám giờ sau khi tiếp xúc.,การเริ่มต้น,การเริ่มต้นของอาการมักเกิดขึ้นภายในสี่สิบแปดชั่วโมงหลังได้รับสัมผัส,permulaan,Permulaan gejala biasanya terjadi dalam empat puluh delapan jam setelah paparan.
opaque,The company's opaque financial reporting raised concerns among regulatory authorities.,불투명한,그 회사의 불투명한 재무 보고는 규제 당국 사이에서 우려를 불러일으켰다.,不透明な,その会社の不透明な財務報告は規制当局の間で懸念を引き起こした。,不透明的,该公司不透明的财务报告引起了监管机构的关注。,opaco,Los informes financieros opacos de la empresa generaron preocupación entre las autoridades.,mờ đục,Báo cáo tài chính không minh bạch của công ty gây lo ngại cho các cơ quan quản lý.,ทึบ,รายงานทางการเงินที่ไม่โปร่งใสของบริษัทสร้างความกังวลในหมู่หน่วยงานกำกับดูแล,tidak transparan,Pelaporan keuangan perusahaan yang tidak transparan menimbulkan kekhawatiran di kalangan regulator.
opponent,The debate opponent presented compelling evidence to challenge the existing theory.,상대,토론 상대는 기존 이론에 이의를 제기하기 위해 설득력 있는 증거를 제시했다.,反対者,討論の反対者は既存の理論に異議を唱えるための説得力のある証拠を提示した。,对手,辩论对手提出了令人信服的证据来挑战现有理论。,oponente,El oponente del debate presentó evidencia convincente para desafiar la teoría existente.,đối thủ,Đối thủ tranh luận đã trình bày bằng chứng thuyết phục để thách thức lý thuyết hiện có.,ฝ่ายตรงข้าม,ฝ่ายตรงข้ามในการอภิปรายนำเสนอหลักฐานที่น่าเชื่อถือเพื่อท้าทายทฤษฎีที่มีอยู่,lawan,Lawan debat menyajikan bukti yang meyakinkan untuk menantang teori yang ada.
optimal,Researchers identified the optimal temperature range for the enzyme reaction process.,최적의,연구자들은 효소 반응 과정에 대한 최적의 온도 범위를 확인했다.,最適な,研究者たちは酵素反応プロセスの最適な温度範囲を特定した。,最佳的,研究人员确定了酶反应过程的最佳温度范围。,óptimo,Los investigadores identificaron el rango de temperatura óptimo para la reacción enzimática.,tối ưu,Các nhà nghiên cứu đã xác định phạm vi nhiệt độ tối ưu cho quá trình phản ứng enzyme.,เหมาะสมที่สุด,นักวิจัยระบุช่วงอุณหภูมิที่เหมาะสมที่สุดสำหรับกระบวนการปฏิกิริยาเอนไซม์,optimal,Peneliti mengidentifikasi rentang suhu optimal untuk proses reaksi enzim.
optimistic,Economists remain cautiously optimistic about the recovery of global financial markets.,낙관적인,경제학자들은 글로벌 금융 시장의 회복에 대해 조심스럽게 낙관적이다.,楽観的な,経済学者たちは世界金融市場の回復について慎重に楽観的である。,乐观的,经济学家们对全球金融市场的复苏持谨慎乐观态度。,optimista,Los economistas se mantienen cautelosamente optimistas sobre la recuperación de los mercados.,lạc quan,Các nhà kinh tế vẫn lạc quan thận trọng về sự phục hồi của thị trường tài chính toàn cầu.,มองโลกในแง่ดี,นักเศรษฐศาสตร์ยังคงมองโลกในแง่ดีอย่างระมัดระวังเกี่ยวกับการฟื้นตัวของตลาดการเงินโลก,optimis,Para ekonom tetap optimis secara hati-hati tentang pemulihan pasar keuangan global.
orient,The introductory course helps orient new students to university academic expectations.,적응시키다,입문 과정은 신입생들이 대학의 학업 기대에 적응하도록 돕는다.,適応させる,導入コースは新入生を大学の学術的期待に適応させるのに役立つ。,引导,入门课程帮助新生适应大学的学术期望。,orientar,El curso introductorio ayuda a orientar a los nuevos estudiantes sobre las expectativas académicas.,định hướng,Khóa học nhập môn giúp định hướng sinh viên mới về kỳ vọng học thuật của đại học.,ปรับตัว,หลักสูตรเบื้องต้นช่วยให้นักศึกษาใหม่ปรับตัวเข้ากับความคาดหวังทางวิชาการ,mengarahkan,Kursus pengantar membantu mengarahkan mahasiswa baru terhadap ekspektasi akademis universitas.
orthodox,The researcher challenged orthodox views on evolutionary biology with new findings.,정통의,연구자는 새로운 발견으로 진화 생물학에 대한 정통적인 견해에 도전했다.,正統的な,研究者は新しい発見で進化生物学に関する正統的な見解に異議を唱えた。,正统的,研究人员用新发现挑战了进化生物学的正统观点。,ortodoxo,El investigador desafió las opiniones ortodoxas sobre biología evolutiva con nuevos hallazgos.,chính thống,Nhà nghiên cứu đã thách thức quan điểm chính thống về sinh học tiến hóa bằng phát hiện mới.,ดั้งเดิม,นักวิจัยท้าทายมุมมองดั้งเดิมเกี่ยวกับชีววิทยาวิวัฒนาการด้วยการค้นพบใหม่,ortodoks,Peneliti menantang pandangan ortodoks tentang biologi evolusioner dengan temuan baru.
outcome,The outcome of the clinical trial exceeded all initial expectations of researchers.,결과,임상 시험의 결과는 연구자들의 모든 초기 기대를 초과했다.,結果,臨床試験の結果は研究者たちの初期の期待をすべて上回った。,结果,临床试验的结果超出了研究人员的所有初始预期。,resultado,El resultado del ensayo clínico superó todas las expectativas iniciales de los investigadores.,kết quả,Kết quả của thử nghiệm lâm sàng vượt quá mọi kỳ vọng ban đầu của các nhà nghiên cứu.,ผลลัพธ์,ผลลัพธ์ของการทดลองทางคลินิกเกินความคาดหมายเบื้องต้นทั้งหมดของนักวิจัย,hasil,Hasil uji klinis melampaui semua ekspektasi awal para peneliti.
outweigh,The long-term benefits of vaccination clearly outweigh the minor temporary side effects.,능가하다,예방 접종의 장기적 이점은 사소한 일시적 부작용을 분명히 능가한다.,上回る,ワクチン接種の長期的な利点は軽微な一時的副作用を明らかに上回る。,超过,疫苗接种的长期益处明显超过轻微的暂时性副作用。,superar,Los beneficios a largo plazo de la vacunación superan claramente los efectos secundarios menores.,vượt trội,Lợi ích lâu dài của tiêm chủng rõ ràng vượt trội hơn các tác dụng phụ tạm thời nhỏ.,มีน้ำหนักมากกว่า,ประโยชน์ระยะยาวของการฉีดวัคซีนมีน้ำหนักมากกว่าผลข้างเคียงเล็กน้อยชั่วคราวอย่างชัดเจน,lebih besar,Manfaat jangka panjang vaksinasi jelas lebih besar daripada efek samping sementara yang ringan.
overlap,The research interests of the two departments overlap significantly in several areas.,겹치다,두 학과의 연구 관심사는 여러 분야에서 상당히 겹친다.,重なる,二つの学部の研究関心はいくつかの分野で大きく重なっている。,重叠,两个部门的研究兴趣在几个领域有显著重叠。,superponerse,Los intereses de investigación de los dos departamentos se superponen significativamente.,chồng chéo,Mối quan tâm nghiên cứu của hai khoa chồng chéo đáng kể trong một số lĩnh vực.,ทับซ้อน,ความสนใจในการวิจัยของสองภาควิชาทับซ้อนกันอย่างมากในหลายด้าน,tumpang tindih,Minat penelitian kedua departemen tumpang tindih secara signifikan di beberapa bidang.
override,The Supreme Court has the authority to override decisions made by lower courts.,무효화하다,대법원은 하급 법원이 내린 결정을 무효화할 권한이 있다.,覆す,最高裁判所は下級裁判所の決定を覆す権限を持っている。,推翻,最高法院有权推翻下级法院作出的决定。,anular,La Corte Suprema tiene la autoridad de anular decisiones tomadas por tribunales inferiores.,bác bỏ,Tòa án Tối cao có quyền bác bỏ các quyết định của tòa án cấp dưới.,ล้มล้าง,ศาลฎีกามีอำนาจในการล้มล้างคำตัดสินของศาลชั้นล่าง,membatalkan,Mahkamah Agung memiliki wewenang untuk membatalkan keputusan yang dibuat oleh pengadilan rendah.
overt,The government's overt military intervention drew widespread international criticism.,공공연한,정부의 공공연한 군사 개입은 광범위한 국제적 비판을 불러일으켰다.,あからさまな,政府のあからさまな軍事介入は広範な国際的批判を招いた。,公开的,政府公开的军事干预招致了广泛的国际批评。,abierto,La intervención militar abierta del gobierno atrajo críticas internacionales generalizadas.,công khai,Sự can thiệp quân sự công khai của chính phủ đã gây ra sự chỉ trích quốc tế rộng rãi.,เปิดเผย,การแทรกแซงทางทหารอย่างเปิดเผยของรัฐบาลถูกวิพากษ์วิจารณ์อย่างกว้างขวางจากนานาชาติ,terang-terangan,Intervensi militer terang-terangan pemerintah menuai kritik internasional yang meluas.
overwhelm,The sheer volume of data can overwhelm researchers without proper analytical tools.,압도하다,방대한 양의 데이터는 적절한 분석 도구 없이는 연구자들을 압도할 수 있다.,圧倒する,膨大なデータ量は適切な分析ツールなしでは研究者を圧倒する可能性がある。,压倒,大量数据如果没有适当的分析工具可能会压倒研究人员。,abrumar,El volumen de datos puede abrumar a los investigadores sin herramientas analíticas adecuadas.,choáng ngợp,Khối lượng dữ liệu khổng lồ có thể khiến các nhà nghiên cứu choáng ngợp nếu thiếu công cụ phân tích.,ท่วมท้น,ปริมาณข้อมูลมหาศาลอาจท่วมท้นนักวิจัยที่ไม่มีเครื่องมือวิเคราะห์ที่เหมาะสม,membanjiri,Volume data yang besar dapat membanjiri peneliti tanpa alat analisis yang tepat.
labyrinth,The ancient labyrinth beneath the ruins puzzled archaeologists for many decades.,미로,유적 아래의 고대 미로는 수십 년 동안 고고학자들을 당혹스럽게 했다.,迷宮,遺跡の下にある古代の迷宮は何十年もの間考古学者たちを困惑させた。,迷宫,遗址下方的古代迷宫让考古学家困惑了几十年。,laberinto,El antiguo laberinto bajo las ruinas desconcertó a los arqueólogos durante décadas.,mê cung,Mê cung cổ đại dưới tàn tích đã làm bối rối các nhà khảo cổ trong nhiều thập kỷ.,เขาวงกต,เขาวงกตโบราณใต้ซากปรักหักพังทำให้นักโบราณคดีงุนงงมาหลายทศวรรษ,labirin,Labirin kuno di bawah reruntuhan membingungkan para arkeolog selama beberapa dekade.
languid,The languid pace of reform frustrated advocates for immediate social change.,나른한,개혁의 나른한 속도는 즉각적인 사회 변화를 옹호하는 사람들을 좌절시켰다.,気だるい,改革の気だるいペースは即座の社会変革の擁護者たちを苛立たせた。,缓慢的,改革缓慢的步伐让倡导立即社会变革的人感到沮丧。,lánguido,El ritmo lánguido de la reforma frustró a los defensores del cambio social inmediato.,uể oải,Tốc độ cải cách uể oải khiến những người ủng hộ thay đổi xã hội ngay lập tức thất vọng.,เฉื่อยชา,ความเฉื่อยชาของการปฏิรูปทำให้ผู้สนับสนุนการเปลี่ยนแปลงทางสังคมทันทีหงุดหงิด,lesu,Langkah reformasi yang lesu membuat para pendukung perubahan sosial segera frustrasi.
lateral,Lateral thinking skills are valued in creative problem-solving and innovation fields.,수평적인,수평적 사고 능력은 창의적 문제 해결과 혁신 분야에서 가치가 있다.,水平的な,水平的思考スキルは創造的な問題解決とイノベーションの分野で重要視される。,横向的,横向思维能力在创造性解决问题和创新领域中备受重视。,lateral,Las habilidades de pensamiento lateral son valoradas en la resolución creativa de problemas.,tư duy ngang,Kỹ năng tư duy ngang được đánh giá cao trong lĩnh vực giải quyết vấn đề sáng tạo.,ด้านข้าง,ทักษะการคิดด้านข้างมีคุณค่าในการแก้ปัญหาเชิงสร้างสรรค์และนวัตกรรม,lateral,Keterampilan berpikir lateral dihargai dalam pemecahan masalah kreatif dan bidang inovasi.
laudable,The university's efforts to increase diversity enrollment are considered highly laudable.,칭찬할 만한,다양성 등록을 늘리려는 대학의 노력은 매우 칭찬할 만한 것으로 간주된다.,称賛に値する,多様性のある入学を増やすための大学の努力は非常に称賛に値するとされている。,值得称赞的,该大学增加多样性招生的努力被认为非常值得称赞。,loable,Los esfuerzos de la universidad para aumentar la diversidad son considerados muy loables.,đáng khen ngợi,Nỗ lực tăng cường sự đa dạng trong tuyển sinh của trường đại học rất đáng khen ngợi.,น่ายกย่อง,ความพยายามของมหาวิทยาลัยในการเพิ่มความหลากหลายถือว่าน่ายกย่องอย่างยิ่ง,terpuji,Upaya universitas untuk meningkatkan keragaman pendaftaran dianggap sangat terpuji.
