english,example,ko_meaning,ko_example,ja_meaning,ja_example,zh_meaning,zh_example,es_meaning,es_example,vi_meaning,vi_example,th_meaning,th_example,id_meaning,id_example
spatial,The architect considered spatial relationships between all building components carefully.,공간의; 공간적인,건축가는 모든 건물 구성 요소 간의 공간적 관계를 신중하게 고려했다.,空間的な,建築家はすべての建築要素間の空間的関係を慎重に考慮した。,空间的,建筑师仔细考虑了所有建筑组件之间的空间关系。,espacial,El arquitecto consideró cuidadosamente las relaciones espaciales entre los componentes.,không gian,Kiến trúc sư đã cân nhắc kỹ lưỡng mối quan hệ không gian giữa các thành phần.,เชิงพื้นที่,สถาปนิกพิจารณาความสัมพันธ์เชิงพื้นที่ระหว่างส่วนประกอบของอาคารอย่างรอบคอบ,spasial,Arsitek mempertimbangkan hubungan spasial antara semua komponen bangunan dengan cermat.
speculate,Economists speculate that inflation will continue rising throughout the year.,추측하다; 투기하다,경제학자들은 인플레이션이 연중 계속 상승할 것으로 추측한다.,推測する,経済学者たちはインフレが年間を通じて上昇し続けると推測している。,推测; 投机,经济学家推测通胀将在全年继续上升。,especular,Los economistas especulan que la inflación seguirá aumentando durante todo el año.,suy đoán,Các nhà kinh tế suy đoán rằng lạm phát sẽ tiếp tục tăng trong suốt năm.,คาดเดา,นักเศรษฐศาสตร์คาดเดาว่าเงินเฟ้อจะยังคงเพิ่มขึ้นตลอดทั้งปี,berspekulasi,Para ekonom berspekulasi bahwa inflasi akan terus meningkat sepanjang tahun.
sphere,The professor examined the political sphere of influence in ancient Rome.,영역; 구체,교수는 고대 로마의 정치적 영향 영역을 조사했다.,領域; 球体,教授は古代ローマの政治的影響圏を調査した。,领域; 球体,教授研究了古罗马的政治影响领域。,esfera,El profesor examinó la esfera de influencia política en la antigua Roma.,lĩnh vực; phạm vi,Giáo sư đã nghiên cứu phạm vi ảnh hưởng chính trị ở La Mã cổ đại.,ขอบเขต; ทรงกลม,ศาสตราจารย์ตรวจสอบขอบเขตอิทธิพลทางการเมืองในกรุงโรมโบราณ,ranah; bidang,Profesor memeriksa ranah pengaruh politik di Roma kuno.
spontaneous,The spontaneous combustion of chemicals caused the laboratory fire incident.,자발적인,화학 물질의 자연 발화가 실험실 화재 사고를 일으켰다.,自発的な,化学物質の自然発火が研究室の火災事故を引き起こした。,自发的,化学物质的自燃引发了实验室火灾事故。,espontáneo,La combustión espontánea de químicos causó el incidente de incendio en el laboratorio.,tự phát,Sự cháy tự phát của hóa chất đã gây ra vụ cháy phòng thí nghiệm.,ที่เกิดขึ้นเอง,การลุกไหม้ที่เกิดขึ้นเองของสารเคมีทำให้เกิดเหตุไฟไหม้ในห้องปฏิบัติการ,spontan,Pembakaran spontan bahan kimia menyebabkan insiden kebakaran laboratorium.
sporadic,Sporadic protests erupted across the country following the controversial policy.,산발적인,논란이 된 정책에 따라 전국적으로 산발적인 시위가 발생했다.,散発的な,物議を醸す政策に続いて全国で散発的な抗議が発生した。,零星的,在有争议的政策出台后全国爆发了零星的抗议活动。,esporádico,Protestas esporádicas estallaron por todo el país tras la política controvertida.,lẻ tẻ; rải rác,Các cuộc biểu tình lẻ tẻ đã nổ ra khắp đất nước sau chính sách gây tranh cãi.,ประปราย; เป็นระยะ,การประท้วงประปรายเกิดขึ้นทั่วประเทศหลังจากนโยบายที่ถกเถียง,sporadis,Protes sporadis meletus di seluruh negeri menyusul kebijakan kontroversial.
stabilize,The government implemented policies to stabilize the national currency value.,안정시키다,정부는 국가 화폐 가치를 안정시키기 위한 정책을 시행했다.,安定させる,政府は国の通貨価値を安定させる政策を実施した。,稳定,政府实施了稳定国家货币价值的政策。,estabilizar,El gobierno implementó políticas para estabilizar el valor de la moneda nacional.,ổn định,Chính phủ đã thực hiện các chính sách để ổn định giá trị đồng tiền quốc gia.,ทำให้มีเสถียรภาพ,รัฐบาลดำเนินนโยบายเพื่อทำให้ค่าเงินของประเทศมีเสถียรภาพ,menstabilkan,Pemerintah menerapkan kebijakan untuk menstabilkan nilai mata uang nasional.
stagnant,The stagnant economy showed no signs of growth for three years.,정체된; 침체된,정체된 경제는 3년 동안 성장의 조짐을 보이지 않았다.,停滞した,停滞した経済は3年間成長の兆しを見せなかった。,停滞的,停滞的经济三年来没有显示出增长迹象。,estancado,La economía estancada no mostró signos de crecimiento durante tres años.,trì trệ,Nền kinh tế trì trệ không có dấu hiệu tăng trưởng trong ba năm.,ซบเซา; หยุดนิ่ง,เศรษฐกิจที่ซบเซาไม่แสดงสัญญาณของการเติบโตเป็นเวลาสามปี,stagnan,Ekonomi yang stagnan tidak menunjukkan tanda-tanda pertumbuhan selama tiga tahun.
stark,The report revealed a stark contrast between urban and rural education.,극명한; 뚜렷한,보고서는 도시와 농촌 교육 사이의 극명한 대비를 보여주었다.,際立った; 厳然たる,報告書は都市と農村の教育の間の際立った対照を明らかにした。,鲜明的; 明显的,报告揭示了城乡教育之间的鲜明对比。,marcado; crudo,El informe reveló un marcado contraste entre la educación urbana y rural.,rõ rệt; hoàn toàn,Báo cáo cho thấy sự tương phản rõ rệt giữa giáo dục thành thị và nông thôn.,ชัดเจน; เด่นชัด,รายงานเผยให้เห็นความแตกต่างอย่างเด่นชัดระหว่างการศึกษาในเมืองและชนบท,mencolok; jelas,Laporan mengungkapkan kontras yang mencolok antara pendidikan perkotaan dan pedesaan.
static,The population of the island remained static over the past decade.,정적인; 변화 없는,그 섬의 인구는 지난 10년 동안 변화가 없었다.,静的な,その島の人口は過去10年間静的なままだった。,静态的; 不变的,该岛的人口在过去十年中保持不变。,estático,La población de la isla permaneció estática durante la última década.,tĩnh; không thay đổi,Dân số của hòn đảo vẫn không thay đổi trong suốt thập kỷ qua.,คงที่; ไม่เปลี่ยนแปลง,ประชากรของเกาะยังคงคงที่ตลอดทศวรรษที่ผ่านมา,statis,Populasi pulau tersebut tetap statis selama dekade terakhir.
statute,The statute of limitations for the offense expired after five years.,법령; 법규,그 범죄에 대한 공소시효는 5년 후에 만료되었다.,法令; 制定法,その犯罪の時効は5年後に期限切れとなった。,法令; 法规,该罪行的诉讼时效在五年后届满。,estatuto,El estatuto de limitaciones para el delito expiró después de cinco años.,đạo luật; quy chế,Thời hiệu truy cứu trách nhiệm hình sự đối với tội phạm đã hết sau năm năm.,กฎหมาย; พระราชบัญญัติ,อายุความของความผิดนั้นหมดลงหลังจากห้าปี,undang-undang,Daluwarsa untuk pelanggaran tersebut berakhir setelah lima tahun.
stem,The economic crisis stemmed from unregulated financial speculation activities.,유래하다; 기인하다,경제 위기는 규제되지 않은 금융 투기 활동에서 비롯되었다.,起因する,経済危機は規制のない金融投機活動に起因した。,源于,经济危机源于不受监管的金融投机活动。,derivar; provenir,La crisis económica se derivó de actividades de especulación financiera no reguladas.,bắt nguồn,Cuộc khủng hoảng kinh tế bắt nguồn từ hoạt động đầu cơ tài chính không được kiểm soát.,เกิดจาก; มีต้นกำเนิดจาก,วิกฤตเศรษฐกิจเกิดจากกิจกรรมการเก็งกำไรทางการเงินที่ไม่ได้รับการควบคุม,berasal,Krisis ekonomi berasal dari aktivitas spekulasi keuangan yang tidak diatur.
stereotype,Media portrayals often reinforce harmful stereotypes about minority communities.,고정관념,미디어 묘사는 종종 소수 집단에 대한 해로운 고정관념을 강화한다.,固定観念; ステレオタイプ,メディアの描写はしばしばマイノリティに関する有害な固定観念を強化する。,刻板印象,媒体描述往往强化对少数族群的有害刻板印象。,estereotipo,Las representaciones mediáticas a menudo refuerzan estereotipos dañinos sobre minorías.,khuôn mẫu; định kiến,Hình ảnh truyền thông thường củng cố các định kiến có hại về cộng đồng thiểu số.,อคติ; ภาพจำ,สื่อมักตอกย้ำภาพจำที่เป็นอันตรายเกี่ยวกับชุมชนชนกลุ่มน้อย,stereotip,Penggambaran media sering memperkuat stereotip berbahaya tentang komunitas minoritas.
stimulate,The fiscal policy aimed to stimulate economic growth during the recession.,자극하다; 촉진하다,재정 정책은 경기 침체기에 경제 성장을 촉진하는 것을 목표로 했다.,刺激する,財政政策は不況時の経済成長を刺激することを目指した。,刺激; 促进,财政政策旨在刺激经济衰退期间的经济增长。,estimular,La política fiscal buscaba estimular el crecimiento económico durante la recesión.,kích thích,Chính sách tài khóa nhằm kích thích tăng trưởng kinh tế trong thời kỳ suy thoái.,กระตุ้น,นโยบายการคลังมุ่งกระตุ้นการเติบโตทางเศรษฐกิจในช่วงภาวะถดถอย,merangsang,Kebijakan fiskal bertujuan merangsang pertumbuhan ekonomi selama resesi.
stipulate,The contract stipulates that both parties must agree to any amendments.,규정하다; 명시하다,계약서는 양 당사자가 모든 수정에 동의해야 한다고 규정한다.,規定する,契約は両当事者がいかなる修正にも同意しなければならないと規定している。,规定,合同规定双方必须同意任何修改。,estipular,El contrato estipula que ambas partes deben acordar cualquier enmienda.,quy định,Hợp đồng quy định rằng cả hai bên phải đồng ý với bất kỳ sửa đổi nào.,กำหนด; ระบุ,สัญญากำหนดว่าทั้งสองฝ่ายต้องตกลงในการแก้ไขใดๆ,menetapkan,Kontrak menetapkan bahwa kedua pihak harus menyetujui setiap amandemen.
strata,Geologists analyzed the rock strata to determine the age of fossils.,지층; 계층,지질학자들은 화석의 나이를 결정하기 위해 암석 지층을 분석했다.,地層; 階層,地質学者たちは化石の年代を特定するために岩石の地層を分析した。,地层; 阶层,地质学家分析了岩层以确定化石的年代。,estratos,Los geólogos analizaron los estratos rocosos para determinar la edad de los fósiles.,tầng lớp; địa tầng,Các nhà địa chất đã phân tích các tầng đá để xác định tuổi của hóa thạch.,ชั้น,นักธรณีวิทยาวิเคราะห์ชั้นหินเพื่อระบุอายุของฟอสซิล,lapisan; strata,Ahli geologi menganalisis strata batuan untuk menentukan usia fosil.
stringent,The university enforces stringent academic integrity policies for all students.,엄격한,대학은 모든 학생에게 엄격한 학문적 진실성 정책을 시행한다.,厳格な,大学はすべての学生に厳格な学術的誠実さの方針を施行している。,严格的,大学对所有学生执行严格的学术诚信政策。,estricto; riguroso,La universidad aplica políticas estrictas de integridad académica para todos los estudiantes.,nghiêm ngặt,Trường đại học thực thi các chính sách liêm chính học thuật nghiêm ngặt cho tất cả sinh viên.,เข้มงวด,มหาวิทยาลัยบังคับใช้นโยบายความซื่อสัตย์ทางวิชาการที่เข้มงวดสำหรับนักศึกษาทุกคน,ketat,Universitas memberlakukan kebijakan integritas akademik yang ketat untuk semua mahasiswa.
subordinate,The manager assigned the task to a subordinate within the department.,하위의; 부하,관리자는 부서 내 부하 직원에게 업무를 할당했다.,部下; 従属的な,マネージャーは部門内の部下にその作業を割り当てた。,下属; 从属的,经理将任务分配给部门内的一名下属。,subordinado,El gerente asignó la tarea a un subordinado dentro del departamento.,cấp dưới,Người quản lý đã giao nhiệm vụ cho một cấp dưới trong bộ phận.,ผู้ใต้บังคับบัญชา,ผู้จัดการมอบหมายงานให้ผู้ใต้บังคับบัญชาภายในแผนก,bawahan,Manajer menugaskan pekerjaan kepada bawahan di dalam departemen.
subsequent,Subsequent experiments validated the hypothesis proposed in the original paper.,그 다음의; 후속의,후속 실험들이 원래 논문에서 제안된 가설을 검증했다.,その後の,その後の実験は元の論文で提案された仮説を検証した。,随后的; 后续的,后续实验验证了原论文中提出的假设。,subsiguiente,Los experimentos subsiguientes validaron la hipótesis propuesta en el artículo original.,tiếp theo; sau đó,Các thí nghiệm tiếp theo đã xác nhận giả thuyết được đề xuất trong bài báo gốc.,ถัดมา; ตามมา,การทดลองที่ตามมาได้ยืนยันสมมติฐานที่เสนอในบทความต้นฉบับ,selanjutnya,Eksperimen selanjutnya memvalidasi hipotesis yang diajukan dalam makalah asli.
subsidiary,The corporation established a subsidiary to manage overseas operations effectively.,자회사; 보조적인,그 기업은 해외 사업을 효과적으로 관리하기 위해 자회사를 설립했다.,子会社; 補助的な,その企業は海外事業を効果的に管理するために子会社を設立した。,子公司; 附属的,该公司成立了一家子公司以有效管理海外业务。,subsidiario; filial,La corporación estableció una filial para gestionar operaciones en el extranjero.,công ty con,Tập đoàn đã thành lập một công ty con để quản lý hoạt động ở nước ngoài.,บริษัทในเครือ,บริษัทก่อตั้งบริษัทในเครือเพื่อจัดการการดำเนินงานในต่างประเทศอย่างมีประสิทธิภาพ,anak perusahaan,Korporasi mendirikan anak perusahaan untuk mengelola operasi luar negeri secara efektif.
substantiate,The researcher needed additional data to substantiate her theoretical claims.,입증하다; 실증하다,연구자는 이론적 주장을 입증하기 위해 추가 데이터가 필요했다.,実証する,研究者は理論的主張を実証するために追加データが必要だった。,证实,研究人员需要额外的数据来证实她的理论主张。,fundamentar; corroborar,La investigadora necesitaba datos adicionales para fundamentar sus afirmaciones teóricas.,chứng minh,Nhà nghiên cứu cần thêm dữ liệu để chứng minh các luận điểm lý thuyết của mình.,พิสูจน์; ยืนยัน,นักวิจัยต้องการข้อมูลเพิ่มเติมเพื่อพิสูจน์ข้อเรียกร้องทางทฤษฎีของเธอ,membuktikan,Peneliti membutuhkan data tambahan untuk membuktikan klaim teoretisnya.
substitute,Renewable energy sources can substitute fossil fuels in power generation..,대체하다; 대용품,재생 에너지원은 발전에서 화석 연료를 대체할 수 있다.,代替する; 代用品,再生可能エネルギー源は発電において化石燃料を代替できる。,替代; 替代品,可再生能源可以替代化石燃料进行发电。,sustituir; sustituto,Las fuentes de energía renovable pueden sustituir a los combustibles fósiles en la generación.,thay thế,Các nguồn năng lượng tái tạo có thể thay thế nhiên liệu hóa thạch trong sản xuất điện.,ทดแทน,แหล่งพลังงานหมุนเวียนสามารถทดแทนเชื้อเพลิงฟอสซิลในการผลิตไฟฟ้า,menggantikan,Sumber energi terbarukan dapat menggantikan bahan bakar fosil dalam pembangkit listrik.
subtle,The subtle differences between the two dialects require careful linguistic analysis.,미묘한,두 방언 사이의 미묘한 차이는 신중한 언어학적 분석이 필요하다.,微妙な,二つの方言の微妙な違いは慎重な言語学的分析を必要とする。,微妙的,两种方言之间的微妙差异需要仔细的语言学分析。,sutil,Las diferencias sutiles entre los dos dialectos requieren un análisis lingüístico cuidadoso.,tinh tế; tế nhị,Những khác biệt tinh tế giữa hai phương ngữ đòi hỏi phân tích ngôn ngữ học kỹ lưỡng.,ละเอียดอ่อน,ความแตกต่างที่ละเอียดอ่อนระหว่างสองภาษาถิ่นต้องการการวิเคราะห์ภาษาศาสตร์อย่างรอบคอบ,halus,Perbedaan halus antara kedua dialek memerlukan analisis linguistik yang cermat.
succumb,Many patients succumbed to the disease before the vaccine was developed.,굴복하다; 쓰러지다,많은 환자들이 백신이 개발되기 전에 그 질병에 쓰러졌다.,屈服する; 負ける,多くの患者がワクチン開発前にその病気に屈した。,屈服; 死于,许多患者在疫苗研发之前死于这种疾病。,sucumbir,Muchos pacientes sucumbieron a la enfermedad antes de que se desarrollara la vacuna.,chết vì; khuất phục,Nhiều bệnh nhân đã chết vì bệnh trước khi vắc-xin được phát triển.,ยอมจำนน; เสียชีวิต,ผู้ป่วยจำนวนมากเสียชีวิตจากโรคก่อนที่จะมีการพัฒนาวัคซีน,menyerah,Banyak pasien menyerah pada penyakit sebelum vaksin dikembangkan.
sufficient,The evidence was sufficient to support the prosecution in the trial.,충분한,증거는 재판에서 기소를 뒷받침하기에 충분했다.,十分な,証拠は裁判での起訴を裏付けるのに十分であった。,充分的,证据足以支持审判中的起诉。,suficiente,La evidencia fue suficiente para respaldar la acusación en el juicio.,đủ,Bằng chứng đã đủ để hỗ trợ việc truy tố trong phiên tòa.,เพียงพอ,หลักฐานเพียงพอที่จะสนับสนุนการฟ้องร้องในการพิจารณาคดี,cukup,Bukti tersebut cukup untuk mendukung penuntutan dalam persidangan.
superficial,The analysis was too superficial to capture the complexity of the issue.,표면적인; 피상적인,분석이 너무 피상적이어서 문제의 복잡성을 포착할 수 없었다.,表面的な,分析は表面的すぎてその問題の複雑さを捉えられなかった。,肤浅的; 表面的,分析过于肤浅无法捕捉问题的复杂性。,superficial,El análisis fue demasiado superficial para captar la complejidad del problema.,hời hợt; bề ngoài,Phân tích quá hời hợt để nắm bắt được sự phức tạp của vấn đề.,ผิวเผิน,การวิเคราะห์นั้นผิวเผินเกินกว่าจะเข้าใจความซับซ้อนของปัญหา,dangkal,Analisis tersebut terlalu dangkal untuk menangkap kompleksitas masalah.
supersede,The new regulation will supersede all previous environmental protection guidelines.,대체하다; 대신하다,새 규정은 모든 이전 환경 보호 지침을 대체할 것이다.,取って代わる,新しい規制はすべての以前の環境保護ガイドラインに取って代わる。,取代,新法规将取代所有先前的环境保护准则。,reemplazar; sustituir,La nueva regulación reemplazará todas las directrices anteriores de protección ambiental.,thay thế,Quy định mới sẽ thay thế tất cả các hướng dẫn bảo vệ môi trường trước đó.,แทนที่,กฎระเบียบใหม่จะแทนที่แนวทางการคุ้มครองสิ่งแวดล้อมก่อนหน้าทั้งหมด,menggantikan,Peraturan baru akan menggantikan semua pedoman perlindungan lingkungan sebelumnya.
supplement,Students may supplement their coursework with additional reading materials freely.,보충하다; 보충제,학생들은 추가 읽기 자료로 자유롭게 수업을 보충할 수 있다.,補足する; サプリメント,学生は追加の読書資料で自由にコースワークを補足できる。,补充,学生可以自由地用额外的阅读材料补充课程内容。,complementar; suplemento,Los estudiantes pueden complementar su trabajo de curso con materiales de lectura adicionales.,bổ sung,Sinh viên có thể tự do bổ sung bài học bằng các tài liệu đọc thêm.,เสริม; อาหารเสริม,นักศึกษาสามารถเสริมหลักสูตรด้วยเอกสารการอ่านเพิ่มเติมได้อย่างอิสระ,melengkapi,Mahasiswa dapat melengkapi tugas kuliah mereka dengan bahan bacaan tambahan secara bebas.
suppress,The government attempted to suppress information about the environmental disaster.,억압하다; 진압하다,정부는 환경 재난에 관한 정보를 억압하려 했다.,抑圧する,政府は環境災害に関する情報を抑圧しようとした。,压制; 镇压,政府试图压制有关环境灾难的信息。,suprimir,El gobierno intentó suprimir la información sobre el desastre ambiental.,đàn áp; che giấu,Chính phủ đã cố gắng che giấu thông tin về thảm họa môi trường.,ปราบปราม; ระงับ,รัฐบาลพยายามระงับข้อมูลเกี่ยวกับภัยพิบัติทางสิ่งแวดล้อม,menekan,Pemerintah berusaha menekan informasi tentang bencana lingkungan.
surge,There was a surge in demand for online education during the pandemic.,급증; 급등,팬데믹 기간 동안 온라인 교육에 대한 수요가 급증했다.,急増,パンデミック中にオンライン教育への需要が急増した。,激增,疫情期间在线教育需求激增。,aumento repentino,Hubo un aumento repentino en la demanda de educación en línea durante la pandemia.,sự gia tăng đột biến,Đã có sự gia tăng đột biến nhu cầu giáo dục trực tuyến trong đại dịch.,การเพิ่มขึ้นอย่างรวดเร็ว,มีความต้องการการศึกษาออนไลน์เพิ่มขึ้นอย่างรวดเร็วในช่วงการระบาด,lonjakan,Ada lonjakan permintaan pendidikan daring selama pandemi.
