sovereign,"The sovereign nation refused to submit to the ruling of the international court arguing that it would compromise national autonomy.",주권국의,주권 국가는 국가 자주성을 훼손할 것이라고 주장하며 국제 법원의 판결에 따르기를 거부했다.,主権国の,主権国家は国家の自律性を損なうとして国際裁判所の裁定に従うことを拒否した。,主权国家的,该主权国家拒绝服从国际法院的裁决认为这将损害国家自主权。,soberano,La nación soberana se negó a someterse al fallo del tribunal internacional argumentando que comprometería la autonomía nacional.,có chủ quyền,Quốc gia có chủ quyền từ chối tuân theo phán quyết của tòa án quốc tế với lý do sẽ làm tổn hại quyền tự chủ quốc gia.,อธิปไตย,ชาติที่มีอธิปไตยปฏิเสธที่จะยอมรับคำตัดสินของศาลระหว่างประเทศโดยอ้างว่าจะกระทบต่อเอกราชของชาติ,berdaulat,Negara berdaulat tersebut menolak tunduk pada putusan pengadilan internasional dengan alasan akan membahayakan otonomi nasional.
restitution,"The court ordered the convicted fraudster to pay full restitution to all victims who had suffered financial losses.",배상,법원은 유죄 판결을 받은 사기꾼에게 재정적 손실을 입은 모든 피해자에게 전액 배상을 지불하라고 명령했다.,賠償,裁判所は有罪判決を受けた詐欺師に対して財務的損失を被ったすべての被害者に全額賠償を支払うよう命じた。,赔偿,法院命令被定罪的欺诈者向所有遭受经济损失的受害者支付全额赔偿。,restitución,El tribunal ordenó al estafador condenado pagar la restitución completa a todas las víctimas que habían sufrido pérdidas financieras.,bồi thường,Tòa án ra lệnh cho kẻ lừa đảo bị kết án bồi thường toàn bộ cho tất cả nạn nhân chịu tổn thất tài chính.,การชดใช้,ศาลสั่งให้นักต้มตุ๋นที่ถูกตัดสินว่าผิดจ่ายค่าชดใช้เต็มจำนวนให้แก่เหยื่อทุกคนที่ได้รับความเสียหายทางการเงิน,restitusi,Pengadilan memerintahkan penipu yang dihukum untuk membayar restitusi penuh kepada semua korban yang menderita kerugian finansial.
writ,"The defense attorney filed a writ of habeas corpus demanding that the detained individual be brought before the court.",영장,변호인은 구금된 개인을 법원에 출석시킬 것을 요구하는 인신보호 영장을 제출했다.,令状,弁護人は拘留された個人を裁判所に出廷させることを要求する人身保護令状を提出した。,令状,辩护律师提交了人身保护令状要求将被拘留者带到法庭面前。,orden judicial,El abogado defensor presentó un recurso de habeas corpus exigiendo que el individuo detenido fuera llevado ante el tribunal.,lệnh tòa,Luật sư bào chữa đã nộp lệnh tòa habeas corpus yêu cầu đưa người bị giam giữ ra trước tòa án.,หมายศาล,ทนายฝ่ายจำเลยยื่นหมายศาลเรียกตัวบุคคลที่ถูกคุมขังให้มาปรากฏตัวต่อหน้าศาล,surat perintah,Pengacara pembela mengajukan surat perintah habeas corpus yang menuntut individu yang ditahan dibawa ke hadapan pengadilan.
usury,"Medieval European laws strictly prohibited usury viewing the practice of charging excessive interest as morally reprehensible.",고리대금,중세 유럽 법률은 과도한 이자를 부과하는 관행을 도덕적으로 비난받을 만한 것으로 보고 고리대금을 엄격히 금지했다.,高利貸し,中世ヨーロッパの法律は過度な利息を課す慣行を道徳的に非難すべきものとして高利貸しを厳しく禁止した。,高利贷,中世纪欧洲法律严格禁止高利贷认为收取过高利息的做法在道德上应受谴责。,usura,Las leyes medievales europeas prohibían estrictamente la usura considerando la práctica de cobrar intereses excesivos como moralmente reprobable.,cho vay nặng lãi,Luật pháp châu Âu thời trung cổ nghiêm cấm việc cho vay nặng lãi coi việc tính lãi suất quá cao là đáng lên án về mặt đạo đức.,การให้กู้ยืมเงินดอกเบี้ยสูง,กฎหมายยุโรปในยุคกลางห้ามการให้กู้ยืมเงินดอกเบี้ยสูงอย่างเข้มงวดโดยมองว่าการเก็บดอกเบี้ยมากเกินไปเป็นสิ่งที่น่าตำหนิทางศีลธรรม,riba,Hukum Eropa abad pertengahan secara ketat melarang riba memandang praktik memungut bunga berlebihan sebagai tercela secara moral.
solvent,"Despite facing mounting debts the company remained technically solvent because its assets still exceeded its total liabilities.",지급 능력이 있는,부채가 증가함에도 불구하고 회사의 자산이 여전히 총 부채를 초과하여 기술적으로 지급 능력이 있었다.,支払い能力のある,膨らむ負債に直面しながらも資産が総負債を上回っていたため会社は技術的に支払い能力を維持していた。,有偿付能力的,尽管面临不断增加的债务但该公司在技术上仍具有偿付能力因为其资产仍超过其总负债。,solvente,A pesar de enfrentar deudas crecientes la empresa seguía siendo técnicamente solvente porque sus activos aún superaban sus pasivos totales.,có khả năng thanh toán,Mặc dù đối mặt với nợ tăng cao công ty vẫn về mặt kỹ thuật có khả năng thanh toán vì tài sản vẫn vượt quá tổng nợ phải trả.,มีความสามารถชำระหนี้,แม้จะเผชิญกับหนี้ที่เพิ่มขึ้นบริษัทยังคงมีความสามารถชำระหนี้ในทางเทคนิคเนื่องจากสินทรัพย์ยังคงมากกว่าหนี้สินรวม,solven,Meskipun menghadapi utang yang meningkat perusahaan tetap secara teknis solven karena asetnya masih melebihi total kewajibannya.
cartel,"The oil cartel coordinated production cuts among its members to artificially inflate global crude oil prices.",카르텔,석유 카르텔은 글로벌 원유 가격을 인위적으로 올리기 위해 회원국 간 생산 감축을 조정했다.,カルテル,石油カルテルは世界の原油価格を人為的に引き上げるために加盟国間で減産を調整した。,卡特尔,石油卡特尔协调其成员国减产以人为抬高全球原油价格。,cártel,El cártel petrolero coordinó recortes de producción entre sus miembros para inflar artificialmente los precios mundiales del petróleo crudo.,các-ten,Các-ten dầu mỏ đã phối hợp cắt giảm sản lượng giữa các thành viên để đẩy giá dầu thô toàn cầu lên cao một cách nhân tạo.,คาร์เทล,คาร์เทลน้ำมันประสานงานการลดการผลิตในหมู่สมาชิกเพื่อเพิ่มราคาน้ำมันดิบโลกอย่างเทียม,kartel,Kartel minyak mengoordinasikan pemotongan produksi di antara anggotanya untuk menaikkan harga minyak mentah global secara artifisial.
debenture,"The corporation issued debentures to raise capital for its ambitious expansion plan without diluting existing shareholders' equity.",사채,기업은 기존 주주의 지분을 희석시키지 않고 야심찬 확장 계획을 위한 자본을 조달하기 위해 사채를 발행했다.,社債,企業は既存株主の持分を希薄化させることなく野心的な拡大計画のための資金を調達するために社債を発行した。,债券,该公司发行了无担保债券以筹集资金用于雄心勃勃的扩张计划而不稀释现有股东的股权。,obligación,La corporación emitió obligaciones para recaudar capital para su ambicioso plan de expansión sin diluir el capital de los accionistas existentes.,trái phiếu không bảo đảm,Công ty phát hành trái phiếu không bảo đảm để huy động vốn cho kế hoạch mở rộng đầy tham vọng mà không pha loãng vốn chủ sở hữu của cổ đông hiện tại.,หุ้นกู้,บริษัทออกหุ้นกู้เพื่อระดมทุนสำหรับแผนการขยายกิจการที่ทะเยอทะยานโดยไม่เจือจางส่วนทุนของผู้ถือหุ้นเดิม,obligasi,Perusahaan menerbitkan obligasi untuk mengumpulkan modal bagi rencana ekspansinya yang ambisius tanpa mendilusi ekuitas pemegang saham yang ada.
prosody,"The linguist's analysis of prosody revealed how intonation patterns differ significantly between questions and statements in Mandarin.",운율학,언어학자의 운율 분석은 만다린어에서 의문문과 평서문 사이에 억양 패턴이 어떻게 크게 다른지를 밝혔다.,韻律,言語学者の韻律分析は北京語において疑問文と平叙文の間でイントネーションパターンがどのように大きく異なるかを明らかにした。,韵律,语言学家对韵律的分析揭示了普通话中疑问句和陈述句之间语调模式的显著差异。,prosodia,El análisis de la prosodia del lingüista reveló cómo los patrones de entonación difieren significativamente entre preguntas y declaraciones en mandarín.,ngữ điệu,Phân tích ngữ điệu của nhà ngôn ngữ học cho thấy các mô hình ngữ điệu khác biệt đáng kể giữa câu hỏi và câu trần thuật trong tiếng Quan Thoại.,ทำนองเสียง,การวิเคราะห์ทำนองเสียงของนักภาษาศาสตร์เผยให้เห็นว่ารูปแบบการออกเสียงแตกต่างกันอย่างมีนัยสำคัญระหว่างคำถามและคำกล่าวในภาษาจีนกลาง,prosodi,Analisis prosodi linguistik mengungkapkan bagaimana pola intonasi berbeda secara signifikan antara pertanyaan dan pernyataan dalam bahasa Mandarin.
metastasis,"The oncologist confirmed that metastasis had occurred with the cancer spreading from the lungs to the liver and bones.",전이,종양 전문의는 암이 폐에서 간과 뼈로 퍼지며 전이가 발생했음을 확인했다.,転移,腫瘍専門医は肺から肝臓と骨にがんが転移したことを確認した。,转移,肿瘤专家确认已发生转移癌症已从肺部扩散到肝脏和骨骼。,metástasis,El oncólogo confirmó que se había producido metástasis con el cáncer extendiéndose de los pulmones al hígado y los huesos.,di căn,Bác sĩ ung thư xác nhận đã xảy ra di căn với ung thư lan từ phổi sang gan và xương.,การแพร่กระจาย,แพทย์ด้านมะเร็งยืนยันว่ามีการแพร่กระจายเกิดขึ้นโดยมะเร็งกระจายจากปอดไปยังตับและกระดูก,metastasis,Ahli onkologi mengonfirmasi bahwa metastasis telah terjadi dengan kanker menyebar dari paru-paru ke hati dan tulang.
asymptomatic,"Many carriers of the virus were asymptomatic making it extremely difficult to track and contain the outbreak.",무증상의,바이러스의 많은 보균자가 무증상이어서 발병을 추적하고 억제하는 것이 매우 어려웠다.,無症状の,ウイルスの多くの保菌者は無症状であったため感染拡大の追跡と封じ込めが極めて困難であった。,无症状的,许多病毒携带者是无症状的这使得追踪和控制疫情极为困难。,asintomático,Muchos portadores del virus eran asintomáticos lo que hacía extremadamente difícil rastrear y contener el brote.,không có triệu chứng,Nhiều người mang virus không có triệu chứng khiến việc theo dõi và kiểm soát dịch bệnh trở nên cực kỳ khó khăn.,ไม่มีอาการ,ผู้ติดเชื้อหลายคนไม่มีอาการทำให้การติดตามและควบคุมการระบาดเป็นเรื่องยากมาก,asimtomatik,Banyak pembawa virus bersifat asimtomatik sehingga sangat sulit untuk melacak dan mengendalikan wabah.
endoscopy,"The gastroenterologist performed an endoscopy to examine the lining of the patient's esophagus for signs of chronic inflammation.",내시경 검사,위장병 전문의는 만성 염증의 징후를 확인하기 위해 환자의 식도 내벽을 검사하는 내시경 검사를 시행했다.,内視鏡検査,消化器専門医は慢性炎症の兆候がないか患者の食道の粘膜を調べるために内視鏡検査を行った。,内窥镜检查,胃肠病学家进行了内窥镜检查以检查患者食道内壁是否有慢性炎症迹象。,endoscopia,El gastroenterólogo realizó una endoscopia para examinar el revestimiento del esófago del paciente en busca de signos de inflamación crónica.,nội soi,Bác sĩ tiêu hóa đã thực hiện nội soi để kiểm tra niêm mạc thực quản của bệnh nhân tìm dấu hiệu viêm mãn tính.,การส่องกล้อง,แพทย์ระบบทางเดินอาหารทำการส่องกล้องเพื่อตรวจสอบเยื่อบุหลอดอาหารของผู้ป่วยหาสัญญาณของการอักเสบเรื้อรัง,endoskopi,Ahli gastroenterologi melakukan endoskopi untuk memeriksa lapisan esofagus pasien untuk tanda-tanda peradangan kronis.
synthesis,"The biochemist achieved the complete synthesis of the protein molecule using a novel technique that reduced production time by half.",합성,생화학자는 생산 시간을 절반으로 줄이는 새로운 기술을 사용하여 단백질 분자의 완전한 합성을 달성했다.,合成,生化学者は生産時間を半分に短縮する新しい技術を使用してタンパク質分子の完全な合成を達成した。,合成,生物化学家使用一种将生产时间缩短一半的新技术实现了蛋白质分子的完全合成。,síntesis,El bioquímico logró la síntesis completa de la molécula de proteína utilizando una técnica novedosa que redujo el tiempo de producción a la mitad.,tổng hợp,Nhà hóa sinh đã đạt được sự tổng hợp hoàn chỉnh phân tử protein bằng kỹ thuật mới giảm thời gian sản xuất xuống một nửa.,การสังเคราะห์,นักชีวเคมีบรรลุการสังเคราะห์โมเลกุลโปรตีนที่สมบูรณ์โดยใช้เทคนิคใหม่ที่ลดเวลาการผลิตลงครึ่งหนึ่ง,sintesis,Ahli biokimia mencapai sintesis lengkap molekul protein menggunakan teknik baru yang mengurangi waktu produksi hingga setengahnya.
levy,"The government proposed a new levy on carbon emissions to incentivize corporations to adopt cleaner energy sources.",부과금,정부는 기업이 더 깨끗한 에너지원을 채택하도록 장려하기 위해 탄소 배출에 대한 새로운 부과금을 제안했다.,課徴金,政府は企業にクリーンなエネルギー源の採用を促すために炭素排出に対する新たな課徴金を提案した。,征税,政府提议对碳排放征收新税以激励企业采用更清洁的能源。,gravamen,El gobierno propuso un nuevo gravamen sobre las emisiones de carbono para incentivar a las corporaciones a adoptar fuentes de energía más limpias.,thuế,Chính phủ đề xuất một khoản thuế mới đối với lượng khí thải carbon để khuyến khích các tập đoàn áp dụng nguồn năng lượng sạch hơn.,การจัดเก็บภาษี,รัฐบาลเสนอการจัดเก็บภาษีใหม่สำหรับการปล่อยก๊าซคาร์บอนเพื่อจูงใจให้บริษัทนำแหล่งพลังงานสะอาดมาใช้,pungutan,Pemerintah mengusulkan pungutan baru atas emisi karbon untuk mendorong perusahaan mengadopsi sumber energi yang lebih bersih.
remittance,"The flow of remittances from workers abroad represents a significant portion of the developing nation's gross domestic product.",송금,해외 근로자들의 송금 흐름은 개발도상국 국내 총생산의 상당 부분을 차지한다.,送金,海外の労働者からの送金の流れはその開発途上国の国内総生産の相当部分を占めている。,汇款,海外工人的汇款流是该发展中国家国内生产总值的重要组成部分。,remesa,El flujo de remesas de los trabajadores en el extranjero representa una porción significativa del producto interno bruto de la nación en desarrollo.,kiều hối,Dòng kiều hối từ lao động ở nước ngoài chiếm một phần đáng kể trong tổng sản phẩm quốc nội của quốc gia đang phát triển.,เงินโอน,กระแสเงินโอนจากแรงงานในต่างประเทศเป็นสัดส่วนสำคัญของผลิตภัณฑ์มวลรวมภายในประเทศของประเทศกำลังพัฒนา,remitansi,Aliran remitansi dari pekerja di luar negeri mewakili porsi signifikan dari produk domestik bruto negara berkembang tersebut.
syndicate,"A syndicate of international banks was formed to underwrite the massive infrastructure bond offering.",신디케이트,대규모 인프라 채권 발행을 인수하기 위해 국제 은행 신디케이트가 결성되었다.,シンジケート,大規模なインフラ債の引受のために国際銀行のシンジケートが結成された。,辛迪加,一个国际银行辛迪加成立来承销这次大规模基础设施债券发行。,sindicato,Se formó un sindicato de bancos internacionales para suscribir la masiva oferta de bonos de infraestructura.,tập đoàn tài chính,Một tập đoàn tài chính gồm các ngân hàng quốc tế được thành lập để bảo lãnh phát hành trái phiếu cơ sở hạ tầng quy mô lớn.,กลุ่มธนาคาร,กลุ่มธนาคารระหว่างประเทศถูกจัดตั้งขึ้นเพื่อรับประกันการเสนอขายพันธบัตรโครงสร้างพื้นฐานขนาดใหญ่,sindikat,Sebuah sindikat bank internasional dibentuk untuk menjamin penawaran obligasi infrastruktur besar-besaran tersebut.
speculation,"Rampant speculation in the real estate market created an unsustainable bubble that eventually burst with devastating consequences.",투기,부동산 시장에서의 만연한 투기는 결국 파괴적인 결과와 함께 붕괴한 지속 불가능한 거품을 만들었다.,投機,不動産市場における蔓延する投機は最終的に壊滅的な結果をもたらして崩壊した持続不可能なバブルを生み出した。,投机,房地产市场猖獗的投机行为制造了一个不可持续的泡沫最终以毁灭性的后果破裂。,especulación,La especulación desenfrenada en el mercado inmobiliario creó una burbuja insostenible que finalmente estalló con consecuencias devastadoras.,đầu cơ,Đầu cơ tràn lan trong thị trường bất động sản đã tạo ra bong bóng không bền vững cuối cùng vỡ tung với hậu quả tàn khốc.,การเก็งกำไร,การเก็งกำไรที่แพร่หลายในตลาดอสังหาริมทรัพย์สร้างฟองสบู่ที่ไม่ยั่งยืนซึ่งในที่สุดก็แตกออกด้วยผลลัพธ์ที่เลวร้าย,spekulasi,Spekulasi yang merajalela di pasar real estat menciptakan gelembung yang tidak berkelanjutan yang akhirnya pecah dengan konsekuensi yang menghancurkan.
mercantilism,"The economic historian argued that mercantilism as a doctrine prioritized national wealth accumulation through favorable trade balances.",중상주의,경제사학자는 중상주의가 교리로서 유리한 무역 수지를 통한 국부 축적을 우선시했다고 주장했다.,重商主義,経済史家は重商主義が教義として有利な貿易収支を通じた国富の蓄積を優先したと論じた。,重商主义,经济史学家认为重商主义作为一种学说优先考虑通过有利的贸易收支来积累国家财富。,mercantilismo,El historiador económico argumentó que el mercantilismo como doctrina priorizaba la acumulación de riqueza nacional a través de balanzas comerciales favorables.,chủ nghĩa trọng thương,Nhà sử học kinh tế lập luận rằng chủ nghĩa trọng thương với tư cách là một học thuyết ưu tiên tích lũy tài sản quốc gia thông qua cán cân thương mại thuận lợi.,ลัทธิพาณิชยนิยม,นักประวัติศาสตร์เศรษฐกิจโต้แย้งว่าลัทธิพาณิชยนิยมในฐานะหลักคำสอนให้ความสำคัญกับการสะสมความมั่งคั่งของชาติผ่านดุลการค้าที่เอื้ออำนวย,merkantilisme,Sejarawan ekonomi berpendapat bahwa merkantilisme sebagai doktrin memprioritaskan akumulasi kekayaan nasional melalui neraca perdagangan yang menguntungkan.
pheromone,"Scientists discovered that the insect uses pheromones to communicate alarm signals that trigger coordinated defensive behavior in the colony.",페로몬,과학자들은 곤충이 군체의 협조적인 방어 행동을 유발하는 경보 신호를 전달하기 위해 페로몬을 사용한다는 것을 발견했다.,フェロモン,科学者は昆虫がコロニーでの協調的な防御行動を引き起こす警報信号を伝達するためにフェロモンを使用していることを発見した。,信息素,科学家发现该昆虫使用信息素传递警报信号从而触发群体中的协调防御行为。,feromona,Los científicos descubrieron que el insecto utiliza feromonas para comunicar señales de alarma que desencadenan un comportamiento defensivo coordinado en la colonia.,pheromone,Các nhà khoa học phát hiện rằng côn trùng sử dụng pheromone để truyền tín hiệu báo động kích hoạt hành vi phòng thủ phối hợp trong đàn.,ฟีโรโมน,นักวิทยาศาสตร์ค้นพบว่าแมลงใช้ฟีโรโมนในการสื่อสารสัญญาณเตือนภัยที่กระตุ้นพฤติกรรมป้องกันตัวอย่างประสานงานในรังผึ้ง,feromon,Para ilmuwan menemukan bahwa serangga menggunakan feromon untuk mengkomunikasikan sinyal alarm yang memicu perilaku pertahanan terkoordinasi dalam koloni.
symbiosis,"The relationship between the clownfish and the sea anemone is a textbook example of mutualistic symbiosis in marine ecosystems.",공생,흰동가리와 말미잘의 관계는 해양 생태계에서 상호이익적 공생의 교과서적 예이다.,共生,クマノミとイソギンチャクの関係は海洋生態系における相互共生の教科書的な例である。,共生,小丑鱼和海葵之间的关系是海洋生态系统中互利共生的教科书式典例。,simbiosis,La relación entre el pez payaso y la anémona de mar es un ejemplo de libro de texto de simbiosis mutualista en los ecosistemas marinos.,cộng sinh,Mối quan hệ giữa cá hề và hải quỳ là ví dụ kinh điển về cộng sinh hỗ trợ trong hệ sinh thái biển.,การอยู่ร่วมกัน,ความสัมพันธ์ระหว่างปลาการ์ตูนและดอกไม้ทะเลเป็นตัวอย่างในตำราเรียนของการอยู่ร่วมกันแบบพึ่งพาอาศัยกันในระบบนิเวศทางทะเล,simbiosis,Hubungan antara ikan badut dan anemon laut adalah contoh buku teks simbiosis mutualistik dalam ekosistem laut.
