signal transduction,Signal transduction cascades convert extracellular stimuli into intracellular biochemical responses.,신호전달,신호전달 연쇄반응은 세포외 자극을 세포내 생화학적 반응으로 변환한다.,シグナル伝達,シグナル伝達カスケードは細胞外刺激を細胞内の生化学的応答に変換する。,信号转导,信号转导级联将细胞外刺激转化为细胞内生化反应。,transducción de señales,Las cascadas de transducción de señales convierten estímulos extracelulares en respuestas bioquímicas intracelulares.,truyền tín hiệu,Các chuỗi truyền tín hiệu chuyển đổi kích thích ngoại bào thành phản ứng sinh hóa nội bào.,การถ่ายทอดสัญญาณ,กระบวนการถ่ายทอดสัญญาณแบบน้ำตกแปลงสิ่งกระตุ้นจากภายนอกเซลล์เป็นการตอบสนองทางชีวเคมีภายในเซลล์,transduksi sinyal,Kaskade transduksi sinyal mengubah rangsangan ekstraseluler menjadi respons biokimia intraseluler.
angiogenesis,Angiogenesis is the formation of new blood vessels from pre-existing vasculature during wound healing.,혈관신생,혈관신생은 상처 치유 과정에서 기존 혈관으로부터 새로운 혈관이 형성되는 것이다.,血管新生,血管新生は創傷治癒中に既存の血管から新しい血管が形成されることである。,血管生成,血管生成是伤口愈合过程中从已有血管形成新血管的过程。,angiogénesis,La angiogénesis es la formación de nuevos vasos sanguíneos a partir de vasculatura preexistente durante la cicatrización.,tân tạo mạch,Tân tạo mạch là sự hình thành mạch máu mới từ hệ mạch có sẵn trong quá trình lành vết thương.,การสร้างหลอดเลือดใหม่,การสร้างหลอดเลือดใหม่คือการสร้างหลอดเลือดใหม่จากหลอดเลือดที่มีอยู่แล้วระหว่างการรักษาแผล,angiogenesis,Angiogenesis adalah pembentukan pembuluh darah baru dari pembuluh darah yang sudah ada selama penyembuhan luka.
homologous recombination,Homologous recombination repairs double-strand DNA breaks using a sister chromatid as a template.,상동 재조합,상동 재조합은 자매 염색분체를 템플릿으로 사용하여 이중가닥 DNA 절단을 복구한다.,相同組換え,相同組換えは姉妹染色分体をテンプレートとして使用して二本鎖DNA切断を修復する。,同源重组,同源重组利用姐妹染色单体作为模板修复双链DNA断裂。,recombinación homóloga,La recombinación homóloga repara las roturas de doble cadena del ADN usando una cromátida hermana como plantilla.,tái tổ hợp tương đồng,Tái tổ hợp tương đồng sửa chữa các đứt gãy sợi đôi DNA bằng cách sử dụng nhiễm sắc tử chị em làm khuôn mẫu.,การรวมตัวแบบคล้ายคลึง,การรวมตัวแบบคล้ายคลึงซ่อมแซมการแตกหักของดีเอ็นเอสายคู่โดยใช้โครมาทิดพี่น้องเป็นแม่แบบ,rekombinasi homolog,Rekombinasi homolog memperbaiki kerusakan untai ganda DNA menggunakan kromatid saudara sebagai templat.
meristematic tissue,Meristematic tissue contains undifferentiated cells responsible for continuous plant growth.,분열조직,분열조직은 지속적인 식물 성장을 담당하는 미분화 세포를 포함한다.,分裂組織,分裂組織は継続的な植物の成長を担う未分化細胞を含む。,分生组织,分生组织包含负责植物持续生长的未分化细胞。,tejido meristemático,El tejido meristemático contiene células indiferenciadas responsables del crecimiento continuo de la planta.,mô phân sinh,Mô phân sinh chứa các tế bào chưa biệt hóa chịu trách nhiệm cho sự tăng trưởng liên tục của thực vật.,เนื้อเยื่อเจริญ,เนื้อเยื่อเจริญมีเซลล์ที่ยังไม่เปลี่ยนแปลงซึ่งรับผิดชอบการเจริญเติบโตอย่างต่อเนื่องของพืช,jaringan meristematik,Jaringan meristematik mengandung sel-sel yang belum terdiferensiasi yang bertanggung jawab atas pertumbuhan tanaman yang berkelanjutan.
allosteric regulation,Allosteric regulation modulates enzyme activity through binding at sites other than the active site.,알로스테릭 조절,알로스테릭 조절은 활성 부위가 아닌 다른 부위에서의 결합을 통해 효소 활성을 조절한다.,アロステリック調節,アロステリック調節は活性部位以外の部位での結合を通じて酵素活性を調節する。,变构调节,变构调节通过在活性位点以外的位点结合来调节酶活性。,regulación alostérica,La regulación alostérica modula la actividad enzimática mediante la unión en sitios distintos al sitio activo.,điều hòa dị lập thể,Điều hòa dị lập thể điều chỉnh hoạt tính enzyme thông qua liên kết tại các vị trí khác ngoài vị trí hoạt động.,การควบคุมแบบอัลโลสเตอริก,การควบคุมแบบอัลโลสเตอริกปรับเปลี่ยนกิจกรรมของเอนไซม์ผ่านการจับที่ตำแหน่งอื่นนอกเหนือจากตำแหน่งที่ทำงาน,regulasi alosterik,Regulasi alosterik memodulasi aktivitas enzim melalui pengikatan di situs selain situs aktif.
chemotaxis,Chemotaxis guides the directed movement of organisms toward or away from chemical stimuli.,주화성,주화성은 화학적 자극을 향해 또는 멀어지는 유기체의 방향성 이동을 안내한다.,走化性,走化性は化学刺激に向かうまたは遠ざかる生物の方向性のある移動を誘導する。,趋化性,趋化性引导生物体向化学刺激方向或远离化学刺激的定向运动。,quimiotaxis,La quimiotaxis guía el movimiento dirigido de organismos hacia o lejos de estímulos químicos.,hóa hướng động,Hóa hướng động hướng dẫn sự di chuyển có hướng của sinh vật về phía hoặc xa các kích thích hóa học.,เคมีแทกซิส,เคมีแทกซิสนำทางการเคลื่อนที่อย่างมีทิศทางของสิ่งมีชีวิตเข้าหาหรือออกห่างจากสิ่งกระตุ้นทางเคมี,kemotaksis,Kemotaksis memandu pergerakan terarah organisme menuju atau menjauhi rangsangan kimia.
symbiogenesis,Symbiogenesis proposes that mitochondria and chloroplasts originated from endosymbiotic prokaryotes.,공생발생,공생발생은 미토콘드리아와 엽록체가 내부공생 원핵생물에서 유래했다고 제안한다.,共生発生,共生発生はミトコンドリアと葉緑体が内部共生原核生物に由来すると提唱する。,共生起源,共生起源提出线粒体和叶绿体起源于内共生原核生物。,simbiogénesis,La simbiogénesis propone que las mitocondrias y los cloroplastos se originaron a partir de procariotas endosimbióticos.,cộng sinh phát sinh,Cộng sinh phát sinh đề xuất rằng ty thể và lục lạp có nguồn gốc từ các sinh vật nhân sơ nội cộng sinh.,ซิมไบโอเจเนซิส,ซิมไบโอเจเนซิสเสนอว่าไมโทคอนเดรียและคลอโรพลาสต์มีต้นกำเนิดจากโพรแคริโอตแบบเอนโดซิมไบโอติก,simbiogenesis,Simbiogenesis mengusulkan bahwa mitokondria dan kloroplas berasal dari prokariota endosimbiotik.
proteomics,Proteomics analyzes the entire complement of proteins expressed by a genome under specific conditions.,프로테오믹스,프로테오믹스는 특정 조건에서 게놈에 의해 발현되는 전체 단백질 보완체를 분석한다.,プロテオミクス,プロテオミクスは特定の条件下でゲノムによって発現されるタンパク質の全体を分析する。,蛋白质组学,蛋白质组学分析基因组在特定条件下表达的全部蛋白质。,proteómica,La proteómica analiza el complemento completo de proteínas expresadas por un genoma bajo condiciones específicas.,protein học,Protein học phân tích toàn bộ bổ sung protein được biểu hiện bởi một hệ gen trong các điều kiện cụ thể.,โปรตีโอมิกส์,โปรตีโอมิกส์วิเคราะห์โปรตีนทั้งหมดที่แสดงออกโดยจีโนมภายใต้สภาวะเฉพาะ,proteomik,Proteomik menganalisis seluruh komplemen protein yang diekspresikan oleh genom di bawah kondisi tertentu.
nucleosynthesis,Stellar nucleosynthesis forges heavier elements from hydrogen and helium in the cores of massive stars.,핵합성,항성 핵합성은 거대한 별의 핵에서 수소와 헬륨으로부터 더 무거운 원소를 만들어낸다.,核合成,恒星核合成は巨大な恒星の核で水素とヘリウムからより重い元素を生成する。,核合成,恒星核合成在大质量恒星核心中从氢和氦锻造更重的元素。,nucleosíntesis,La nucleosíntesis estelar forja elementos más pesados a partir de hidrógeno y helio en los núcleos de estrellas masivas.,tổng hợp hạt nhân,Tổng hợp hạt nhân sao tạo ra các nguyên tố nặng hơn từ hydro và heli trong lõi của các ngôi sao lớn.,นิวคลีโอซินทีซิส,นิวคลีโอซินทีซิสของดาวฤกษ์สร้างธาตุที่หนักกว่าจากไฮโดรเจนและฮีเลียมในแกนกลางของดาวฤกษ์มวลมาก,nukleosintesis,Nukleosintesis bintang menempa unsur-unsur yang lebih berat dari hidrogen dan helium di inti bintang masif.
redshift,The cosmological redshift of distant galaxies provides evidence for the expansion of the universe.,적색편이,먼 은하의 우주론적 적색편이는 우주 팽창에 대한 증거를 제공한다.,赤方偏移,遠方の銀河の宇宙論的赤方偏移は宇宙の膨張の証拠を提供する。,红移,遥远星系的宇宙学红移为宇宙膨胀提供了证据。,corrimiento al rojo,El corrimiento al rojo cosmológico de galaxias distantes proporciona evidencia de la expansión del universo.,dịch chuyển đỏ,Dịch chuyển đỏ vũ trụ học của các thiên hà xa cung cấp bằng chứng cho sự giãn nở của vũ trụ.,การเลื่อนไปทางแดง,การเลื่อนไปทางแดงทางจักรวาลวิทยาของกาแล็กซีที่อยู่ไกลให้หลักฐานของการขยายตัวของเอกภพ,pergeseran merah,Pergeseran merah kosmologis galaksi-galaksi jauh memberikan bukti ekspansi alam semesta.
accretion disk,An accretion disk forms when matter spirals inward toward a compact object such as a black hole.,강착원반,강착원반은 물질이 블랙홀과 같은 치밀한 천체를 향해 안쪽으로 나선형으로 움직일 때 형성된다.,降着円盤,降着円盤はブラックホールのようなコンパクト天体に向かって物質が内側に渦を巻くときに形成される。,吸积盘,当物质向黑洞等致密天体内旋时形成吸积盘。,disco de acreción,Un disco de acreción se forma cuando la materia espirala hacia el interior de un objeto compacto como un agujero negro.,đĩa bồi tụ,Đĩa bồi tụ hình thành khi vật chất xoáy vào phía trong hướng tới một vật thể chặt như hố đen.,จานสะสมมวล,จานสะสมมวลเกิดขึ้นเมื่อสสารหมุนวนเข้าด้านในไปยังวัตถุอัดแน่นเช่นหลุมดำ,piringan akresi,Piringan akresi terbentuk ketika materi berputar ke dalam menuju objek kompak seperti lubang hitam.
gravitational lensing,Gravitational lensing bends light from distant sources as it passes through the warped spacetime near massive objects.,중력렌즈,중력렌즈는 거대한 천체 근처의 휘어진 시공간을 통과할 때 먼 광원의 빛을 휘게 한다.,重力レンズ,重力レンズは巨大な天体の近くの歪んだ時空を通過する際に遠方の光源からの光を曲げる。,引力透镜,引力透镜在光线经过大质量天体附近弯曲的时空时使来自遥远光源的光发生弯曲。,lente gravitacional,La lente gravitacional curva la luz de fuentes distantes al pasar por el espacio-tiempo deformado cerca de objetos masivos.,thấu kính hấp dẫn,Thấu kính hấp dẫn bẻ cong ánh sáng từ các nguồn xa khi nó đi qua không-thời gian bị biến dạng gần các vật thể lớn.,เลนส์ความโน้มถ่วง,เลนส์ความโน้มถ่วงเบี่ยงเบนแสงจากแหล่งกำเนิดที่อยู่ไกลเมื่อผ่านกาลอวกาศที่บิดเบี้ยวใกล้วัตถุมวลมาก,lensa gravitasi,Lensa gravitasi membelokkan cahaya dari sumber jauh saat melewati ruang-waktu yang melengkung di dekat objek masif.
cosmic microwave background,The cosmic microwave background radiation is a relic of the early universe shortly after the Big Bang.,우주 마이크로파 배경,우주 마이크로파 배경 복사는 빅뱅 직후 초기 우주의 유물이다.,宇宙マイクロ波背景放射,宇宙マイクロ波背景放射はビッグバンの直後の初期宇宙の遺物である。,宇宙微波背景,宇宙微波背景辐射是大爆炸后不久早期宇宙的遗迹。,radiación cósmica de fondo de microondas,La radiación cósmica de fondo de microondas es una reliquia del universo temprano poco después del Big Bang.,bức xạ nền vi sóng vũ trụ,Bức xạ nền vi sóng vũ trụ là di tích của vũ trụ sơ khai ngay sau Vụ Nổ Lớn.,รังสีไมโครเวฟพื้นหลังของจักรวาล,รังสีไมโครเวฟพื้นหลังของจักรวาลเป็นสิ่งที่หลงเหลือจากเอกภพยุคแรกหลังบิกแบงไม่นาน,radiasi latar belakang gelombang mikro kosmik,Radiasi latar belakang gelombang mikro kosmik adalah peninggalan alam semesta awal tak lama setelah Big Bang.
dark matter,Dark matter constitutes approximately twenty-seven percent of the universe yet remains undetectable by electromagnetic radiation.,암흑물질,암흑물질은 우주의 약 27퍼센트를 구성하지만 전자기 복사로는 감지할 수 없다.,暗黒物質,暗黒物質は宇宙の約27パーセントを構成するが電磁放射では検出できない。,暗物质,暗物质约占宇宙的百分之二十七，但仍无法通过电磁辐射探测到。,materia oscura,La materia oscura constituye aproximadamente el veintisiete por ciento del universo pero permanece indetectable por radiación electromagnética.,vật chất tối,Vật chất tối chiếm khoảng hai mươi bảy phần trăm vũ trụ nhưng vẫn không thể phát hiện bằng bức xạ điện từ.,สสารมืด,สสารมืดคิดเป็นประมาณยี่สิบเจ็ดเปอร์เซ็นต์ของเอกภพแต่ยังคงตรวจจับไม่ได้ด้วยรังสีแม่เหล็กไฟฟ้า,materi gelap,Materi gelap merupakan sekitar dua puluh tujuh persen alam semesta namun tetap tidak terdeteksi oleh radiasi elektromagnetik.
event horizon,The event horizon marks the boundary beyond which nothing can escape a black hole's gravitational pull.,사건의 지평선,사건의 지평선은 블랙홀의 중력에서 아무것도 탈출할 수 없는 경계를 표시한다.,事象の地平面,事象の地平面はブラックホールの重力から何も脱出できない境界を示す。,事件视界,事件视界标志着任何物体都无法逃脱黑洞引力的边界。,horizonte de eventos,El horizonte de eventos marca el límite más allá del cual nada puede escapar de la atracción gravitacional de un agujero negro.,chân trời sự kiện,Chân trời sự kiện đánh dấu ranh giới mà không gì có thể thoát khỏi lực hấp dẫn của hố đen.,ขอบฟ้าเหตุการณ์,ขอบฟ้าเหตุการณ์เป็นเส้นแบ่งเขตที่ไม่มีสิ่งใดสามารถหลุดพ้นจากแรงโน้มถ่วงของหลุมดำได้,cakrawala peristiwa,Cakrawala peristiwa menandai batas di mana tidak ada yang bisa lolos dari tarikan gravitasi lubang hitam.
neutron degeneracy,Neutron degeneracy pressure prevents further gravitational collapse in neutron stars.,중성자 축퇴,중성자 축퇴 압력은 중성자별에서 추가적인 중력 붕괴를 방지한다.,中性子縮退,中性子縮退圧は中性子星におけるさらなる重力崩壊を防ぐ。,中子简并,中子简并压力防止中子星进一步的引力坍缩。,degeneración de neutrones,La presión de degeneración de neutrones previene un mayor colapso gravitacional en las estrellas de neutrones.,suy biến neutron,Áp suất suy biến neutron ngăn chặn sự sụp đổ hấp dẫn tiếp theo trong các sao neutron.,ความเสื่อมของนิวตรอน,แรงดันความเสื่อมของนิวตรอนป้องกันการยุบตัวเพิ่มเติมจากแรงโน้มถ่วงในดาวนิวตรอน,degenerasi neutron,Tekanan degenerasi neutron mencegah keruntuhan gravitasi lebih lanjut pada bintang neutron.
Chandrasekhar limit,The Chandrasekhar limit defines the maximum mass a white dwarf can sustain before collapsing.,찬드라세카르 한계,찬드라세카르 한계는 백색왜성이 붕괴하기 전에 유지할 수 있는 최대 질량을 정의한다.,チャンドラセカール限界,チャンドラセカール限界は白色矮星が崩壊する前に維持できる最大質量を定義する。,钱德拉塞卡极限,钱德拉塞卡极限定义了白矮星在坍缩前能维持的最大质量。,límite de Chandrasekhar,El límite de Chandrasekhar define la masa máxima que una enana blanca puede sostener antes de colapsar.,giới hạn Chandrasekhar,Giới hạn Chandrasekhar xác định khối lượng tối đa mà một sao lùn trắng có thể duy trì trước khi sụp đổ.,ขีดจำกัดจันทรเสกขร,ขีดจำกัดจันทรเสกขรกำหนดมวลสูงสุดที่ดาวแคระขาวสามารถรองรับได้ก่อนยุบตัว,batas Chandrasekhar,Batas Chandrasekhar mendefinisikan massa maksimum yang dapat ditopang bintang katai putih sebelum runtuh.
Hertzsprung-Russell diagram,The Hertzsprung-Russell diagram classifies stars according to their luminosity and surface temperature.,헤르츠스프룽-러셀 도표,헤르츠스프룽-러셀 도표는 별을 광도와 표면 온도에 따라 분류한다.,ヘルツシュプルング・ラッセル図,ヘルツシュプルング・ラッセル図は恒星を光度と表面温度に従って分類する。,赫罗图,赫罗图根据恒星的光度和表面温度对其进行分类。,diagrama de Hertzsprung-Russell,El diagrama de Hertzsprung-Russell clasifica las estrellas según su luminosidad y temperatura superficial.,biểu đồ Hertzsprung-Russell,Biểu đồ Hertzsprung-Russell phân loại các ngôi sao theo độ sáng và nhiệt độ bề mặt của chúng.,แผนภาพเฮิร์ตสปรุง-รัสเซลล์,แผนภาพเฮิร์ตสปรุง-รัสเซลล์จำแนกดาวฤกษ์ตามความส่องสว่างและอุณหภูมิพื้นผิว,diagram Hertzsprung-Russell,Diagram Hertzsprung-Russell mengklasifikasikan bintang berdasarkan luminositas dan suhu permukaannya.
magnetohydrodynamics,Magnetohydrodynamics describes the behavior of electrically conducting fluids in the presence of magnetic fields.,자기유체역학,자기유체역학은 자기장이 존재하는 상태에서 전기 전도성 유체의 거동을 설명한다.,磁気流体力学,磁気流体力学は磁場の存在下での導電性流体の挙動を記述する。,磁流体动力学,磁流体动力学描述了电导流体在磁场存在下的行为。,magnetohidrodinámica,La magnetohidrodinámica describe el comportamiento de fluidos eléctricamente conductores en presencia de campos magnéticos.,từ thủy động lực học,Từ thủy động lực học mô tả hành vi của chất lỏng dẫn điện trong sự hiện diện của từ trường.,แมกนีโตไฮโดรไดนามิกส์,แมกนีโตไฮโดรไดนามิกส์อธิบายพฤติกรรมของของไหลที่นำไฟฟ้าในสนามแม่เหล็ก,magnetohidrodinamika,Magnetohidrodinamika menggambarkan perilaku fluida penghantar listrik dalam kehadiran medan magnet.
baryonic matter,Baryonic matter comprises the ordinary atoms and molecules that constitute visible celestial objects.,바리온 물질,바리온 물질은 가시적인 천체를 구성하는 일반적인 원자와 분자로 이루어진다.,バリオン物質,バリオン物質は可視的な天体を構成する通常の原子と分子から成る。,重子物质,重子物质由构成可见天体的普通原子和分子组成。,materia bariónica,La materia bariónica comprende los átomos y moléculas ordinarios que constituyen los objetos celestes visibles.,vật chất baryon,Vật chất baryon bao gồm các nguyên tử và phân tử thông thường tạo nên các thiên thể nhìn thấy được.,สสารแบริออน,สสารแบริออนประกอบด้วยอะตอมและโมเลกุลธรรมดาที่เป็นองค์ประกอบของวัตถุท้องฟ้าที่มองเห็นได้,materi barionik,Materi barionik terdiri dari atom dan molekul biasa yang membentuk objek langit yang terlihat.
Schwarzschild radius,The Schwarzschild radius determines the size of the event horizon for a non-rotating black hole.,슈바르츠실트 반지름,슈바르츠실트 반지름은 비회전 블랙홀의 사건의 지평선 크기를 결정한다.,シュヴァルツシルト半径,シュヴァルツシルト半径は非回転ブラックホールの事象の地平面の大きさを決定する。,史瓦西半径,史瓦西半径决定了非旋转黑洞事件视界的大小。,radio de Schwarzschild,El radio de Schwarzschild determina el tamaño del horizonte de eventos para un agujero negro sin rotación.,bán kính Schwarzschild,Bán kính Schwarzschild xác định kích thước của chân trời sự kiện cho một hố đen không quay.,รัศมีชวาร์สชิลด์,รัศมีชวาร์สชิลด์กำหนดขนาดของขอบฟ้าเหตุการณ์สำหรับหลุมดำที่ไม่หมุน,radius Schwarzschild,Radius Schwarzschild menentukan ukuran cakrawala peristiwa untuk lubang hitam yang tidak berotasi.
spectroscopy,Spectroscopy reveals the chemical composition of distant stars by analyzing their emitted light spectra.,분광학,분광학은 방출된 빛 스펙트럼을 분석하여 먼 별의 화학적 구성을 밝힌다.,分光学,分光学は放出された光のスペクトルを分析することで遠方の恒星の化学組成を明らかにする。,光谱学,光谱学通过分析恒星发出的光谱来揭示遥远恒星的化学组成。,espectroscopía,La espectroscopía revela la composición química de estrellas distantes analizando sus espectros de luz emitida.,quang phổ học,Quang phổ học tiết lộ thành phần hóa học của các ngôi sao xa bằng cách phân tích quang phổ ánh sáng phát ra.,สเปกโทรสโกปี,สเปกโทรสโกปีเผยให้เห็นองค์ประกอบทางเคมีของดาวฤกษ์ที่อยู่ไกลโดยการวิเคราะห์สเปกตรัมแสงที่ปล่อยออกมา,spektroskopi,Spektroskopi mengungkapkan komposisi kimia bintang jauh dengan menganalisis spektrum cahaya yang dipancarkannya.
