oligopoly,"An oligopoly emerges when a few firms dominate an entire market sector.",과점,"과점은 소수의 기업이 전체 시장 부문을 지배할 때 나타난다.",寡占,"寡占は少数の企業が市場セクター全体を支配するときに生じる。",寡头垄断,"当少数企业主导整个市场部门时就形成了寡头垄断。",oligopolio,"Un oligopolio surge cuando unas pocas empresas dominan un sector de mercado entero.",độc quyền nhóm,"Độc quyền nhóm xuất hiện khi một vài công ty thống trị toàn bộ một lĩnh vực thị trường.",ตลาดผู้ขายน้อยราย,"ตลาดผู้ขายน้อยรายเกิดขึ้นเมื่อบริษัทไม่กี่แห่งครอบงำภาคตลาดทั้งหมด",oligopoli,"Oligopoli muncul ketika beberapa perusahaan mendominasi seluruh sektor pasar."
monetarism,"Monetarism emphasizes controlling the money supply to manage inflation.",통화주의,"통화주의는 인플레이션 관리를 위해 통화 공급 조절을 강조한다.",マネタリズム,"マネタリズムはインフレ管理のために通貨供給量の制御を重視する。",货币主义,"货币主义强调通过控制货币供应来管理通胀。",monetarismo,"El monetarismo enfatiza el control de la oferta monetaria para gestionar la inflación.",chủ nghĩa tiền tệ,"Chủ nghĩa tiền tệ nhấn mạnh việc kiểm soát cung tiền để quản lý lạm phát.",ลัทธิการเงิน,"ลัทธิการเงินเน้นการควบคุมปริมาณเงินเพื่อจัดการเงินเฟ้อ",monetarisme,"Monetarisme menekankan pengendalian jumlah uang beredar untuk mengelola inflasi."
stagflation,"Stagflation combines stagnant economic growth with high inflation and unemployment.",스태그플레이션,"스태그플레이션은 경기 침체에 높은 인플레이션과 실업률이 결합된 것이다.",スタグフレーション,"スタグフレーションは経済成長の停滞と高インフレ・高失業率の組み合わせである。",滞胀,"滞胀是经济增长停滞与高通胀和高失业率的结合。",estanflación,"La estanflación combina el crecimiento económico estancado con alta inflación y desempleo.",đình lạm,"Đình lạm kết hợp tăng trưởng kinh tế trì trệ với lạm phát và thất nghiệp cao.",ภาวะเศรษฐกิจชะงักงัน,"ภาวะเศรษฐกิจชะงักงันรวมการเติบโตทางเศรษฐกิจที่หยุดนิ่งกับเงินเฟ้อและการว่างงานสูง",stagflasi,"Stagflasi menggabungkan pertumbuhan ekonomi yang stagnan dengan inflasi dan pengangguran tinggi."
liquidity,"Central banks inject liquidity into markets during financial crises.",유동성,"중앙은행은 금융 위기 시 시장에 유동성을 주입한다.",流動性,"中央銀行は金融危機時に市場に流動性を注入する。",流动性,"央行在金融危机期间向市场注入流动性。",liquidez,"Los bancos centrales inyectan liquidez en los mercados durante las crisis financieras.",thanh khoản,"Các ngân hàng trung ương bơm thanh khoản vào thị trường trong các cuộc khủng hoảng tài chính.",สภาพคล่อง,"ธนาคารกลางอัดฉีดสภาพคล่องเข้าสู่ตลาดในช่วงวิกฤตการเงิน",likuiditas,"Bank sentral menyuntikkan likuiditas ke pasar selama krisis keuangan."
externality,"Pollution is a negative externality that imposes costs on third parties.",외부효과,"오염은 제3자에게 비용을 전가하는 부정적 외부효과이다.",外部性,"汚染は第三者にコストを課す負の外部性である。",外部性,"污染是一种将成本转嫁给第三方的负外部性。",externalidad,"La contaminación es una externalidad negativa que impone costos a terceros.",ngoại tác,"Ô nhiễm là một ngoại tác tiêu cực gây ra chi phí cho bên thứ ba.",ผลกระทบภายนอก,"มลพิษเป็นผลกระทบภายนอกเชิงลบที่สร้างต้นทุนให้บุคคลที่สาม",eksternalitas,"Polusi adalah eksternalitas negatif yang membebankan biaya kepada pihak ketiga."
asymmetric,"Asymmetric information between buyers and sellers causes market failures.",비대칭적,"매수자와 매도자 간의 비대칭적 정보는 시장 실패를 유발한다.",非対称の,"買い手と売り手の間の非対称情報は市場の失敗を引き起こす。",不对称的,"买卖双方之间的不对称信息导致市场失灵。",asimétrico,"La información asimétrica entre compradores y vendedores causa fallas de mercado.",bất đối xứng,"Thông tin bất đối xứng giữa người mua và người bán gây ra thất bại thị trường.",ไม่สมมาตร,"ข้อมูลไม่สมมาตรระหว่างผู้ซื้อและผู้ขายทำให้ตลาดล้มเหลว",asimetris,"Informasi asimetris antara pembeli dan penjual menyebabkan kegagalan pasar."
hermeneutics,"Hermeneutics provides a framework for interpreting literary and sacred texts.",해석학,"해석학은 문학 및 신성한 텍스트를 해석하는 틀을 제공한다.",解釈学,"解釈学は文学的・宗教的テキストを解釈するための枠組みを提供する。",诠释学,"诠释学为解读文学和宗教文本提供了框架。",hermenéutica,"La hermenéutica proporciona un marco para interpretar textos literarios y sagrados.",chú giải học,"Chú giải học cung cấp một khuôn khổ để diễn giải các văn bản văn học và thánh kinh.",ศาสตร์การตีความ,"ศาสตร์การตีความให้กรอบสำหรับการตีความงานวรรณกรรมและคัมภีร์ศักดิ์สิทธิ์",hermeneutika,"Hermeneutika menyediakan kerangka untuk menafsirkan teks sastra dan sakral."
intertextuality,"Intertextuality reveals how texts reference and reshape one another.",상호텍스트성,"상호텍스트성은 텍스트가 서로를 참조하고 재구성하는 방식을 드러낸다.",間テクスト性,"間テクスト性はテキストが互いにどのように参照し再構成するかを明らかにする。",互文性,"互文性揭示了文本如何相互引用和重塑。",intertextualidad,"La intertextualidad revela cómo los textos se referencian y remodelan mutuamente.",liên văn bản,"Tính liên văn bản cho thấy các văn bản tham chiếu và tái tạo lẫn nhau như thế nào.",สหบท,"สหบทเผยให้เห็นว่าตัวบทอ้างอิงและปรับเปลี่ยนซึ่งกันและกันอย่างไร",intertekstualitas,"Intertekstualitas mengungkapkan bagaimana teks saling merujuk dan membentuk ulang."
verisimilitude,"The novel's verisimilitude lends it a powerful sense of authenticity.",사실성,"소설의 사실성은 강렬한 진정성을 부여한다.",真実味,"その小説の真実味は強力な真正性を与えている。",逼真性,"这部小说的逼真性赋予了它强烈的真实感。",verosimilitud,"La verosimilitud de la novela le confiere un poderoso sentido de autenticidad.",tính chân thực,"Tính chân thực của tiểu thuyết mang lại cảm giác xác thực mạnh mẽ.",ความสมจริง,"ความสมจริงของนวนิยายทำให้เกิดความรู้สึกแท้จริงอย่างทรงพลัง",kesepertinyataan,"Kesepertinyataan novel tersebut memberikan rasa otentisitas yang kuat."
metanarrative,"Postmodernism is skeptical of grand metanarratives that claim universal truth.",대서사,"포스트모더니즘은 보편적 진리를 주장하는 거대한 대서사에 회의적이다.",メタナラティブ,"ポストモダニズムは普遍的真理を主張する大きなメタナラティブに懐疑的である。",元叙事,"后现代主义对声称普遍真理的宏大元叙事持怀疑态度。",metanarrativa,"El posmodernismo es escéptico de las grandes metanarrativas que reclaman verdad universal.",siêu tự sự,"Chủ nghĩa hậu hiện đại hoài nghi các siêu tự sự lớn tuyên bố chân lý phổ quát.",อภิมหาเรื่องเล่า,"หลังสมัยใหม่สงสัยอภิมหาเรื่องเล่าที่อ้างความจริงสากล",metanaratif,"Postmodernisme skeptis terhadap metanaratif besar yang mengklaim kebenaran universal."
ekphrasis,"Ekphrasis is the literary technique of vividly describing a work of visual art.",에크프라시스,"에크프라시스는 시각 예술 작품을 생생하게 묘사하는 문학 기법이다.",エクフラシス,"エクフラシスは視覚芸術作品を生き生きと描写する文学的技法である。",艺格敷词,"艺格敷词是一种生动描述视觉艺术作品的文学技巧。",écfrasis,"La écfrasis es la técnica literaria de describir vívidamente una obra de arte visual.",thuật miêu tả tranh,"Thuật miêu tả tranh là kỹ thuật văn học mô tả sinh động một tác phẩm nghệ thuật thị giác.",เอคฟราซิส,"เอคฟราซิสคือเทคนิคทางวรรณกรรมในการบรรยายงานศิลปะอย่างมีชีวิตชีวา",ekfrasis,"Ekfrasis adalah teknik sastra untuk mendeskripsikan karya seni visual secara hidup."
didacticism,"The fable's didacticism serves to convey a clear moral lesson.",교훈주의,"우화의 교훈주의는 명확한 도덕적 교훈을 전달하는 데 기여한다.",教訓主義,"寓話の教訓主義は明確な道徳的教訓を伝える役割を果たす。",说教性,"寓言的说教性旨在传达明确的道德教训。",didactismo,"El didactismo de la fábula sirve para transmitir una lección moral clara.",tính giáo huấn,"Tính giáo huấn của ngụ ngôn nhằm truyền đạt một bài học đạo đức rõ ràng.",ลักษณะสั่งสอน,"ลักษณะสั่งสอนของนิทานทำหน้าที่ถ่ายทอดบทเรียนทางศีลธรรมที่ชัดเจน",didaktisisme,"Didaktisisme fabel berfungsi untuk menyampaikan pelajaran moral yang jelas."
deontological,"Deontological ethics judges actions by their adherence to rules and duties.",의무론적,"의무론적 윤리는 규칙과 의무에 대한 준수로 행위를 판단한다.",義務論的,"義務論的倫理は規則と義務への遵守によって行為を判断する。",义务论的,"义务论伦理根据行为对规则和义务的遵守来判断行为。",deontológico,"La ética deontológica juzga las acciones por su adherencia a reglas y deberes.",nghĩa vụ luận,"Đạo đức nghĩa vụ luận đánh giá hành động dựa trên sự tuân thủ quy tắc và bổn phận.",จริยศาสตร์หน้าที่,"จริยศาสตร์หน้าที่ตัดสินการกระทำโดยการยึดมั่นในกฎเกณฑ์และหน้าที่",deontologis,"Etika deontologis menilai tindakan berdasarkan kepatuhan terhadap aturan dan kewajiban."
utilitarian,"A utilitarian framework seeks to maximize overall happiness for the greatest number.",공리주의적,"공리주의적 틀은 최대 다수의 전체적 행복을 극대화하려 한다.",功利主義的,"功利主義的な枠組みは最大多数の全体的な幸福の最大化を目指す。",功利主义的,"功利主义框架寻求为最大多数人最大化整体幸福。",utilitarista,"Un marco utilitarista busca maximizar la felicidad general para el mayor número.",theo chủ nghĩa vị lợi,"Khuôn khổ chủ nghĩa vị lợi tìm cách tối đa hóa hạnh phúc chung cho số đông nhất.",อรรถประโยชน์นิยม,"กรอบอรรถประโยชน์นิยมมุ่งเพิ่มความสุขโดยรวมให้มากที่สุดสำหรับคนจำนวนมากที่สุด",utilitarian,"Kerangka utilitarian berusaha memaksimalkan kebahagiaan keseluruhan bagi jumlah terbanyak."
existentialist,"Existentialist philosophy insists that existence precedes essence.",실존주의적,"실존주의 철학은 실존이 본질에 앞선다고 주장한다.",実存主義的,"実存主義的哲学は実存が本質に先立つと主張する。",存在主义的,"存在主义哲学坚持存在先于本质。",existencialista,"La filosofía existencialista insiste en que la existencia precede a la esencia.",hiện sinh,"Triết học hiện sinh khẳng định rằng tồn tại đi trước bản chất.",อัตถิภาวนิยม,"ปรัชญาอัตถิภาวนิยมยืนยันว่าการดำรงอยู่มาก่อนแก่นสาร",eksistensialis,"Filsafat eksistensialis menegaskan bahwa eksistensi mendahului esensi."
empiricism,"Empiricism holds that all knowledge originates from sensory experience.",경험주의,"경험주의는 모든 지식이 감각 경험에서 비롯된다고 주장한다.",経験主義,"経験主義はすべての知識が感覚的経験に由来すると主張する。",经验主义,"经验主义认为所有知识都源于感官经验。",empirismo,"El empirismo sostiene que todo conocimiento se origina en la experiencia sensorial.",chủ nghĩa kinh nghiệm,"Chủ nghĩa kinh nghiệm cho rằng mọi tri thức đều bắt nguồn từ trải nghiệm giác quan.",ประจักษ์นิยม,"ประจักษ์นิยมถือว่าความรู้ทั้งหมดมีต้นกำเนิดจากประสบการณ์ทางประสาทสัมผัส",empirisme,"Empirisme berpendapat bahwa semua pengetahuan berasal dari pengalaman indrawi."
syllogism,"A syllogism draws a logical conclusion from two given premises.",삼단논법,"삼단논법은 두 개의 전제에서 논리적 결론을 도출한다.",三段論法,"三段論法は二つの前提から論理的結論を導き出す。",三段论,"三段论从两个前提中得出逻辑结论。",silogismo,"Un silogismo extrae una conclusión lógica de dos premisas dadas.",tam đoạn luận,"Tam đoạn luận rút ra kết luận logic từ hai tiền đề đã cho.",ตรรกบท,"ตรรกบทดึงข้อสรุปเชิงตรรกะจากสมมติฐานสองข้อที่กำหนด",silogisme,"Silogisme menarik kesimpulan logis dari dua premis yang diberikan."
axiomatic,"The proof rests on axiomatic assumptions that cannot themselves be proven.",공리적,"그 증명은 그 자체로 증명할 수 없는 공리적 가정에 기초한다.",公理的,"その証明は、それ自体証明できない公理的仮定に基づいている。",公理性的,"该证明建立在本身无法被证明的公理性假设之上。",axiomático,"La prueba se basa en supuestos axiomáticos que no pueden probarse por sí mismos.",tiên đề,"Chứng minh dựa trên các giả định tiên đề mà bản thân chúng không thể được chứng minh.",เป็นสัจพจน์,"การพิสูจน์ตั้งอยู่บนสมมติฐานที่เป็นสัจพจน์ซึ่งไม่สามารถพิสูจน์ได้",aksiomatis,"Pembuktian itu bertumpu pada asumsi aksiomatis yang tidak dapat dibuktikan sendiri."
dopaminergic,"Dopaminergic dysfunction is implicated in Parkinson's disease pathology.",도파민성의,"도파민성 기능 장애는 파킨슨병 병리에 관련되어 있다.",ドーパミン作動性の,"ドーパミン作動性の機能障害はパーキンソン病の病理に関与している。",多巴胺能的,"多巴胺能功能障碍与帕金森病的病理有关。",dopaminérgico,"La disfunción dopaminérgica está implicada en la patología de la enfermedad de Parkinson.",dopaminergic,"Rối loạn chức năng dopaminergic liên quan đến bệnh lý Parkinson.",เกี่ยวกับโดพามีน,"ความผิดปกติของระบบโดพามีนเกี่ยวข้องกับพยาธิวิทยาของโรคพาร์กินสัน",dopaminergik,"Disfungsi dopaminergik terlibat dalam patologi penyakit Parkinson."
cerebellum,"The cerebellum coordinates voluntary movements and maintains balance.",소뇌,"소뇌는 수의 운동을 조정하고 균형을 유지한다.",小脳,"小脳は随意運動を調整しバランスを維持する。",小脑,"小脑协调自主运动并维持平衡。",cerebelo,"El cerebelo coordina los movimientos voluntarios y mantiene el equilibrio.",tiểu não,"Tiểu não phối hợp các chuyển động tự nguyện và duy trì thăng bằng.",สมองน้อย,"สมองน้อยประสานการเคลื่อนไหวโดยสมัครใจและรักษาสมดุล",serebelum,"Serebelum mengoordinasikan gerakan sadar dan menjaga keseimbangan."
excitatory,"Glutamate is the primary excitatory neurotransmitter in the mammalian brain.",흥분성의,"글루타메이트는 포유류 뇌의 주요 흥분성 신경전달물질이다.",興奮性の,"グルタミン酸は哺乳類の脳における主要な興奮性神経伝達物質である。",兴奋性的,"谷氨酸是哺乳动物大脑中主要的兴奋性神经递质。",excitatorio,"El glutamato es el principal neurotransmisor excitatorio en el cerebro de los mamíferos.",kích thích,"Glutamate là chất dẫn truyền thần kinh kích thích chính trong não động vật có vú.",กระตุ้น,"กลูตาเมตเป็นสารสื่อประสาทกระตุ้นหลักในสมองสัตว์เลี้ยงลูกด้วยนม",eksitatorik,"Glutamat adalah neurotransmiter eksitatorik utama di otak mamalia."
thalamus,"The thalamus relays sensory signals to the appropriate cortical regions.",시상,"시상은 감각 신호를 적절한 피질 영역으로 전달한다.",視床,"視床は感覚信号を適切な皮質領域に中継する。",丘脑,"丘脑将感觉信号传递到相应的皮层区域。",tálamo,"El tálamo transmite señales sensoriales a las regiones corticales apropiadas.",đồi thị,"Đồi thị chuyển tiếp các tín hiệu cảm giác đến các vùng vỏ não thích hợp.",ทาลามัส,"ทาลามัสถ่ายทอดสัญญาณประสาทสัมผัสไปยังบริเวณเปลือกสมองที่เหมาะสม",talamus,"Talamus meneruskan sinyal sensorik ke wilayah kortikal yang sesuai."
dendritic,"Dendritic branching increases the number of synaptic connections a neuron can form.",수상돌기의,"수상돌기 분지는 뉴런이 형성할 수 있는 시냅스 연결 수를 증가시킨다.",樹状突起の,"樹状突起の分岐はニューロンが形成できるシナプス接続の数を増やす。",树突的,"树突分支增加了神经元可以形成的突触连接数量。",dendrítico,"La ramificación dendrítica aumenta el número de conexiones sinápticas que una neurona puede formar.",nhánh gai,"Sự phân nhánh gai tăng số lượng kết nối synapse mà một nơ-ron có thể hình thành.",เดนไดรต์,"การแตกแขนงของเดนไดรต์เพิ่มจำนวนการเชื่อมต่อไซแนปส์ที่เซลล์ประสาทสามารถสร้างได้",dendritik,"Percabangan dendritik meningkatkan jumlah koneksi sinaptik yang dapat dibentuk neuron."
due process,"Due process guarantees fair treatment through the judicial system.",적법 절차,"적법 절차는 사법 체계를 통한 공정한 대우를 보장한다.",適正手続,"適正手続は司法制度を通じた公正な取り扱いを保証する。",正当程序,"正当程序保障通过司法系统获得公正待遇。",debido proceso,"El debido proceso garantiza un trato justo a través del sistema judicial.",thủ tục pháp lý,"Thủ tục pháp lý đảm bảo sự đối xử công bằng thông qua hệ thống tư pháp.",กระบวนการที่ชอบธรรม,"กระบวนการที่ชอบธรรมรับประกันการปฏิบัติอย่างเป็นธรรมผ่านระบบตุลาการ",proses hukum,"Proses hukum menjamin perlakuan yang adil melalui sistem peradilan."
stare decisis,"Stare decisis obliges courts to follow established precedents in their rulings.",선례구속,"선례구속은 법원이 판결에서 확립된 판례를 따르도록 의무화한다.",先例拘束,"先例拘束は裁判所が判決において確立された判例に従うことを義務付ける。",遵循先例,"遵循先例要求法院在裁决中遵循已确立的判例。",stare decisis,"El stare decisis obliga a los tribunales a seguir los precedentes establecidos en sus fallos.",nguyên tắc tiền lệ,"Nguyên tắc tiền lệ bắt buộc tòa án tuân theo các tiền lệ đã được thiết lập.",หลักบรรทัดฐาน,"หลักบรรทัดฐานบังคับให้ศาลปฏิบัติตามบรรทัดฐานที่กำหนดไว้ในคำพิพากษา",stare decisis,"Stare decisis mewajibkan pengadilan untuk mengikuti preseden yang telah ditetapkan."
appellate,"The appellate court reviewed the lower court's interpretation of the statute.",항소의,"항소 법원은 하급 법원의 법률 해석을 검토했다.",控訴の,"控訴裁判所は下級裁判所の法令解釈を審査した。",上诉的,"上诉法院审查了下级法院对法规的解释。",de apelación,"El tribunal de apelación revisó la interpretación del estatuto del tribunal inferior.",phúc thẩm,"Tòa phúc thẩm xem xét lại cách giải thích luật của tòa sơ thẩm.",อุทธรณ์,"ศาลอุทธรณ์ทบทวนการตีความกฎหมายของศาลชั้นต้น",banding,"Pengadilan banding meninjau penafsiran undang-undang oleh pengadilan yang lebih rendah."
injunction,"The court issued an injunction to halt construction pending environmental review.",가처분,"법원은 환경 심사가 완료될 때까지 건설 중단 가처분을 내렸다.",差止命令,"裁判所は環境審査が完了するまで建設を中止する差止命令を出した。",禁令,"法院发出禁令，在环境审查期间停止施工。",mandamiento judicial,"El tribunal emitió un mandamiento judicial para detener la construcción pendiente de revisión ambiental.",lệnh cấm,"Tòa án đã ban hành lệnh cấm để dừng xây dựng trong khi chờ đánh giá môi trường.",คำสั่งศาล,"ศาลออกคำสั่งศาลให้หยุดการก่อสร้างระหว่างรอการตรวจสอบสิ่งแวดล้อม",perintah pengadilan,"Pengadilan mengeluarkan perintah pengadilan untuk menghentikan konstruksi menunggu tinjauan lingkungan."
fiscal,"Fiscal austerity measures reduced government expenditure significantly.",재정의,"재정 긴축 조치는 정부 지출을 크게 줄였다.",財政の,"財政緊縮措置は政府支出を大幅に削減した。",财政的,"财政紧缩措施大幅减少了政府支出。",fiscal,"Las medidas de austeridad fiscal redujeron significativamente el gasto gubernamental.",tài khóa,"Các biện pháp thắt chặt tài khóa đã giảm đáng kể chi tiêu chính phủ.",การคลัง,"มาตรการรัดเข็มขัดทางการคลังลดการใช้จ่ายของรัฐบาลลงอย่างมาก",fiskal,"Langkah-langkah penghematan fiskal mengurangi pengeluaran pemerintah secara signifikan."
