jurisdiction,"The appellate court questioned whether it had jurisdiction over cases originating in foreign territories.",관할권,항소 법원은 외국 영토에서 발생한 사건에 대해 관할권이 있는지 의문을 제기했다.,管轄権,控訴裁判所は外国の領土で発生した事件に対する管轄権があるかどうか疑問を呈した。,管辖权,上诉法院质疑其是否对源自外国领土的案件拥有管辖权。,jurisdicción,El tribunal de apelaciones cuestionó si tenía jurisdicción sobre casos originados en territorios extranjeros.,quyền tài phán,Tòa phúc thẩm đặt câu hỏi liệu họ có quyền tài phán đối với các vụ án phát sinh từ lãnh thổ nước ngoài hay không.,เขตอำนาจศาล,ศาลอุทธรณ์ตั้งคำถามว่ามีเขตอำนาจศาลเหนือคดีที่เกิดขึ้นในดินแดนต่างประเทศหรือไม่,yurisdiksi,Pengadilan banding mempertanyakan apakah mereka memiliki yurisdiksi atas kasus yang berasal dari wilayah asing.
litigation,"Prolonged litigation between the two corporations drained their financial resources and damaged public trust.",소송,두 기업 간의 장기 소송은 재정 자원을 고갈시키고 공공 신뢰를 훼손했다.,訴訟,二社間の長期にわたる訴訟は財源を枯渇させ、公的信頼を損なった。,诉讼,两家公司之间旷日持久的诉讼耗尽了其财务资源并损害了公众信任。,litigio,El litigio prolongado entre las dos corporaciones agotó sus recursos financieros y dañó la confianza pública.,kiện tụng,Việc kiện tụng kéo dài giữa hai tập đoàn đã làm cạn kiệt nguồn tài chính và tổn hại niềm tin công chúng.,การฟ้องร้อง,การฟ้องร้องที่ยืดเยื้อระหว่างสองบริษัททำให้ทรัพยากรทางการเงินหมดไปและทำลายความเชื่อมั่นของสาธารณชน,litigasi,Litigasi yang berkepanjangan antara dua perusahaan menguras sumber daya keuangan mereka dan merusak kepercayaan publik.
arbitration,"Both parties agreed to resolve the dispute through binding arbitration rather than a lengthy court trial.",중재,양 당사자는 장기간의 법원 재판 대신 구속력 있는 중재를 통해 분쟁을 해결하기로 합의했다.,仲裁,両当事者は長期にわたる法廷審理ではなく、拘束力のある仲裁を通じて紛争を解決することに合意した。,仲裁,双方同意通过具有约束力的仲裁而非漫长的法庭审判来解决争端。,arbitraje,Ambas partes acordaron resolver la disputa mediante arbitraje vinculante en lugar de un largo juicio judicial.,trọng tài,Cả hai bên đồng ý giải quyết tranh chấp thông qua trọng tài ràng buộc thay vì một phiên tòa kéo dài.,อนุญาโตตุลาการ,ทั้งสองฝ่ายตกลงที่จะแก้ไขข้อพิพาทผ่านอนุญาโตตุลาการที่มีผลผูกพันแทนการพิจารณาคดีในศาลที่ยาวนาน,arbitrase,Kedua pihak sepakat untuk menyelesaikan sengketa melalui arbitrase yang mengikat daripada persidangan pengadilan yang panjang.
statutory,"The company was found in violation of statutory regulations governing environmental emissions.",법정의,그 회사는 환경 배출을 규제하는 법정 규정을 위반한 것으로 밝혀졌다.,法定の,同社は環境排出を規制する法定規則に違反していることが判明した。,法定的,该公司被发现违反了管理环境排放的法定法规。,estatutario,Se descubrió que la empresa violaba las regulaciones estatutarias que rigen las emisiones ambientales.,theo luật định,Công ty bị phát hiện vi phạm các quy định pháp luật về khí thải môi trường.,ตามกฎหมาย,บริษัทถูกพบว่าละเมิดข้อบังคับตามกฎหมายที่ควบคุมการปล่อยมลพิษสิ่งแวดล้อม,berdasarkan undang-undang,Perusahaan tersebut ditemukan melanggar peraturan perundang-undangan yang mengatur emisi lingkungan.
plaintiff,"The plaintiff presented compelling evidence that the manufacturer had knowingly concealed product defects.",원고,원고는 제조업체가 고의로 제품 결함을 은폐했다는 설득력 있는 증거를 제시했다.,原告,原告は製造業者が製品の欠陥を故意に隠蔽していたという説得力のある証拠を提示した。,原告,原告提供了令人信服的证据表明制造商故意隐瞒了产品缺陷。,demandante,El demandante presentó pruebas convincentes de que el fabricante había ocultado deliberadamente los defectos del producto.,nguyên đơn,Nguyên đơn đã đưa ra bằng chứng thuyết phục rằng nhà sản xuất đã cố tình che giấu các khuyết tật sản phẩm.,โจทก์,โจทก์นำเสนอหลักฐานที่น่าเชื่อถือว่าผู้ผลิตจงใจปกปิดข้อบกพร่องของผลิตภัณฑ์,penggugat,Penggugat menyajikan bukti kuat bahwa produsen dengan sengaja menyembunyikan cacat produk.
defendant,"The defendant maintained her innocence throughout the proceedings despite overwhelming circumstantial evidence.",피고,피고는 압도적인 정황 증거에도 불구하고 재판 내내 무죄를 주장했다.,被告,被告は圧倒的な状況証拠にもかかわらず、訴訟を通じて無実を主張した。,被告,尽管有大量间接证据，被告在整个诉讼过程中坚持自己是无辜的。,acusado,La acusada mantuvo su inocencia durante todo el proceso a pesar de las abrumadoras pruebas circunstanciales.,bị cáo,Bị cáo khẳng định mình vô tội trong suốt quá trình tố tụng bất chấp bằng chứng gián tiếp áp đảo.,จำเลย,จำเลยยืนยันความบริสุทธิ์ตลอดกระบวนการพิจารณาคดีแม้จะมีพยานหลักฐานแวดล้อมที่ล้นหลาม,tergugat,Tergugat mempertahankan ketidakbersalahannya sepanjang persidangan meskipun ada bukti tidak langsung yang sangat kuat.
precedent,"The landmark ruling set a legal precedent that would shape environmental law for decades to come.",판례,그 획기적인 판결은 향후 수십 년간 환경법을 형성할 법적 판례를 세웠다.,判例,その画期的な判決は今後数十年にわたり環境法を形作る法的判例を打ち立てた。,先例,这一具有里程碑意义的裁决开创了将在未来几十年塑造环境法的法律先例。,precedente,La sentencia histórica sentó un precedente legal que daría forma al derecho ambiental durante décadas.,tiền lệ,Phán quyết mang tính bước ngoặt đã tạo ra tiền lệ pháp lý sẽ định hình luật môi trường trong nhiều thập kỷ tới.,บรรทัดฐาน,คำตัดสินสำคัญนี้สร้างบรรทัดฐานทางกฎหมายที่จะกำหนดกฎหมายสิ่งแวดล้อมในทศวรรษข้างหน้า,preseden,Putusan bersejarah tersebut menetapkan preseden hukum yang akan membentuk hukum lingkungan selama beberapa dekade mendatang.
amendment,"The proposed amendment to the constitution sparked fierce debate among legislators and constitutional scholars.",수정안,헌법 수정안이 입법자와 헌법 학자들 사이에서 격렬한 논쟁을 촉발했다.,修正案,憲法の修正案は立法者と憲法学者の間で激しい議論を引き起こした。,修正案,拟议的宪法修正案在立法者和宪法学者之间引发了激烈辩论。,enmienda,La enmienda propuesta a la constitución provocó un intenso debate entre legisladores y académicos constitucionales.,tu chính án,Bản tu chính hiến pháp được đề xuất đã gây ra cuộc tranh luận gay gắt giữa các nhà lập pháp và học giả hiến pháp.,การแก้ไขเพิ่มเติม,การแก้ไขเพิ่มเติมรัฐธรรมนูญที่เสนอได้จุดชนวนการถกเถียงอย่างรุนแรงในหมู่สมาชิกสภานิติบัญญัติและนักวิชาการรัฐธรรมนูญ,amandemen,Amandemen konstitusi yang diusulkan memicu perdebatan sengit di antara para legislator dan sarjana konstitusi.
ratify,"All member states must ratify the treaty before it can enter into force under international law.",비준하다,모든 회원국은 국제법에 따라 조약이 발효되기 전에 이를 비준해야 한다.,批准する,すべての加盟国は国際法の下で条約が発効する前にこれを批准しなければならない。,批准,所有成员国必须批准该条约才能根据国际法生效。,ratificar,Todos los estados miembros deben ratificar el tratado antes de que pueda entrar en vigor bajo el derecho internacional.,phê chuẩn,Tất cả các quốc gia thành viên phải phê chuẩn hiệp ước trước khi nó có hiệu lực theo luật quốc tế.,ให้สัตยาบัน,รัฐสมาชิกทั้งหมดต้องให้สัตยาบันสนธิสัญญาก่อนที่จะมีผลบังคับใช้ตามกฎหมายระหว่างประเทศ,meratifikasi,Semua negara anggota harus meratifikasi perjanjian tersebut sebelum dapat berlaku berdasarkan hukum internasional.
sovereignty,"The small nation fiercely defended its sovereignty against the encroachment of more powerful neighboring states.",주권,그 작은 국가는 더 강력한 이웃 국가들의 침범에 맞서 자국의 주권을 맹렬히 수호했다.,主権,その小国はより強力な隣国の侵害に対して主権を激しく守った。,主权,这个小国激烈地捍卫其主权以抵御更强大的邻国的侵犯。,soberanía,La pequeña nación defendió ferozmente su soberanía contra la invasión de estados vecinos más poderosos.,chủ quyền,Quốc gia nhỏ bé đã kiên cường bảo vệ chủ quyền trước sự xâm lấn của các quốc gia láng giềng hùng mạnh hơn.,อธิปไตย,ประเทศเล็กๆ ปกป้องอธิปไตยอย่างแข็งขันจากการรุกล้ำของรัฐเพื่อนบ้านที่มีอำนาจมากกว่า,kedaulatan,Negara kecil itu dengan gigih mempertahankan kedaulatannya terhadap perambahan negara-negara tetangga yang lebih kuat.
indictment,"The grand jury issued a formal indictment against the former executive on charges of fraud and embezzlement.",기소,대배심은 전 임원에 대해 사기 및 횡령 혐의로 정식 기소장을 발부했다.,起訴状,大陪審は詐欺と横領の容疑で元幹部に対して正式な起訴状を発行した。,起诉书,大陪审团对前高管发出了正式起诉书，指控其欺诈和挪用公款。,acusación formal,El gran jurado emitió una acusación formal contra el exejecutivo por cargos de fraude y malversación.,cáo trạng,Đại bồi thẩm đoàn đã ban hành cáo trạng chính thức đối với cựu giám đốc điều hành về tội gian lận và biển thủ.,คำฟ้อง,คณะลูกขุนใหญ่ออกคำฟ้องอย่างเป็นทางการต่ออดีตผู้บริหารในข้อหาฉ้อโกงและยักยอกทรัพย์,dakwaan,Juri agung mengeluarkan dakwaan resmi terhadap mantan eksekutif atas tuduhan penipuan dan penggelapan.
adjudicate,"An independent tribunal was appointed to adjudicate the territorial dispute between the two nations.",판결하다,두 국가 간의 영토 분쟁을 판결하기 위해 독립 재판소가 임명되었다.,裁定する,二国間の領土紛争を裁定するために独立した法廷が任命された。,裁决,一个独立法庭被指定来裁决两国之间的领土争端。,adjudicar,Se designó un tribunal independiente para adjudicar la disputa territorial entre las dos naciones.,phân xử,Một tòa án độc lập được chỉ định để phân xử tranh chấp lãnh thổ giữa hai quốc gia.,ตัดสิน,ศาลอิสระได้รับการแต่งตั้งเพื่อตัดสินข้อพิพาทเรื่องดินแดนระหว่างสองประเทศ,mengadili,Sebuah pengadilan independen ditunjuk untuk mengadili sengketa wilayah antara kedua negara.
jurisprudence,"Her doctoral thesis explored the evolution of environmental jurisprudence in the context of climate change.",법학,그녀의 박사 논문은 기후 변화의 맥락에서 환경 법학의 발전을 탐구했다.,法学,彼女の博士論文は気候変動の文脈における環境法学の進化を探求した。,法学,她的博士论文探讨了气候变化背景下环境法学的演变。,jurisprudencia,Su tesis doctoral exploró la evolución de la jurisprudencia ambiental en el contexto del cambio climático.,luật học,Luận án tiến sĩ của cô khám phá sự phát triển của luật học môi trường trong bối cảnh biến đổi khí hậu.,นิติศาสตร์,วิทยานิพนธ์ปริญญาเอกของเธอสำรวจวิวัฒนาการของนิติศาสตร์สิ่งแวดล้อมในบริบทของการเปลี่ยนแปลงสภาพภูมิอากาศ,yurisprudensi,Disertasi doktoralnya mengeksplorasi evolusi yurisprudensi lingkungan dalam konteks perubahan iklim.
statute,"The newly enacted statute imposed stricter penalties on corporations that violated data privacy regulations.",법령,새로 제정된 법령은 데이터 프라이버시 규정을 위반한 기업에 더 엄격한 처벌을 부과했다.,法令,新たに制定された法令はデータプライバシー規制に違反した企業に対してより厳しい罰則を課した。,法规,新颁布的法规对违反数据隐私法规的企业施加了更严厉的处罚。,estatuto,El estatuto recién promulgado impuso sanciones más estrictas a las corporaciones que violaron las regulaciones de privacidad de datos.,đạo luật,Đạo luật mới ban hành áp đặt hình phạt nghiêm khắc hơn đối với các tập đoàn vi phạm quy định về quyền riêng tư dữ liệu.,กฎหมาย,กฎหมายที่ตราขึ้นใหม่กำหนดบทลงโทษที่เข้มงวดยิ่งขึ้นต่อบริษัทที่ละเมิดข้อบังคับความเป็นส่วนตัวของข้อมูล,undang-undang,Undang-undang yang baru diberlakukan menjatuhkan hukuman yang lebih ketat pada perusahaan yang melanggar peraturan privasi data.
deposition,"During the deposition the witness provided testimony that contradicted earlier statements made to investigators.",증언 녹취,증언 녹취 중 증인은 이전에 수사관에게 한 진술과 모순되는 증언을 제공했다.,証言録取,証言録取中に証人は以前調査官に対して行った供述と矛盾する証言を提供した。,宣誓证词,在宣誓取证过程中证人提供了与之前向调查人员所作陈述相矛盾的证词。,declaración jurada,Durante la declaración jurada el testigo proporcionó un testimonio que contradecía las declaraciones anteriores hechas a los investigadores.,lời khai có tuyên thệ,Trong buổi lấy lời khai có tuyên thệ nhân chứng đã cung cấp lời khai mâu thuẫn với các tuyên bố trước đó với điều tra viên.,การให้การ,ระหว่างการให้การพยานให้คำให้การที่ขัดแย้งกับคำแถลงก่อนหน้าที่ให้ไว้กับผู้สอบสวน,deposisi,Selama deposisi saksi memberikan kesaksian yang bertentangan dengan pernyataan sebelumnya yang dibuat kepada penyidik.
acquittal,"The jury's acquittal of the accused was met with both relief and outrage from different segments of the public.",무죄 선고,피고인의 무죄 선고는 대중의 다양한 계층으로부터 안도와 분노를 동시에 불러일으켰다.,無罪判決,被告の無罪判決は公衆のさまざまな層から安堵と怒りの両方で迎えられた。,无罪释放,陪审团对被告的无罪释放在不同公众群体中引发了宽慰和愤怒。,absolución,La absolución del acusado por parte del jurado fue recibida con alivio e indignación por diferentes segmentos del público.,tha bổng,Việc bồi thẩm đoàn tha bổng bị cáo đã nhận được cả sự nhẹ nhõm lẫn phẫn nộ từ các tầng lớp khác nhau trong công chúng.,การพ้นผิด,การพิพากษาให้พ้นผิดของจำเลยโดยคณะลูกขุนได้รับทั้งความโล่งใจและความโกรธแค้นจากกลุ่มต่างๆ ของสาธารณชน,pembebasan,Pembebasan terdakwa oleh juri disambut dengan kelegaan dan kemarahan dari berbagai segmen masyarakat.
extradition,"The government formally requested the extradition of the fugitive from the country where he had been hiding for years.",인도,정부는 수년간 도피해 온 국가로부터 도망자의 인도를 공식 요청했다.,身柄引渡し,政府は数年間潜伏していた国からの逃亡者の身柄引渡しを正式に要請した。,引渡,政府正式要求从嫌疑人藏匿多年的国家引渡该逃犯。,extradición,El gobierno solicitó formalmente la extradición del fugitivo del país donde se había estado escondiendo durante años.,dẫn độ,Chính phủ chính thức yêu cầu dẫn độ tên tội phạm đào tẩu từ quốc gia nơi hắn ẩn náu nhiều năm.,การส่งผู้ร้ายข้ามแดน,รัฐบาลร้องขอการส่งผู้ร้ายข้ามแดนอย่างเป็นทางการจากประเทศที่ผู้ร้ายหลบซ่อนตัวมาหลายปี,ekstradisi,Pemerintah secara resmi meminta ekstradisi buronan dari negara tempat dia bersembunyi selama bertahun-tahun.
appellate,"The appellate court overturned the lower court's decision on the grounds of procedural irregularities.",항소의,항소 법원은 절차적 부정으로 인해 하급 법원의 판결을 뒤집었다.,控訴審の,控訴裁判所は手続き上の不備を理由に下級裁判所の判決を覆した。,上诉的,上诉法院以程序违规为由推翻了下级法院的判决。,de apelación,El tribunal de apelación revocó la decisión del tribunal inferior por irregularidades procesales.,phúc thẩm,Tòa phúc thẩm đã bác bỏ quyết định của tòa sơ thẩm với lý do vi phạm thủ tục tố tụng.,อุทธรณ์,ศาลอุทธรณ์พลิกคำตัดสินของศาลชั้นต้นด้วยเหตุผลว่ามีความไม่ถูกต้องทางกระบวนวิธี,banding,Pengadilan banding membatalkan keputusan pengadilan yang lebih rendah atas dasar ketidakberesan prosedural.
perjury,"The witness was charged with perjury after investigators discovered that her testimony had been deliberately fabricated.",위증,증인은 수사관들이 그녀의 증언이 고의로 조작되었다는 것을 발견한 후 위증 혐의로 기소되었다.,偽証,証人は調査官が彼女の証言が意図的に捏造されたことを発見した後、偽証罪で起訴された。,伪证,在调查人员发现其证词是故意捏造后该证人被控伪证罪。,perjurio,La testigo fue acusada de perjurio después de que los investigadores descubrieran que su testimonio había sido deliberadamente fabricado.,khai man,Nhân chứng bị buộc tội khai man sau khi điều tra viên phát hiện lời khai của cô ta đã bị cố tình bịa đặt.,การเบิกความเท็จ,พยานถูกตั้งข้อหาเบิกความเท็จหลังจากนักสืบค้นพบว่าคำให้การของเธอถูกสร้างขึ้นโดยจงใจ,sumpah palsu,Saksi didakwa dengan sumpah palsu setelah penyelidik menemukan bahwa kesaksiannya sengaja dibuat-buat.
clemency,"The prisoner's family petitioned the governor for clemency after new evidence suggested a wrongful conviction.",관용,새로운 증거가 부당한 유죄 판결을 시사한 후 수감자의 가족이 주지사에게 관용을 청원했다.,恩赦,新たな証拠が冤罪を示唆した後、受刑者の家族は知事に恩赦を請願した。,宽恕,在新证据表明存在错误定罪后囚犯的家人向州长请求宽恕。,clemencia,La familia del prisionero solicitó clemencia al gobernador después de que nuevas pruebas sugirieran una condena injusta.,khoan hồng,Gia đình tù nhân đã kiến nghị thống đốc khoan hồng sau khi có bằng chứng mới cho thấy bản án oan.,การอภัยโทษ,ครอบครัวของนักโทษยื่นคำร้องต่อผู้ว่าการเพื่อขอการอภัยโทษหลังจากมีหลักฐานใหม่บ่งชี้ว่าเป็นการตัดสินลงโทษที่ผิดพลาด,grasi,Keluarga narapidana mengajukan permohonan grasi kepada gubernur setelah bukti baru menunjukkan adanya vonis yang salah.
injunction,"The court granted a temporary injunction preventing the developer from demolishing the historic building.",금지 명령,법원은 개발업자가 역사적 건물을 철거하는 것을 막는 임시 금지 명령을 내렸다.,差止命令,裁判所は開発業者が歴史的建造物を取り壊すことを禁じる仮差止命令を認めた。,禁令,法院颁发了临时禁令阻止开发商拆除历史建筑。,interdicto,El tribunal otorgó un interdicto temporal que impedía al promotor demoler el edificio histórico.,lệnh cấm,Tòa án đã ban hành lệnh cấm tạm thời ngăn chủ đầu tư phá dỡ tòa nhà lịch sử.,คำสั่งห้าม,ศาลอนุมัติคำสั่งห้ามชั่วคราวป้องกันไม่ให้ผู้พัฒนาทำลายอาคารประวัติศาสตร์,perintah pengadilan,Pengadilan memberikan perintah sementara yang mencegah pengembang menghancurkan bangunan bersejarah tersebut.
subpoena,"The congressional committee issued a subpoena compelling the former advisor to testify under oath.",소환장,의회 위원회는 전 고문에게 선서 아래 증언하도록 강제하는 소환장을 발부했다.,召喚状,議会委員会は元顧問に宣誓の下での証言を強制する召喚状を発行した。,传票,国会委员会发出传票强制前顾问宣誓作证。,citación judicial,El comité del congreso emitió una citación judicial obligando al exasesor a testificar bajo juramento.,trát đòi hầu tòa,Ủy ban quốc hội đã ban hành trát đòi hầu tòa buộc cựu cố vấn phải khai báo dưới lời tuyên thệ.,หมายเรียก,คณะกรรมการรัฐสภาออกหมายเรียกบังคับให้อดีตที่ปรึกษาให้การภายใต้คำสาบาน,surat panggilan,Komite kongres mengeluarkan surat panggilan yang memaksa mantan penasihat untuk bersaksi di bawah sumpah.
