sociolinguistics,"Sociolinguistics examines how factors such as class gender and ethnicity influence language use within a community.",사회언어학,사회언어학은 계층 성별 민족성 등의 요인이 공동체 내 언어 사용에 어떻게 영향을 미치는지를 연구한다.,社会言語学,社会言語学は階級、性別、民族性などの要因がコミュニティ内の言語使用にどのように影響するかを検討する。,社会语言学,社会语言学研究阶层性别和民族等因素如何影响社区内的语言使用。,sociolingüística,"La sociolingüística examina cómo factores como la clase, el género y la etnia influyen en el uso del lenguaje dentro de una comunidad.",ngôn ngữ học xã hội,"Ngôn ngữ học xã hội nghiên cứu cách các yếu tố như tầng lớp, giới tính và dân tộc ảnh hưởng đến việc sử dụng ngôn ngữ trong cộng đồng.",ภาษาศาสตร์สังคม,ภาษาศาสตร์สังคมตรวจสอบว่าปัจจัยเช่นชนชั้น เพศ และชาติพันธุ์มีอิทธิพลต่อการใช้ภาษาในชุมชนอย่างไร,sosiolinguistik,"Sosiolinguistik mempelajari bagaimana faktor-faktor seperti kelas, gender, dan etnisitas memengaruhi penggunaan bahasa dalam suatu komunitas."
bilingual,"Research suggests that bilingual individuals may develop cognitive advantages including enhanced executive function and mental flexibility.",이중 언어의,연구에 따르면 이중 언어 사용자는 향상된 집행 기능과 정신적 유연성을 포함한 인지적 이점을 개발할 수 있다.,バイリンガルの,研究によればバイリンガルの個人は実行機能の向上や精神的柔軟性など認知的な利点を発達させる可能性がある。,双语的,研究表明双语个体可能会发展出认知优势包括增强的执行功能和心理灵活性。,bilingüe,Las investigaciones sugieren que los individuos bilingües pueden desarrollar ventajas cognitivas incluyendo una función ejecutiva mejorada y flexibilidad mental.,song ngữ,Nghiên cứu cho thấy những người song ngữ có thể phát triển các lợi thế nhận thức bao gồm chức năng điều hành nâng cao và sự linh hoạt tinh thần.,สองภาษา,งานวิจัยชี้ว่าบุคคลที่พูดสองภาษาอาจพัฒนาข้อได้เปรียบทางปัญญารวมถึงการทำงานของสมองส่วนบริหารที่ดีขึ้นและความยืดหยุ่นทางจิต,dwibahasa,Penelitian menunjukkan bahwa individu dwibahasa dapat mengembangkan keunggulan kognitif termasuk fungsi eksekutif yang ditingkatkan dan fleksibilitas mental.
vernacular,"The author chose to write the novel entirely in the vernacular of the rural community she had grown up in.",방언,작가는 자신이 자란 농촌 공동체의 방언으로 소설을 전부 집필하기로 했다.,方言,著者は自分が育った農村コミュニティの方言で小説を執筆することを選んだ。,方言,作者选择完全用她成长的农村社区的方言来写这部小说。,vernáculo,La autora eligió escribir la novela enteramente en la lengua vernácula de la comunidad rural donde creció.,tiếng bản địa,Tác giả chọn viết tiểu thuyết hoàn toàn bằng tiếng bản địa của cộng đồng nông thôn nơi cô lớn lên.,ภาษาพื้นเมือง,ผู้เขียนเลือกเขียนนวนิยายทั้งหมดด้วยภาษาพื้นเมืองของชุมชนชนบทที่เธอเติบโตมา,bahasa daerah,Penulis memilih untuk menulis novel sepenuhnya dalam bahasa daerah komunitas pedesaan tempat dia dibesarkan.
pidgin,"A pidgin language typically emerges when speakers of different languages need to communicate for trade or other practical purposes.",피진어,피진어는 일반적으로 서로 다른 언어의 화자가 무역이나 기타 실용적 목적으로 의사소통해야 할 때 발생한다.,ピジン語,ピジン語は通常、異なる言語の話者が貿易やその他の実用的な目的でコミュニケーションする必要がある場合に出現する。,洋泾浜语,皮钦语通常在不同语言的使用者需要为贸易或其他实际目的进行交流时出现。,pidgin,Un idioma pidgin típicamente surge cuando hablantes de diferentes idiomas necesitan comunicarse para el comercio u otros propósitos prácticos.,ngôn ngữ lai,Ngôn ngữ lai thường xuất hiện khi những người nói các ngôn ngữ khác nhau cần giao tiếp với nhau cho mục đích thương mại hoặc thực tiễn khác.,ภาษาพิดจิน,ภาษาพิดจินมักจะเกิดขึ้นเมื่อผู้พูดภาษาต่างๆ จำเป็นต้องสื่อสารกันเพื่อการค้าหรือวัตถุประสงค์ในทางปฏิบัติอื่นๆ,bahasa pidgin,Bahasa pidgin biasanya muncul ketika penutur bahasa yang berbeda perlu berkomunikasi untuk perdagangan atau tujuan praktis lainnya.
creole,"Over generations the pidgin language evolved into a creole with its own complex grammar and native speakers.",크리올어,수 세대에 걸쳐 피진어는 고유한 복잡한 문법과 원어민을 가진 크리올어로 발전했다.,クレオール語,数世代を経てピジン語は独自の複雑な文法とネイティブスピーカーを持つクレオール語に進化した。,克里奥尔语,经过几代人皮钦语演变为拥有自己复杂语法和母语使用者的克里奥尔语。,criollo,A lo largo de generaciones el idioma pidgin evolucionó hacia un criollo con su propia gramática compleja y hablantes nativos.,ngôn ngữ creole,Qua nhiều thế hệ ngôn ngữ lai đã phát triển thành ngôn ngữ creole với ngữ pháp phức tạp riêng và những người nói bản ngữ.,ภาษาครีโอล,ผ่านหลายชั่วอายุคนภาษาพิดจินพัฒนาเป็นภาษาครีโอลที่มีไวยากรณ์ซับซ้อนของตัวเองและมีเจ้าของภาษา,bahasa kreol,Selama beberapa generasi bahasa pidgin berevolusi menjadi bahasa kreol dengan tata bahasa kompleksnya sendiri dan penutur asli.
neologism,"The tech industry is a prolific source of neologisms with words like blog and podcast entering mainstream vocabulary.",신조어,기술 산업은 blog과 podcast 같은 단어가 주류 어휘에 들어오면서 신조어의 풍부한 원천이다.,新語,テクノロジー業界はblogやpodcastなどの言葉が主流の語彙に入り込む新語の豊富な源泉である。,新词,科技行业是新词的丰富来源blog和podcast等词汇已进入主流词汇。,neologismo,La industria tecnológica es una fuente prolífica de neologismos con palabras como blog y podcast que entran en el vocabulario habitual.,từ mới,Ngành công nghệ là nguồn phong phú của từ mới với các từ như blog và podcast đã đi vào vốn từ vựng chủ đạo.,คำศัพท์ใหม่,อุตสาหกรรมเทคโนโลยีเป็นแหล่งคำศัพท์ใหม่ที่อุดมสมบูรณ์โดยมีคำอย่าง blog และ podcast เข้ามาอยู่ในคำศัพท์กระแสหลัก,neologisme,Industri teknologi adalah sumber neologisme yang produktif dengan kata-kata seperti blog dan podcast yang memasuki kosakata umum.
diphthong,"English contains numerous diphthongs such as the vowel sound in the word coin which glides from one position to another.",이중모음,영어에는 coin이라는 단어의 모음 소리처럼 한 위치에서 다른 위치로 미끄러지는 수많은 이중모음이 포함되어 있다.,二重母音,英語にはcoinという語の母音のように一つの位置から別の位置へ滑る多数の二重母音が含まれている。,双元音,英语包含大量双元音例如coin一词中的元音从一个位置滑向另一个位置。,diptongo,El inglés contiene numerosos diptongos como el sonido vocal en la palabra coin que se desliza de una posición a otra.,nguyên âm đôi,Tiếng Anh chứa nhiều nguyên âm đôi như âm nguyên âm trong từ coin trượt từ vị trí này sang vị trí khác.,สระประสม,ภาษาอังกฤษมีสระประสมหลายตัวเช่นเสียงสระในคำว่า coin ที่ลื่นไหลจากตำแหน่งหนึ่งไปอีกตำแหน่งหนึ่ง,diftong,Bahasa Inggris mengandung banyak diftong seperti bunyi vokal dalam kata coin yang meluncur dari satu posisi ke posisi lain.
affix,"In morphological analysis an affix is a bound morpheme that attaches to a root to modify its meaning or grammatical function.",접사,형태론적 분석에서 접사는 의미나 문법적 기능을 변경하기 위해 어근에 부착되는 의존 형태소이다.,接辞,形態論的分析において接辞は意味や文法的機能を変更するために語根に付加される拘束形態素である。,词缀,在形态学分析中词缀是附加在词根上以改变其含义或语法功能的粘着语素。,afijo,En el análisis morfológico un afijo es un morfema ligado que se une a una raíz para modificar su significado o función gramatical.,phụ tố,Trong phân tích hình thái học phụ tố là một hình vị ràng buộc gắn vào gốc từ để thay đổi ý nghĩa hoặc chức năng ngữ pháp của nó.,หน่วยคำเติม,ในการวิเคราะห์ทางสัณฐานวิทยาหน่วยคำเติมเป็นหน่วยคำผูกพันที่แนบกับรากคำเพื่อเปลี่ยนความหมายหรือหน้าที่ทางไวยากรณ์,afiks,Dalam analisis morfologis afiks adalah morfem terikat yang melekat pada akar kata untuk mengubah makna atau fungsi gramatikalnya.
inflection,"Languages with rich inflection systems like Latin can convey grammatical relationships that English expresses through word order.",굴절,라틴어와 같이 풍부한 굴절 체계를 가진 언어는 영어가 어순으로 표현하는 문법적 관계를 전달할 수 있다.,屈折,ラテン語のような豊かな屈折体系を持つ言語は英語が語順で表現する文法的関係を伝えることができる。,屈折变化,具有丰富屈折变化系统的语言如拉丁语能够表达英语通过语序表达的语法关系。,inflexión,Los idiomas con sistemas de inflexión ricos como el latín pueden transmitir relaciones gramaticales que el inglés expresa a través del orden de las palabras.,biến tố,Các ngôn ngữ có hệ thống biến tố phong phú như tiếng Latin có thể truyền đạt các mối quan hệ ngữ pháp mà tiếng Anh biểu đạt thông qua trật tự từ.,การผันคำ,ภาษาที่มีระบบการผันคำที่หลากหลายเช่นภาษาละตินสามารถสื่อความสัมพันธ์ทางไวยากรณ์ที่ภาษาอังกฤษแสดงผ่านลำดับคำ,infleksi,Bahasa dengan sistem infleksi yang kaya seperti bahasa Latin dapat menyampaikan hubungan gramatikal yang bahasa Inggris ekspresikan melalui urutan kata.
transliteration,"The transliteration of Arabic names into English often results in multiple variant spellings of the same name.",음역,아랍어 이름의 영어 음역은 종종 같은 이름의 여러 변형 철자를 초래한다.,翻字,アラビア語の名前の英語への翻字はしばしば同じ名前の複数の異なるつづりをもたらす。,音译,阿拉伯语名字的英语音译通常会导致同一名字出现多种不同拼写。,transliteración,La transliteración de nombres árabes al inglés a menudo resulta en múltiples variantes ortográficas del mismo nombre.,chuyển tự,Việc chuyển tự các tên tiếng Ả Rập sang tiếng Anh thường dẫn đến nhiều biến thể chính tả khác nhau của cùng một tên.,การถอดอักษร,การถอดอักษรชื่อภาษาอาหรับเป็นภาษาอังกฤษมักส่งผลให้เกิดการสะกดชื่อเดียวกันหลายรูปแบบ,transliterasi,Transliterasi nama-nama Arab ke dalam bahasa Inggris sering menghasilkan beberapa varian ejaan dari nama yang sama.
anaphora,"In discourse analysis anaphora refers to the use of a word to refer back to an expression mentioned earlier in the text.",조응,담화 분석에서 조응은 텍스트에서 이전에 언급된 표현을 다시 참조하기 위해 단어를 사용하는 것을 의미한다.,照応,談話分析において照応はテキスト中で以前に言及された表現を参照するための語の使用を指す。,回指,在话语分析中回指是指使用一个词来回指文本中先前提到的表达。,anáfora,En el análisis del discurso la anáfora se refiere al uso de una palabra para referirse a una expresión mencionada anteriormente en el texto.,hồi chỉ,Trong phân tích diễn ngôn hồi chỉ đề cập đến việc sử dụng một từ để chỉ lại một biểu thức đã được đề cập trước đó trong văn bản.,การอ้างถึงย้อนกลับ,ในการวิเคราะห์วาทกรรมการอ้างถึงย้อนกลับหมายถึงการใช้คำเพื่ออ้างถึงสำนวนที่กล่าวถึงก่อนหน้าในข้อความ,anafora,Dalam analisis wacana anafora mengacu pada penggunaan kata untuk merujuk kembali pada ekspresi yang disebutkan sebelumnya dalam teks.
polysemy,"The word bank is a classic example of polysemy having distinct meanings related to finance and river geography.",다의성,bank이라는 단어는 금융과 강 지형과 관련된 별개의 의미를 갖는 다의성의 대표적인 예이다.,多義性,bankという語は金融と河川地理学に関連する異なる意味を持つ多義性の典型的な例である。,多义性,bank一词是多义性的典型例子具有与金融和河流地理相关的不同含义。,polisemia,La palabra bank es un ejemplo clásico de polisemia con significados distintos relacionados con las finanzas y la geografía fluvial.,đa nghĩa,Từ bank là một ví dụ kinh điển về đa nghĩa có các ý nghĩa riêng biệt liên quan đến tài chính và địa lý sông ngòi.,ความหลายความหมาย,คำว่า bank เป็นตัวอย่างคลาสสิกของความหลายความหมายโดยมีความหมายที่แตกต่างกันเกี่ยวกับการเงินและภูมิศาสตร์แม่น้ำ,polisemi,Kata bank adalah contoh klasik polisemi yang memiliki makna berbeda terkait keuangan dan geografi sungai.
lingua franca,"English has become the de facto lingua franca of international business diplomacy and scientific research.",공용어,영어는 국제 비즈니스 외교 및 과학 연구의 사실상 공용어가 되었다.,共通語,英語は国際ビジネス、外交、科学研究の事実上の共通語となった。,通用语,英语已成为国际商务外交和科学研究的事实上的通用语。,lingua franca,El inglés se ha convertido en la lingua franca de facto de los negocios internacionales la diplomacia y la investigación científica.,ngôn ngữ chung,Tiếng Anh đã trở thành ngôn ngữ chung trên thực tế của thương mại quốc tế ngoại giao và nghiên cứu khoa học.,ภาษากลาง,ภาษาอังกฤษได้กลายเป็นภาษากลางโดยพฤตินัยของธุรกิจระหว่างประเทศการทูตและการวิจัยทางวิทยาศาสตร์,bahasa pengantar,Bahasa Inggris telah menjadi lingua franca de facto untuk bisnis internasional diplomasi dan penelitian ilmiah.
embargo,"The international embargo on arms sales to the region remained in effect despite calls for its relaxation.",금수 조치,해당 지역에 대한 국제 무기 금수 조치는 완화 요구에도 불구하고 계속 유효했다.,禁輸,この地域への武器売却に対する国際的な禁輸措置は緩和の要求にもかかわらず引き続き有効であった。,禁运,尽管有放松要求但对该地区的国际武器禁运仍然有效。,embargo,El embargo internacional sobre la venta de armas a la región permaneció vigente a pesar de los llamados a su relajación.,cấm vận,Lệnh cấm vận quốc tế về bán vũ khí cho khu vực vẫn có hiệu lực bất chấp các lời kêu gọi nới lỏng.,การคว่ำบาตร,การคว่ำบาตรระหว่างประเทศเกี่ยวกับการขายอาวุธให้กับภูมิภาคยังคงมีผลบังคับใช้แม้จะมีการเรียกร้องให้ผ่อนคลาย,embargo,Embargo internasional atas penjualan senjata ke wilayah tersebut tetap berlaku meskipun ada seruan untuk pelonggarannya.
ordinance,"The city council passed a new ordinance restricting the construction of high-rise buildings in the historic district.",조례,시의회는 역사 지구에서 고층 건물 건설을 제한하는 새로운 조례를 통과시켰다.,条例,市議会は歴史地区における高層ビルの建設を制限する新しい条例を可決した。,法令,市议会通过了一项限制在历史街区建造高层建筑的新法令。,ordenanza,El concejo municipal aprobó una nueva ordenanza que restringe la construcción de edificios de gran altura en el distrito histórico.,sắc lệnh,Hội đồng thành phố đã thông qua một sắc lệnh mới hạn chế xây dựng các tòa nhà cao tầng trong khu vực lịch sử.,ข้อบัญญัติ,สภาเทศบาลผ่านข้อบัญญัติใหม่จำกัดการก่อสร้างอาคารสูงในเขตประวัติศาสตร์,peraturan daerah,Dewan kota mengesahkan peraturan daerah baru yang membatasi pembangunan gedung pencakar langit di kawasan bersejarah.
jurisprudential,"The scholar's jurisprudential analysis challenged the prevailing interpretation of constitutional rights in the digital age.",법학적,학자의 법학적 분석은 디지털 시대의 헌법적 권리에 대한 지배적 해석에 이의를 제기했다.,法理学的,学者の法理学的分析はデジタル時代における憲法上の権利の一般的な解釈に異議を唱えた。,法理学的,学者的法理学分析对数字时代宪法权利的主流解释提出了挑战。,jurisprudencial,El análisis jurisprudencial del académico desafió la interpretación predominante de los derechos constitucionales en la era digital.,thuộc pháp lý học,Phân tích pháp lý học của học giả đã thách thức cách diễn giải phổ biến về quyền hiến pháp trong thời đại kỹ thuật số.,ทางนิติศาสตร์,การวิเคราะห์ทางนิติศาสตร์ของนักวิชาการท้าทายการตีความสิทธิตามรัฐธรรมนูญที่แพร่หลายในยุคดิจิทัล,yurisprudensial,Analisis yurisprudensial sarjana tersebut menantang interpretasi yang berlaku tentang hak-hak konstitusional di era digital.
fiduciary,"Financial advisors have a fiduciary duty to act in the best interests of their clients rather than pursuing personal gain.",수탁의,금융 자문가는 개인적 이익을 추구하기보다 고객의 최선의 이익을 위해 행동할 수탁 의무가 있다.,受託者の,ファイナンシャルアドバイザーは個人的な利益を追求するのではなくクライアントの最善の利益のために行動する受託者義務がある。,信托的,财务顾问有信托义务以客户的最佳利益行事而非追求个人利益。,fiduciario,Los asesores financieros tienen un deber fiduciario de actuar en el mejor interés de sus clientes en lugar de buscar ganancias personales.,ủy thác,Các cố vấn tài chính có nghĩa vụ ủy thác hành động vì lợi ích tốt nhất của khách hàng thay vì theo đuổi lợi ích cá nhân.,ผู้ดูแลผลประโยชน์,ที่ปรึกษาทางการเงินมีหน้าที่ในฐานะผู้ดูแลผลประโยชน์ในการกระทำเพื่อผลประโยชน์สูงสุดของลูกค้าแทนที่จะแสวงหาผลประโยชน์ส่วนตัว,fidusia,Penasihat keuangan memiliki kewajiban fidusia untuk bertindak demi kepentingan terbaik klien mereka daripada mengejar keuntungan pribadi.
malfeasance,"The investigation uncovered evidence of malfeasance by senior officials who had embezzled public funds.",직권 남용,조사는 공적 자금을 횡령한 고위 관리들의 직권 남용 증거를 밝혀냈다.,不正行為,調査は公的資金を横領した上級職員による不正行為の証拠を明らかにした。,渎职,调查发现了高级官员挪用公共资金的渎职证据。,malversación,La investigación descubrió evidencia de malversación por parte de altos funcionarios que habían malversado fondos públicos.,hành vi sai trái,Cuộc điều tra đã phát hiện bằng chứng về hành vi sai trái của các quan chức cấp cao đã biển thủ công quỹ.,การทุจริต,การสอบสวนเปิดเผยหลักฐานการทุจริตของเจ้าหน้าที่ระดับสูงที่ยักยอกเงินของรัฐ,malfeasance,Investigasi mengungkap bukti malfeasance oleh pejabat senior yang telah menggelapkan dana publik.
lien,"The bank placed a lien on the property to secure repayment of the outstanding mortgage loan.",유치권,은행은 미상환 모기지론의 상환을 확보하기 위해 부동산에 유치권을 설정했다.,先取特権,銀行は住宅ローンの返済を確保するために不動産に先取特権を設定した。,留置权,银行对该房产设置了留置权以确保未偿还抵押贷款的偿还。,gravamen,El banco colocó un gravamen sobre la propiedad para asegurar el reembolso del préstamo hipotecario pendiente.,quyền cầm giữ,Ngân hàng đã đặt quyền cầm giữ trên tài sản để đảm bảo việc hoàn trả khoản vay thế chấp còn tồn đọng.,สิทธิยึดหน่วง,ธนาคารวางสิทธิยึดหน่วงบนอสังหาริมทรัพย์เพื่อรับประกันการชำระคืนเงินกู้จำนองที่ค้างชำระ,hak gadai,Bank menempatkan hak gadai pada properti tersebut untuk menjamin pembayaran kembali pinjaman hipotek yang belum lunas.
quorum,"The board meeting could not proceed because they failed to achieve a quorum with only four of the twelve members present.",정족수,이사회는 12명 중 4명만 출석하여 정족수를 채우지 못해 진행할 수 없었다.,定足数,取締役会は12名中4名のみの出席で定足数に達しなかったため開催できなかった。,法定人数,由于12名成员中只有4人出席未能达到法定人数董事会会议无法进行。,quórum,La reunión de la junta no pudo proceder porque no lograron alcanzar el quórum con solo cuatro de los doce miembros presentes.,số đại biểu tối thiểu,Cuộc họp hội đồng không thể tiến hành vì chỉ có bốn trong số mười hai thành viên có mặt không đạt số đại biểu tối thiểu.,องค์ประชุม,การประชุมคณะกรรมการไม่สามารถดำเนินต่อไปได้เนื่องจากไม่ครบองค์ประชุมโดยมีสมาชิกเข้าร่วมเพียงสี่คนจากทั้งหมดสิบสองคน,kuorum,Rapat dewan tidak dapat dilanjutkan karena mereka gagal mencapai kuorum dengan hanya empat dari dua belas anggota yang hadir.
