jurisprudence,The professor's lecture on jurisprudence explored the philosophical foundations of legal systems.,법학,그 교수의 법학 강의는 법 체계의 철학적 기초를 탐구했다.,法学,その教授の法学の講義は法体系の哲学的基礎を探究した。,法理学,那位教授的法理学讲座探讨了法律体系的哲学基础。,jurisprudencia,La conferencia del profesor sobre jurisprudencia exploró los fundamentos filosóficos de los sistemas legales.,luật học,Bài giảng của giáo sư về luật học đã khám phá nền tảng triết học của các hệ thống pháp luật.,นิติศาสตร์,การบรรยายของศาสตราจารย์เรื่องนิติศาสตร์ได้สำรวจรากฐานทางปรัชญาของระบบกฎหมาย,yurisprudensi,Kuliah profesor tentang yurisprudensi mengeksplorasi dasar filosofis sistem hukum.
adjudication,The adjudication of the dispute required careful examination of constitutional precedent.,재판,그 분쟁의 재판은 헌법적 판례의 신중한 검토를 필요로 했다.,裁定,その紛争の裁定は憲法上の判例の慎重な検討を必要とした。,裁决,该争端的裁决需要仔细审查宪法判例。,adjudicación,La adjudicación de la disputa requirió un examen cuidadoso del precedente constitucional.,phán quyết,Việc phán quyết tranh chấp đòi hỏi phải xem xét kỹ lưỡng tiền lệ hiến pháp.,การพิพากษา,การพิพากษาข้อพิพาทนั้นต้องมีการตรวจสอบบรรทัดฐานทางรัฐธรรมนูญอย่างรอบคอบ,ajudikasi,Ajudikasi sengketa tersebut memerlukan pemeriksaan cermat terhadap preseden konstitusional.
promulgate,The government moved to promulgate the new constitutional amendment immediately.,공포하다,정부는 새로운 헌법 수정안을 즉시 공포하기로 했다.,公布する,政府は新しい憲法修正案を直ちに公布することにした。,颁布,政府决定立即颁布新的宪法修正案。,promulgar,El gobierno procedió a promulgar la nueva enmienda constitucional de inmediato.,ban hành,Chính phủ đã tiến hành ban hành sửa đổi hiến pháp mới ngay lập tức.,ประกาศใช้,รัฐบาลดำเนินการประกาศใช้การแก้ไขรัฐธรรมนูญฉบับใหม่ทันที,mengundangkan,Pemerintah bergerak untuk mengundangkan amandemen konstitusi baru dengan segera.
bicameralism,Bicameralism ensures that legislation undergoes scrutiny by two separate legislative bodies.,양원제,양원제는 입법이 두 개의 별도 입법 기관에 의해 심사되도록 보장한다.,二院制,二院制は立法が二つの別々の立法機関による精査を受けることを保証する。,两院制,两院制确保立法接受两个独立立法机构的审查。,bicameralismo,El bicameralismo asegura que la legislación sea examinada por dos cuerpos legislativos separados.,lưỡng viện,Chế độ lưỡng viện đảm bảo rằng luật pháp được xem xét kỹ lưỡng bởi hai cơ quan lập pháp riêng biệt.,ระบบสองสภา,ระบบสองสภาทำให้มั่นใจว่ากฎหมายได้รับการตรวจสอบโดยสองสภานิติบัญญัติที่แยกจากกัน,bikameralisme,Bikameralisme memastikan bahwa undang-undang menjalani pengawasan oleh dua badan legislatif terpisah.
habeas corpus,The defense attorney filed a writ of habeas corpus to challenge the unlawful detention.,인신보호영장,변호사는 불법 구금에 이의를 제기하기 위해 인신보호영장을 신청했다.,人身保護令状,弁護人は不法拘束に異議を唱えるために人身保護令状を申請した。,人身保护令,辩护律师提出人身保护令以质疑非法拘留。,hábeas corpus,El abogado defensor presentó un recurso de hábeas corpus para impugnar la detención ilegal.,lệnh bảo thân,Luật sư bào chữa đã nộp lệnh bảo thân để phản đối việc giam giữ trái pháp luật.,หมายเรียกตัว,ทนายฝ่ายจำเลยยื่นหมายเรียกตัวเพื่อคัดค้านการควบคุมตัวโดยมิชอบด้วยกฎหมาย,habeas corpus,Pengacara pembela mengajukan surat perintah habeas corpus untuk menentang penahanan yang melanggar hukum.
ratification,Ratification of the treaty required a two-thirds majority in the senate.,비준,조약의 비준은 상원에서 3분의 2의 다수결을 필요로 했다.,批准,条約の批准には上院での三分の二の多数決が必要であった。,批准,条约的批准需要参议院三分之二多数通过。,ratificación,La ratificación del tratado requirió una mayoría de dos tercios en el senado.,phê chuẩn,Việc phê chuẩn hiệp ước đòi hỏi đa số hai phần ba tại thượng viện.,การให้สัตยาบัน,การให้สัตยาบันสนธิสัญญาต้องได้เสียงข้างมากสองในสามในวุฒิสภา,ratifikasi,Ratifikasi perjanjian tersebut memerlukan mayoritas dua pertiga di senat.
enumerated powers,The constitution explicitly lists enumerated powers granted to the federal government.,열거된 권한,헌법은 연방 정부에 부여된 열거된 권한을 명시적으로 나열한다.,列挙された権限,憲法は連邦政府に付与された列挙された権限を明示的に列挙している。,列举权力,宪法明确列出了授予联邦政府的列举权力。,poderes enumerados,La constitución enumera explícitamente los poderes enumerados otorgados al gobierno federal.,quyền liệt kê,Hiến pháp liệt kê rõ ràng các quyền liệt kê được trao cho chính phủ liên bang.,อำนาจที่ระบุไว้,รัฐธรรมนูญระบุอำนาจที่ระบุไว้ที่มอบให้แก่รัฐบาลกลางอย่างชัดเจน,kekuasaan yang disebutkan,Konstitusi secara eksplisit mencantumkan kekuasaan yang disebutkan yang diberikan kepada pemerintah federal.
stare decisis,The principle of stare decisis compels courts to follow established judicial precedent.,선례 구속의 원칙,선례 구속의 원칙은 법원이 확립된 사법 선례를 따르도록 강제한다.,先例拘束の原則,先例拘束の原則は裁判所に確立された司法上の先例に従うことを強いる。,遵循先例原则,遵循先例原则要求法院遵循已确立的司法先例。,stare decisis,El principio de stare decisis obliga a los tribunales a seguir el precedente judicial establecido.,nguyên tắc tiền lệ,Nguyên tắc tiền lệ buộc các tòa án phải tuân theo tiền lệ tư pháp đã được thiết lập.,หลักบรรทัดฐาน,หลักบรรทัดฐานบังคับให้ศาลปฏิบัติตามแนวคำพิพากษาที่ได้วางไว้,stare decisis,Prinsip stare decisis mewajibkan pengadilan untuk mengikuti preseden yudisial yang telah ditetapkan.
sovereign immunity,Sovereign immunity protects the state from being sued without its own consent.,국가면책특권,국가면책특권은 국가가 자체 동의 없이 소송을 당하지 않도록 보호한다.,主権免除,主権免除は国家が自らの同意なしに訴えられることから保護する。,主权豁免,主权豁免保护国家免于在未经其同意的情况下被起诉。,inmunidad soberana,La inmunidad soberana protege al estado de ser demandado sin su propio consentimiento.,quyền miễn trừ chủ quyền,Quyền miễn trừ chủ quyền bảo vệ nhà nước khỏi bị kiện mà không có sự đồng ý của chính nhà nước.,เอกสิทธิ์อธิปไตย,เอกสิทธิ์อธิปไตยคุ้มครองรัฐจากการถูกฟ้องร้องโดยไม่ได้รับความยินยอมจากรัฐเอง,imunitas kedaulatan,Imunitas kedaulatan melindungi negara dari dituntut tanpa persetujuannya sendiri.
due process,The Fifth Amendment guarantees due process before any deprivation of life or liberty.,적법 절차,수정헌법 제5조는 생명이나 자유의 박탈 전에 적법 절차를 보장한다.,適正手続き,修正第五条は生命や自由の剥奪の前に適正手続きを保証する。,正当程序,第五修正案保障在剥夺生命或自由之前的正当程序。,debido proceso,La Quinta Enmienda garantiza el debido proceso antes de cualquier privación de vida o libertad.,thủ tục hợp pháp,Tu chính án thứ năm bảo đảm thủ tục hợp pháp trước bất kỳ sự tước đoạt mạng sống hay tự do nào.,กระบวนการที่ถูกต้อง,การแก้ไขเพิ่มเติมรัฐธรรมนูญครั้งที่ห้ารับประกันกระบวนการที่ถูกต้องก่อนการพรากชีวิตหรือเสรีภาพ,proses hukum yang adil,Amandemen Kelima menjamin proses hukum yang adil sebelum perampasan nyawa atau kebebasan.
federalism,Federalism divides governmental authority between national and subnational jurisdictions.,연방주의,연방주의는 정부 권한을 국가 및 하위 국가 관할권 사이에 분배한다.,連邦主義,連邦主義は政府の権限を国家と地方の管轄権の間で分割する。,联邦制,联邦制将政府权力在国家和次国家管辖区之间进行划分。,federalismo,El federalismo divide la autoridad gubernamental entre jurisdicciones nacionales y subnacionales.,chủ nghĩa liên bang,Chủ nghĩa liên bang phân chia quyền lực chính phủ giữa các cấp quốc gia và địa phương.,สหพันธรัฐนิยม,สหพันธรัฐนิยมแบ่งอำนาจของรัฐบาลระหว่างเขตอำนาจระดับชาติและระดับรอง,federalisme,Federalisme membagi otoritas pemerintahan antara yurisdiksi nasional dan subnasional.
amicus curiae,Several organizations submitted amicus curiae briefs to inform the court on broader implications.,법정조언자,여러 단체가 더 넓은 시사점에 대해 법원에 알리기 위해 법정조언자 의견서를 제출했다.,法廷助言者,いくつかの組織がより広い影響について裁判所に情報を提供するために法廷助言者意見書を提出した。,法庭之友,多个组织提交了法庭之友意见书以告知法院更广泛的影响。,amicus curiae,Varias organizaciones presentaron escritos de amicus curiae para informar al tribunal sobre implicaciones más amplias.,người bạn của tòa án,Nhiều tổ chức đã nộp bản ý kiến người bạn của tòa án để thông báo cho tòa về các tác động rộng hơn.,มิตรศาล,หลายองค์กรยื่นคำแถลงมิตรศาลเพื่อแจ้งให้ศาลทราบถึงผลกระทบในวงกว้าง,amicus curiae,Beberapa organisasi mengajukan ringkasan amicus curiae untuk menginformasikan pengadilan tentang implikasi yang lebih luas.
preemption,Federal preemption invalidates state laws that conflict with national legislation.,선점,연방 선점은 국가 입법과 충돌하는 주법을 무효화한다.,専占,連邦専占は国の立法と矛盾する州法を無効にする。,优先权,联邦优先权使与国家立法冲突的州法律无效。,preempción,La preempción federal invalida las leyes estatales que entran en conflicto con la legislación nacional.,quyền ưu tiên,Quyền ưu tiên liên bang vô hiệu hóa các luật tiểu bang mâu thuẫn với pháp luật quốc gia.,สิทธิเหนือกว่า,สิทธิเหนือกว่าของรัฐบาลกลางทำให้กฎหมายของรัฐที่ขัดแย้งกับกฎหมายระดับชาติเป็นโมฆะ,preemsi,Preemsi federal membatalkan undang-undang negara bagian yang bertentangan dengan legislasi nasional.
originalism,Originalism interprets the constitution according to the framers' intent at the time of drafting.,원의주의,원의주의는 헌법을 기초 당시 기초자들의 의도에 따라 해석한다.,原意主義,原意主義は憲法を起草時の起草者の意図に従って解釈する。,原旨主义,原旨主义按照制宪者起草时的意图来解释宪法。,originalismo,El originalismo interpreta la constitución según la intención de los redactores en el momento de su redacción.,thuyết nguyên gốc,Thuyết nguyên gốc giải thích hiến pháp theo ý định của những người soạn thảo tại thời điểm soạn thảo.,ทฤษฎีต้นฉบับ,ทฤษฎีต้นฉบับตีความรัฐธรรมนูญตามเจตนารมณ์ของผู้ร่างในขณะที่ร่าง,originalisme,Originalisme menafsirkan konstitusi sesuai dengan maksud para perumus pada saat penyusunan.
strict scrutiny,Laws that restrict fundamental rights must survive strict scrutiny to be upheld.,엄격심사,기본권을 제한하는 법률은 유지되기 위해 엄격심사를 통과해야 한다.,厳格審査,基本的権利を制限する法律は維持されるために厳格審査に耐えなければならない。,严格审查,限制基本权利的法律必须经受严格审查才能维持。,escrutinio estricto,Las leyes que restringen derechos fundamentales deben superar el escrutinio estricto para ser confirmadas.,kiểm tra nghiêm ngặt,Các luật hạn chế quyền cơ bản phải vượt qua kiểm tra nghiêm ngặt để được duy trì.,การตรวจสอบอย่างเข้มงวด,กฎหมายที่จำกัดสิทธิขั้นพื้นฐานต้องผ่านการตรวจสอบอย่างเข้มงวดจึงจะมีผลบังคับใช้,pengujian ketat,Undang-undang yang membatasi hak-hak fundamental harus lolos pengujian ketat untuk dipertahankan.
separation of powers,The separation of powers prevents any single branch from accumulating excessive authority.,권력분립,권력분립은 어떤 단일 부서도 과도한 권한을 축적하는 것을 방지한다.,権力分立,権力分立はいかなる単一の部門も過度な権限を蓄積することを防ぐ。,三权分立,三权分立防止任何单一部门积累过多权力。,separación de poderes,La separación de poderes impide que cualquier rama acumule autoridad excesiva.,phân chia quyền lực,Sự phân chia quyền lực ngăn chặn bất kỳ nhánh nào tích lũy quyền lực quá mức.,การแบ่งแยกอำนาจ,การแบ่งแยกอำนาจป้องกันไม่ให้ฝ่ายใดฝ่ายหนึ่งสะสมอำนาจมากเกินไป,pemisahan kekuasaan,Pemisahan kekuasaan mencegah cabang mana pun dari mengakumulasi otoritas yang berlebihan.
equal protection clause,The equal protection clause prohibits states from denying any person equal treatment under the law.,평등보호조항,평등보호조항은 주가 어떤 사람에게도 법 아래 평등한 대우를 거부하는 것을 금지한다.,平等保護条項,平等保護条項は州がいかなる人にも法の下の平等な扱いを否定することを禁じる。,平等保护条款,平等保护条款禁止各州拒绝给予任何人法律上的平等待遇。,cláusula de igual protección,La cláusula de igual protección prohíbe a los estados negar a cualquier persona un trato igualitario ante la ley.,điều khoản bảo vệ bình đẳng,Điều khoản bảo vệ bình đẳng cấm các tiểu bang từ chối đối xử bình đẳng với bất kỳ ai theo pháp luật.,หลักคุ้มครองเท่าเทียม,หลักคุ้มครองเท่าเทียมห้ามรัฐปฏิเสธการปฏิบัติอย่างเท่าเทียมกันภายใต้กฎหมายต่อบุคคลใดๆ,klausul perlindungan yang setara,Klausul perlindungan yang setara melarang negara bagian menolak perlakuan yang sama di bawah hukum kepada siapa pun.
judicial review,Judicial review empowers courts to invalidate legislation that violates constitutional provisions.,사법심사,사법심사는 법원에 헌법 조항을 위반하는 입법을 무효화할 권한을 부여한다.,違憲立法審査権,違憲立法審査権は憲法の規定に違反する立法を無効にする権限を裁判所に与える。,司法审查,司法审查赋予法院权力使违反宪法规定的立法无效。,revisión judicial,La revisión judicial faculta a los tribunales para invalidar legislación que viole disposiciones constitucionales.,quyền xem xét tư pháp,Quyền xem xét tư pháp trao cho tòa án quyền vô hiệu hóa luật vi phạm các quy định hiến pháp.,การทบทวนของศาล,การทบทวนของศาลให้อำนาจศาลในการเพิกถอนกฎหมายที่ละเมิดบทบัญญัติของรัฐธรรมนูญ,judicial review,Judicial review memberdayakan pengadilan untuk membatalkan undang-undang yang melanggar ketentuan konstitusi.
commerce clause,The commerce clause grants Congress the authority to regulate interstate economic activity.,통상조항,통상조항은 의회에 주간 경제 활동을 규제할 권한을 부여한다.,通商条項,通商条項は議会に州間の経済活動を規制する権限を付与する。,商业条款,商业条款授予国会监管州际经济活动的权力。,cláusula de comercio,La cláusula de comercio otorga al Congreso la autoridad para regular la actividad económica interestatal.,điều khoản thương mại,Điều khoản thương mại trao cho Quốc hội quyền điều tiết hoạt động kinh tế liên bang.,มาตราการพาณิชย์,มาตราการพาณิชย์มอบอำนาจให้รัฐสภาในการควบคุมกิจกรรมทางเศรษฐกิจระหว่างรัฐ,klausul perdagangan,Klausul perdagangan memberikan Kongres otoritas untuk mengatur aktivitas ekonomi antarnegara bagian.
epigenetics,Epigenetics studies heritable changes in gene expression that occur without alterations to the DNA sequence.,후성유전학,후성유전학은 DNA 서열의 변화 없이 발생하는 유전자 발현의 유전 가능한 변화를 연구한다.,エピジェネティクス,エピジェネティクスはDNA配列の変化なしに起こる遺伝子発現の遺伝可能な変化を研究する。,表观遗传学,表观遗传学研究在不改变DNA序列的情况下发生的基因表达的可遗传变化。,epigenética,La epigenética estudia los cambios heredables en la expresión génica que ocurren sin alteraciones en la secuencia de ADN.,di truyền biểu sinh,Di truyền biểu sinh nghiên cứu các thay đổi có thể di truyền trong biểu hiện gen xảy ra mà không thay đổi trình tự DNA.,เอพิเจเนติกส์,เอพิเจเนติกส์ศึกษาการเปลี่ยนแปลงที่ถ่ายทอดได้ในการแสดงออกของยีนที่เกิดขึ้นโดยไม่มีการเปลี่ยนแปลงลำดับดีเอ็นเอ,epigenetika,Epigenetika mempelajari perubahan yang dapat diwariskan dalam ekspresi gen yang terjadi tanpa perubahan pada urutan DNA.
apoptosis,Apoptosis is the programmed cell death mechanism essential for maintaining tissue homeostasis.,세포자멸사,세포자멸사는 조직 항상성을 유지하는 데 필수적인 프로그램된 세포 사멸 메커니즘이다.,アポトーシス,アポトーシスは組織の恒常性を維持するために不可欠なプログラム細胞死のメカニズムである。,细胞凋亡,细胞凋亡是维持组织稳态所必需的程序性细胞死亡机制。,apoptosis,La apoptosis es el mecanismo de muerte celular programada esencial para mantener la homeostasis tisular.,chết theo chương trình,Chết theo chương trình là cơ chế chết tế bào được lập trình cần thiết để duy trì cân bằng nội môi mô.,อะพอพโทซิส,อะพอพโทซิสเป็นกลไกการตายของเซลล์แบบโปรแกรมที่จำเป็นต่อการรักษาสมดุลของเนื้อเยื่อ,apoptosis,Apoptosis adalah mekanisme kematian sel terprogram yang penting untuk menjaga homeostasis jaringan.
mitochondrial biogenesis,Mitochondrial biogenesis increases the cellular capacity for oxidative phosphorylation under metabolic stress.,미토콘드리아 생합성,미토콘드리아 생합성은 대사 스트레스 하에서 산화적 인산화에 대한 세포 능력을 증가시킨다.,ミトコンドリア生合成,ミトコンドリア生合成は代謝ストレス下で酸化的リン酸化の細胞能力を増加させる。,线粒体生物合成,线粒体生物合成在代谢应激下增加细胞氧化磷酸化的能力。,biogénesis mitocondrial,La biogénesis mitocondrial aumenta la capacidad celular para la fosforilación oxidativa bajo estrés metabólico.,sinh tổng hợp ty thể,Sinh tổng hợp ty thể tăng khả năng phosphoryl hóa oxy hóa của tế bào dưới stress chuyển hóa.,การสร้างไมโทคอนเดรีย,การสร้างไมโทคอนเดรียเพิ่มความสามารถของเซลล์ในการฟอสโฟรีเลชันแบบออกซิเดทีฟภายใต้ความเครียดทางเมตาบอลิก,biogenesis mitokondria,Biogenesis mitokondria meningkatkan kapasitas seluler untuk fosforilasi oksidatif di bawah stres metabolik.
endocytosis,Receptor-mediated endocytosis allows cells to internalize specific macromolecules from the extracellular environment.,세포내이입,수용체 매개 세포내이입은 세포가 세포외 환경에서 특정 거대분자를 내부화할 수 있게 한다.,エンドサイトーシス,受容体介在性エンドサイトーシスは細胞が細胞外環境から特定の高分子を取り込むことを可能にする。,内吞作用,受体介导的内吞作用使细胞能够从细胞外环境中内化特定的大分子。,endocitosis,La endocitosis mediada por receptores permite a las células internalizar macromoléculas específicas del entorno extracelular.,nhập bào,Nhập bào qua trung gian thụ thể cho phép tế bào thu nhận các đại phân tử cụ thể từ môi trường ngoại bào.,เอนโดไซโทซิส,เอนโดไซโทซิสที่ผ่านตัวรับช่วยให้เซลล์นำโมเลกุลขนาดใหญ่เฉพาะจากสภาพแวดล้อมนอกเซลล์เข้าภายใน,endositosis,Endositosis yang dimediasi reseptor memungkinkan sel menginternalisasi makromolekul tertentu dari lingkungan ekstraseluler.
telomerase,Telomerase is an enzyme that extends telomeres and is aberrantly activated in most cancer cells.,텔로머라아제,텔로머라아제는 텔로미어를 연장하는 효소로 대부분의 암세포에서 비정상적으로 활성화된다.,テロメラーゼ,テロメラーゼはテロメアを伸長する酵素で、ほとんどのがん細胞で異常に活性化される。,端粒酶,端粒酶是一种延长端粒的酶，在大多数癌细胞中被异常激活。,telomerasa,La telomerasa es una enzima que extiende los telómeros y se activa de manera aberrante en la mayoría de las células cancerosas.,telomerase,Telomerase là một enzyme kéo dài telomere và được kích hoạt bất thường trong hầu hết các tế bào ung thư.,เทโลเมอเรส,เทโลเมอเรสเป็นเอนไซม์ที่ยืดเทโลเมียร์และถูกกระตุ้นอย่างผิดปกติในเซลล์มะเร็งส่วนใหญ่,telomerase,Telomerase adalah enzim yang memperpanjang telomer dan diaktifkan secara menyimpang di sebagian besar sel kanker.
