quantitative easing,"Quantitative easing involves central banks purchasing government bonds to stimulate the economy.",양적 완화,"양적 완화는 중앙은행이 경기 부양을 위해 국채를 매입하는 것이다.",量的緩和,"量的緩和は中央銀行が経済を刺激するために国債を購入することを含む。",量化宽松,"量化宽松涉及央行购买政府债券以刺激经济。",flexibilización cuantitativa,"La flexibilización cuantitativa implica que los bancos centrales compren bonos gubernamentales para estimular la economía.",nới lỏng định lượng,"Nới lỏng định lượng liên quan đến việc ngân hàng trung ương mua trái phiếu chính phủ để kích thích kinh tế.",มาตรการผ่อนคลายเชิงปริมาณ,"มาตรการผ่อนคลายเชิงปริมาณเกี่ยวข้องกับการที่ธนาคารกลางซื้อพันธบัตรรัฐบาลเพื่อกระตุ้นเศรษฐกิจ",pelonggaran kuantitatif,"Pelonggaran kuantitatif melibatkan bank sentral membeli obligasi pemerintah untuk merangsang ekonomi."
protectionism,"Protectionism shields domestic industries from foreign competition through tariffs.",보호주의,"보호주의는 관세를 통해 국내 산업을 외국 경쟁으로부터 보호한다.",保護主義,"保護主義は関税を通じて国内産業を外国の競争から守る。",保护主义,"保护主义通过关税保护国内产业免受外国竞争。",proteccionismo,"El proteccionismo protege las industrias nacionales de la competencia extranjera mediante aranceles.",chủ nghĩa bảo hộ,"Chủ nghĩa bảo hộ bảo vệ các ngành công nghiệp trong nước khỏi cạnh tranh nước ngoài thông qua thuế quan.",นโยบายคุ้มครอง,"นโยบายคุ้มครองปกป้องอุตสาหกรรมในประเทศจากการแข่งขันจากต่างประเทศผ่านภาษี",proteksionisme,"Proteksionisme melindungi industri domestik dari persaingan asing melalui tarif."
allegory,"Orwell's Animal Farm functions as an allegory of the Russian Revolution.",우화,"오웰의 동물 농장은 러시아 혁명의 우화로 기능한다.",寓話,"オーウェルの動物農場はロシア革命の寓話として機能する。",寓言,"奥威尔的《动物庄园》是俄国革命的寓言。",alegoría,"La Granja de Animales de Orwell funciona como una alegoría de la Revolución Rusa.",ngụ ngôn,"Trại súc vật của Orwell hoạt động như một câu chuyện ngụ ngôn về Cách mạng Nga.",อุปมานิทัศน์,"แอนิมอลฟาร์มของออร์เวลล์ทำหน้าที่เป็นอุปมานิทัศน์ของการปฏิวัติรัสเซีย",alegori,"Animal Farm karya Orwell berfungsi sebagai alegori Revolusi Rusia."
bildungsroman,"A bildungsroman traces the psychological and moral growth of its protagonist.",성장소설,"성장소설은 주인공의 심리적·도덕적 성장 과정을 추적한다.",教養小説,"教養小説は主人公の心理的・道徳的成長を辿る。",成长小说,"成长小说追溯主人公的心理和道德成长。",bildungsroman,"Un bildungsroman traza el crecimiento psicológico y moral de su protagonista.",tiểu thuyết trưởng thành,"Tiểu thuyết trưởng thành theo dõi sự phát triển tâm lý và đạo đức của nhân vật chính.",นวนิยายแห่งการเติบโต,"นวนิยายแห่งการเติบโตติดตามการเจริญเติบโตทางจิตใจและศีลธรรมของตัวเอก",bildungsroman,"Bildungsroman menelusuri pertumbuhan psikologis dan moral protagonisnya."
polysemy,"Polysemy occurs when a single word carries multiple related meanings.",다의성,"다의성은 하나의 단어가 여러 관련된 의미를 가질 때 발생한다.",多義性,"多義性は一つの単語が複数の関連する意味を持つときに生じる。",多义性,"多义性指一个词具有多个相关含义的现象。",polisemia,"La polisemia ocurre cuando una sola palabra lleva múltiples significados relacionados.",đa nghĩa,"Hiện tượng đa nghĩa xảy ra khi một từ mang nhiều nghĩa liên quan.",ความหลายความหมาย,"ความหลายความหมายเกิดขึ้นเมื่อคำเดียวมีหลายความหมายที่เกี่ยวข้องกัน",polisemi,"Polisemi terjadi ketika satu kata memiliki beberapa makna yang terkait."
synecdoche,"Referring to workers as hands is a classic example of synecdoche.",제유,"노동자를 손이라고 부르는 것은 제유의 전형적인 예이다.",提喩,"労働者を手と呼ぶことは提喩の典型的な例である。",提喻,"把工人称为'手'是提喻的经典例子。",sinécdoque,"Referirse a los trabajadores como manos es un ejemplo clásico de sinécdoque.",hoán dụ bộ phận,"Gọi công nhân là tay là một ví dụ kinh điển của hoán dụ bộ phận.",สหลักษณ์,"การเรียกคนงานว่ามือเป็นตัวอย่างคลาสสิกของสหลักษณ์",sinekdoke,"Menyebut pekerja sebagai tangan adalah contoh klasik sinekdoke."
antithesis,"The speech employed antithesis to sharpen the contrast between freedom and tyranny.",대조법,"그 연설은 자유와 폭정 사이의 대조를 날카롭게 하기 위해 대조법을 사용했다.",対照法,"その演説は自由と専制の対比を鮮明にするために対照法を用いた。",对仗,"演讲运用对仗来强化自由与暴政之间的对比。",antítesis,"El discurso empleó la antítesis para agudizar el contraste entre libertad y tiranía.",phép đối,"Bài phát biểu sử dụng phép đối để làm rõ sự tương phản giữa tự do và bạo quyền.",ปฏิพจน์,"สุนทรพจน์ใช้ปฏิพจน์เพื่อทำให้ความแตกต่างระหว่างเสรีภาพและทรราชชัดเจนขึ้น",antitesis,"Pidato tersebut menggunakan antitesis untuk mempertajam kontras antara kebebasan dan tirani."
qualia,"Qualia refer to the subjective qualities of conscious sensory experiences.",감각질,"감각질은 의식적 감각 경험의 주관적 특성을 가리킨다.",クオリア,"クオリアは意識的な感覚経験の主観的な質を指す。",感质,"感质是指有意识的感官经验的主观特质。",qualia,"Los qualia se refieren a las cualidades subjetivas de las experiencias sensoriales conscientes.",cảm thụ chất,"Cảm thụ chất đề cập đến những phẩm chất chủ quan của trải nghiệm cảm giác có ý thức.",คุณสมบัติเชิงอัตวิสัย,"คุณสมบัติเชิงอัตวิสัยหมายถึงคุณภาพส่วนตัวของประสบการณ์ทางประสาทสัมผัสที่มีจิตสำนึก",kualia,"Kualia merujuk pada kualitas subjektif dari pengalaman sensorik sadar."
reductionism,"Reductionism attempts to explain complex phenomena through their simplest components.",환원주의,"환원주의는 복잡한 현상을 가장 단순한 구성 요소로 설명하려 한다.",還元主義,"還元主義は複雑な現象をその最も単純な構成要素で説明しようとする。",还原论,"还原论试图通过最简单的组成部分来解释复杂现象。",reduccionismo,"El reduccionismo intenta explicar fenómenos complejos a través de sus componentes más simples.",chủ nghĩa quy giản,"Chủ nghĩa quy giản cố gắng giải thích các hiện tượng phức tạp thông qua các thành phần đơn giản nhất.",ลดทอนนิยม,"ลดทอนนิยมพยายามอธิบายปรากฏการณ์ที่ซับซ้อนผ่านองค์ประกอบที่ง่ายที่สุด",reduksionisme,"Reduksionisme mencoba menjelaskan fenomena kompleks melalui komponen paling sederhananya."
paradigm,"A paradigm shift occurs when the dominant scientific framework is replaced.",패러다임,"지배적인 과학적 틀이 대체될 때 패러다임 전환이 발생한다.",パラダイム,"支配的な科学的枠組みが置き換えられるときパラダイムシフトが起こる。",范式,"当主导的科学框架被替代时就发生了范式转换。",paradigma,"Un cambio de paradigma ocurre cuando el marco científico dominante es reemplazado.",hệ thức,"Sự chuyển đổi hệ thức xảy ra khi khuôn khổ khoa học chủ đạo bị thay thế.",กระบวนทัศน์,"การเปลี่ยนกระบวนทัศน์เกิดขึ้นเมื่อกรอบวิทยาศาสตร์ที่ครอบงำถูกแทนที่",paradigma,"Pergeseran paradigma terjadi ketika kerangka ilmiah yang dominan digantikan."
heuristic,"Scientists often rely on heuristic methods when formal proofs are unavailable.",발견법적,"과학자들은 형식적 증명이 불가능할 때 발견법적 방법에 의존한다.",発見的,"科学者は形式的証明が利用できないとき発見的方法に頼ることが多い。",启发式的,"当正式证明不可用时科学家常常依赖启发式方法。",heurístico,"Los científicos a menudo se basan en métodos heurísticos cuando no hay pruebas formales disponibles.",phương pháp suy nghiệm,"Các nhà khoa học thường dựa vào phương pháp suy nghiệm khi không có chứng minh hình thức.",ฮิวริสติก,"นักวิทยาศาสตร์มักพึ่งพาวิธีการฮิวริสติกเมื่อไม่มีการพิสูจน์อย่างเป็นทางการ",heuristik,"Para ilmuwan sering mengandalkan metode heuristik ketika pembuktian formal tidak tersedia."
neocortex,"The neocortex is responsible for higher-order cognitive functions like reasoning.",신피질,"신피질은 추론 같은 고차 인지 기능을 담당한다.",新皮質,"新皮質は推論などの高次認知機能を担っている。",新皮层,"新皮层负责推理等高级认知功能。",neocórtex,"El neocórtex es responsable de funciones cognitivas de orden superior como el razonamiento.",vỏ não mới,"Vỏ não mới chịu trách nhiệm cho các chức năng nhận thức bậc cao như suy luận.",นีโอคอร์เทกซ์,"นีโอคอร์เทกซ์รับผิดชอบหน้าที่ทางปัญญาขั้นสูงเช่นการใช้เหตุผล",neokorteks,"Neokorteks bertanggung jawab atas fungsi kognitif tingkat tinggi seperti penalaran."
oligarchy,"An oligarchy concentrates political power in the hands of a small elite group.",과두정,"과두정은 정치 권력을 소수 엘리트 집단의 손에 집중시킨다.",寡頭政治,"寡頭政治は政治権力を少数のエリート集団の手に集中させる。",寡头政治,"寡头政治将政治权力集中在少数精英群体手中。",oligarquía,"Una oligarquía concentra el poder político en las manos de un pequeño grupo de élite.",chế độ đầu sỏ,"Chế độ đầu sỏ tập trung quyền lực chính trị vào tay một nhóm tinh hoa nhỏ.",คณาธิปไตย,"คณาธิปไตยรวมอำนาจทางการเมืองไว้ในมือของกลุ่มชนชั้นนำขนาดเล็ก",oligarki,"Oligarki memusatkan kekuasaan politik di tangan sekelompok kecil elit."
filibuster,"The senator launched a filibuster to delay the vote on the controversial bill.",필리버스터,"상원의원은 논쟁적인 법안 투표를 지연시키기 위해 필리버스터를 개시했다.",フィリバスター,"上院議員は物議を醸す法案の投票を遅らせるためにフィリバスターを開始した。",拉布,"参议员发起了拉布以推迟对争议法案的投票。",filibusterismo,"El senador lanzó un filibusterismo para retrasar la votación del proyecto de ley controvertido.",chiến thuật trì hoãn,"Thượng nghị sĩ đã phát động chiến thuật trì hoãn để trì hoãn cuộc bỏ phiếu về dự luật gây tranh cãi.",การอภิปรายไม่ลง,"วุฒิสมาชิกเริ่มการอภิปรายไม่ลงเพื่อเลื่อนการลงคะแนนเสียงร่างกฎหมายที่เป็นที่ถกเถียง",filibuster,"Senator meluncurkan filibuster untuk menunda pemungutan suara atas rancangan undang-undang kontroversial."
supply-side,"Supply-side economics advocates tax cuts to stimulate production and growth.",공급측,"공급측 경제학은 생산과 성장을 촉진하기 위한 감세를 옹호한다.",サプライサイド,"サプライサイド経済学は生産と成長を刺激するための減税を提唱する。",供给侧,"供给侧经济学主张通过减税来刺激生产和增长。",de oferta,"La economía de oferta aboga por recortes de impuestos para estimular la producción y el crecimiento.",trọng cung,"Kinh tế học trọng cung ủng hộ việc cắt giảm thuế để kích thích sản xuất và tăng trưởng.",เศรษฐศาสตร์ด้านอุปทาน,"เศรษฐศาสตร์ด้านอุปทานสนับสนุนการลดภาษีเพื่อกระตุ้นการผลิตและการเติบโต",sisi penawaran,"Ekonomi sisi penawaran menganjurkan pemotongan pajak untuk merangsang produksi dan pertumbuhan."
moral hazard,"Moral hazard arises when insured parties take greater risks knowing they are protected.",도덕적 해이,"도덕적 해이는 보험 가입자가 보호받고 있음을 알고 더 큰 위험을 감수할 때 발생한다.",モラルハザード,"モラルハザードは保険加入者が保護されていることを知ってより大きなリスクを取るときに生じる。",道德风险,"道德风险是指被保险方知道自己受到保护而承担更大风险时产生的。",riesgo moral,"El riesgo moral surge cuando las partes aseguradas asumen mayores riesgos sabiendo que están protegidas.",rủi ro đạo đức,"Rủi ro đạo đức phát sinh khi các bên được bảo hiểm chấp nhận rủi ro lớn hơn vì biết mình được bảo vệ.",ภัยทางศีลธรรม,"ภัยทางศีลธรรมเกิดขึ้นเมื่อผู้เอาประกันเสี่ยงมากขึ้นเพราะรู้ว่าได้รับการคุ้มครอง",bahaya moral,"Bahaya moral muncul ketika pihak yang diasuransikan mengambil risiko lebih besar karena tahu mereka dilindungi."
pareto efficiency,"Pareto efficiency is achieved when no individual can be made better off without making another worse off.",파레토 효율,"파레토 효율은 다른 사람을 악화시키지 않고는 어떤 개인도 더 나아질 수 없을 때 달성된다.",パレート効率,"パレート効率は他の誰かを悪化させずには誰も改善できない状態で達成される。",帕累托效率,"当不使任何人变差就无法使任何人变好时就实现了帕累托效率。",eficiencia de Pareto,"La eficiencia de Pareto se logra cuando ningún individuo puede mejorar sin empeorar a otro.",hiệu quả Pareto,"Hiệu quả Pareto đạt được khi không ai có thể được cải thiện mà không làm người khác tệ hơn.",ประสิทธิภาพพาเรโต,"ประสิทธิภาพพาเรโตเกิดขึ้นเมื่อไม่มีบุคคลใดสามารถดีขึ้นได้โดยไม่ทำให้อีกคนแย่ลง",efisiensi Pareto,"Efisiensi Pareto tercapai ketika tidak ada individu yang dapat diperbaiki tanpa memperburuk yang lain."
pastiche,"The novel is a pastiche that playfully imitates the style of Victorian fiction.",파스티시,"이 소설은 빅토리아 시대 소설의 문체를 장난스럽게 모방한 파스티시이다.",パスティーシュ,"この小説はヴィクトリア朝小説のスタイルを遊び心で模倣したパスティーシュである。",仿作,"这部小说是一部戏仿维多利亚时代小说风格的仿作。",pastiche,"La novela es un pastiche que imita de forma lúdica el estilo de la ficción victoriana.",phỏng tác,"Tiểu thuyết này là một phỏng tác bắt chước phong cách tiểu thuyết thời Victoria một cách vui nhộn.",งานลอกเลียน,"นวนิยายเรื่องนี้เป็นงานลอกเลียนที่เลียนแบบสไตล์นิยายวิกตอเรียนอย่างสนุกสนาน",pastis,"Novel ini adalah pastis yang secara main-main meniru gaya fiksi Victoria."
aporia,"The philosopher encountered an aporia that exposed contradictions within the argument.",아포리아,"철학자는 논증 내의 모순을 드러내는 아포리아에 봉착했다.",アポリア,"哲学者は論証内の矛盾を露呈するアポリアに遭遇した。",疑难,"哲学家遇到了一个暴露论证内部矛盾的疑难。",aporía,"El filósofo encontró una aporía que expuso contradicciones dentro del argumento.",nan đề,"Nhà triết học gặp phải một nan đề phơi bày những mâu thuẫn trong lập luận.",อาโพเรีย,"นักปรัชญาพบอาโพเรียที่เผยให้เห็นความขัดแย้งภายในข้อโต้แย้ง",aporia,"Filsuf menemui aporia yang mengungkap kontradiksi dalam argumen tersebut."
normative,"Normative ethics prescribes how people ought to act in moral situations.",규범적,"규범적 윤리는 사람들이 도덕적 상황에서 어떻게 행동해야 하는지를 규정한다.",規範的,"規範的倫理は道徳的状況において人々がどのように行動すべきかを規定する。",规范性的,"规范伦理学规定人们在道德情境中应该如何行动。",normativo,"La ética normativa prescribe cómo las personas deben actuar en situaciones morales.",chuẩn tắc,"Đạo đức chuẩn tắc quy định con người nên hành xử như thế nào trong các tình huống đạo đức.",เชิงบรรทัดฐาน,"จริยศาสตร์เชิงบรรทัดฐานกำหนดว่าผู้คนควรปฏิบัติอย่างไรในสถานการณ์ทางศีลธรรม",normatif,"Etika normatif menetapkan bagaimana orang seharusnya bertindak dalam situasi moral."
neurodegenerative,"Neurodegenerative diseases progressively destroy neurons and impair cognition.",신경퇴행성,"신경퇴행성 질환은 뉴런을 점진적으로 파괴하고 인지를 손상시킨다.",神経変性の,"神経変性疾患はニューロンを徐々に破壊し認知を障害する。",神经退行性的,"神经退行性疾病逐渐破坏神经元并损害认知。",neurodegenerativo,"Las enfermedades neurodegenerativas destruyen progresivamente las neuronas y deterioran la cognición.",thoái hóa thần kinh,"Các bệnh thoái hóa thần kinh dần phá hủy các nơ-ron và suy giảm nhận thức.",โรคเสื่อมของระบบประสาท,"โรคเสื่อมของระบบประสาทค่อยๆทำลายเซลล์ประสาทและทำให้การรับรู้บกพร่อง",neurodegeneratif,"Penyakit neurodegeneratif secara progresif menghancurkan neuron dan merusak kognisi."
homeostasis,"The hypothalamus maintains homeostasis by regulating body temperature and hunger.",항상성,"시상하부는 체온과 배고픔을 조절하여 항상성을 유지한다.",恒常性,"視床下部は体温と空腹を調節することで恒常性を維持する。",稳态,"下丘脑通过调节体温和饥饿来维持稳态。",homeostasis,"El hipotálamo mantiene la homeostasis regulando la temperatura corporal y el hambre.",cân bằng nội môi,"Vùng dưới đồi duy trì cân bằng nội môi bằng cách điều chỉnh nhiệt độ cơ thể và cảm giác đói.",สมดุลภายใน,"ไฮโปทาลามัสรักษาสมดุลภายในโดยการควบคุมอุณหภูมิร่างกายและความหิว",homeostasis,"Hipotalamus menjaga homeostasis dengan mengatur suhu tubuh dan rasa lapar."
amicus curiae,"An amicus curiae brief was filed to provide expertise on the constitutional question.",법정의 벗,"헌법적 질문에 대한 전문성을 제공하기 위해 법정의 벗 의견서가 제출되었다.",法廷助言者,"憲法問題に関する専門知識を提供するために法廷助言者意見書が提出された。",法庭之友,"一份法庭之友意见书被提交以就宪法问题提供专业意见。",amicus curiae,"Se presentó un escrito de amicus curiae para proporcionar experiencia sobre la cuestión constitucional.",người bạn của tòa,"Một bản ý kiến người bạn của tòa đã được nộp để cung cấp chuyên môn về vấn đề hiến pháp.",มิตรศาล,"บทความมิตรศาลถูกยื่นเพื่อให้ความเชี่ยวชาญเกี่ยวกับคำถามทางรัฐธรรมนูญ",amikus kuriae,"Amikus kuriae diajukan untuk memberikan keahlian tentang pertanyaan konstitusional."
subsidiarity,"The principle of subsidiarity delegates decisions to the most local competent authority.",보충성,"보충성 원칙은 결정을 가장 가까운 권한 있는 기관에 위임한다.",補完性,"補完性の原則は決定を最も地域的な権限ある機関に委任する。",辅助性,"辅助性原则将决策权委托给最基层的主管机关。",subsidiariedad,"El principio de subsidiariedad delega las decisiones a la autoridad competente más local.",nguyên tắc bổ trợ,"Nguyên tắc bổ trợ ủy quyền quyết định cho cơ quan có thẩm quyền địa phương gần nhất.",หลักอุปถัมภ์,"หลักอุปถัมภ์มอบหมายการตัดสินใจให้กับหน่วยงานที่มีอำนาจในระดับท้องถิ่นที่สุด",subsidiaritas,"Prinsip subsidiaritas mendelegasikan keputusan kepada otoritas lokal yang paling kompeten."
elasticity,"Price elasticity of demand measures consumer sensitivity to price changes.",탄력성,"수요의 가격 탄력성은 가격 변동에 대한 소비자 민감도를 측정한다.",弾力性,"需要の価格弾力性は価格変動に対する消費者の感応度を測定する。",弹性,"需求价格弹性衡量消费者对价格变化的敏感度。",elasticidad,"La elasticidad precio de la demanda mide la sensibilidad del consumidor a los cambios de precio.",độ co giãn,"Độ co giãn giá của cầu đo lường mức độ nhạy cảm của người tiêu dùng đối với thay đổi giá.",ความยืดหยุ่น,"ความยืดหยุ่นของอุปสงค์ต่อราคาวัดความไวของผู้บริโภคต่อการเปลี่ยนแปลงราคา",elastisitas,"Elastisitas harga permintaan mengukur sensitivitas konsumen terhadap perubahan harga."
diminishing returns,"The law of diminishing returns states that adding more input eventually yields less additional output.",수확 체감,"수확 체감의 법칙은 투입을 늘릴수록 결국 추가 산출이 줄어든다고 말한다.",収穫逓減,"収穫逓減の法則は投入を増やすと最終的に追加産出が減少すると述べる。",边际收益递减,"边际收益递减法则指出增加更多投入最终会产生更少的额外产出。",rendimientos decrecientes,"La ley de rendimientos decrecientes establece que agregar más insumos eventualmente produce menos producción adicional.",lợi tức giảm dần,"Quy luật lợi tức giảm dần nói rằng việc tăng thêm đầu vào cuối cùng sẽ mang lại ít sản lượng bổ sung hơn.",ผลตอบแทนลดลง,"กฎผลตอบแทนลดลงระบุว่าการเพิ่มปัจจัยการผลิตมากขึ้นในที่สุดจะให้ผลผลิตเพิ่มเติมน้อยลง",hasil yang berkurang,"Hukum hasil yang berkurang menyatakan bahwa menambah lebih banyak input akhirnya menghasilkan lebih sedikit output tambahan."
