english,example,ko_meaning,ko_example,ja_meaning,ja_example,zh_meaning,zh_example,es_meaning,es_example
holistic,A holistic analysis of the data revealed unexpected trends in the market.,전체론적인,데이터에 대한 전체론적인 분석은 시장에서 예상치 못한 추세를 보여주었습니다.,全体論的な,データの全体論的な分析により、市場の予期しないトレンドが明らかになりました。,整体的,对数据的整体的分析揭示了市场中意想不到的趋势。,"holístico, integral",Un análisis holístico de los datos reveló tendencias inesperadas en el mercado.
homogeneous,It is important to take a homogeneous approach when handling client relationships.,균질한,고객 관계를 처리할 때 균질한 접근 방식을 취하는 것이 중요합니다.,均質な,顧客関係を扱う際に均質なアプローチを取ることが重要です。,同质的,在处理客户关系时采取同质的的方法很重要。,"homogéneo, uniforme",Es importante adoptar un enfoque homogéneo al gestionar las relaciones con los clientes.
horizon,The company's horizon has been a topic of discussion at recent board meetings.,전망,회사의 전망이/가 최근 이사회에서 논의 주제가 되었습니다.,展望,会社の展望は最近の取締役会で議論のトピックとなっています。,前景,公司的前景已成为近期董事会会议的讨论话题。,"horizonte, perspectiva",El horizonte de la empresa ha sido un tema de debate en las reuniones recientes de la junta.
hostile,The project outcomes were more hostile than anyone had initially expected.,적대적인,프로젝트 결과는 누구보다도 더 적대적인 것으로 나타났습니다.,敵対的な,プロジェクトの成果は誰もが当初予想したよりも敵対的なものでした。,敌对的,项目成果比任何人最初预期的都更加敌对的。,"hostil, adverso",Los resultados del proyecto fueron más hostiles de lo que nadie había previsto inicialmente.
humanitarian,The humanitarian requires careful consideration before any final decisions are made.,인도주의의,인도주의의은/는 최종 결정을 내리기 전에 신중한 고려가 필요합니다.,人道主義の,人道主義のは最終決定を下す前に慎重な検討が必要です。,人道主义的,人道主义的在做出最终决定之前需要仔细考虑。,humanitario,El enfoque humanitario requiere una consideración cuidadosa antes de tomar decisiones finales.
hypothetical,A detailed analysis of the hypothetical was included in the quarterly report.,가설의,가설의에 대한 상세한 분석이 분기 보고서에 포함되었습니다.,仮説の,仮説のの詳細な分析が四半期報告書に含まれていました。,假设的,季度报告中包含了对假设的的详细分析。,"hipotético, teórico",Un análisis detallado del escenario hipotético fue incluido en el informe trimestral.
ideology,The ideology requires careful consideration before any final decisions are made.,이념,이념은/는 최종 결정을 내리기 전에 신중한 고려가 필요합니다.,イデオロギー,イデオロギーは最終決定を下す前に慎重な検討が必要です。,意识形态,意识形态在做出最终决定之前需要仔细考虑。,"ideología, doctrina",La ideología requiere una consideración cuidadosa antes de tomar decisiones finales.
illicit,The team found the new regulations to be quite illicit in their scope.,불법적인,팀은 새로운 규정이 범위에서 상당히 불법적인다는 것을 발견했습니다.,不正な,チームは新しい規制がその範囲においてかなり不正なであることを発見しました。,非法的,团队发现新法规在范围上相当非法的。,"ilícito, ilegal",El equipo encontró que las nuevas regulaciones eran bastante ilícitas en su alcance.
imminent,It is important to take a imminent approach when handling client relationships.,임박한,고객 관계를 처리할 때 임박한 접근 방식을 취하는 것이 중요합니다.,差し迫った,顧客関係を扱う際に差し迫ったアプローチを取ることが重要です。,迫在眉睫的,在处理客户关系时采取迫在眉睫的的方法很重要。,"inminente, próximo",Es importante adoptar un enfoque preventivo ante los peligros inminentes al gestionar las relaciones con los clientes.
immunity,The new immunity will be implemented across all departments starting next month.,면역,새로운 면역이/가 다음 달부터 모든 부서에 시행될 것입니다.,免疫,新しい免疫は来月からすべての部門で実施されます。,免疫,新的免疫将从下月起在所有部门实施。,"inmunidad, exención",La nueva política de inmunidad será implementada en todos los departamentos a partir del mes próximo.
impair,The department needs to impair to meet the upcoming project deadline.,손상시키다,부서는 다가오는 프로젝트 마감일을 맞추기 위해 손상시키다야 합니다.,損なう,部門は今後のプロジェクト期限に間に合うよう損なう必要があります。,损害,部门需要损害以满足即将到来的项目截止日期。,"deteriorar, perjudicar",El departamento necesita evitar que ciertas situaciones deterioren el rendimiento para cumplir con el plazo del proyecto.
impartial,Maintaining a impartial standard is essential for the company's brand reputation.,공정한,공정한 기준을 유지하는 것은 회사의 브랜드 평판에 필수적입니다.,公平な,公平な基準を維持することは会社のブランドの評判に不可欠です。,公正的,维持公正的标准对公司的品牌声誉至关重要。,"imparcial, objetivo",Mantener un estándar imparcial es esencial para la reputación de la marca de la empresa.
impeach,The board voted to impeach as part of the new corporate strategy.,탄핵하다,이사회는 새로운 기업 전략의 일환으로 탄핵하다기로 투표했습니다.,弾劾する,取締役会は新しい企業戦略の一環として弾劾することを決議しました。,弹劾,董事会投票弹劾作为新企业战略的一部分。,"impugnar, destituir",La junta votó impugnar ciertas decisiones como parte de la nueva estrategia corporativa.
impede,The company decided to impede in response to the changing market conditions.,방해하다,회사는 변화하는 시장 상황에 대응하여 방해하다기로 결정했습니다.,妨げる,会社は変化する市場状況に対応して妨げることを決定しました。,阻碍,公司决定阻碍以应对不断变化的市场状况。,"obstaculizar, estorbar",La empresa decidió eliminar todo lo que obstaculizara en respuesta a las cambiantes condiciones del mercado.
imperative,The imperative results of the pilot program encouraged further investment.,필수적인,파일럿 프로그램의 필수적인 결과가 추가 투자를 촉진했습니다.,不可欠な,パイロットプログラムの不可欠な結果がさらなる投資を促進しました。,必要的,试点项目的必要的结果鼓励了进一步的投资。,"imperativo, indispensable",Los resultados imperativos del programa piloto alentaron una mayor inversión.
implication,The implication requires careful consideration before any final decisions are made.,함의,함의은/는 최종 결정을 내리기 전에 신중한 고려가 필요합니다.,含意,含意は最終決定を下す前に慎重な検討が必要です。,含义,含义在做出最终决定之前需要仔细考虑。,"implicación, consecuencia",La implicación requiere una consideración cuidadosa antes de tomar decisiones finales.
implicit,The team found the new regulations to be quite implicit in their scope.,암묵적인,팀은 새로운 규정이 범위에서 상당히 암묵적인다는 것을 발견했습니다.,暗黙の,チームは新しい規制がその範囲においてかなり暗黙のであることを発見しました。,隐含的,团队发现新法规在范围上相当隐含的。,"implícito, tácito",El equipo encontró que las nuevas regulaciones eran bastante implícitas en su alcance.
impose,Stakeholders expect the organization to impose within the next fiscal year.,부과하다,이해관계자들은 조직이 다음 회계연도 내에 부과하다기를 기대합니다.,課す,利害関係者は組織が次の会計年度内に課すことを期待しています。,施加,利益相关者期望组织在下一财政年度内施加。,"imponer, aplicar",Los interesados esperan que la organización imponga nuevas reglas dentro del próximo año fiscal.
impound,The company decided to impound in response to the changing market conditions.,압수하다,회사는 변화하는 시장 상황에 대응하여 압수하다기로 결정했습니다.,差し押さえる,会社は変化する市場状況に対応して差し押さえることを決定しました。,扣押,公司决定扣押以应对不断变化的市场状况。,"incautar, embargar",La empresa decidió incautar ciertos activos en respuesta a las cambiantes condiciones del mercado.
improvise,Senior executives were asked to improvise before the next quarterly review.,즉흥하다,고위 임원들은 다음 분기 검토 전에 즉흥하다도록 요청받았습니다.,即興する,上級幹部は次の四半期レビューの前に即興するよう求められました。,即兴,高管们被要求在下季度审查之前即兴。,"improvisar, actuar espontáneamente",A los altos ejecutivos se les pidió improvisar antes de la próxima revisión trimestral.
inaugural,The inaugural plays a critical role in the company's long-term strategic planning.,취임의,취임의은/는 회사의 장기 전략 계획에서 중요한 역할을 합니다.,就任の,就任のは会社の長期戦略計画において重要な役割を果たしています。,就职的,就职的在公司的长期战略规划中起着关键作用。,"inaugural, inaugural",El evento inaugural desempeña un papel fundamental en la planificación estratégica a largo plazo de la empresa.
incentivize,The company decided to incentivize in response to the changing market conditions.,동기를 부여하다,회사는 변화하는 시장 상황에 대응하여 동기를 부여하다기로 결정했습니다.,動機付けする,会社は変化する市場状況に対応して動機付けすることを決定しました。,激励,公司决定激励以应对不断变化的市场状况。,"incentivar, motivar",La empresa decidió incentivar a los empleados en respuesta a las cambiantes condiciones del mercado.
inception,The inception requires careful consideration before any final decisions are made.,시작,시작은/는 최종 결정을 내리기 전에 신중한 고려가 필요합니다.,開始,開始は最終決定を下す前に慎重な検討が必要です。,开始,开始在做出最终决定之前需要仔细考虑。,"inicio, comienzo",El inicio requiere una consideración cuidadosa antes de tomar decisiones finales.
incidence,Management addressed concerns regarding the incidence at the annual conference.,발생률,경영진은 연례 회의에서 발생률에 관한 우려를 다루었습니다.,発生率,経営陣は年次会議で発生率に関する懸念に対処しました。,发生率,管理层在年度会议上讨论了有关发生率的问题。,"incidencia, frecuencia",La dirección abordó las preocupaciones sobre la incidencia en la conferencia anual.
incite,The board voted to incite as part of the new corporate strategy.,선동하다,이사회는 새로운 기업 전략의 일환으로 선동하다기로 투표했습니다.,扇動する,取締役会は新しい企業戦略の一環として扇動することを決議しました。,煽动,董事会投票煽动作为新企业战略的一部分。,"incitar, provocar",La junta votó no incitar conflictos como parte de la nueva estrategia corporativa.
inclusive,The team found the new regulations to be quite inclusive in their scope.,포괄적인,팀은 새로운 규정이 범위에서 상당히 포괄적인다는 것을 발견했습니다.,包括的な,チームは新しい規制がその範囲においてかなり包括的なであることを発見しました。,包容的,团队发现新法规在范围上相当包容的。,"inclusivo, integrador",El equipo encontró que las nuevas regulaciones eran bastante inclusivas en su alcance.
incorporate,Senior executives were asked to incorporate before the next quarterly review.,편입하다,고위 임원들은 다음 분기 검토 전에 편입하다도록 요청받았습니다.,組み入れる,上級幹部は次の四半期レビューの前に組み入れるよう求められました。,纳入,高管们被要求在下季度审查之前纳入。,"incorporar, integrar",A los altos ejecutivos se les pidió incorporar nuevas prácticas antes de la próxima revisión trimestral.
increment,The increment requires careful consideration before any final decisions are made.,증분,증분은/는 최종 결정을 내리기 전에 신중한 고려가 필요합니다.,増分,増分は最終決定を下す前に慎重な検討が必要です。,增量,增量在做出最终决定之前需要仔细考虑。,"incremento, aumento",El incremento requiere una consideración cuidadosa antes de tomar decisiones finales.
incur,The team was instructed to incur following the recent policy update.,초래하다,팀은 최근 정책 업데이트에 따라 초래하다도록 지시받았습니다.,招く,チームは最近の方針変更に従い招くよう指示されました。,招致,团队被指示根据最近的政策更新招致。,"incurrir, ocasionar",Al equipo se le instruyó registrar los gastos incurridos conforme a la reciente actualización de políticas.
indemnify,The board voted to indemnify as part of the new corporate strategy.,배상하다,이사회는 새로운 기업 전략의 일환으로 배상하다기로 투표했습니다.,補償する,取締役会は新しい企業戦略の一環として補償することを決議しました。,赔偿,董事会投票赔偿作为新企业战略的一部分。,"indemnizar, compensar",La junta votó indemnizar a los afectados como parte de la nueva estrategia corporativa.
indicative,The indicative plays a critical role in the company's long-term strategic planning.,나타내는,나타내는은/는 회사의 장기 전략 계획에서 중요한 역할을 합니다.,示す,示すは会社の長期戦略計画において重要な役割を果たしています。,表明的,表明的在公司的长期战略规划中起着关键作用。,"indicativo, representativo",El resultado indicativo desempeña un papel fundamental en la planificación estratégica a largo plazo de la empresa.
indict,The department needs to indict to meet the upcoming project deadline.,기소하다,부서는 다가오는 프로젝트 마감일을 맞추기 위해 기소하다야 합니다.,起訴する,部門は今後のプロジェクト期限に間に合うよう起訴する必要があります。,起诉,部门需要起诉以满足即将到来的项目截止日期。,"acusar formalmente, procesar",El departamento necesita acusar a los responsables para cumplir con el plazo del proyecto.
indigenous,The new indigenous will be implemented across all departments starting next month.,토착의,새로운 토착의이/가 다음 달부터 모든 부서에 시행될 것입니다.,先住の,新しい先住のは来月からすべての部門で実施されます。,本土的,新的本土的将从下月起在所有部门实施。,"indígena, nativo",El nuevo enfoque indígena será implementado en todos los departamentos a partir del mes próximo.
indispensable,The project outcomes were more indispensable than anyone had initially expected.,필수불가결한,프로젝트 결과는 누구보다도 더 필수불가결한 것으로 나타났습니다.,不可欠な,プロジェクトの成果は誰もが当初予想したよりも不可欠なものでした。,不可或缺的,项目成果比任何人最初预期的都更加不可或缺的。,"indispensable, imprescindible",Los resultados del proyecto fueron más indispensables de lo que nadie había previsto inicialmente.
induce,The company decided to induce in response to the changing market conditions.,유도하다,회사는 변화하는 시장 상황에 대응하여 유도하다기로 결정했습니다.,誘導する,会社は変化する市場状況に対応して誘導することを決定しました。,诱导,公司决定诱导以应对不断变化的市场状况。,"inducir, provocar",La empresa decidió inducir cambios en respuesta a las cambiantes condiciones del mercado.
inequality,The company's inequality has been a topic of discussion at recent board meetings.,불평등,회사의 불평등이/가 최근 이사회에서 논의 주제가 되었습니다.,不平等,会社の不平等は最近の取締役会で議論のトピックとなっています。,不平等,公司的不平等已成为近期董事会会议的讨论话题。,"desigualdad, inequidad",La desigualdad de la empresa ha sido un tema de debate en las reuniones recientes de la junta.
inflation,A thorough review of the inflation revealed several areas for improvement.,인플레이션,인플레이션에 대한 철저한 검토에서 여러 개선 영역이 밝혀졌습니다.,インフレーション,インフレーションの徹底的なレビューにより、いくつかの改善点が明らかになりました。,通货膨胀,对通货膨胀的全面审查揭示了几个需要改进的领域。,inflación,Una revisión exhaustiva de la inflación reveló varias áreas de mejora.
influx,The influx was carefully reviewed by the senior management team.,유입,유입은/는 고위 경영진에 의해 신중히 검토되었습니다.,流入,流入は上級管理チームによって慎重に検討されました。,涌入,涌入经过高级管理团队的仔细审查。,"afluencia, entrada masiva",La afluencia fue revisada cuidadosamente por el equipo de alta dirección.
infrastructure,Experts believe the infrastructure will significantly impact the industry going forward.,기반시설,전문가들은 기반시설이/가 향후 산업에 상당한 영향을 미칠 것으로 보고 있습니다.,インフラ,専門家はインフラが今後業界に大きな影響を与えると考えています。,基础设施,专家认为基础设施将对行业未来产生重大影响。,infraestructura,Los expertos creen que la infraestructura tendrá un impacto significativo en la industria en el futuro.
infringe,It is essential to infringe in order to maintain our competitive advantage.,침해하다,경쟁 우위를 유지하기 위해 침해하다는 것이 필수적입니다.,侵害する,競争優位を維持するために侵害することが不可欠です。,侵犯,为了保持竞争优势，侵犯是至关重要的。,"infringir, violar",Es esencial no infringir los derechos para mantener nuestra ventaja competitiva.
inherent,A detailed analysis of the inherent was included in the quarterly report.,고유의,고유의에 대한 상세한 분석이 분기 보고서에 포함되었습니다.,固有の,固有のの詳細な分析が四半期報告書に含まれていました。,固有的,季度报告中包含了对固有的的详细分析。,"inherente, intrínseco",Un análisis detallado del riesgo inherente fue incluido en el informe trimestral.
inhibit,Management plans to inhibit the current operations to improve overall efficiency.,억제하다,경영진은 전반적인 효율성을 개선하기 위해 현재 운영을 억제하다 계획입니다.,抑制する,経営陣は全体的な効率を改善するために現在の業務を抑制する計画です。,抑制,管理层计划抑制以提高整体运营效率。,"inhibir, frenar",La dirección planea inhibir las prácticas ineficientes en las operaciones actuales para mejorar la eficiencia general.
initiate,Management plans to initiate the current operations to improve overall efficiency.,개시하다,경영진은 전반적인 효율성을 개선하기 위해 현재 운영을 개시하다 계획입니다.,開始する,経営陣は全体的な効率を改善するために現在の業務を開始する計画です。,发起,管理层计划发起以提高整体运营效率。,"iniciar, poner en marcha",La dirección planea iniciar nuevos procesos en las operaciones actuales para mejorar la eficiencia general.
injunction,A detailed analysis of the injunction was included in the quarterly report.,금지명령,금지명령에 대한 상세한 분석이 분기 보고서에 포함되었습니다.,差し止め命令,差し止め命令の詳細な分析が四半期報告書に含まれていました。,禁令,季度报告中包含了对禁令的详细分析。,"orden judicial, mandato",Un análisis detallado de la orden judicial fue incluido en el informe trimestral.
innovative,The team found the new regulations to be quite innovative in their scope.,혁신적인,팀은 새로운 규정이 범위에서 상당히 혁신적인다는 것을 발견했습니다.,革新的な,チームは新しい規制がその範囲においてかなり革新的なであることを発見しました。,创新的,团队发现新法规在范围上相当创新的。,"innovador, creativo",El equipo encontró que las nuevas regulaciones eran bastante innovadoras en su alcance.
inquiry,The company's inquiry has been a topic of discussion at recent board meetings.,조회,회사의 조회이/가 최근 이사회에서 논의 주제가 되었습니다.,照会,会社の照会は最近の取締役会で議論のトピックとなっています。,询问,公司的询问已成为近期董事会会议的讨论话题。,"consulta, investigación",La consulta de la empresa ha sido un tema de debate en las reuniones recientes de la junta.
insolvency,The company's insolvency has been a topic of discussion at recent board meetings.,지급불능,회사의 지급불능이/가 최근 이사회에서 논의 주제가 되었습니다.,支払不能,会社の支払不能は最近の取締役会で議論のトピックとなっています。,破产,公司的破产已成为近期董事会会议的讨论话题。,"insolvencia, quiebra",La insolvencia de la empresa ha sido un tema de debate en las reuniones recientes de la junta.
inspect,It is essential to inspect in order to maintain our competitive advantage.,검사하다,경쟁 우위를 유지하기 위해 검사하다는 것이 필수적입니다.,検査する,競争優位を維持するために検査することが不可欠です。,检查,为了保持竞争优势，检查是至关重要的。,"inspeccionar, revisar",Es esencial inspeccionar regularmente para mantener nuestra ventaja competitiva.
instill,The CEO announced plans to instill across all regional office locations.,주입하다,CEO는 모든 지역 사무소에 걸쳐 주입하다 계획을 발표했습니다.,植え付ける,CEOはすべての地域オフィスにわたって植え付ける計画を発表しました。,灌输,首席执行官宣布了在所有区域办事处灌输的计划。,"inculcar, instaurar",El CEO anunció planes para inculcar los valores en todas las oficinas regionales.
institute,The board voted to institute as part of the new corporate strategy.,설립하다,이사회는 새로운 기업 전략의 일환으로 설립하다기로 투표했습니다.,設立する,取締役会は新しい企業戦略の一環として設立することを決議しました。,设立,董事会投票设立作为新企业战略的一部分。,"establecer, fundar",La junta votó establecer un nuevo comité como parte de la nueva estrategia corporativa.
institutional,Maintaining a institutional standard is essential for the company's brand reputation.,제도적인,제도적인 기준을 유지하는 것은 회사의 브랜드 평판에 필수적입니다.,制度的な,制度的な基準を維持することは会社のブランドの評判に不可欠です。,机构的,维持机构的标准对公司的品牌声誉至关重要。,"institucional, oficial",Mantener un estándar institucional es esencial para la reputación de la marca de la empresa.
integrate,The board voted to integrate as part of the new corporate strategy.,통합하다,이사회는 새로운 기업 전략의 일환으로 통합하다기로 투표했습니다.,統合する,取締役会は新しい企業戦略の一環として統合することを決議しました。,整合,董事会投票整合作为新企业战略的一部分。,"integrar, unificar",La junta votó integrar los sistemas como parte de la nueva estrategia corporativa.
integrity,Understanding the integrity is essential for making informed business decisions.,무결성,정보에 입각한 비즈니스 결정을 위해 무결성을/를 이해하는 것이 중요합니다.,完全性,情報に基づくビジネス判断のために完全性を理解することが重要です。,诚信,了解诚信对于做出明智的商业决策至关重要。,"integridad, honestidad",Comprender la integridad es esencial para tomar decisiones empresariales informadas.
intellectual,The project outcomes were more intellectual than anyone had initially expected.,지적인,프로젝트 결과는 누구보다도 더 지적인 것으로 나타났습니다.,知的な,プロジェクトの成果は誰もが当初予想したよりも知的なものでした。,知识的,项目成果比任何人最初预期的都更加知识的。,"intelectual, cognitivo",Los resultados del proyecto fueron más intelectuales de lo que nadie había previsto inicialmente.
