english,example,ko_meaning,ko_example,ja_meaning,ja_example,zh_meaning,zh_example,es_meaning,es_example
abide,All employees must abide by the company's code of conduct.,준수하다,모든 직원은 회사의 행동 강령을 준수해야 합니다.,従う,全従業員は会社の行動規範を遵守しなければなりません。,遵守,所有员工必须遵守公司的行为准则。,"cumplir, atenerse a",Todos los empleados deben atenerse al código de conducta de la empresa.
abolish,The board voted to abolish the outdated overtime policy.,폐지하다,이사회는 구식 초과근무 정책을 폐지하기로 투표했습니다.,廃止する,取締役会は時代遅れの残業方針を廃止することを決議しました。,废除,董事会投票决定废除过时的加班政策。,"abolir, suprimir",La junta votó abolir la obsoleta política de horas extra.
abstain,Three board members chose to abstain from the important vote.,삼가다,세 명의 이사가 중요한 투표를 기권하기로 했습니다.,控える,3人の取締役が重要な投票を棄権することを選びました。,弃权,三名董事会成员选择在重要投票中弃权。,abstenerse,Tres miembros de la junta eligieron abstenerse en la votación importante.
accelerate,The new strategy will accelerate growth in the Asian market.,가속하다,새로운 전략은 아시아 시장에서의 성장을 가속할 것입니다.,加速する,新しい戦略はアジア市場での成長を加速させるでしょう。,加速,新战略将加速亚洲市场的增长。,acelerar,La nueva estrategia acelerará el crecimiento en el mercado asiático.
accumulate,The company managed to accumulate significant cash reserves this year.,축적하다,회사는 올해 상당한 현금 보유고를 축적했습니다.,蓄積する,会社は今年かなりの現金準備金を蓄積しました。,积累,公司今年成功积累了大量现金储备。,acumular,La empresa logró acumular importantes reservas de efectivo este año.
acquaint,Please acquaint yourself with the new safety regulations before Monday.,알리다,월요일 전에 새로운 안전 규정을 숙지해 주세요.,知らせる,月曜日までに新しい安全規則を把握してください。,使了解,请在周一之前熟悉新的安全规定。,"familiarizar, informar","Por favor, familiarícese con las nuevas normas de seguridad antes del lunes."
acquisition,The acquisition of the rival firm was completed last quarter.,인수,경쟁사 인수는 지난 분기에 완료되었습니다.,買収,ライバル企業の買収は前四半期に完了しました。,收购,对竞争对手公司的收购在上季度完成。,adquisición,La adquisición de la empresa rival se completó el trimestre pasado.
adjourn,The chairperson decided to adjourn the meeting until next Friday.,휴회하다,의장은 회의를 다음 금요일까지 휴회하기로 했습니다.,休会する,議長は会議を来週金曜日まで休会することを決めました。,休会,主席决定将会议休会至下周五。,"levantar la sesión, aplazar",El presidente decidió levantar la sesión hasta el próximo viernes.
admonish,The supervisor had to admonish the team for missing the deadline.,훈계하다,감독관은 마감을 놓친 팀을 훈계해야 했습니다.,忠告する,上司は締め切りを逃したチームを忠告しなければなりませんでした。,告诫,主管不得不告诫团队错过截止日期的问题。,"amonestar, reprender",El supervisor tuvo que amonestar al equipo por no cumplir el plazo.
adversary,Our main adversary in the market launched a new competing product.,적수,시장에서 우리의 주요 적수가 새로운 경쟁 제품을 출시했습니다.,敵対者,市場での主な敵対者が新しい競合製品を発売しました。,对手,我们在市场上的主要对手推出了一款新的竞争产品。,"adversario, rival",Nuestro principal adversario en el mercado lanzó un nuevo producto competidor.
adverse,Adverse weather conditions caused significant delays in the supply chain.,불리한,불리한 기상 조건이 공급망에 상당한 지연을 초래했습니다.,不利な,不利な気象条件がサプライチェーンに大きな遅延を引き起こしました。,不利的,不利的天气条件导致了供应链的严重延迟。,"adverso, desfavorable",Las condiciones climáticas adversas causaron retrasos significativos en la cadena de suministro.
advocacy,Her advocacy for employee wellness programs gained strong company-wide support.,옹호,직원 웰니스 프로그램에 대한 그녀의 옹호가 전사적 지지를 얻었습니다.,擁護,従業員ウェルネスプログラムへの彼女の擁護は全社的な支持を得ました。,倡导,她对员工健康计划的倡导获得了全公司的大力支持。,"defensa, promoción",Su defensa de los programas de bienestar para empleados obtuvo un sólido apoyo en toda la empresa.
affiliate,The company plans to affiliate with a European distribution partner.,제휴하다,회사는 유럽 유통 파트너와 제휴할 계획입니다.,提携する,会社はヨーロッパの流通パートナーと提携する予定です。,附属,公司计划与一家欧洲分销合作伙伴建立附属关系。,"afiliarse, asociarse",La empresa planea afiliarse con un socio de distribución europeo.
affirmative,The committee gave an affirmative response to the budget proposal.,긍정적인,위원회는 예산안에 대해 긍정적인 응답을 했습니다.,肯定的な,委員会は予算案に対して肯定的な回答をしました。,肯定的,委员会对预算提案给出了肯定的答复。,"afirmativo, positivo",El comité dio una respuesta afirmativa a la propuesta de presupuesto.
aggregate,The aggregate sales figures exceeded our quarterly projections this year.,합계의,합계 매출 수치가 올해 분기 예상치를 크게 초과했습니다.,合計の,合計売上高は今年の四半期の予測を大幅に上回りました。,总计的,总销售额大大超过了今年的季度预测。,"total, agregado",Las cifras de ventas totales superaron nuestras proyecciones trimestrales este año.
agile,An agile approach allows the team to respond quickly to changes.,민첩한,애자일 접근 방식은 팀이 변화에 빠르게 대응할 수 있게 합니다.,機敏な,アジャイルなアプローチにより、チームは変化に迅速に対応できます。,敏捷的,敏捷的方法使团队能够快速应对变化。,"ágil, flexible",Un enfoque ágil permite al equipo responder rápidamente a los cambios.
allegation,The allegation of financial fraud led to a thorough investigation.,주장,재정 사기 주장이 철저한 조사로 이어졌습니다.,申し立て,金融詐欺の申し立てにより、徹底的な調査が行われました。,指控,财务欺诈的指控导致了彻底的调查。,"acusación, alegación",La acusación de fraude financiero llevó a una investigación exhaustiva.
alleviate,The new policy aims to alleviate the burden on small businesses.,완화하다,새 정책은 중소기업의 부담을 완화하는 것을 목표로 합니다.,軽減する,新しい方針は中小企業の負担を軽減することを目指しています。,缓解,新政策旨在缓解小企业的负担。,"aliviar, mitigar",La nueva política tiene como objetivo aliviar la carga sobre las pequeñas empresas.
allocation,The budget allocation for marketing increased by fifteen percent this year.,배분,올해 마케팅 예산 배분이 15% 증가했습니다.,配分,マーケティングへの予算配分が今年15パーセント増加しました。,分配,今年市场营销的预算分配增加了百分之十五。,"asignación, distribución",La asignación presupuestaria para marketing aumentó un quince por ciento este año.
allowance,Employees receive a monthly travel allowance of five hundred dollars.,수당,직원들은 월 500달러의 출장 수당을 받습니다.,手当,従業員は毎月500ドルの旅行手当を受け取ります。,津贴,员工每月获得五百美元的差旅津贴。,"subsidio, asignación",Los empleados reciben un subsidio mensual de viaje de quinientos dólares.
ambiguity,The ambiguity in the contract led to a dispute between parties.,모호함,계약서의 모호함이 당사자 간 분쟁으로 이어졌습니다.,曖昧さ,契約書の曖昧さが当事者間の紛争につながりました。,模糊性,合同中的模糊性导致了双方之间的纠纷。,"ambigüedad, imprecisión",La ambigüedad en el contrato provocó una disputa entre las partes.
amend,The legal team will amend the contract to include new terms.,수정하다,법무팀이 새로운 조건을 포함하도록 계약서를 수정할 것입니다.,修正する,法務チームが新しい条件を含めるよう契約を修正します。,修改,法务团队将修改合同以纳入新条款。,"enmendar, modificar",El equipo legal enmendará el contrato para incluir nuevas cláusulas.
amicable,Both parties reached an amicable settlement outside of the courtroom.,우호적인,양 당사자는 법정 밖에서 우호적인 합의에 도달했습니다.,友好的な,両当事者は法廷外で友好的な和解に達しました。,友好的,双方在庭外达成了友好的和解。,"amistoso, cordial",Ambas partes llegaron a un acuerdo amistoso fuera de los tribunales.
ample,There is ample time to complete the project before the deadline.,충분한,마감 전에 프로젝트를 완료할 충분한 시간이 있습니다.,十分な,締め切り前にプロジェクトを完了する十分な時間があります。,充足的,在截止日期前完成项目有充足的时间。,"amplio, suficiente",Hay tiempo suficiente para completar el proyecto antes de la fecha límite.
annex,The company built a new annex to accommodate the growing staff.,별관,회사는 증가하는 직원을 수용하기 위해 새 별관을 지었습니다.,別館,会社は増加するスタッフを収容するために新しい別館を建設しました。,附件,公司建了一座新的附属建筑以容纳不断增加的员工。,"anexo, edificio adicional",La empresa construyó un nuevo anexo para acomodar al personal en crecimiento.
anomaly,The auditor discovered an anomaly in the quarterly financial report.,이상,감사인이 분기 재무 보고서에서 이상을 발견했습니다.,異常,監査人が四半期財務報告書に異常を発見しました。,异常,审计师在季度财务报告中发现了一处异常。,"anomalía, irregularidad",El auditor descubrió una anomalía en el informe financiero trimestral.
apparatus,The testing apparatus must be calibrated before each quality inspection.,장치,검사 장치는 각 품질 검사 전에 교정되어야 합니다.,装置,テスト装置は品質検査の前に校正する必要があります。,装置,测试装置必须在每次质量检查前进行校准。,"aparato, dispositivo",El aparato de prueba debe calibrarse antes de cada inspección de calidad.
appease,Management offered bonuses to appease workers upset about the restructuring.,달래다,경영진은 구조조정에 불만인 직원들을 달래기 위해 보너스를 제안했습니다.,なだめる,経営陣はリストラに不満を持つ従業員をなだめるためにボーナスを提案しました。,安抚,管理层提供奖金来安抚对重组不满的员工。,"apaciguar, calmar",La dirección ofreció bonificaciones para apaciguar a los trabajadores molestos por la reestructuración.
appendix,Please refer to the appendix for detailed financial data and charts.,부록,상세한 재무 데이터와 차트는 부록을 참조하세요.,付録,詳細な財務データとチャートについては付録を参照してください。,附录,请参阅附录以获取详细的财务数据和图表。,"apéndice, anexo","Por favor, consulte el apéndice para obtener datos financieros y gráficos detallados."
appraise,An independent expert was hired to appraise the property's current value.,감정하다,부동산의 현재 가치를 감정하기 위해 독립 전문가를 고용했습니다.,鑑定する,不動産の現在の価値を鑑定するために独立した専門家が雇われました。,评估,聘请了一位独立专家来评估该房产的当前价值。,"tasar, evaluar",Se contrató a un experto independiente para tasar el valor actual de la propiedad.
apprehend,Security was able to apprehend the suspect near the office building.,체포하다,보안팀이 사무실 건물 근처에서 용의자를 체포할 수 있었습니다.,逮捕する,警備がオフィスビル付近で容疑者を逮捕することができました。,逮捕,保安人员在办公楼附近逮捕了嫌疑人。,"aprehender, detener",El personal de seguridad pudo aprehender al sospechoso cerca del edificio de oficinas.
apprentice,The apprentice will shadow senior engineers for the first three months.,견습생,견습생은 처음 3개월 동안 선임 엔지니어를 따라다닐 것입니다.,見習い,見習いは最初の3か月間、先輩エンジニアに付いて学びます。,学徒,学徒将在前三个月跟随高级工程师学习。,aprendiz,El aprendiz acompañará a los ingenieros senior durante los primeros tres meses.
arbitrate,A neutral third party was called to arbitrate the labor dispute.,중재하다,노동 분쟁을 중재하기 위해 중립적인 제3자가 호출되었습니다.,仲裁する,労働紛争を仲裁するために中立的な第三者が呼ばれました。,仲裁,一位中立的第三方被请来仲裁劳动纠纷。,"arbitrar, mediar",Se llamó a una tercera parte neutral para arbitrar el conflicto laboral.
array,The company offers an impressive array of products and services.,배열,회사는 인상적인 배열의 제품과 서비스를 제공합니다.,配列,その会社は印象的な品揃えの製品とサービスを提供しています。,排列,公司提供一系列令人印象深刻的产品和服务。,"gama, variedad",La empresa ofrece una impresionante variedad de productos y servicios.
articulate,She was able to articulate the company's vision clearly to investors.,명확히 말하다,그녀는 투자자들에게 회사의 비전을 명확하게 표현할 수 있었습니다.,明確に述べる,彼女は投資家に会社のビジョンを明確に表現することができました。,清晰表达,她能够向投资者清晰地阐述公司的愿景。,"articular, expresar claramente",Ella pudo articular claramente la visión de la empresa ante los inversores.
ascertain,We need to ascertain the cause of the production delay immediately.,확인하다,생산 지연의 원인을 즉시 확인해야 합니다.,確認する,生産遅延の原因を直ちに確認する必要があります。,查明,我们需要立即查明生产延迟的原因。,"determinar, verificar",Necesitamos determinar de inmediato la causa del retraso en la producción.
aspire,Many young professionals aspire to reach executive-level positions eventually.,열망하다,많은 젊은 전문가들이 궁극적으로 임원급 직위에 도달하기를 열망합니다.,熱望する,多くの若い専門家が最終的に幹部レベルの地位に到達することを目指しています。,渴望,许多年轻的专业人士渴望最终达到高管级别的职位。,"aspirar, ambicionar",Muchos jóvenes profesionales aspiran a alcanzar puestos de nivel ejecutivo.
assertion,His assertion that costs would decrease proved to be accurate.,주장,비용이 감소할 것이라는 그의 주장이 정확한 것으로 밝혀졌습니다.,主張,コストが減少するという彼の主張は正確であることが証明されました。,断言,他关于成本会下降的断言被证明是准确的。,"afirmación, declaración",Su afirmación de que los costos disminuirían resultó ser precisa.
assimilate,New hires need time to assimilate into the company's work culture.,동화하다,신입사원은 회사의 업무 문화에 적응하는 시간이 필요합니다.,同化する,新入社員は会社の仕事文化に馴染むのに時間が必要です。,吸收,新员工需要时间来融入公司的工作文化。,"asimilar, integrarse",Los nuevos empleados necesitan tiempo para asimilarse a la cultura de trabajo de la empresa.
attrition,High attrition rates indicate potential problems with employee satisfaction.,자연감소,높은 이직률은 직원 만족도에 잠재적 문제가 있음을 나타냅니다.,自然減少,高い離職率は従業員満足度に潜在的な問題があることを示しています。,自然减员,高流失率表明员工满意度可能存在问题。,"desgaste, reducción gradual",Las altas tasas de desgaste de personal indican posibles problemas con la satisfacción de los empleados.
authenticate,Users must authenticate their identity before accessing confidential files.,인증하다,사용자는 기밀 파일에 접근하기 전에 신원을 인증해야 합니다.,認証する,ユーザーは機密ファイルにアクセスする前に身元を認証する必要があります。,认证,用户在访问机密文件之前必须验证其身份。,"autenticar, verificar",Los usuarios deben autenticar su identidad antes de acceder a los archivos confidenciales.
avert,Quick action by management helped avert a potential financial crisis.,피하다,경영진의 신속한 조치가 잠재적 재정 위기를 피하는 데 도움이 되었습니다.,回避する,経営陣の迅速な行動が潜在的な財務危機を回避するのに役立ちました。,避免,管理层的快速行动帮助避免了一场潜在的财务危机。,"evitar, prevenir",La acción rápida de la dirección ayudó a evitar una posible crisis financiera.
backlog,A thorough review of the backlog revealed several areas for improvement.,밀린 업무,밀린 업무에 대한 철저한 검토에서 여러 개선 영역이 밝혀졌습니다.,未処理分,未処理分の徹底的なレビューにより、いくつかの改善点が明らかになりました。,积压,对积压的全面审查揭示了几个需要改进的领域。,"trabajo atrasado, tareas pendientes",Una revisión exhaustiva de las tareas pendientes reveló varias áreas de mejora.
bandwidth,Management addressed concerns regarding the bandwidth at the annual conference.,대역폭,경영진은 연례 회의에서 대역폭에 관한 우려를 다루었습니다.,帯域幅,経営陣は年次会議で帯域幅に関する懸念に対処しました。,带宽,管理层在年度会议上讨论了有关带宽的问题。,"ancho de banda, capacidad",La dirección abordó las preocupaciones sobre el ancho de banda en la conferencia anual.
bankrupt,The report highlighted several bankrupt factors affecting the quarterly results.,파산한,보고서는 분기 실적에 영향을 미치는 여러 파산한 요소를 강조했습니다.,破産した,報告書は四半期の業績に影響を与えるいくつかの破産した要因を強調しました。,破产的,报告强调了影响季度业绩的几个破产的因素。,"en bancarrota, insolvente",El informe destacó varios factores que llevaron a la insolvencia que afectaron los resultados trimestrales.
benchmark,Experts believe the benchmark will significantly impact the industry going forward.,기준점,전문가들은 기준점이/가 향후 산업에 상당한 영향을 미칠 것으로 보고 있습니다.,基準点,専門家は基準点が今後業界に大きな影響を与えると考えています。,基准,专家认为基准将对行业未来产生重大影响。,"referencia, punto de comparación",Los expertos creen que el punto de referencia tendrá un impacto significativo en la industria en el futuro.
beneficiary,Management addressed concerns regarding the beneficiary at the annual conference.,수혜자,경영진은 연례 회의에서 수혜자에 관한 우려를 다루었습니다.,受益者,経営陣は年次会議で受益者に関する懸念に対処しました。,受益人,管理层在年度会议上讨论了有关受益人的问题。,beneficiario,La dirección abordó las preocupaciones relacionadas con el beneficiario en la conferencia anual.
bequest,A thorough review of the bequest revealed several areas for improvement.,유산,유산에 대한 철저한 검토에서 여러 개선 영역이 밝혀졌습니다.,遺贈,遺贈の徹底的なレビューにより、いくつかの改善点が明らかになりました。,遗赠,对遗赠的全面审查揭示了几个需要改进的领域。,"legado, herencia",Una revisión exhaustiva del legado reveló varias áreas de mejora.
bilateral,A detailed analysis of the bilateral was included in the quarterly report.,양자간의,양자간의에 대한 상세한 분석이 분기 보고서에 포함되었습니다.,二国間の,二国間のの詳細な分析が四半期報告書に含まれていました。,双边的,季度报告中包含了对双边的的详细分析。,"bilateral, entre dos partes",Un análisis detallado del acuerdo bilateral se incluyó en el informe trimestral.
binding,The company decided to binding in response to the changing market conditions.,구속력 있는,회사는 변화하는 시장 상황에 대응하여 구속력 있는기로 결정했습니다.,拘束力のある,会社は変化する市場状況に対応して拘束力のあることを決定しました。,有约束力的,公司决定有约束力的以应对不断变化的市场状况。,"vinculante, obligatorio",La empresa decidió aplicar medidas vinculantes en respuesta a las cambiantes condiciones del mercado.
blueprint,Management addressed concerns regarding the blueprint at the annual conference.,청사진,경영진은 연례 회의에서 청사진에 관한 우려를 다루었습니다.,設計図,経営陣は年次会議で設計図に関する懸念に対処しました。,蓝图,管理层在年度会议上讨论了有关蓝图的问题。,"plano, modelo, esquema",La dirección abordó las preocupaciones sobre el plan estratégico en la conferencia anual.
bolster,The CEO announced plans to bolster across all regional office locations.,강화하다,CEO는 모든 지역 사무소에 걸쳐 강화하다 계획을 발표했습니다.,支える,CEOはすべての地域オフィスにわたって支える計画を発表しました。,支撑,首席执行官宣布了在所有区域办事处支撑的计划。,"reforzar, apuntalar",El CEO anunció planes para reforzar las operaciones en todas las oficinas regionales.
bondholder,Understanding the bondholder is essential for making informed business decisions.,채권 보유자,정보에 입각한 비즈니스 결정을 위해 채권 보유자을/를 이해하는 것이 중요합니다.,債券保有者,情報に基づくビジネス判断のために債券保有者を理解することが重要です。,债券持有人,了解债券持有人对于做出明智的商业决策至关重要。,tenedor de bonos,Comprender las obligaciones con los tenedores de bonos es esencial para tomar decisiones empresariales informadas.
bottleneck,The bottleneck requires careful consideration before any final decisions are made.,병목,병목은/는 최종 결정을 내리기 전에 신중한 고려가 필요합니다.,ボトルネック,ボトルネックは最終決定を下す前に慎重な検討が必要です。,瓶颈,瓶颈在做出最终决定之前需要仔细考虑。,"cuello de botella, obstáculo",El cuello de botella requiere una consideración cuidadosa antes de tomar decisiones finales.
breach,The new breach will be implemented across all departments starting next month.,위반,새로운 위반이/가 다음 달부터 모든 부서에 시행될 것입니다.,違反,新しい違反は来月からすべての部門で実施されます。,违反,新的违反将从下月起在所有部门实施。,"incumplimiento, violación",El nuevo procedimiento de incumplimiento será implementado en todos los departamentos a partir del mes próximo.
breakeven,The company's breakeven has been a topic of discussion at recent board meetings.,손익분기,회사의 손익분기이/가 최근 이사회에서 논의 주제가 되었습니다.,損益分岐,会社の損益分岐は最近の取締役会で議論のトピックとなっています。,盈亏平衡,公司的盈亏平衡已成为近期董事会会议的讨论话题。,punto de equilibrio,El punto de equilibrio de la empresa ha sido tema de debate en las reuniones recientes de la junta.
bribery,A thorough review of the bribery revealed several areas for improvement.,뇌물 수수,뇌물 수수에 대한 철저한 검토에서 여러 개선 영역이 밝혀졌습니다.,贈収賄,贈収賄の徹底的なレビューにより、いくつかの改善点が明らかになりました。,贿赂,对贿赂的全面审查揭示了几个需要改进的领域。,"soborno, corrupción",Una revisión exhaustiva del caso de soborno reveló varias áreas de mejora.
broker,The company's broker has been a topic of discussion at recent board meetings.,중개인,회사의 중개인이/가 최근 이사회에서 논의 주제가 되었습니다.,仲介人,会社の仲介人は最近の取締役会で議論のトピックとなっています。,经纪人,公司的经纪人已成为近期董事会会议的讨论话题。,"corredor, intermediario",El corredor de la empresa ha sido un tema de debate en las reuniones recientes de la junta.
