english,example,ko_meaning,ko_example,ja_meaning,ja_example,zh_meaning,zh_example,es_meaning,es_example
remainder,A detailed analysis of the remainder was included in the quarterly report.,나머지,나머지에 대한 상세한 분석이 분기 보고서에 포함되었습니다.,残り,残りの詳細な分析が四半期報告書に含まれていました。,剩余,季度报告中包含了对剩余的详细分析。,"resto, remanente",Un análisis detallado del remanente fue incluido en el informe trimestral.
remedial,The new remedial will be implemented across all departments starting next month.,시정의,새로운 시정의이/가 다음 달부터 모든 부서에 시행될 것입니다.,是正の,新しい是正のは来月からすべての部門で実施されます。,补救的,新的补救的将从下月起在所有部门实施。,"correctivo, de remediación",La nueva medida correctiva será implementada en todos los departamentos a partir del mes próximo.
remit,It is essential to remit in order to maintain our competitive advantage.,송금하다,경쟁 우위를 유지하기 위해 송금하다는 것이 필수적입니다.,送金する,競争優位を維持するために送金することが不可欠です。,汇款,为了保持竞争优势，汇款是至关重要的。,"remitir, enviar dinero",Es esencial remitir los pagos a tiempo para mantener nuestra ventaja competitiva.
remunerate,Management plans to remunerate the current operations to improve overall efficiency.,보수를 주다,경영진은 전반적인 효율성을 개선하기 위해 현재 운영을 보수를 주다 계획입니다.,報酬を与える,経営陣は全体的な効率を改善するために現在の業務を報酬を与える計画です。,酬劳,管理层计划酬劳以提高整体运营效率。,"remunerar, compensar económicamente",La dirección planea remunerar adecuadamente a los empleados para mejorar la eficiencia general.
render,Management plans to render the current operations to improve overall efficiency.,제공하다,경영진은 전반적인 효율성을 개선하기 위해 현재 운영을 제공하다 계획입니다.,提供する,経営陣は全体的な効率を改善するために現在の業務を提供する計画です。,提供,管理层计划提供以提高整体运营效率。,"proporcionar, ofrecer",La dirección planea proporcionar mejores servicios en las operaciones actuales para mejorar la eficiencia general.
renew,The company decided to renew in response to the changing market conditions.,갱신하다,회사는 변화하는 시장 상황에 대응하여 갱신하다기로 결정했습니다.,更新する,会社は変化する市場状況に対応して更新することを決定しました。,续期,公司决定续期以应对不断变化的市场状况。,"renovar, actualizar",La empresa decidió renovar los contratos en respuesta a las cambiantes condiciones del mercado.
renowned,The renowned nature of the proposal raised concerns among board members.,유명한,제안의 유명한 성격이 이사회 구성원들 사이에서 우려를 제기했습니다.,有名な,提案の有名な性質が取締役会メンバーの間で懸念を引き起こしました。,著名的,提案的著名的性质引起了董事会成员的关切。,"renombrado, famoso",La naturaleza renombrada de la propuesta generó preocupaciones entre los miembros de la junta.
repeal,The department needs to repeal to meet the upcoming project deadline.,폐지하다,부서는 다가오는 프로젝트 마감일을 맞추기 위해 폐지하다야 합니다.,廃止する,部門は今後のプロジェクト期限に間に合うよう廃止する必要があります。,废除,部门需要废除以满足即将到来的项目截止日期。,"derogar, abolir",El departamento necesita derogar la antigua ley para cumplir con el plazo del proyecto.
repercussion,The company's repercussion has been a topic of discussion at recent board meetings.,반향,회사의 반향이/가 최근 이사회에서 논의 주제가 되었습니다.,反響,会社の反響は最近の取締役会で議論のトピックとなっています。,反响,公司的反响已成为近期董事会会议的讨论话题。,"repercusión, consecuencia",La repercusión de la empresa ha sido un tema de debate en las reuniones recientes de la junta.
replenish,The team was instructed to replenish following the recent policy update.,보충하다,팀은 최근 정책 업데이트에 따라 보충하다도록 지시받았습니다.,補充する,チームは最近の方針変更に従い補充するよう指示されました。,补充,团队被指示根据最近的政策更新补充。,"reponer, reabastecer",Al equipo se le instruyó reponer las existencias conforme a la reciente actualización de políticas.
replicate,The CEO announced plans to replicate across all regional office locations.,복제하다,CEO는 모든 지역 사무소에 걸쳐 복제하다 계획을 발표했습니다.,複製する,CEOはすべての地域オフィスにわたって複製する計画を発表しました。,复制,首席执行官宣布了在所有区域办事处复制的计划。,"replicar, reproducir",El CEO anunció planes para replicar el modelo en todas las oficinas regionales.
repository,The company's repository has been a topic of discussion at recent board meetings.,저장소,회사의 저장소이/가 최근 이사회에서 논의 주제가 되었습니다.,リポジトリ,会社のリポジトリは最近の取締役会で議論のトピックとなっています。,存储库,公司的存储库已成为近期董事会会议的讨论话题。,"repositorio, depósito",El repositorio de la empresa ha sido un tema de debate en las reuniones recientes de la junta.
reprimand,Experts believe the reprimand will significantly impact the industry going forward.,견책,전문가들은 견책이/가 향후 산업에 상당한 영향을 미칠 것으로 보고 있습니다.,譴責,専門家は譴責が今後業界に大きな影響を与えると考えています。,训斥,专家认为训斥将对行业未来产生重大影响。,"reprimenda, amonestación",Los expertos creen que la reprimenda tendrá un impacto significativo en la industria en el futuro.
reproduce,Stakeholders expect the organization to reproduce within the next fiscal year.,재현하다,이해관계자들은 조직이 다음 회계연도 내에 재현하다기를 기대합니다.,再現する,利害関係者は組織が次の会計年度内に再現することを期待しています。,再现,利益相关者期望组织在下一财政年度内再现。,"reproducir, duplicar",Los interesados esperan que la organización reproduzca los resultados en el próximo año fiscal.
repudiate,Management plans to repudiate the current operations to improve overall efficiency.,거부하다,경영진은 전반적인 효율성을 개선하기 위해 현재 운영을 거부하다 계획입니다.,拒否する,経営陣は全体的な効率を改善するために現在の業務を拒否する計画です。,拒绝,管理层计划拒绝以提高整体运营效率。,"repudiar, rechazar",La dirección planea repudiar ciertas obligaciones en las operaciones actuales para mejorar la eficiencia general.
requisite,It is important to take a requisite approach when handling client relationships.,필수적인,고객 관계를 처리할 때 필수적인 접근 방식을 취하는 것이 중요합니다.,必要な,顧客関係を扱う際に必要なアプローチを取ることが重要です。,必要的,在处理客户关系时采取必要的的方法很重要。,"necesario, requerido",Es importante adoptar el enfoque necesario al gestionar las relaciones con los clientes.
rescind,Management plans to rescind the current operations to improve overall efficiency.,취소하다,경영진은 전반적인 효율성을 개선하기 위해 현재 운영을 취소하다 계획입니다.,撤回する,経営陣は全体的な効率を改善するために現在の業務を撤回する計画です。,撤销,管理层计划撤销以提高整体运营效率。,"rescindir, cancelar",La dirección planea rescindir ciertas operaciones actuales para mejorar la eficiencia general.
resilient,The company decided to resilient in response to the changing market conditions.,탄력적인,회사는 변화하는 시장 상황에 대응하여 탄력적인기로 결정했습니다.,回復力のある,会社は変化する市場状況に対応して回復力のあることを決定しました。,有韧性的,公司决定有韧性的以应对不断变化的市场状况。,"resiliente, resistente",La empresa decidió adoptar un enfoque más resiliente en respuesta a las cambiantes condiciones del mercado.
resolution,The resolution plays a critical role in the company's long-term strategic planning.,결의,결의은/는 회사의 장기 전략 계획에서 중요한 역할을 합니다.,決議,決議は会社の長期戦略計画において重要な役割を果たしています。,决议,决议在公司的长期战略规划中起着关键作用。,"resolución, decisión",La resolución desempeña un papel fundamental en la planificación estratégica a largo plazo de la empresa.
resonate,The board voted to resonate as part of the new corporate strategy.,공감을 얻다,이사회는 새로운 기업 전략의 일환으로 공감을 얻다기로 투표했습니다.,共鳴する,取締役会は新しい企業戦略の一環として共鳴することを決議しました。,引起共鸣,董事会投票引起共鸣作为新企业战略的一部分。,"resonar, tener eco",La junta votó que el mensaje resuene en la nueva estrategia corporativa.
respective,The respective plays a critical role in the company's long-term strategic planning.,각각의,각각의은/는 회사의 장기 전략 계획에서 중요한 역할을 합니다.,それぞれの,それぞれのは会社の長期戦略計画において重要な役割を果たしています。,各自的,各自的在公司的长期战略规划中起着关键作用。,"respectivo, correspondiente",El papel respectivo desempeña un papel fundamental en la planificación estratégica a largo plazo de la empresa.
restitution,A thorough review of the restitution revealed several areas for improvement.,배상,배상에 대한 철저한 검토에서 여러 개선 영역이 밝혀졌습니다.,賠償,賠償の徹底的なレビューにより、いくつかの改善点が明らかになりました。,赔偿,对赔偿的全面审查揭示了几个需要改进的领域。,"restitución, compensación",Una revisión exhaustiva de la restitución reveló varias áreas de mejora.
restrain,The team was instructed to restrain following the recent policy update.,억제하다,팀은 최근 정책 업데이트에 따라 억제하다도록 지시받았습니다.,抑制する,チームは最近の方針変更に従い抑制するよう指示されました。,限制,团队被指示根据最近的政策更新限制。,"restringir, controlar",Al equipo se le instruyó restringir el acceso conforme a la reciente actualización de políticas.
restructure,Stakeholders expect the organization to restructure within the next fiscal year.,구조조정하다,이해관계자들은 조직이 다음 회계연도 내에 구조조정하다기를 기대합니다.,リストラする,利害関係者は組織が次の会計年度内にリストラすることを期待しています。,重组,利益相关者期望组织在下一财政年度内重组。,"reestructurar, reorganizar",Los interesados esperan que la organización se reestructure en el próximo año fiscal.
resume,Management plans to resume the current operations to improve overall efficiency.,재개하다,경영진은 전반적인 효율성을 개선하기 위해 현재 운영을 재개하다 계획입니다.,再開する,経営陣は全体的な効率を改善するために現在の業務を再開する計画です。,恢复,管理层计划恢复以提高整体运营效率。,"reanudar, continuar",La dirección planea reanudar las operaciones actuales para mejorar la eficiencia general.
retain,Stakeholders expect the organization to retain within the next fiscal year.,유지하다,이해관계자들은 조직이 다음 회계연도 내에 유지하다기를 기대합니다.,保持する,利害関係者は組織が次の会計年度内に保持することを期待しています。,保留,利益相关者期望组织在下一财政年度内保留。,"retener, conservar",Los interesados esperan que la organización retenga el talento en el próximo año fiscal.
retaliate,The CEO announced plans to retaliate across all regional office locations.,보복하다,CEO는 모든 지역 사무소에 걸쳐 보복하다 계획을 발표했습니다.,報復する,CEOはすべての地域オフィスにわたって報復する計画を発表しました。,报复,首席执行官宣布了在所有区域办事处报复的计划。,"represaliar, tomar represalias",El CEO anunció planes de respuesta en todas las oficinas regionales.
retention,The company's retention has been a topic of discussion at recent board meetings.,유지,회사의 유지이/가 최근 이사회에서 논의 주제가 되었습니다.,保持,会社の保持は最近の取締役会で議論のトピックとなっています。,留任,公司的留任已成为近期董事会会议的讨论话题。,"retención, conservación",La retención de empleados de la empresa ha sido un tema de debate en las reuniones recientes de la junta.
retrieve,The company decided to retrieve in response to the changing market conditions.,검색하다,회사는 변화하는 시장 상황에 대응하여 검색하다기로 결정했습니다.,取り戻す,会社は変化する市場状況に対応して取り戻すことを決定しました。,检索,公司决定检索以应对不断变化的市场状况。,"recuperar, obtener de nuevo",La empresa decidió recuperar los datos en respuesta a las cambiantes condiciones del mercado.
retroactive,The retroactive results of the pilot program encouraged further investment.,소급적인,파일럿 프로그램의 소급적인 결과가 추가 투자를 촉진했습니다.,遡及的な,パイロットプログラムの遡及的な結果がさらなる投資を促進しました。,追溯的,试点项目的追溯的结果鼓励了进一步的投资。,"retroactivo, con efecto retroactivo",Los resultados retroactivos del programa piloto alentaron una mayor inversión.
retrospect,Understanding the retrospect is essential for making informed business decisions.,회고,정보에 입각한 비즈니스 결정을 위해 회고을/를 이해하는 것이 중요합니다.,回顧,情報に基づくビジネス判断のために回顧を理解することが重要です。,回顾,了解回顾对于做出明智的商业决策至关重要。,"retrospectiva, mirada atrás",Comprender la retrospectiva es esencial para tomar decisiones empresariales informadas.
revenue,A thorough review of the revenue revealed several areas for improvement.,수익,수익에 대한 철저한 검토에서 여러 개선 영역이 밝혀졌습니다.,収益,収益の徹底的なレビューにより、いくつかの改善点が明らかになりました。,收入,对收入的全面审查揭示了几个需要改进的领域。,"ingresos, ganancias",Una revisión exhaustiva de los ingresos reveló varias áreas de mejora.
revise,The board voted to revise as part of the new corporate strategy.,수정하다,이사회는 새로운 기업 전략의 일환으로 수정하다기로 투표했습니다.,修正する,取締役会は新しい企業戦略の一環として修正することを決議しました。,修订,董事会投票修订作为新企业战略的一部分。,"revisar, modificar",La junta votó revisar la estrategia como parte de la nueva estrategia corporativa.
revoke,It is essential to revoke in order to maintain our competitive advantage.,취소하다,경쟁 우위를 유지하기 위해 취소하다는 것이 필수적입니다.,取り消す,競争優位を維持するために取り消すことが不可欠です。,撤销,为了保持竞争优势，撤销是至关重要的。,"revocar, retirar",Es esencial revocar ciertas decisiones para mantener nuestra ventaja competitiva.
revolve,The board voted to revolve as part of the new corporate strategy.,회전하다,이사회는 새로운 기업 전략의 일환으로 회전하다기로 투표했습니다.,回転する,取締役会は新しい企業戦略の一環として回転することを決議しました。,围绕,董事会投票围绕作为新企业战略的一部分。,"girar, rotar",La junta votó que los roles giren como parte de la nueva estrategia corporativa.
rigorous,The rigorous results of the pilot program encouraged further investment.,엄격한,파일럿 프로그램의 엄격한 결과가 추가 투자를 촉진했습니다.,厳格な,パイロットプログラムの厳格な結果がさらなる投資を促進しました。,严格的,试点项目的严格的结果鼓励了进一步的投资。,"riguroso, estricto",Los resultados rigurosos del programa piloto alentaron una mayor inversión.
robust,The project outcomes were more robust than anyone had initially expected.,강력한,프로젝트 결과는 누구보다도 더 강력한 것으로 나타났습니다.,堅牢な,プロジェクトの成果は誰もが当初予想したよりも堅牢なものでした。,稳健的,项目成果比任何人最初预期的都更加稳健的。,"sólido, robusto",Los resultados del proyecto fueron más sólidos de lo que nadie había previsto inicialmente.
roster,The new roster will be implemented across all departments starting next month.,명단,새로운 명단이/가 다음 달부터 모든 부서에 시행될 것입니다.,名簿,新しい名簿は来月からすべての部門で実施されます。,名册,新的名册将从下月起在所有部门实施。,"lista de personal, planilla",La nueva lista de personal será implementada en todos los departamentos a partir del mes próximo.
royalty,The new royalty will be implemented across all departments starting next month.,로열티,새로운 로열티이/가 다음 달부터 모든 부서에 시행될 것입니다.,ロイヤルティ,新しいロイヤルティは来月からすべての部門で実施されます。,版税,新的版税将从下月起在所有部门实施。,"regalías, derechos de autor",Las nuevas regalías serán implementadas en todos los departamentos a partir del mes próximo.
rudimentary,The manager described the situation as particularly rudimentary for the department.,기초적인,관리자는 상황이 부서에 특히 기초적인다고 설명했습니다.,基本的な,マネージャーは状況が部門にとって特に基本的なであると説明しました。,基础的,经理描述该情况对部门来说特别基础的。,"rudimentario, básico",El gerente describió la situación como particularmente rudimentaria para el departamento.
safeguard,It is essential to safeguard in order to maintain our competitive advantage.,보호하다,경쟁 우위를 유지하기 위해 보호하다는 것이 필수적입니다.,保護する,競争優位を維持するために保護することが不可欠です。,保障,为了保持竞争优势，保障是至关重要的。,"salvaguardar, proteger",Es esencial salvaguardar los activos para mantener nuestra ventaja competitiva.
sanction,The sanction was carefully reviewed by the senior management team.,제재,제재은/는 고위 경영진에 의해 신중히 검토되었습니다.,制裁,制裁は上級管理チームによって慎重に検討されました。,制裁,制裁经过高级管理团队的仔细审查。,"sanción, medida disciplinaria",La sanción fue revisada cuidadosamente por el equipo de alta dirección.
saturate,Management plans to saturate the current operations to improve overall efficiency.,포화시키다,경영진은 전반적인 효율성을 개선하기 위해 현재 운영을 포화시키다 계획입니다.,飽和させる,経営陣は全体的な効率を改善するために現在の業務を飽和させる計画です。,饱和,管理层计划饱和以提高整体运营效率。,"saturar, inundar",La dirección planea saturar el mercado actual para mejorar la eficiencia general.
scalable,It is important to take a scalable approach when handling client relationships.,확장 가능한,고객 관계를 처리할 때 확장 가능한 접근 방식을 취하는 것이 중요합니다.,スケーラブルな,顧客関係を扱う際にスケーラブルなアプローチを取ることが重要です。,可扩展的,在处理客户关系时采取可扩展的的方法很重要。,"escalable, adaptable",Es importante adoptar un enfoque escalable al gestionar las relaciones con los clientes.
scenario,Experts believe the scenario will significantly impact the industry going forward.,시나리오,전문가들은 시나리오이/가 향후 산업에 상당한 영향을 미칠 것으로 보고 있습니다.,シナリオ,専門家はシナリオが今後業界に大きな影響を与えると考えています。,情景,专家认为情景将对行业未来产生重大影响。,"escenario, supuesto",Los expertos creen que el escenario tendrá un impacto significativo en la industria en el futuro.
scrutinize,The company decided to scrutinize in response to the changing market conditions.,면밀히 조사하다,회사는 변화하는 시장 상황에 대응하여 면밀히 조사하다기로 결정했습니다.,精査する,会社は変化する市場状況に対応して精査することを決定しました。,仔细审查,公司决定仔细审查以应对不断变化的市场状况。,"escudriñar, examinar minuciosamente",La empresa decidió escudriñar sus operaciones en respuesta a las cambiantes condiciones del mercado.
secede,The department needs to secede to meet the upcoming project deadline.,탈퇴하다,부서는 다가오는 프로젝트 마감일을 맞추기 위해 탈퇴하다야 합니다.,脱退する,部門は今後のプロジェクト期限に間に合うよう脱退する必要があります。,脱离,部门需要脱离以满足即将到来的项目截止日期。,"separarse, secesionar",El departamento necesita separarse de ciertas obligaciones para cumplir con el plazo del proyecto.
sector,The new sector will be implemented across all departments starting next month.,부문,새로운 부문이/가 다음 달부터 모든 부서에 시행될 것입니다.,部門,新しい部門は来月からすべての部門で実施されます。,部门,新的部门将从下月起在所有部门实施。,"sector, área",El nuevo sector será implementado en todos los departamentos a partir del mes próximo.
securities,The company's securities has been a topic of discussion at recent board meetings.,유가증권,회사의 유가증권이/가 최근 이사회에서 논의 주제가 되었습니다.,有価証券,会社の有価証券は最近の取締役会で議論のトピックとなっています。,证券,公司的证券已成为近期董事会会议的讨论话题。,"valores mobiliarios, acciones",Los valores de la empresa han sido un tema de debate en las reuniones recientes de la junta.
segregate,The team was instructed to segregate following the recent policy update.,분리하다,팀은 최근 정책 업데이트에 따라 분리하다도록 지시받았습니다.,分離する,チームは最近の方針変更に従い分離するよう指示されました。,隔离,团队被指示根据最近的政策更新隔离。,"segregar, separar",Al equipo se le instruyó segregar los datos conforme a la reciente actualización de políticas.
seizure,The seizure requires careful consideration before any final decisions are made.,압류,압류은/는 최종 결정을 내리기 전에 신중한 고려가 필요합니다.,差し押さえ,差し押さえは最終決定を下す前に慎重な検討が必要です。,扣押,扣押在做出最终决定之前需要仔细考虑。,"embargo, incautación",El embargo requiere una consideración cuidadosa antes de tomar decisiones finales.
semiconductor,The company's semiconductor has been a topic of discussion at recent board meetings.,반도체,회사의 반도체이/가 최근 이사회에서 논의 주제가 되었습니다.,半導体,会社の半導体は最近の取締役会で議論のトピックとなっています。,半导体,公司的半导体已成为近期董事会会议的讨论话题。,semiconductor,El negocio de semiconductores de la empresa ha sido un tema de debate en las reuniones recientes de la junta.
seminar,Experts believe the seminar will significantly impact the industry going forward.,세미나,전문가들은 세미나이/가 향후 산업에 상당한 영향을 미칠 것으로 보고 있습니다.,セミナー,専門家はセミナーが今後業界に大きな影響を与えると考えています。,研讨会,专家认为研讨会将对行业未来产生重大影响。,"seminario, taller",Los expertos creen que el seminario tendrá un impacto significativo en la industria en el futuro.
seniority,The seniority requires careful consideration before any final decisions are made.,연공서열,연공서열은/는 최종 결정을 내리기 전에 신중한 고려가 필요합니다.,年功序列,年功序列は最終決定を下す前に慎重な検討が必要です。,资历,资历在做出最终决定之前需要仔细考虑。,"antigüedad, jerarquía laboral",La antigüedad requiere una consideración cuidadosa antes de tomar decisiones finales.
