english,example,ko_meaning,ko_example,ja_meaning,ja_example,zh_meaning,zh_example,es_meaning,es_example
corollary,Management addressed concerns regarding the corollary at the annual conference.,당연한 결과,경영진은 연례 회의에서 당연한 결과에 관한 우려를 다루었습니다.,当然の結果,経営陣は年次会議で当然の結果に関する懸念に対処しました。,必然结果,管理层在年度会议上讨论了有关必然结果的问题。,"corolario, consecuencia lógica",La dirección abordó las preocupaciones sobre el corolario en la conferencia anual.
corrosion,A detailed analysis of the corrosion was included in the quarterly report.,부식,부식에 대한 상세한 분석이 분기 보고서에 포함되었습니다.,腐食,腐食の詳細な分析が四半期報告書に含まれていました。,腐蚀,季度报告中包含了对腐蚀的详细分析。,"corrosión, deterioro por oxidación o desgaste",Un análisis detallado de la corrosión se incluyó en el reporte trimestral.
cosign,The team was instructed to cosign following the recent policy update.,연대서명하다,팀은 최근 정책 업데이트에 따라 연대서명하다도록 지시받았습니다.,連帯署名する,チームは最近の方針変更に従い連帯署名するよう指示されました。,共同签署,团队被指示根据最近的政策更新共同签署。,"cofirmar, avalar conjuntamente",El equipo fue instruido para cofirmar el documento siguiendo la reciente actualización de políticas.
counterbalance,Management plans to counterbalance the current operations to improve overall efficiency.,균형을 맞추다,경영진은 전반적인 효율성을 개선하기 위해 현재 운영을 균형을 맞추다 계획입니다.,均衡を取る,経営陣は全体的な効率を改善するために現在の業務を均衡を取る計画です。,平衡,管理层计划平衡以提高整体运营效率。,"contrarrestar, equilibrar una fuerza opuesta",La dirección planea contrarrestar las operaciones actuales para mejorar la eficiencia general.
countermand,The CEO announced plans to countermand across all regional office locations.,철회하다,CEO는 모든 지역 사무소에 걸쳐 철회하다 계획을 발표했습니다.,撤回する,CEOはすべての地域オフィスにわたって撤回する計画を発表しました。,撤销,首席执行官宣布了在所有区域办事处撤销的计划。,"revocar una orden, contradecir una instrucción previa",El CEO anunció planes para revocar órdenes en todas las oficinas regionales.
countervail,The CEO announced plans to countervail across all regional office locations.,상쇄하다,CEO는 모든 지역 사무소에 걸쳐 상쇄하다 계획을 발표했습니다.,相殺する,CEOはすべての地域オフィスにわたって相殺する計画を発表しました。,抵消,首席执行官宣布了在所有区域办事处抵消的计划。,"contrarrestar, compensar un efecto negativo",El CEO anunció planes para contrarrestar efectos adversos en todas las oficinas regionales.
courteous,The report highlighted several courteous factors affecting the quarterly results.,정중한,보고서는 분기 실적에 영향을 미치는 여러 정중한 요소를 강조했습니다.,丁寧な,報告書は四半期の業績に影響を与えるいくつかの丁寧な要因を強調しました。,礼貌的,报告强调了影响季度业绩的几个礼貌的因素。,"cortés, educado, amable en el trato",El informe destacó varios factores corteses que afectaron los resultados trimestrales.
covet,The committee recommended that the company covet to reduce operational risks.,탐내다,위원회는 운영 위험을 줄이기 위해 회사가 탐내다도록 권고했습니다.,切望する,委員会は運営リスクを削減するために会社が切望することを推奨しました。,觊觎,委员会建议公司觊觎以降低运营风险。,"codiciar, desear algo ajeno intensamente",El comité recomendó que la empresa evitara codiciar recursos ajenos para reducir riesgos.
credence,Understanding the credence is essential for making informed business decisions.,신뢰,정보에 입각한 비즈니스 결정을 위해 신뢰을/를 이해하는 것이 중요합니다.,信用,情報に基づくビジネス判断のために信用を理解することが重要です。,信任,了解信任对于做出明智的商业决策至关重要。,"credibilidad, confianza, fundamento",Comprender la credibilidad es esencial para tomar decisiones comerciales informadas.
cumbersome,The manager described the situation as particularly cumbersome for the department.,번거로운,관리자는 상황이 부서에 특히 번거로운다고 설명했습니다.,煩雑な,マネージャーは状況が部門にとって特に煩雑なであると説明しました。,笨重的,经理描述该情况对部门来说特别笨重的。,"engorroso, pesado, difícil de manejar",El gerente describió la situación como particularmente engorrosa para el departamento.
curative,Management addressed concerns regarding the curative at the annual conference.,치료의,경영진은 연례 회의에서 치료의에 관한 우려를 다루었습니다.,治療の,経営陣は年次会議で治療のに関する懸念に対処しました。,治疗的,管理层在年度会议上讨论了有关治疗的的问题。,"curativo, que tiene propiedades de sanación",La dirección abordó las preocupaciones sobre el tratamiento curativo en la conferencia anual.
custodian,A thorough review of the custodian revealed several areas for improvement.,관리인,관리인에 대한 철저한 검토에서 여러 개선 영역이 밝혀졌습니다.,管理人,管理人の徹底的なレビューにより、いくつかの改善点が明らかになりました。,保管人,对保管人的全面审查揭示了几个需要改进的领域。,"custodio, guardián, responsable de la custodia",Una revisión exhaustiva del rol del custodio reveló varias áreas de mejora.
dapper,The manager described the situation as particularly dapper for the department.,말쑥한,관리자는 상황이 부서에 특히 말쑥한다고 설명했습니다.,きちんとした,マネージャーは状況が部門にとって特にきちんとしたであると説明しました。,整洁的,经理描述该情况对部门来说特别整洁的。,"pulcro, elegante y bien arreglado",El gerente describió la situación como particularmente pulcra para el departamento.
debacle,The debacle was carefully reviewed by the senior management team.,대실패,대실패은/는 고위 경영진에 의해 신중히 검토되었습니다.,大失敗,大失敗は上級管理チームによって慎重に検討されました。,惨败,惨败经过高级管理团队的仔细审查。,"debacle, fracaso estrepitoso",La debacle fue revisada cuidadosamente por el equipo de alta dirección.
debilitate,The company decided to debilitate in response to the changing market conditions.,약화시키다,회사는 변화하는 시장 상황에 대응하여 약화시키다기로 결정했습니다.,弱体化させる,会社は変化する市場状況に対応して弱体化させることを決定しました。,使衰弱,公司决定使衰弱以应对不断变化的市场状况。,"debilitar, reducir la fuerza o capacidad",La empresa decidió no debilitar su posición en respuesta a las cambiantes condiciones del mercado.
decorum,Management addressed concerns regarding the decorum at the annual conference.,예의,경영진은 연례 회의에서 예의에 관한 우려를 다루었습니다.,礼儀,経営陣は年次会議で礼儀に関する懸念に対処しました。,礼仪,管理层在年度会议上讨论了有关礼仪的问题。,"decoro, comportamiento apropiado y digno",La dirección abordó las preocupaciones sobre el decoro en la conferencia anual.
decree,Experts believe the decree will significantly impact the industry going forward.,법령,전문가들은 법령이/가 향후 산업에 상당한 영향을 미칠 것으로 보고 있습니다.,法令,専門家は法令が今後業界に大きな影響を与えると考えています。,法令,专家认为法令将对行业未来产生重大影响。,"decreto, orden oficial, disposición legal",Los expertos creen que el decreto impactará significativamente la industria en el futuro.
deductible,A deductible analysis of the data revealed unexpected trends in the market.,공제 가능한,데이터에 대한 공제 가능한 분석은 시장에서 예상치 못한 추세를 보여주었습니다.,控除可能な,データの控除可能な分析により、市場の予期しないトレンドが明らかになりました。,可扣除的,对数据的可扣除的分析揭示了市场中意想不到的趋势。,"deducible, que puede descontarse o restarse",Un análisis deducible de los datos reveló tendencias inesperadas en el mercado.
deferment,The deferment requires careful consideration before any final decisions are made.,연기,연기은/는 최종 결정을 내리기 전에 신중한 고려가 필요합니다.,延期,延期は最終決定を下す前に慎重な検討が必要です。,延期,延期在做出最终决定之前需要仔细考虑。,"aplazamiento, postergación de una obligación",El aplazamiento requiere una consideración cuidadosa antes de tomar cualquier decisión final.
deficit,A detailed analysis of the deficit was included in the quarterly report.,적자,적자에 대한 상세한 분석이 분기 보고서에 포함되었습니다.,赤字,赤字の詳細な分析が四半期報告書に含まれていました。,赤字,季度报告中包含了对赤字的详细分析。,"déficit, saldo negativo, falta de recursos",Un análisis detallado del déficit se incluyó en el reporte trimestral.
deflect,The team was instructed to deflect following the recent policy update.,편향시키다,팀은 최근 정책 업데이트에 따라 편향시키다도록 지시받았습니다.,そらす,チームは最近の方針変更に従いそらすよう指示されました。,偏转,团队被指示根据最近的政策更新偏转。,"desviar, esquivar, rechazar",El equipo fue instruido para desviar las críticas siguiendo la reciente actualización de políticas.
degradation,The new degradation will be implemented across all departments starting next month.,저하,새로운 저하이/가 다음 달부터 모든 부서에 시행될 것입니다.,劣化,新しい劣化は来月からすべての部門で実施されます。,退化,新的退化将从下月起在所有部门实施。,"degradación, deterioro, disminución de calidad",La nueva estrategia de degradación se implementará en todos los departamentos a partir del próximo mes.
delineate,The department needs to delineate to meet the upcoming project deadline.,기술하다,부서는 다가오는 프로젝트 마감일을 맞추기 위해 기술하다야 합니다.,描写する,部門は今後のプロジェクト期限に間に合うよう描写する必要があります。,描绘,部门需要描绘以满足即将到来的项目截止日期。,"delimitar, describir con precisión",El departamento necesita delimitar sus responsabilidades para cumplir con el próximo plazo del proyecto.
delve,The company decided to delve in response to the changing market conditions.,파고들다,회사는 변화하는 시장 상황에 대응하여 파고들다기로 결정했습니다.,掘り下げる,会社は変化する市場状況に対応して掘り下げることを決定しました。,深入探究,公司决定深入探究以应对不断变化的市场状况。,"profundizar, investigar a fondo",La empresa decidió profundizar en el análisis en respuesta a las cambiantes condiciones del mercado.
demarcate,Management plans to demarcate the current operations to improve overall efficiency.,경계를 정하다,경영진은 전반적인 효율성을 개선하기 위해 현재 운영을 경계를 정하다 계획입니다.,境界を定める,経営陣は全体的な効率を改善するために現在の業務を境界を定める計画です。,划定,管理层计划划定以提高整体运营效率。,"demarcar, trazar límites o fronteras",La dirección planea demarcar las operaciones actuales para mejorar la eficiencia general.
demeanor,The demeanor plays a critical role in the company's long-term strategic planning.,태도,태도은/는 회사의 장기 전략 계획에서 중요한 역할을 합니다.,態度,態度は会社の長期戦略計画において重要な役割を果たしています。,举止,举止在公司的长期战略规划中起着关键作用。,"conducta, comportamiento, actitud",La conducta profesional juega un papel fundamental en la planificación estratégica a largo plazo de la empresa.
demolish,The company decided to demolish in response to the changing market conditions.,철거하다,회사는 변화하는 시장 상황에 대응하여 철거하다기로 결정했습니다.,取り壊す,会社は変化する市場状況に対応して取り壊すことを決定しました。,拆除,公司决定拆除以应对不断变化的市场状况。,"demoler, derribar, destruir",La empresa decidió demoler las instalaciones antiguas en respuesta a las cambiantes condiciones del mercado.
denote,Management addressed concerns regarding the denote at the annual conference.,나타내다,경영진은 연례 회의에서 나타내다에 관한 우려를 다루었습니다.,示す,経営陣は年次会議で示すに関する懸念に対処しました。,表示,管理层在年度会议上讨论了有关表示的问题。,"denotar, indicar, significar",La dirección abordó las preocupaciones sobre lo que denota el símbolo en la conferencia anual.
depict,Senior executives were asked to depict before the next quarterly review.,묘사하다,고위 임원들은 다음 분기 검토 전에 묘사하다도록 요청받았습니다.,描写する,上級幹部は次の四半期レビューの前に描写するよう求められました。,描绘,高管们被要求在下季度审查之前描绘。,"representar, plasmar, describir visualmente",Se pidió a los altos ejecutivos que representaran los resultados antes de la próxima revisión trimestral.
deplore,The board voted to deplore as part of the new corporate strategy.,개탄하다,이사회는 새로운 기업 전략의 일환으로 개탄하다기로 투표했습니다.,嘆く,取締役会は新しい企業戦略の一環として嘆くことを決議しました。,谴责,董事会投票谴责作为新企业战略的一部分。,"deplorar, lamentar profundamente",La junta votó para deplorar la situación como parte de la nueva estrategia corporativa.
depose,The board voted to depose as part of the new corporate strategy.,면직시키다,이사회는 새로운 기업 전략의 일환으로 면직시키다기로 투표했습니다.,退位させる,取締役会は新しい企業戦略の一環として退位させることを決議しました。,罢免,董事会投票罢免作为新企业战略的一部分。,"deponer, destituir de un cargo",La junta votó para deponer al directivo como parte de la nueva estrategia corporativa.
deprecate,Senior executives were asked to deprecate before the next quarterly review.,반대하다,고위 임원들은 다음 분기 검토 전에 반대하다도록 요청받았습니다.,非難する,上級幹部は次の四半期レビューの前に非難するよう求められました。,反对,高管们被要求在下季度审查之前反对。,"reprobar, desaprobar, desaconsejar",Se pidió a los altos ejecutivos que reprobaran la práctica antes de la próxima revisión trimestral.
deputy,The deputy requires careful consideration before any final decisions are made.,부의,부의은/는 최종 결정을 내리기 전에 신중한 고려가 필요합니다.,副,副は最終決定を下す前に慎重な検討が必要です。,副的,副的在做出最终决定之前需要仔细考虑。,"adjunto, sustituto, delegado",El papel del adjunto requiere una consideración cuidadosa antes de tomar cualquier decisión final.
derelict,The derelict requires careful consideration before any final decisions are made.,방치된,방치된은/는 최종 결정을 내리기 전에 신중한 고려가 필요합니다.,放置された,放置されたは最終決定を下す前に慎重な検討が必要です。,荒废的,荒废的在做出最终决定之前需要仔细考虑。,"abandonado, en estado de descuido o negligencia",El edificio abandonado requiere una consideración cuidadosa antes de tomar cualquier decisión final.
derogate,Senior executives were asked to derogate before the next quarterly review.,손상시키다,고위 임원들은 다음 분기 검토 전에 손상시키다도록 요청받았습니다.,損なう,上級幹部は次の四半期レビューの前に損なうよう求められました。,减损,高管们被要求在下季度审查之前减损。,"menoscabar, restar valor o autoridad",Se pidió a los altos ejecutivos que evitaran menoscabar la reputación antes de la próxima revisión.
desist,The board voted to desist as part of the new corporate strategy.,중지하다,이사회는 새로운 기업 전략의 일환으로 중지하다기로 투표했습니다.,中止する,取締役会は新しい企業戦略の一環として中止することを決議しました。,停止,董事会投票停止作为新企业战略的一部分。,"cesar, abstenerse, dejar de hacer algo",La junta votó para cesar las actividades como parte de la nueva estrategia corporativa.
destitute,A destitute analysis of the data revealed unexpected trends in the market.,궁핍한,데이터에 대한 궁핍한 분석은 시장에서 예상치 못한 추세를 보여주었습니다.,困窮した,データの困窮した分析により、市場の予期しないトレンドが明らかになりました。,贫困的,对数据的贫困的分析揭示了市场中意想不到的趋势。,"indigente, en extrema pobreza",Un análisis de las condiciones indigentes de los datos reveló tendencias inesperadas en el mercado.
detain,Management plans to detain the current operations to improve overall efficiency.,구금하다,경영진은 전반적인 효율성을 개선하기 위해 현재 운영을 구금하다 계획입니다.,拘束する,経営陣は全体的な効率を改善するために現在の業務を拘束する計画です。,拘留,管理层计划拘留以提高整体运营效率。,"detener, retener bajo custodia",La dirección planea revisar los procedimientos de retención para mejorar la eficiencia general.
deviate,The board voted to deviate as part of the new corporate strategy.,일탈하다,이사회는 새로운 기업 전략의 일환으로 일탈하다기로 투표했습니다.,逸脱する,取締役会は新しい企業戦略の一環として逸脱することを決議しました。,偏离,董事会投票偏离作为新企业战略的一部分。,"desviarse, apartarse del camino establecido",La junta votó para desviarse del plan como parte de la nueva estrategia corporativa.
devolve,Stakeholders expect the organization to devolve within the next fiscal year.,이양하다,이해관계자들은 조직이 다음 회계연도 내에 이양하다기를 기대합니다.,委譲する,利害関係者は組織が次の会計年度内に委譲することを期待しています。,下放,利益相关者期望组织在下一财政年度内下放。,"delegar, transferir responsabilidades a niveles inferiores",Los accionistas esperan que la organización delegue funciones dentro del próximo año fiscal.
dexterous,The manager described the situation as particularly dexterous for the department.,손재주 있는,관리자는 상황이 부서에 특히 손재주 있는다고 설명했습니다.,器用な,マネージャーは状況が部門にとって特に器用なであると説明しました。,灵巧的,经理描述该情况对部门来说特别灵巧的。,"diestro, hábil con las manos",El gerente describió la situación como particularmente favorable para el departamento diestro.
dichotomy,The dichotomy plays a critical role in the company's long-term strategic planning.,이분법,이분법은/는 회사의 장기 전략 계획에서 중요한 역할을 합니다.,二分法,二分法は会社の長期戦略計画において重要な役割を果たしています。,二分法,二分法在公司的长期战略规划中起着关键作用。,"dicotomía, división en dos partes opuestas",La dicotomía juega un papel fundamental en la planificación estratégica a largo plazo de la empresa.
diffuse,The CEO announced plans to diffuse across all regional office locations.,확산시키다,CEO는 모든 지역 사무소에 걸쳐 확산시키다 계획을 발표했습니다.,拡散させる,CEOはすべての地域オフィスにわたって拡散させる計画を発表しました。,扩散,首席执行官宣布了在所有区域办事处扩散的计划。,"difundir, extender, dispersar",El CEO anunció planes para difundir información en todas las oficinas regionales.
digress,Senior executives were asked to digress before the next quarterly review.,주제에서 벗어나다,고위 임원들은 다음 분기 검토 전에 주제에서 벗어나다도록 요청받았습니다.,脱線する,上級幹部は次の四半期レビューの前に脱線するよう求められました。,离题,高管们被要求在下季度审查之前离题。,"divagar, alejarse del tema principal",Se pidió a los altos ejecutivos que no divagaran antes de la próxima revisión trimestral.
dilute,The team was instructed to dilute following the recent policy update.,희석하다,팀은 최근 정책 업데이트에 따라 희석하다도록 지시받았습니다.,希釈する,チームは最近の方針変更に従い希釈するよう指示されました。,稀释,团队被指示根据最近的政策更新稀释。,"diluir, reducir la concentración o intensidad",El equipo fue instruido para diluir la solución siguiendo la reciente actualización de políticas.
disaffirm,It is essential to disaffirm in order to maintain our competitive advantage.,부인하다,경쟁 우위를 유지하기 위해 부인하다는 것이 필수적입니다.,否認する,競争優位を維持するために否認することが不可欠です。,否认,为了保持竞争优势，否认是至关重要的。,"desacreditar, negar formalmente",Es esencial desacreditar las afirmaciones falsas para mantener nuestra ventaja competitiva.
disambiguate,The board voted to disambiguate as part of the new corporate strategy.,명확히 하다,이사회는 새로운 기업 전략의 일환으로 명확히 하다기로 투표했습니다.,曖昧さを除く,取締役会は新しい企業戦略の一環として曖昧さを除くことを決議しました。,消除歧义,董事会投票消除歧义作为新企业战略的一部分。,"aclarar, eliminar ambigüedades",La junta votó para aclarar los términos como parte de la nueva estrategia corporativa.
disbursement,Management addressed concerns regarding the disbursement at the annual conference.,지출,경영진은 연례 회의에서 지출에 관한 우려를 다루었습니다.,支出,経営陣は年次会議で支出に関する懸念に対処しました。,支出,管理层在年度会议上讨论了有关支出的问题。,"desembolso, pago, gasto de fondos",La dirección abordó las preocupaciones sobre el desembolso en la conferencia anual.
disclaim,The committee recommended that the company disclaim to reduce operational risks.,부인하다,위원회는 운영 위험을 줄이기 위해 회사가 부인하다도록 권고했습니다.,否認する,委員会は運営リスクを削減するために会社が否認することを推奨しました。,否认,委员会建议公司否认以降低运营风险。,"renunciar a una responsabilidad, negar una reclamación",El comité recomendó que la empresa renunciara a la reclamación para reducir los riesgos operativos.
discomfit,The board voted to discomfit as part of the new corporate strategy.,당황하게 하다,이사회는 새로운 기업 전략의 일환으로 당황하게 하다기로 투표했습니다.,困惑させる,取締役会は新しい企業戦略の一環として困惑させることを決議しました。,使困窘,董事会投票使困窘作为新企业战略的一部分。,"desconcertar, incomodar, frustrar",La junta votó para evitar desconcertar al equipo como parte de la nueva estrategia corporativa.
discourse,Experts believe the discourse will significantly impact the industry going forward.,담론,전문가들은 담론이/가 향후 산업에 상당한 영향을 미칠 것으로 보고 있습니다.,談話,専門家は談話が今後業界に大きな影響を与えると考えています。,话语,专家认为话语将对行业未来产生重大影响。,"discurso, debate, conversación formal",Los expertos creen que el discurso impactará significativamente la industria en el futuro.
discretionary,The discretionary requires careful consideration before any final decisions are made.,재량의,재량의은/는 최종 결정을 내리기 전에 신중한 고려가 필요합니다.,裁量の,裁量のは最終決定を下す前に慎重な検討が必要です。,可自由支配的,可自由支配的在做出最终决定之前需要仔细考虑。,"discrecional, sujeto al libre albedrío o criterio propio",El gasto discrecional requiere una consideración cuidadosa antes de tomar cualquier decisión final.
